3.1497	Trafic Legitim	73.12%
0	192.168.192.179:60343	185.26.182.106:443	6	55	Ether / IP / TCP 192.168.192.179:60343 > 185.26.182.106:https A / Raw
----------------------------------------
3.3582	Eroare: main thread is not in main loop	0.00%
0	185.26.182.106:443	192.168.192.179:60343	6	54	Ether / IP / TCP 185.26.182.106:https > 192.168.192.179:60343 A
----------------------------------------
4.8907	Eroare: main thread is not in main loop	0.00%
0	192.168.192.179:60213	52.97.141.82:443	6	55	Ether / IP / TCP 192.168.192.179:60213 > 52.97.141.82:https A / Raw
----------------------------------------
6.0082	Eroare: main thread is not in main loop	0.00%
0	13.89.179.8:443	192.168.192.179:60368	6	1354	Ether / IP / TCP 13.89.179.8:https > 192.168.192.179:60368 A / Raw
----------------------------------------
8.2239	Eroare: main thread is not in main loop	0.00%
0	192.168.192.179:60342	20.189.173.10:443	6	172	Ether / IP / TCP 192.168.192.179:60342 > 20.189.173.10:https PA / Raw
----------------------------------------
9.3602	Eroare: main thread is not in main loop	0.00%
0	13.89.179.8:443	192.168.192.179:60369	6	54	Ether / IP / TCP 13.89.179.8:https > 192.168.192.179:60369 A
----------------------------------------
12.3002	Eroare: main thread is not in main loop	0.00%
0	192.168.192.179:60325	52.30.201.170:443	6	298	Ether / IP / TCP 192.168.192.179:60325 > 52.30.201.170:https PA / Raw
----------------------------------------
13.5735	Eroare: main thread is not in main loop	0.00%
0	192.168.192.179:59293	52.223.6.21:443	6	55	Ether / IP / TCP 192.168.192.179:59293 > 52.223.6.21:https A / Raw
----------------------------------------
20.7364	Eroare: main thread is not in main loop	0.00%
0	192.168.192.179:59225	172.217.218.188:5228	6	55	Ether / IP / TCP 192.168.192.179:59225 > 172.217.218.188:5228 A / Raw
----------------------------------------
23.1481	Eroare: main thread is not in main loop	0.00%
0	185.26.182.106:443	192.168.192.179:60343	6	93	Ether / IP / TCP 185.26.182.106:https > 192.168.192.179:60343 PA / Raw
----------------------------------------
24.3917	Eroare: main thread is not in main loop	0.00%
0	185.26.182.106:443	192.168.192.179:60343	6	78	Ether / IP / TCP 185.26.182.106:https > 192.168.192.179:60343 FPA / Raw
----------------------------------------
25.7588	Eroare: main thread is not in main loop	0.00%
0	192.168.192.179:53444	192.168.192.165:53	17	92	Ether / IP / UDP / DNS Qry b'mobile.events.data.microsoft.com.'
----------------------------------------
26.8685	Eroare: main thread is not in main loop	0.00%
0	192.168.192.179:60342	20.189.173.10:443	6	89	Ether / IP / TCP 192.168.192.179:60342 > 20.189.173.10:https PA / Raw
----------------------------------------
28.2144	Eroare: main thread is not in main loop	0.00%
0	192.168.192.179:60246	172.161.47.103:443	6	55	Ether / IP / TCP 192.168.192.179:60246 > 172.161.47.103:https A / Raw
----------------------------------------
42.5876	Eroare: main thread is not in main loop	0.00%
0	192.168.192.179:60325	52.30.201.170:443	6	297	Ether / IP / TCP 192.168.192.179:60325 > 52.30.201.170:https PA / Raw
----------------------------------------
50.0248	Eroare: main thread is not in main loop	0.00%
0	192.168.192.179:60213	52.97.141.82:443	6	55	Ether / IP / TCP 192.168.192.179:60213 > 52.97.141.82:https A / Raw
----------------------------------------
51.5806	Eroare: main thread is not in main loop	0.00%
0	192.168.192.179:58564	192.168.192.165:53	17	77	Ether / IP / UDP / DNS Qry b'get.geo.opera.com.'
----------------------------------------
52.6661	Eroare: main thread is not in main loop	0.00%
0	185.26.182.72:443	192.168.192.179:60371	6	1354	Ether / IP / TCP 185.26.182.72:https > 192.168.192.179:60371 A / Raw
----------------------------------------
54.5952	Eroare: main thread is not in main loop	0.00%
0	192.168.192.179:51533	192.168.192.165:53	17	74	Ether / IP / UDP / DNS Qry b'www.google.com.'
----------------------------------------
55.6579	Eroare: main thread is not in main loop	0.00%
0	192.168.192.179:60373	82.145.216.15:443	6	66	Ether / IP / TCP 192.168.192.179:60373 > 82.145.216.15:https S
----------------------------------------
56.7804	Eroare: main thread is not in main loop	0.00%
0	216.58.212.4:443	192.168.192.179:62494	17	70	Ether / IP / UDP 216.58.212.4:https > 192.168.192.179:62494 / Raw
----------------------------------------
57.8942	Eroare: main thread is not in main loop	0.00%
0	34.120.62.213:443	192.168.192.179:60318	6	66	Ether / IP / TCP 34.120.62.213:https > 192.168.192.179:60318 A
----------------------------------------
59.0279	Eroare: main thread is not in main loop	0.00%
0	192.168.192.179:62494	216.58.212.4:443	17	186	Ether / IP / UDP 192.168.192.179:62494 > 216.58.212.4:https / Raw
----------------------------------------
60.0973	Eroare: main thread is not in main loop	0.00%
0	216.58.212.14:443	192.168.192.179:65498	17	67	Ether / IP / UDP 216.58.212.14:https > 192.168.192.179:65498 / Raw
----------------------------------------
61.3352	Eroare: main thread is not in main loop	0.00%
0	192.168.192.179:59216	192.168.192.165:53	17	75	Ether / IP / UDP / DNS Qry b'play.google.com.'
----------------------------------------
63.6581	Eroare: main thread is not in main loop	0.00%
0	192.168.192.179:58637	192.168.192.165:53	17	78	Ether / IP / UDP / DNS Qry b'www.cloudflare.com.'
----------------------------------------
64.7364	Eroare: main thread is not in main loop	0.00%
0	104.16.123.96:443	192.168.192.179:59151	17	1242	Ether / IP / UDP 104.16.123.96:https > 192.168.192.179:59151 / Raw
----------------------------------------
65.8188	Eroare: main thread is not in main loop	0.00%
0	192.168.192.179:53763	104.18.94.41:443	17	86	Ether / IP / UDP 192.168.192.179:53763 > 104.18.94.41:https / Raw
----------------------------------------
67.5897	Eroare: main thread is not in main loop	0.00%
0	192.168.192.179:53763	104.18.94.41:443	17	991	Ether / IP / UDP 192.168.192.179:53763 > 104.18.94.41:https / Raw
----------------------------------------
68.8732	Eroare: main thread is not in main loop	0.00%
0	192.168.192.179:60230	52.30.201.170:443	6	55	Ether / IP / TCP 192.168.192.179:60230 > 52.30.201.170:https A / Raw
----------------------------------------
72.3490	Eroare: main thread is not in main loop	0.00%
0	192.168.192.179:60342	20.189.173.10:443	6	55	Ether / IP / TCP 192.168.192.179:60342 > 20.189.173.10:https A / Raw
----------------------------------------
73.4589	Eroare: main thread is not in main loop	0.00%
0	172.161.47.103:443	192.168.192.179:60246	6	66	Ether / IP / TCP 172.161.47.103:https > 192.168.192.179:60246 A
----------------------------------------
78.8172	Eroare: main thread is not in main loop	0.00%
0	192.168.192.179:59151	104.16.123.96:443	17	1041	Ether / IP / UDP 192.168.192.179:59151 > 104.16.123.96:https / Raw
----------------------------------------
81.0630	Eroare: main thread is not in main loop	0.00%
0	192.168.192.179:60325	52.30.201.170:443	6	164	Ether / IP / TCP 192.168.192.179:60325 > 52.30.201.170:https PA / Raw
----------------------------------------
90.0528	Eroare: main thread is not in main loop	0.00%
0	192.168.192.179:60325	52.30.201.170:443	6	297	Ether / IP / TCP 192.168.192.179:60325 > 52.30.201.170:https PA / Raw
----------------------------------------
95.1863	Eroare: main thread is not in main loop	0.00%
0	192.168.192.179:60213	52.97.141.82:443	6	55	Ether / IP / TCP 192.168.192.179:60213 > 52.97.141.82:https A / Raw
----------------------------------------
97.0322	Eroare: main thread is not in main loop	0.00%
0	192.168.192.179:60370	185.26.182.71:443	6	55	Ether / IP / TCP 192.168.192.179:60370 > 185.26.182.71:https A / Raw
----------------------------------------
98.6207	Eroare: main thread is not in main loop	0.00%
0	52.30.201.170:443	192.168.192.179:60230	6	78	Ether / IP / TCP 52.30.201.170:https > 192.168.192.179:60230 PA / Raw
----------------------------------------
99.9525	Eroare: main thread is not in main loop	0.00%
0	192.168.192.179:60332	172.64.155.209:443	6	55	Ether / IP / TCP 192.168.192.179:60332 > 172.64.155.209:https A / Raw
----------------------------------------
102.9004	Eroare: main thread is not in main loop	0.00%
0	192.168.192.179:60318	34.120.62.213:443	6	55	Ether / IP / TCP 192.168.192.179:60318 > 34.120.62.213:https A / Raw
----------------------------------------
104.6098	Eroare: main thread is not in main loop	0.00%
0	192.168.192.179:60374	82.145.216.15:443	6	55	Ether / IP / TCP 192.168.192.179:60374 > 82.145.216.15:https A / Raw
----------------------------------------
105.7911	Eroare: main thread is not in main loop	0.00%
0	52.168.117.169:443	192.168.192.179:60384	6	1354	Ether / IP / TCP 52.168.117.169:https > 192.168.192.179:60384 A / Raw
----------------------------------------
106.9379	Eroare: main thread is not in main loop	0.00%
0	192.168.192.179:55222	192.168.192.165:53	17	87	Ether / IP / UDP / DNS Qry b'roaming.officeapps.live.com.'
----------------------------------------
109.4064	Eroare: main thread is not in main loop	0.00%
0	192.168.192.179:60381	104.16.80.73:443	6	55	Ether / IP / TCP 192.168.192.179:60381 > 104.16.80.73:https A / Raw
----------------------------------------
110.6562	Eroare: main thread is not in main loop	0.00%
0	192.168.192.179:60379	82.145.216.15:443	6	55	Ether / IP / TCP 192.168.192.179:60379 > 82.145.216.15:https A / Raw
----------------------------------------
115.3021	Eroare: main thread is not in main loop	0.00%
0	82.145.216.15:443	192.168.192.179:60375	6	93	Ether / IP / TCP 82.145.216.15:https > 192.168.192.179:60375 PA / Raw
----------------------------------------
117.1255	Eroare: main thread is not in main loop	0.00%
0	185.26.182.71:443	192.168.192.179:60370	6	78	Ether / IP / TCP 185.26.182.71:https > 192.168.192.179:60370 PA / Raw
----------------------------------------
118.4678	Eroare: main thread is not in main loop	0.00%
0	192.168.192.179:60246	172.161.47.103:443	6	55	Ether / IP / TCP 192.168.192.179:60246 > 172.161.47.103:https A / Raw
----------------------------------------
120.6551	Eroare: main thread is not in main loop	0.00%
0	185.26.182.106:443	192.168.192.179:60376	6	93	Ether / IP / TCP 185.26.182.106:https > 192.168.192.179:60376 PA / Raw
----------------------------------------
122.0512	Eroare: main thread is not in main loop	0.00%
0	192.168.192.179:60325	52.30.201.170:443	6	298	Ether / IP / TCP 192.168.192.179:60325 > 52.30.201.170:https PA / Raw
----------------------------------------
124.8360	Eroare: main thread is not in main loop	0.00%
0	82.145.216.15:443	192.168.192.179:60374	6	93	Ether / IP / TCP 82.145.216.15:https > 192.168.192.179:60374 PA / Raw
----------------------------------------
125.9150	Eroare: main thread is not in main loop	0.00%
0	20.189.173.10:443	192.168.192.179:60342	6	54	Ether / IP / TCP 20.189.173.10:https > 192.168.192.179:60342 A
----------------------------------------
127.0269	Eroare: main thread is not in main loop	0.00%
0	20.50.201.204:443	192.168.192.179:60386	6	54	Ether / IP / TCP 20.50.201.204:https > 192.168.192.179:60386 A
----------------------------------------
129.3178	Eroare: main thread is not in main loop	0.00%
0	185.26.182.93:443	192.168.192.179:60380	6	93	Ether / IP / TCP 185.26.182.93:https > 192.168.192.179:60380 PA / Raw
----------------------------------------
130.6609	Eroare: main thread is not in main loop	0.00%
0	82.145.216.15:443	192.168.192.179:60379	6	93	Ether / IP / TCP 82.145.216.15:https > 192.168.192.179:60379 PA / Raw
----------------------------------------
134.1776	Eroare: main thread is not in main loop	0.00%
0	52.30.201.170:443	192.168.192.179:60325	6	78	Ether / IP / TCP 52.30.201.170:https > 192.168.192.179:60325 PA / Raw
----------------------------------------
137.2011	Eroare: main thread is not in main loop	0.00%
0	192.168.192.179:60325	52.30.201.170:443	6	297	Ether / IP / TCP 192.168.192.179:60325 > 52.30.201.170:https PA / Raw
----------------------------------------
140.3547	Eroare: main thread is not in main loop	0.00%
0	192.168.192.179:60213	52.97.141.82:443	6	55	Ether / IP / TCP 192.168.192.179:60213 > 52.97.141.82:https A / Raw
----------------------------------------
143.7349	Eroare: main thread is not in main loop	0.00%
0	192.168.192.179:60230	52.30.201.170:443	6	55	Ether / IP / TCP 192.168.192.179:60230 > 52.30.201.170:https A / Raw
----------------------------------------
145.0553	Eroare: main thread is not in main loop	0.00%
0	192.168.192.179:60332	172.64.155.209:443	6	55	Ether / IP / TCP 192.168.192.179:60332 > 172.64.155.209:https A / Raw
----------------------------------------
148.0340	Eroare: main thread is not in main loop	0.00%
0	192.168.192.179:60318	34.120.62.213:443	6	55	Ether / IP / TCP 192.168.192.179:60318 > 34.120.62.213:https A / Raw
----------------------------------------
152.3143	Eroare: main thread is not in main loop	0.00%
0	192.168.192.179:60325	52.30.201.170:443	6	298	Ether / IP / TCP 192.168.192.179:60325 > 52.30.201.170:https PA / Raw
----------------------------------------
154.4728	Eroare: main thread is not in main loop	0.00%
0	192.168.192.179:60381	104.16.80.73:443	6	55	Ether / IP / TCP 192.168.192.179:60381 > 104.16.80.73:https A / Raw
----------------------------------------
155.9876	Eroare: main thread is not in main loop	0.00%
0	192.168.192.179:60382	104.16.124.96:443	6	55	Ether / IP / TCP 192.168.192.179:60382 > 104.16.124.96:https A / Raw
----------------------------------------
160.3081	Eroare: main thread is not in main loop	0.00%
0	192.168.192.179:60377	185.26.182.106:443	6	55	Ether / IP / TCP 192.168.192.179:60377 > 185.26.182.106:https A / Raw
----------------------------------------
162.1449	Eroare: main thread is not in main loop	0.00%
0	192.168.192.179:60370	185.26.182.71:443	6	55	Ether / IP / TCP 192.168.192.179:60370 > 185.26.182.71:https A / Raw
----------------------------------------
163.5967	Eroare: main thread is not in main loop	0.00%
0	192.168.192.179:60246	172.161.47.103:443	6	55	Ether / IP / TCP 192.168.192.179:60246 > 172.161.47.103:https A / Raw
----------------------------------------
167.5232	Eroare: main thread is not in main loop	0.00%
0	192.168.192.179:60325	52.30.201.170:443	6	296	Ether / IP / TCP 192.168.192.179:60325 > 52.30.201.170:https PA / Raw
----------------------------------------
171.8329	Eroare: main thread is not in main loop	0.00%
0	192.168.192.179:60342	20.189.173.10:443	6	55	Ether / IP / TCP 192.168.192.179:60342 > 20.189.173.10:https A / Raw
----------------------------------------
173.2107	Eroare: main thread is not in main loop	0.00%
0	192.168.192.179:49438	104.18.23.152:443	17	1292	Ether / IP / UDP 192.168.192.179:49438 > 104.18.23.152:https / Raw
----------------------------------------
174.2758	Eroare: main thread is not in main loop	0.00%
0	192.168.192.179:49438	104.18.23.152:443	17	86	Ether / IP / UDP 192.168.192.179:49438 > 104.18.23.152:https / Raw
----------------------------------------
175.3590	Eroare: main thread is not in main loop	0.00%
0	104.18.23.152:443	192.168.192.179:49438	17	83	Ether / IP / UDP 104.18.23.152:https > 192.168.192.179:49438 / Raw
----------------------------------------
176.4353	Eroare: main thread is not in main loop	0.00%
0	104.18.23.152:443	192.168.192.179:49438	17	80	Ether / IP / UDP 104.18.23.152:https > 192.168.192.179:49438 / Raw
----------------------------------------
177.5368	Eroare: main thread is not in main loop	0.00%
0	104.18.23.152:443	192.168.192.179:49438	17	75	Ether / IP / UDP 104.18.23.152:https > 192.168.192.179:49438 / Raw
----------------------------------------
178.6623	Eroare: main thread is not in main loop	0.00%
0	104.18.23.152:443	192.168.192.179:49438	17	74	Ether / IP / UDP 104.18.23.152:https > 192.168.192.179:49438 / Raw
----------------------------------------
179.7730	Eroare: main thread is not in main loop	0.00%
0	104.18.23.152:443	192.168.192.179:49438	17	78	Ether / IP / UDP 104.18.23.152:https > 192.168.192.179:49438 / Raw
----------------------------------------
180.8867	Eroare: main thread is not in main loop	0.00%
0	104.18.23.152:443	192.168.192.179:49438	17	81	Ether / IP / UDP 104.18.23.152:https > 192.168.192.179:49438 / Raw
----------------------------------------
182.0144	Eroare: main thread is not in main loop	0.00%
0	192.168.192.179:49438	104.18.23.152:443	17	86	Ether / IP / UDP 192.168.192.179:49438 > 104.18.23.152:https / Raw
----------------------------------------
183.0989	Eroare: main thread is not in main loop	0.00%
0	104.18.23.152:443	192.168.192.179:49438	17	76	Ether / IP / UDP 104.18.23.152:https > 192.168.192.179:49438 / Raw
----------------------------------------
184.1712	Eroare: main thread is not in main loop	0.00%
0	104.18.23.152:443	192.168.192.179:49438	17	101	Ether / IP / UDP 104.18.23.152:https > 192.168.192.179:49438 / Raw
----------------------------------------
185.2289	Eroare: main thread is not in main loop	0.00%
0	104.18.23.152:443	192.168.192.179:49438	17	77	Ether / IP / UDP 104.18.23.152:https > 192.168.192.179:49438 / Raw
----------------------------------------
186.3290	Eroare: main thread is not in main loop	0.00%
0	192.168.192.179:60151	172.64.155.209:443	6	55	Ether / IP / TCP 192.168.192.179:60151 > 172.64.155.209:https A / Raw
----------------------------------------
188.9887	Eroare: main thread is not in main loop	0.00%
0	192.168.192.179:60230	52.30.201.170:443	6	55	Ether / IP / TCP 192.168.192.179:60230 > 52.30.201.170:https A / Raw
----------------------------------------
190.2288	Eroare: main thread is not in main loop	0.00%
0	192.168.192.179:60332	172.64.155.209:443	6	55	Ether / IP / TCP 192.168.192.179:60332 > 172.64.155.209:https A / Raw
----------------------------------------
193.1858	Eroare: main thread is not in main loop	0.00%
0	192.168.192.179:60318	34.120.62.213:443	6	55	Ether / IP / TCP 192.168.192.179:60318 > 34.120.62.213:https A / Raw
----------------------------------------
197.0275	Eroare: main thread is not in main loop	0.00%
0	192.168.192.179:53095	192.168.192.165:53	17	75	Ether / IP / UDP / DNS Qry b'ssl.gstatic.com.'
----------------------------------------
199.6520	Eroare: main thread is not in main loop	0.00%
0	192.168.192.179:60381	104.16.80.73:443	6	55	Ether / IP / TCP 192.168.192.179:60381 > 104.16.80.73:https A / Raw
----------------------------------------
200.9278	Eroare: main thread is not in main loop	0.00%
0	192.168.192.179:60325	52.30.201.170:443	6	298	Ether / IP / TCP 192.168.192.179:60325 > 52.30.201.170:https PA / Raw
----------------------------------------
204.0563	Eroare: main thread is not in main loop	0.00%
0	192.168.192.179:49438	104.18.23.152:443	17	1292	Ether / IP / UDP 192.168.192.179:49438 > 104.18.23.152:https / Raw
----------------------------------------
205.1488	Eroare: main thread is not in main loop	0.00%
0	104.18.23.152:443	192.168.192.179:49438	17	423	Ether / IP / UDP 104.18.23.152:https > 192.168.192.179:49438 / Raw
----------------------------------------
206.2072	Eroare: main thread is not in main loop	0.00%
0	104.18.23.152:443	192.168.192.179:49438	17	76	Ether / IP / UDP 104.18.23.152:https > 192.168.192.179:49438 / Raw
----------------------------------------
207.2793	Eroare: main thread is not in main loop	0.00%
0	104.18.23.152:443	192.168.192.179:49438	17	77	Ether / IP / UDP 104.18.23.152:https > 192.168.192.179:49438 / Raw
----------------------------------------
208.3889	Eroare: main thread is not in main loop	0.00%
0	104.18.23.152:443	192.168.192.179:49438	17	75	Ether / IP / UDP 104.18.23.152:https > 192.168.192.179:49438 / Raw
----------------------------------------
209.4987	Eroare: main thread is not in main loop	0.00%
0	104.18.23.152:443	192.168.192.179:49438	17	423	Ether / IP / UDP 104.18.23.152:https > 192.168.192.179:49438 / Raw
----------------------------------------
215.2274	Eroare: main thread is not in main loop	0.00%
0	192.168.192.179:57145	192.168.192.165:53	17	79	Ether / IP / UDP / DNS Qry b'main.vscode-cdn.net.'
----------------------------------------
217.1659	Eroare: main thread is not in main loop	0.00%
0	192.168.192.179:60342	20.189.173.10:443	6	55	Ether / IP / TCP 192.168.192.179:60342 > 20.189.173.10:https A / Raw
----------------------------------------
218.5916	Eroare: main thread is not in main loop	0.00%
0	52.30.201.170:443	192.168.192.179:60230	6	78	Ether / IP / TCP 52.30.201.170:https > 192.168.192.179:60230 PA / Raw
----------------------------------------
222.3275	Eroare: main thread is not in main loop	0.00%
0	192.168.192.179:63785	216.58.212.3:443	17	144	Ether / IP / UDP 192.168.192.179:63785 > 216.58.212.3:https / Raw
----------------------------------------
230.5764	Eroare: main thread is not in main loop	0.00%
0	192.168.192.179:60213	52.97.141.82:443	6	55	Ether / IP / TCP 192.168.192.179:60213 > 52.97.141.82:https A / Raw
----------------------------------------
235.2690	Eroare: main thread is not in main loop	0.00%
0	192.168.192.179:60332	172.64.155.209:443	6	55	Ether / IP / TCP 192.168.192.179:60332 > 172.64.155.209:https A / Raw
----------------------------------------
238.2275	Eroare: main thread is not in main loop	0.00%
0	192.168.192.179:60318	34.120.62.213:443	6	55	Ether / IP / TCP 192.168.192.179:60318 > 34.120.62.213:https A / Raw
----------------------------------------
244.7020	Eroare: main thread is not in main loop	0.00%
0	192.168.192.179:60381	104.16.80.73:443	6	55	Ether / IP / TCP 192.168.192.179:60381 > 104.16.80.73:https A / Raw
----------------------------------------
245.8732	Eroare: main thread is not in main loop	0.00%
0	52.30.201.170:443	192.168.192.179:60325	6	54	Ether / IP / TCP 52.30.201.170:https > 192.168.192.179:60325 A
----------------------------------------
249.6725	Eroare: main thread is not in main loop	0.00%
0	20.189.173.10:443	192.168.192.179:60342	6	54	Ether / IP / TCP 20.189.173.10:https > 192.168.192.179:60342 RA
----------------------------------------
252.4209	Eroare: main thread is not in main loop	0.00%
0	192.168.192.179:61579	216.58.212.3:443	17	1292	Ether / IP / UDP 192.168.192.179:61579 > 216.58.212.3:https / Raw
----------------------------------------
253.8518	Eroare: main thread is not in main loop	0.00%
0	192.168.192.179:62127	192.168.192.165:53	17	92	Ether / IP / UDP / DNS Qry b'mobile.events.data.microsoft.com.'
----------------------------------------
255.0450	Eroare: main thread is not in main loop	0.00%
0	20.42.65.84:443	192.168.192.179:60388	6	519	Ether / IP / TCP 20.42.65.84:https > 192.168.192.179:60388 FPA / Raw
----------------------------------------
260.4409	Eroare: main thread is not in main loop	0.00%
0	192.168.192.179:60387	13.107.246.44:443	6	55	Ether / IP / TCP 192.168.192.179:60387 > 13.107.246.44:https A / Raw
----------------------------------------
261.5729	Eroare: main thread is not in main loop	0.00%
0	192.168.192.179:60325	52.30.201.170:443	6	54	Ether / IP / TCP 192.168.192.179:60325 > 52.30.201.170:https A
----------------------------------------
263.6890	Eroare: main thread is not in main loop	0.00%
0	192.168.192.179:60230	52.30.201.170:443	6	55	Ether / IP / TCP 192.168.192.179:60230 > 52.30.201.170:https A / Raw
----------------------------------------
268.1344	Eroare: main thread is not in main loop	0.00%
0	192.168.192.179:60246	172.161.47.103:443	6	55	Ether / IP / TCP 192.168.192.179:60246 > 172.161.47.103:https A / Raw
----------------------------------------
271.0636	Eroare: main thread is not in main loop	0.00%
0	172.64.155.209:443	192.168.192.179:60151	6	93	Ether / IP / TCP 172.64.155.209:https > 192.168.192.179:60151 PA / Raw
----------------------------------------
274.9618	Eroare: main thread is not in main loop	0.00%
0	172.64.155.209:443	192.168.192.179:60332	6	93	Ether / IP / TCP 172.64.155.209:https > 192.168.192.179:60332 PA / Raw
----------------------------------------
276.2342	Eroare: main thread is not in main loop	0.00%
0	192.168.192.179:60293	52.97.160.178:443	6	55	Ether / IP / TCP 192.168.192.179:60293 > 52.97.160.178:https A / Raw
----------------------------------------
284.2344	Eroare: main thread is not in main loop	0.00%
0	192.168.192.179:59293	52.223.6.21:443	6	55	Ether / IP / TCP 192.168.192.179:59293 > 52.223.6.21:https A / Raw
----------------------------------------
289.8539	Eroare: main thread is not in main loop	0.00%
0	192.168.192.179:60381	104.16.80.73:443	6	55	Ether / IP / TCP 192.168.192.179:60381 > 104.16.80.73:https A / Raw
----------------------------------------
291.2895	Eroare: main thread is not in main loop	0.00%
0	192.168.192.179:60382	104.16.124.96:443	6	55	Ether / IP / TCP 192.168.192.179:60382 > 104.16.124.96:https A / Raw
----------------------------------------
298.0587	Eroare: main thread is not in main loop	0.00%
0	192.168.192.179:52775	192.168.192.165:53	17	75	Ether / IP / UDP / DNS Qry b'play.google.com.'
----------------------------------------
305.4860	Eroare: main thread is not in main loop	0.00%
0	192.168.192.179:60387	13.107.246.44:443	6	55	Ether / IP / TCP 192.168.192.179:60387 > 13.107.246.44:https A / Raw
----------------------------------------
306.8830	Eroare: main thread is not in main loop	0.00%
0	192.168.192.179:60325	52.30.201.170:443	6	298	Ether / IP / TCP 192.168.192.179:60325 > 52.30.201.170:https PA / Raw
----------------------------------------
308.7965	Eroare: main thread is not in main loop	0.00%
0	192.168.192.179:60230	52.30.201.170:443	6	55	Ether / IP / TCP 192.168.192.179:60230 > 52.30.201.170:https A / Raw
----------------------------------------
313.3118	Eroare: main thread is not in main loop	0.00%
0	192.168.192.179:60246	172.161.47.103:443	6	55	Ether / IP / TCP 192.168.192.179:60246 > 172.161.47.103:https A / Raw
----------------------------------------
320.9023	Eroare: main thread is not in main loop	0.00%
0	192.168.192.179:60213	52.97.141.82:443	6	55	Ether / IP / TCP 192.168.192.179:60213 > 52.97.141.82:https A / Raw
----------------------------------------
322.0116	Eroare: main thread is not in main loop	0.00%
0	192.168.192.179:60325	52.30.201.170:443	6	297	Ether / IP / TCP 192.168.192.179:60325 > 52.30.201.170:https PA / Raw
----------------------------------------
329.3959	Eroare: main thread is not in main loop	0.00%
0	192.168.192.179:59293	52.223.6.21:443	6	55	Ether / IP / TCP 192.168.192.179:59293 > 52.223.6.21:https A / Raw
----------------------------------------
335.0204	Eroare: main thread is not in main loop	0.00%
0	192.168.192.179:60381	104.16.80.73:443	6	55	Ether / IP / TCP 192.168.192.179:60381 > 104.16.80.73:https A / Raw
----------------------------------------
336.4499	Eroare: main thread is not in main loop	0.00%
0	192.168.192.179:60382	104.16.124.96:443	6	55	Ether / IP / TCP 192.168.192.179:60382 > 104.16.124.96:https A / Raw
----------------------------------------
338.5847	Eroare: main thread is not in main loop	0.00%
0	52.30.201.170:443	192.168.192.179:60230	6	78	Ether / IP / TCP 52.30.201.170:https > 192.168.192.179:60230 PA / Raw
----------------------------------------
340.9283	Eroare: main thread is not in main loop	0.00%
0	192.168.192.179:54687	192.168.192.165:53	17	92	Ether / IP / UDP / DNS Qry b'mobile.events.data.microsoft.com.'
----------------------------------------
342.3031	Eroare: main thread is not in main loop	0.00%
0	192.168.192.179:56920	20.199.120.151:443	6	55	Ether / IP / TCP 192.168.192.179:56920 > 20.199.120.151:https A / Raw
----------------------------------------
352.3024	Eroare: main thread is not in main loop	0.00%
0	192.168.192.179:60325	52.30.201.170:443	6	298	Ether / IP / TCP 192.168.192.179:60325 > 52.30.201.170:https PA / Raw
----------------------------------------
358.0728	Eroare: main thread is not in main loop	0.00%
0	192.168.192.179:56993	192.168.192.165:53	17	85	Ether / IP / UDP / DNS Qry b'challenges.cloudflare.com.'
----------------------------------------
359.2156	Eroare: main thread is not in main loop	0.00%
0	104.18.95.41:443	192.168.192.179:64031	17	1242	Ether / IP / UDP 104.18.95.41:https > 192.168.192.179:64031 / Raw
----------------------------------------
360.6668	Eroare: main thread is not in main loop	0.00%
0	192.168.192.179:64031	104.18.95.41:443	17	1286	Ether / IP / UDP 192.168.192.179:64031 > 104.18.95.41:https / Raw
----------------------------------------
365.6351	Eroare: main thread is not in main loop	0.00%
0	192.168.192.179:60325	52.30.201.170:443	6	164	Ether / IP / TCP 192.168.192.179:60325 > 52.30.201.170:https PA / Raw
----------------------------------------
367.4943	Eroare: main thread is not in main loop	0.00%
0	192.168.192.179:60325	52.30.201.170:443	6	298	Ether / IP / TCP 192.168.192.179:60325 > 52.30.201.170:https PA / Raw
----------------------------------------
374.1894	Eroare: main thread is not in main loop	0.00%
0	52.30.201.170:443	192.168.192.179:60325	6	78	Ether / IP / TCP 52.30.201.170:https > 192.168.192.179:60325 PA / Raw
----------------------------------------
380.1793	Eroare: main thread is not in main loop	0.00%
0	192.168.192.179:60381	104.16.80.73:443	6	55	Ether / IP / TCP 192.168.192.179:60381 > 104.16.80.73:https A / Raw
----------------------------------------
381.6167	Eroare: main thread is not in main loop	0.00%
0	192.168.192.179:60382	104.16.124.96:443	6	55	Ether / IP / TCP 192.168.192.179:60382 > 104.16.124.96:https A / Raw
----------------------------------------
382.8040	Eroare: main thread is not in main loop	0.00%
0	52.30.201.170:443	192.168.192.179:60325	6	54	Ether / IP / TCP 52.30.201.170:https > 192.168.192.179:60325 A
----------------------------------------
392.9820	Eroare: main thread is not in main loop	0.00%
0	192.168.192.179:57099	192.168.192.165:53	17	92	Ether / IP / UDP / DNS Qry b'mobile.events.data.microsoft.com.'
----------------------------------------
394.0902	Eroare: main thread is not in main loop	0.00%
0	104.208.16.95:443	192.168.192.179:60390	6	157	Ether / IP / TCP 104.208.16.95:https > 192.168.192.179:60390 PA / Raw
----------------------------------------
397.8156	Eroare: main thread is not in main loop	0.00%
0	192.168.192.179:60325	52.30.201.170:443	6	297	Ether / IP / TCP 192.168.192.179:60325 > 52.30.201.170:https PA / Raw
----------------------------------------
403.6331	Eroare: main thread is not in main loop	0.00%
0	192.168.192.179:60246	172.161.47.103:443	6	55	Ether / IP / TCP 192.168.192.179:60246 > 172.161.47.103:https A / Raw
----------------------------------------
411.1479	Eroare: main thread is not in main loop	0.00%
0	192.168.192.179:60213	52.97.141.82:443	6	55	Ether / IP / TCP 192.168.192.179:60213 > 52.97.141.82:https A / Raw
----------------------------------------
412.9445	Eroare: main thread is not in main loop	0.00%
0	192.168.192.179:60325	52.30.201.170:443	6	298	Ether / IP / TCP 192.168.192.179:60325 > 52.30.201.170:https PA / Raw
----------------------------------------
418.7939	Eroare: main thread is not in main loop	0.00%
0	192.168.192.179:62143	192.168.192.165:53	17	92	Ether / IP / UDP / DNS Qry b'mobile.events.data.microsoft.com.'
----------------------------------------
425.3409	Eroare: main thread is not in main loop	0.00%
0	192.168.192.179:60381	104.16.80.73:443	6	55	Ether / IP / TCP 192.168.192.179:60381 > 104.16.80.73:https A / Raw
----------------------------------------
426.7720	Eroare: main thread is not in main loop	0.00%
0	192.168.192.179:60382	104.16.124.96:443	6	55	Ether / IP / TCP 192.168.192.179:60382 > 104.16.124.96:https A / Raw
----------------------------------------
428.0688	Eroare: main thread is not in main loop	0.00%
0	192.168.192.179:60325	52.30.201.170:443	6	298	Ether / IP / TCP 192.168.192.179:60325 > 52.30.201.170:https PA / Raw
----------------------------------------
443.2149	Eroare: main thread is not in main loop	0.00%
0	192.168.192.179:60325	52.30.201.170:443	6	297	Ether / IP / TCP 192.168.192.179:60325 > 52.30.201.170:https PA / Raw
----------------------------------------
446.1837	Eroare: main thread is not in main loop	0.00%
0	192.168.192.179:57711	192.168.192.165:53	17	74	Ether / IP / UDP / DNS Qry b'ab.chatgpt.com.'
----------------------------------------
447.2561	Eroare: main thread is not in main loop	0.00%
0	192.168.192.179:51891	172.217.20.86:443	17	1292	Ether / IP / UDP 192.168.192.179:51891 > 172.217.20.86:https / Raw
----------------------------------------
448.7074	Eroare: main thread is not in main loop	0.00%
0	192.168.192.179:60246	172.161.47.103:443	6	55	Ether / IP / TCP 192.168.192.179:60246 > 172.161.47.103:https A / Raw
----------------------------------------
450.1940	Eroare: main thread is not in main loop	0.00%
0	192.168.192.179:60392	172.64.155.209:443	6	230	Ether / IP / TCP 192.168.192.179:60392 > 172.64.155.209:https PA / Raw
----------------------------------------
451.6783	Eroare: main thread is not in main loop	0.00%
0	192.168.192.179:60393	172.64.155.209:443	6	5262	Ether / IP / TCP 192.168.192.179:60393 > 172.64.155.209:https PA / Raw
----------------------------------------
453.8239	Eroare: main thread is not in main loop	0.00%
0	192.168.192.179:60393	172.64.155.209:443	6	5263	Ether / IP / TCP 192.168.192.179:60393 > 172.64.155.209:https PA / Raw
----------------------------------------
454.9596	Eroare: main thread is not in main loop	0.00%
0	194.124.205.65:443	192.168.192.179:60394	6	54	Ether / IP / TCP 194.124.205.65:https > 192.168.192.179:60394 A
----------------------------------------
456.0113	Eroare: main thread is not in main loop	0.00%
0	192.168.192.179:55484	172.64.146.98:443	17	1292	Ether / IP / UDP 192.168.192.179:55484 > 172.64.146.98:https / Raw
----------------------------------------
457.0890	Eroare: main thread is not in main loop	0.00%
0	172.64.155.209:443	192.168.192.179:60392	6	54	Ether / IP / TCP 172.64.155.209:https > 192.168.192.179:60392 A
----------------------------------------
458.1784	Eroare: main thread is not in main loop	0.00%
0	172.64.155.209:443	192.168.192.179:60393	6	54	Ether / IP / TCP 172.64.155.209:https > 192.168.192.179:60393 A
----------------------------------------
459.2328	Eroare: main thread is not in main loop	0.00%
0	104.18.43.204:443	192.168.192.179:60395	6	1354	Ether / IP / TCP 104.18.43.204:https > 192.168.192.179:60395 A / Raw
----------------------------------------
461.0532	Eroare: main thread is not in main loop	0.00%
0	192.168.192.179:54754	216.58.212.46:443	17	1288	Ether / IP / UDP 192.168.192.179:54754 > 216.58.212.46:https / Raw
----------------------------------------
462.3090	Eroare: main thread is not in main loop	0.00%
0	192.168.192.179:60393	172.64.155.209:443	6	10200	Ether / IP / TCP 192.168.192.179:60393 > 172.64.155.209:https PA / Raw
----------------------------------------
463.4022	Eroare: main thread is not in main loop	0.00%
0	172.64.155.209:443	192.168.192.179:60393	6	394	Ether / IP / TCP 172.64.155.209:https > 192.168.192.179:60393 PA / Raw
----------------------------------------
464.6511	Eroare: main thread is not in main loop	0.00%
0	104.16.80.73:443	192.168.192.179:60381	6	93	Ether / IP / TCP 104.16.80.73:https > 192.168.192.179:60381 PA / Raw
----------------------------------------
465.9345	Eroare: main thread is not in main loop	0.00%
0	104.16.124.96:443	192.168.192.179:60382	6	93	Ether / IP / TCP 104.16.124.96:https > 192.168.192.179:60382 PA / Raw
----------------------------------------
467.8706	Eroare: main thread is not in main loop	0.00%
0	172.64.155.209:443	192.168.192.179:60393	6	1354	Ether / IP / TCP 172.64.155.209:https > 192.168.192.179:60393 A / Raw
----------------------------------------
469.7742	Eroare: main thread is not in main loop	0.00%
0	172.64.155.209:443	192.168.192.179:60393	6	298	Ether / IP / TCP 172.64.155.209:https > 192.168.192.179:60393 PA / Raw
----------------------------------------
471.7063	Eroare: main thread is not in main loop	0.00%
0	172.64.155.209:443	192.168.192.179:60393	6	1354	Ether / IP / TCP 172.64.155.209:https > 192.168.192.179:60393 A / Raw
----------------------------------------
472.7780	Eroare: main thread is not in main loop	0.00%
0	192.168.192.179:60393	172.64.155.209:443	6	54	Ether / IP / TCP 192.168.192.179:60393 > 172.64.155.209:https A
----------------------------------------
473.8504	Eroare: main thread is not in main loop	0.00%
0	172.64.155.209:443	192.168.192.179:60393	6	130	Ether / IP / TCP 172.64.155.209:https > 192.168.192.179:60393 PA / Raw
----------------------------------------
474.9250	Eroare: main thread is not in main loop	0.00%
0	172.64.155.209:443	192.168.192.179:60393	6	130	Ether / IP / TCP 172.64.155.209:https > 192.168.192.179:60393 PA / Raw
----------------------------------------
476.0020	Eroare: main thread is not in main loop	0.00%
0	172.64.155.209:443	192.168.192.179:60393	6	54	Ether / IP / TCP 172.64.155.209:https > 192.168.192.179:60393 A
----------------------------------------
477.0825	Eroare: main thread is not in main loop	0.00%
0	172.64.155.209:443	192.168.192.179:60393	6	54	Ether / IP / TCP 172.64.155.209:https > 192.168.192.179:60393 A
----------------------------------------
478.1768	Eroare: main thread is not in main loop	0.00%
0	192.168.192.179:60393	172.64.155.209:443	6	6655	Ether / IP / TCP 192.168.192.179:60393 > 172.64.155.209:https PA / Raw
----------------------------------------
486.4465	Eroare: main thread is not in main loop	0.00%
0	192.168.192.179:60392	172.64.155.209:443	6	230	Ether / IP / TCP 192.168.192.179:60392 > 172.64.155.209:https PA / Raw
----------------------------------------
491.0626	Eroare: main thread is not in main loop	0.00%
0	192.168.192.179:60325	52.30.201.170:443	6	298	Ether / IP / TCP 192.168.192.179:60325 > 52.30.201.170:https PA / Raw
----------------------------------------
492.9048	Eroare: main thread is not in main loop	0.00%
0	192.168.192.179:60392	172.64.155.209:443	6	230	Ether / IP / TCP 192.168.192.179:60392 > 172.64.155.209:https PA / Raw
----------------------------------------
494.1273	Eroare: main thread is not in main loop	0.00%
0	172.64.155.209:443	192.168.192.179:60393	6	170	Ether / IP / TCP 172.64.155.209:https > 192.168.192.179:60393 PA / Raw
----------------------------------------
495.1955	Eroare: main thread is not in main loop	0.00%
0	172.64.155.209:443	192.168.192.179:60393	6	130	Ether / IP / TCP 172.64.155.209:https > 192.168.192.179:60393 PA / Raw
----------------------------------------
496.3195	Eroare: main thread is not in main loop	0.00%
0	192.168.192.179:60393	172.64.155.209:443	6	54	Ether / IP / TCP 192.168.192.179:60393 > 172.64.155.209:https A
----------------------------------------
497.3881	Eroare: main thread is not in main loop	0.00%
0	192.168.192.179:60393	172.64.155.209:443	6	54	Ether / IP / TCP 192.168.192.179:60393 > 172.64.155.209:https A
----------------------------------------
498.8953	Eroare: main thread is not in main loop	0.00%
0	172.64.155.209:443	192.168.192.179:60393	6	146	Ether / IP / TCP 172.64.155.209:https > 192.168.192.179:60393 PA / Raw
----------------------------------------
500.1212	Eroare: main thread is not in main loop	0.00%
0	172.64.155.209:443	192.168.192.179:60393	6	154	Ether / IP / TCP 172.64.155.209:https > 192.168.192.179:60393 PA / Raw
----------------------------------------
501.3353	Eroare: main thread is not in main loop	0.00%
0	192.168.192.179:60213	52.97.141.82:443	6	55	Ether / IP / TCP 192.168.192.179:60213 > 52.97.141.82:https A / Raw
----------------------------------------
503.7036	Eroare: main thread is not in main loop	0.00%
0	192.168.192.179:60230	52.30.201.170:443	6	55	Ether / IP / TCP 192.168.192.179:60230 > 52.30.201.170:https A / Raw
----------------------------------------
506.1188	Eroare: main thread is not in main loop	0.00%
0	192.168.192.179:53086	192.168.192.165:53	17	88	Ether / IP / UDP / DNS Qry b'browser-intake-datadoghq.com.'
----------------------------------------
508.1366	Eroare: main thread is not in main loop	0.00%
0	192.168.192.179:60246	172.161.47.103:443	6	55	Ether / IP / TCP 192.168.192.179:60246 > 172.161.47.103:https A / Raw
----------------------------------------
509.9163	Eroare: main thread is not in main loop	0.00%
0	192.168.192.179:59293	52.223.6.21:443	6	55	Ether / IP / TCP 192.168.192.179:59293 > 52.223.6.21:https A / Raw
