0.3674	Trafic Legitim	73.12%
0	192.168.192.179:59717	172.64.155.209:443	6	55	Ether / IP / TCP 192.168.192.179:59717 > 172.64.155.209:https A / Raw
----------------------------------------
0.5821	Trafic Legitim	73.12%
0	192.168.192.179:59225	172.217.218.188:5228	6	55	Ether / IP / TCP 192.168.192.179:59225 > 172.217.218.188:5228 A / Raw
----------------------------------------
0.6445	Trafic Legitim	73.12%
2	172.64.155.209:443	192.168.192.179:59717	6	66	Ether / IP / TCP 172.64.155.209:https > 192.168.192.179:59717 A
----------------------------------------
0.7146	Trafic Legitim	73.12%
3	172.217.218.188:5228	192.168.192.179:59225	6	66	Ether / IP / TCP 172.217.218.188:5228 > 192.168.192.179:59225 A
----------------------------------------
1.9659	Trafic Legitim	73.12%
4	82.145.216.19:443	192.168.192.179:59743	6	78	Ether / IP / TCP 82.145.216.19:https > 192.168.192.179:59743 PA / Raw
----------------------------------------
2.4081	Trafic Legitim	73.12%
5	192.168.192.179:59744	52.182.141.63:443	6	172	Ether / IP / TCP 192.168.192.179:59744 > 52.182.141.63:https PA / Raw
----------------------------------------
2.4827	Trafic Legitim	73.12%
6	192.168.192.179:59744	52.182.141.63:443	6	93	Ether / IP / TCP 192.168.192.179:59744 > 52.182.141.63:https PA / Raw
----------------------------------------
2.5454	Trafic Legitim	73.12%
6	192.168.192.179:59744	52.182.141.63:443	6	2327	Ether / IP / TCP 192.168.192.179:59744 > 52.182.141.63:https PA / Raw
----------------------------------------
2.6641	Trafic Legitim	73.12%
8	52.182.141.63:443	192.168.192.179:59744	6	54	Ether / IP / TCP 52.182.141.63:https > 192.168.192.179:59744 A
----------------------------------------
2.7286	Trafic Legitim	73.12%
9	52.182.141.63:443	192.168.192.179:59744	6	54	Ether / IP / TCP 52.182.141.63:https > 192.168.192.179:59744 A
----------------------------------------
2.8050	Trafic Legitim	73.12%
10	52.182.141.63:443	192.168.192.179:59744	6	93	Ether / IP / TCP 52.182.141.63:https > 192.168.192.179:59744 PA / Raw
----------------------------------------
2.8694	Trafic Legitim	73.12%
10	192.168.192.179:59744	52.182.141.63:443	6	54	Ether / IP / TCP 192.168.192.179:59744 > 52.182.141.63:https A
----------------------------------------
3.0589	Trafic Legitim	73.12%
12	52.182.141.63:443	192.168.192.179:59744	6	153	Ether / IP / TCP 52.182.141.63:https > 192.168.192.179:59744 PA / Raw
----------------------------------------
3.1260	Trafic Legitim	73.12%
13	192.168.192.179:59744	52.182.141.63:443	6	89	Ether / IP / TCP 192.168.192.179:59744 > 52.182.141.63:https PA / Raw
----------------------------------------
3.4335	Trafic Legitim	73.12%
14	192.168.192.179:59744	52.182.141.63:443	6	89	Ether / IP / TCP 192.168.192.179:59744 > 52.182.141.63:https PA / Raw
----------------------------------------
3.4974	Trafic Legitim	73.12%
15	52.182.141.63:443	192.168.192.179:59744	6	54	Ether / IP / TCP 52.182.141.63:https > 192.168.192.179:59744 A
----------------------------------------
3.6819	Trafic Legitim	73.12%
16	52.182.141.63:443	192.168.192.179:59744	6	66	Ether / IP / TCP 52.182.141.63:https > 192.168.192.179:59744 A
----------------------------------------
7.0826	Trafic Legitim	73.12%
17	192.168.192.179:62138	216.58.212.3:443	17	1292	Ether / IP / UDP 192.168.192.179:62138 > 216.58.212.3:https / Raw
----------------------------------------
