0.3621	Atac: NORMAL	85.75%
12	52.16.218.208:443	192.168.125.179:61228	6	78	Ether / IP / TCP 52.16.218.208:https > 192.168.125.179:61228 PA / Raw
----------------------------------------
0.4372	Atac: NORMAL	85.75%
13	192.168.125.179:61228	52.16.218.208:443	6	82	Ether / IP / TCP 192.168.125.179:61228 > 52.16.218.208:https PA / Raw
----------------------------------------
0.5692	Atac: NORMAL	85.75%
14	52.16.218.208:443	192.168.125.179:61228	6	54	Ether / IP / TCP 52.16.218.208:https > 192.168.125.179:61228 A
----------------------------------------
5.8380	Atac: NORMAL	70.54%
15	192.168.125.179:59092	192.168.125.213:53	17	79	Ether / IP / UDP / DNS Qry b'accounts.google.com.'
----------------------------------------
5.9205	Atac: NORMAL	70.54%
16	192.168.125.179:65529	192.168.125.213:53	17	79	Ether / IP / UDP / DNS Qry b'accounts.google.com.'
----------------------------------------
6.0010	Atac: NORMAL	70.54%
17	192.168.125.213:53	192.168.125.179:59092	17	95	Ether / IP / UDP / DNS Ans 64.233.166.84
----------------------------------------
6.0971	Atac: NORMAL	70.54%
18	64.233.166.84:443	192.168.125.179:50943	17	82	Ether / IP / UDP 64.233.166.84:https > 192.168.125.179:50943 / Raw
----------------------------------------
6.1691	Atac: NORMAL	70.54%
18	64.233.166.84:443	192.168.125.179:50943	17	82	Ether / IP / UDP 64.233.166.84:https > 192.168.125.179:50943 / Raw
----------------------------------------
6.2396	Atac: NORMAL	70.54%
20	64.233.166.84:443	192.168.125.179:50943	17	1292	Ether / IP / UDP 64.233.166.84:https > 192.168.125.179:50943 / Raw
----------------------------------------
6.3086	Atac: NORMAL	70.54%
21	64.233.166.84:443	192.168.125.179:50943	17	1292	Ether / IP / UDP 64.233.166.84:https > 192.168.125.179:50943 / Raw
----------------------------------------
6.3806	Atac: NORMAL	70.54%
21	64.233.166.84:443	192.168.125.179:50943	17	1292	Ether / IP / UDP 64.233.166.84:https > 192.168.125.179:50943 / Raw
----------------------------------------
6.4566	Atac: NORMAL	70.54%
23	64.233.166.84:443	192.168.125.179:50943	17	348	Ether / IP / UDP 64.233.166.84:https > 192.168.125.179:50943 / Raw
----------------------------------------
6.5306	Atac: NORMAL	70.54%
24	64.233.166.84:443	192.168.125.179:50943	17	986	Ether / IP / UDP 64.233.166.84:https > 192.168.125.179:50943 / Raw
----------------------------------------
6.6036	Atac: NORMAL	70.54%
24	64.233.166.84:443	192.168.125.179:50943	17	73	Ether / IP / UDP 64.233.166.84:https > 192.168.125.179:50943 / Raw
----------------------------------------
6.6766	Atac: NORMAL	70.54%
26	192.168.125.179:50943	64.233.166.84:443	17	120	Ether / IP / UDP 192.168.125.179:50943 > 64.233.166.84:https / Raw
----------------------------------------
6.7482	Atac: NORMAL	70.54%
27	192.168.125.179:50943	64.233.166.84:443	17	73	Ether / IP / UDP 192.168.125.179:50943 > 64.233.166.84:https / Raw
----------------------------------------
6.8171	Atac: NORMAL	70.54%
27	192.168.125.179:50943	64.233.166.84:443	17	1288	Ether / IP / UDP 192.168.125.179:50943 > 64.233.166.84:https / Raw
----------------------------------------
6.8877	Atac: NORMAL	70.54%
29	192.168.125.179:50943	64.233.166.84:443	17	1292	Ether / IP / UDP 192.168.125.179:50943 > 64.233.166.84:https / Raw
----------------------------------------
6.9577	Atac: NORMAL	70.54%
30	192.168.125.179:50943	64.233.166.84:443	17	1193	Ether / IP / UDP 192.168.125.179:50943 > 64.233.166.84:https / Raw
----------------------------------------
7.0388	Atac: NORMAL	70.54%
30	192.168.125.179:50943	64.233.166.84:443	17	137	Ether / IP / UDP 192.168.125.179:50943 > 64.233.166.84:https / Raw
----------------------------------------
7.1834	Atac: NORMAL	70.54%
32	192.168.125.179:56554	192.168.125.213:53	17	79	Ether / IP / UDP / DNS Qry b'teams.microsoft.com.'
----------------------------------------
7.2574	Atac: NORMAL	70.54%
33	192.168.125.179:62626	192.168.125.213:53	17	79	Ether / IP / UDP / DNS Qry b'teams.microsoft.com.'
----------------------------------------
7.3264	Atac: NORMAL	70.54%
33	192.168.125.213:53	192.168.125.179:62626	17	248	Ether / IP / UDP / DNS Ans b'teams.office.com.'
----------------------------------------
7.3964	Atac: NORMAL	70.54%
35	192.168.125.213:53	192.168.125.179:56554	17	233	Ether / IP / UDP / DNS Ans b'teams.office.com.'
----------------------------------------
7.4672	Atac: NORMAL	85.75%
36	192.168.125.179:63706	52.123.128.14:443	6	66	Ether / IP / TCP 192.168.125.179:63706 > 52.123.128.14:https S
----------------------------------------
7.5402	Atac: NORMAL	85.75%
36	52.123.128.14:443	192.168.125.179:63706	6	66	Ether / IP / TCP 52.123.128.14:https > 192.168.125.179:63706 SA
----------------------------------------
7.6104	Atac: NORMAL	85.75%
38	192.168.125.179:63706	52.123.128.14:443	6	54	Ether / IP / TCP 192.168.125.179:63706 > 52.123.128.14:https A
----------------------------------------
7.6794	Atac: NORMAL	85.75%
39	192.168.125.179:63706	52.123.128.14:443	6	2266	Ether / IP / TCP 192.168.125.179:63706 > 52.123.128.14:https PA / Raw
----------------------------------------
7.7504	Atac: NORMAL	85.75%
39	52.123.128.14:443	192.168.125.179:63706	6	54	Ether / IP / TCP 52.123.128.14:https > 192.168.125.179:63706 A
----------------------------------------
7.8204	Atac: NORMAL	85.75%
41	52.123.128.14:443	192.168.125.179:63706	6	54	Ether / IP / TCP 52.123.128.14:https > 192.168.125.179:63706 A
----------------------------------------
7.8874	Atac: NORMAL	85.75%
41	52.123.128.14:443	192.168.125.179:63706	6	153	Ether / IP / TCP 52.123.128.14:https > 192.168.125.179:63706 PA / Raw
----------------------------------------
7.9574	Atac: NORMAL	85.75%
43	192.168.125.179:63706	52.123.128.14:443	6	1112	Ether / IP / TCP 192.168.125.179:63706 > 52.123.128.14:https PA / Raw
----------------------------------------
8.0244	Atac: NORMAL	85.75%
44	52.123.128.14:443	192.168.125.179:63706	6	54	Ether / IP / TCP 52.123.128.14:https > 192.168.125.179:63706 A
----------------------------------------
8.0934	Atac: NORMAL	85.75%
44	52.123.128.14:443	192.168.125.179:63706	6	1354	Ether / IP / TCP 52.123.128.14:https > 192.168.125.179:63706 A / Raw
----------------------------------------
9.8322	Atac: NORMAL	85.75%
46	192.168.125.179:61228	52.16.218.208:443	6	297	Ether / IP / TCP 192.168.125.179:61228 > 52.16.218.208:https PA / Raw
----------------------------------------
9.9445	Atac: NORMAL	85.75%
46	52.16.218.208:443	192.168.125.179:61228	6	54	Ether / IP / TCP 52.16.218.208:https > 192.168.125.179:61228 A
----------------------------------------
10.1474	Eroare: main thread is not in main loop	0.00%
46	52.16.218.208:443	192.168.125.179:61228	6	320	Ether / IP / TCP 52.16.218.208:https > 192.168.125.179:61228 PA / Raw
----------------------------------------
11.8334	Eroare: main thread is not in main loop	0.00%
46	192.168.125.179:63345	185.60.218.53:5222	6	123	Ether / IP / TCP 192.168.125.179:63345 > 185.60.218.53:5222 PA / Raw
----------------------------------------
13.9567	Eroare: main thread is not in main loop	0.00%
46	162.247.241.14:443	192.168.125.179:63500	6	54	Ether / IP / TCP 162.247.241.14:https > 192.168.125.179:63500 A
----------------------------------------
17.9597	Eroare: main thread is not in main loop	0.00%
46	192.168.125.179:62651	52.123.134.246:443	6	105	Ether / IP / TCP 192.168.125.179:62651 > 52.123.134.246:https PA / Raw
----------------------------------------
20.6753	Eroare: main thread is not in main loop	0.00%
46	3.126.133.169:443	192.168.125.179:63626	6	93	Ether / IP / TCP 3.126.133.169:https > 192.168.125.179:63626 PA / Raw
----------------------------------------
23.0810	Eroare: main thread is not in main loop	0.00%
46	192.168.125.179:62718	52.123.134.246:443	6	105	Ether / IP / TCP 192.168.125.179:62718 > 52.123.134.246:https PA / Raw
----------------------------------------
25.6042	Eroare: main thread is not in main loop	0.00%
46	192.168.125.179:60374	108.177.96.188:5228	6	55	Ether / IP / TCP 192.168.125.179:60374 > 108.177.96.188:5228 A / Raw
----------------------------------------
26.7208	Eroare: main thread is not in main loop	0.00%
46	192.168.125.179:59852	142.250.187.131:443	17	74	Ether / IP / UDP 192.168.125.179:59852 > 142.250.187.131:https / Raw
----------------------------------------
28.8433	Eroare: main thread is not in main loop	0.00%
46	192.168.125.179:63345	185.60.218.53:5222	6	123	Ether / IP / TCP 192.168.125.179:63345 > 185.60.218.53:5222 PA / Raw
----------------------------------------
30.5699	Eroare: main thread is not in main loop	0.00%
46	192.168.125.179:60242	52.123.200.36:443	6	112	Ether / IP / TCP 192.168.125.179:60242 > 52.123.200.36:https PA / Raw
----------------------------------------
32.6893	Eroare: main thread is not in main loop	0.00%
46	192.168.125.179:63613	104.18.32.47:443	6	55	Ether / IP / TCP 192.168.125.179:63613 > 104.18.32.47:https A / Raw
----------------------------------------
35.8165	Eroare: main thread is not in main loop	0.00%
46	192.168.125.179:60257	74.248.74.217:443	6	112	Ether / IP / TCP 192.168.125.179:60257 > 74.248.74.217:https PA / Raw
----------------------------------------
39.1434	Eroare: main thread is not in main loop	0.00%
46	192.168.125.179:63699	104.208.16.92:443	6	55	Ether / IP / TCP 192.168.125.179:63699 > 104.208.16.92:https A / Raw
----------------------------------------
41.8322	Eroare: main thread is not in main loop	0.00%
46	192.168.125.179:61228	52.16.218.208:443	6	297	Ether / IP / TCP 192.168.125.179:61228 > 52.16.218.208:https PA / Raw
----------------------------------------
43.4256	Eroare: main thread is not in main loop	0.00%
46	192.168.125.179:63500	162.247.241.14:443	6	55	Ether / IP / TCP 192.168.125.179:63500 > 162.247.241.14:https A / Raw
----------------------------------------
45.5943	Eroare: main thread is not in main loop	0.00%
46	192.168.125.179:50212	192.168.125.213:53	17	91	Ether / IP / UDP / DNS Qry b'teams.events.data.microsoft.com.'
----------------------------------------
46.6851	Eroare: main thread is not in main loop	0.00%
46	192.168.125.179:63733	52.168.117.170:443	6	54	Ether / IP / TCP 192.168.125.179:63733 > 52.168.117.170:https A
----------------------------------------
51.6286	Eroare: main thread is not in main loop	0.00%
46	192.168.125.179:59852	142.250.187.131:443	17	145	Ether / IP / UDP 192.168.125.179:59852 > 142.250.187.131:https / Raw
----------------------------------------
52.7927	Eroare: main thread is not in main loop	0.00%
46	192.168.125.179:63706	52.123.128.14:443	6	55	Ether / IP / TCP 192.168.125.179:63706 > 52.123.128.14:https A / Raw
----------------------------------------
54.8329	Eroare: main thread is not in main loop	0.00%
46	192.168.125.179:63345	185.60.218.53:5222	6	123	Ether / IP / TCP 192.168.125.179:63345 > 185.60.218.53:5222 PA / Raw
----------------------------------------
57.8321	Eroare: main thread is not in main loop	0.00%
46	192.168.125.179:61228	52.16.218.208:443	6	298	Ether / IP / TCP 192.168.125.179:61228 > 52.16.218.208:https PA / Raw
----------------------------------------
60.7405	Eroare: main thread is not in main loop	0.00%
46	192.168.125.179:54424	192.168.125.213:53	17	101	Ether / IP / UDP / DNS Qry b'westus-0.in.applicationinsights.azure.com.'
----------------------------------------
62.0079	Eroare: main thread is not in main loop	0.00%
46	20.189.172.76:443	192.168.125.179:63764	6	157	Ether / IP / TCP 20.189.172.76:https > 192.168.125.179:63764 PA / Raw
----------------------------------------
63.1234	Eroare: main thread is not in main loop	0.00%
46	4.208.165.247:443	192.168.125.179:63771	6	657	Ether / IP / TCP 4.208.165.247:https > 192.168.125.179:63771 PA / Raw
----------------------------------------
64.6249	Eroare: main thread is not in main loop	0.00%
46	20.189.172.76:443	192.168.125.179:63779	6	66	Ether / IP / TCP 20.189.172.76:https > 192.168.125.179:63779 SA
----------------------------------------
65.8709	Eroare: main thread is not in main loop	0.00%
46	20.189.172.76:443	192.168.125.179:63779	6	54	Ether / IP / TCP 20.189.172.76:https > 192.168.125.179:63779 A
----------------------------------------
66.9888	Eroare: main thread is not in main loop	0.00%
46	20.189.172.76:443	192.168.125.179:63789	6	153	Ether / IP / TCP 20.189.172.76:https > 192.168.125.179:63789 PA / Raw
----------------------------------------
68.5915	Eroare: main thread is not in main loop	0.00%
46	192.168.125.179:63791	20.189.172.76:443	6	66	Ether / IP / TCP 192.168.125.179:63791 > 20.189.172.76:https S
----------------------------------------
69.7053	Eroare: main thread is not in main loop	0.00%
46	20.189.172.76:443	192.168.125.179:63791	6	54	Ether / IP / TCP 20.189.172.76:https > 192.168.125.179:63791 A
----------------------------------------
70.8418	Eroare: main thread is not in main loop	0.00%
46	108.177.96.188:5228	192.168.125.179:60374	6	66	Ether / IP / TCP 108.177.96.188:5228 > 192.168.125.179:60374 A
----------------------------------------
71.9487	Eroare: main thread is not in main loop	0.00%
46	20.189.172.76:443	192.168.125.179:63793	6	66	Ether / IP / TCP 20.189.172.76:https > 192.168.125.179:63793 SA
----------------------------------------
73.8415	Eroare: main thread is not in main loop	0.00%
46	192.168.125.179:61228	52.16.218.208:443	6	298	Ether / IP / TCP 192.168.125.179:61228 > 52.16.218.208:https PA / Raw
----------------------------------------
74.9478	Eroare: main thread is not in main loop	0.00%
46	185.60.218.53:5222	192.168.125.179:63345	6	125	Ether / IP / TCP 185.60.218.53:5222 > 192.168.125.179:63345 PA / Raw
----------------------------------------
76.3265	Eroare: main thread is not in main loop	0.00%
46	192.168.125.179:51123	192.168.125.213:53	17	79	Ether / IP / UDP / DNS Qry b'main.vscode-cdn.net.'
----------------------------------------
77.7342	Eroare: main thread is not in main loop	0.00%
46	192.168.125.179:63613	104.18.32.47:443	6	55	Ether / IP / TCP 192.168.125.179:63613 > 104.18.32.47:https A / Raw
----------------------------------------
81.7476	Eroare: main thread is not in main loop	0.00%
46	192.168.125.179:56993	142.250.187.131:443	17	1292	Ether / IP / UDP 192.168.125.179:56993 > 142.250.187.131:https / Raw
----------------------------------------
84.3851	Eroare: main thread is not in main loop	0.00%
46	192.168.125.179:63699	104.208.16.92:443	6	55	Ether / IP / TCP 192.168.125.179:63699 > 104.208.16.92:https A / Raw
----------------------------------------
85.6581	Eroare: main thread is not in main loop	0.00%
46	192.168.125.179:62799	52.123.200.36:443	6	111	Ether / IP / TCP 192.168.125.179:62799 > 52.123.200.36:https PA / Raw
----------------------------------------
88.5875	Eroare: main thread is not in main loop	0.00%
46	192.168.125.179:61334	172.161.47.103:443	6	55	Ether / IP / TCP 192.168.125.179:61334 > 172.161.47.103:https A / Raw
----------------------------------------
89.8420	Eroare: main thread is not in main loop	0.00%
46	192.168.125.179:61228	52.16.218.208:443	6	298	Ether / IP / TCP 192.168.125.179:61228 > 52.16.218.208:https PA / Raw
----------------------------------------
91.0177	Eroare: main thread is not in main loop	0.00%
46	74.248.74.217:443	192.168.125.179:60257	6	101	Ether / IP / TCP 74.248.74.217:https > 192.168.125.179:60257 PA / Raw
----------------------------------------
97.8359	Eroare: main thread is not in main loop	0.00%
46	192.168.125.179:63706	52.123.128.14:443	6	55	Ether / IP / TCP 192.168.125.179:63706 > 52.123.128.14:https A / Raw
----------------------------------------
102.8352	Eroare: main thread is not in main loop	0.00%
46	192.168.125.179:63345	185.60.218.53:5222	6	123	Ether / IP / TCP 192.168.125.179:63345 > 185.60.218.53:5222 PA / Raw
----------------------------------------
104.0190	Eroare: main thread is not in main loop	0.00%
46	162.247.241.14:443	192.168.125.179:63500	6	66	Ether / IP / TCP 162.247.241.14:https > 192.168.125.179:63500 A
----------------------------------------
105.8303	Eroare: main thread is not in main loop	0.00%
46	192.168.125.179:61228	52.16.218.208:443	6	297	Ether / IP / TCP 192.168.125.179:61228 > 52.16.218.208:https PA / Raw
----------------------------------------
108.4255	Eroare: main thread is not in main loop	0.00%
46	192.168.125.179:62936	192.168.125.213:53	17	92	Ether / IP / UDP / DNS Qry b'mobile.events.data.microsoft.com.'
----------------------------------------
109.5257	Eroare: main thread is not in main loop	0.00%
46	13.70.79.200:443	192.168.125.179:63800	6	153	Ether / IP / TCP 13.70.79.200:https > 192.168.125.179:63800 PA / Raw
----------------------------------------
110.6548	Eroare: main thread is not in main loop	0.00%
46	13.70.79.200:443	192.168.125.179:63800	6	54	Ether / IP / TCP 13.70.79.200:https > 192.168.125.179:63800 A
----------------------------------------
113.1740	Eroare: main thread is not in main loop	0.00%
46	192.168.125.179:60374	108.177.96.188:5228	6	80	Ether / IP / TCP 192.168.125.179:60374 > 108.177.96.188:5228 PA / Raw
----------------------------------------
117.0367	Eroare: main thread is not in main loop	0.00%
46	104.18.32.47:443	192.168.125.179:63613	6	93	Ether / IP / TCP 104.18.32.47:https > 192.168.125.179:63613 PA / Raw
----------------------------------------
118.2692	Eroare: main thread is not in main loop	0.00%
46	162.247.241.14:443	192.168.125.179:63500	6	535	Ether / IP / TCP 162.247.241.14:https > 192.168.125.179:63500 PA / Raw
----------------------------------------
120.3560	Eroare: main thread is not in main loop	0.00%
46	52.16.218.208:443	192.168.125.179:61228	6	78	Ether / IP / TCP 52.16.218.208:https > 192.168.125.179:61228 PA / Raw
----------------------------------------
121.6001	Eroare: main thread is not in main loop	0.00%
46	192.168.125.179:63797	13.107.246.44:443	6	55	Ether / IP / TCP 192.168.125.179:63797 > 13.107.246.44:https A / Raw
----------------------------------------
125.8379	Eroare: main thread is not in main loop	0.00%
46	192.168.125.179:63345	185.60.218.53:5222	6	123	Ether / IP / TCP 192.168.125.179:63345 > 185.60.218.53:5222 PA / Raw
----------------------------------------
133.7707	Eroare: main thread is not in main loop	0.00%
46	192.168.125.179:61334	172.161.47.103:443	6	55	Ether / IP / TCP 192.168.125.179:61334 > 172.161.47.103:https A / Raw
----------------------------------------
136.9241	Eroare: main thread is not in main loop	0.00%
46	192.168.125.179:63733	52.168.117.170:443	6	55	Ether / IP / TCP 192.168.125.179:63733 > 52.168.117.170:https A / Raw
----------------------------------------
138.0692	Eroare: main thread is not in main loop	0.00%
46	192.168.125.179:61228	52.16.218.208:443	6	54	Ether / IP / TCP 192.168.125.179:61228 > 52.16.218.208:https A
----------------------------------------
140.7354	Eroare: main thread is not in main loop	0.00%
46	192.168.125.179:62799	52.123.200.36:443	6	111	Ether / IP / TCP 192.168.125.179:62799 > 52.123.200.36:https PA / Raw
----------------------------------------
142.8378	Eroare: main thread is not in main loop	0.00%
46	192.168.125.179:63345	185.60.218.53:5222	6	123	Ether / IP / TCP 192.168.125.179:63345 > 185.60.218.53:5222 PA / Raw
----------------------------------------
146.0208	Eroare: main thread is not in main loop	0.00%
46	192.168.125.179:60257	74.248.74.217:443	6	112	Ether / IP / TCP 192.168.125.179:60257 > 74.248.74.217:https PA / Raw
----------------------------------------
148.1472	Eroare: main thread is not in main loop	0.00%
46	172.161.47.103:443	192.168.125.179:61334	6	113	Ether / IP / TCP 172.161.47.103:https > 192.168.125.179:61334 PA / Raw
----------------------------------------
149.3583	Eroare: main thread is not in main loop	0.00%
46	4.208.35.46:443	192.168.125.179:60273	6	94	Ether / IP / TCP 4.208.35.46:https > 192.168.125.179:60273 PA / Raw
----------------------------------------
153.8431	Eroare: main thread is not in main loop	0.00%
46	192.168.125.179:61228	52.16.218.208:443	6	298	Ether / IP / TCP 192.168.125.179:61228 > 52.16.218.208:https PA / Raw
----------------------------------------
158.2663	Eroare: main thread is not in main loop	0.00%
46	192.168.125.179:60374	108.177.96.188:5228	6	55	Ether / IP / TCP 192.168.125.179:60374 > 108.177.96.188:5228 A / Raw
----------------------------------------
162.8302	Eroare: main thread is not in main loop	0.00%
46	192.168.125.179:63345	185.60.218.53:5222	6	123	Ether / IP / TCP 192.168.125.179:63345 > 185.60.218.53:5222 PA / Raw
----------------------------------------
166.0038	Eroare: main thread is not in main loop	0.00%
46	192.168.125.179:63796	140.82.112.21:443	6	55	Ether / IP / TCP 192.168.125.179:63796 > 140.82.112.21:https A / Raw
----------------------------------------
167.0961	Eroare: main thread is not in main loop	0.00%
46	13.107.246.44:443	192.168.125.179:63797	6	78	Ether / IP / TCP 13.107.246.44:https > 192.168.125.179:63797 FPA / Raw
----------------------------------------
168.5112	Eroare: main thread is not in main loop	0.00%
46	13.107.246.44:443	192.168.125.179:63797	6	78	Ether / IP / TCP 13.107.246.44:https > 192.168.125.179:63797 FPA / Raw
----------------------------------------
169.8384	Eroare: main thread is not in main loop	0.00%
46	192.168.125.179:61228	52.16.218.208:443	6	298	Ether / IP / TCP 192.168.125.179:61228 > 52.16.218.208:https PA / Raw
----------------------------------------
175.1860	Eroare: main thread is not in main loop	0.00%
46	52.168.117.170:443	192.168.125.179:63733	6	54	Ether / IP / TCP 52.168.117.170:https > 192.168.125.179:63733 RA
----------------------------------------
177.8367	Eroare: main thread is not in main loop	0.00%
46	192.168.125.179:63500	162.247.241.14:443	6	1055	Ether / IP / TCP 192.168.125.179:63500 > 162.247.241.14:https PA / Raw
----------------------------------------
181.5020	Eroare: main thread is not in main loop	0.00%
46	192.168.125.179:63771	4.208.165.247:443	6	54	Ether / IP / TCP 192.168.125.179:63771 > 4.208.165.247:https FA
----------------------------------------
183.0842	Eroare: main thread is not in main loop	0.00%
46	192.168.125.179:62718	52.123.134.246:443	6	105	Ether / IP / TCP 192.168.125.179:62718 > 52.123.134.246:https PA / Raw
----------------------------------------
185.8289	Eroare: main thread is not in main loop	0.00%
46	192.168.125.179:61228	52.16.218.208:443	6	297	Ether / IP / TCP 192.168.125.179:61228 > 52.16.218.208:https PA / Raw
----------------------------------------
186.9492	Eroare: main thread is not in main loop	0.00%
46	48.209.144.71:443	192.168.125.179:63801	6	54	Ether / IP / TCP 48.209.144.71:https > 192.168.125.179:63801 A
----------------------------------------
189.2052	Eroare: main thread is not in main loop	0.00%
46	192.168.125.179:60273	4.208.35.46:443	6	105	Ether / IP / TCP 192.168.125.179:60273 > 4.208.35.46:https PA / Raw
----------------------------------------
193.2549	Eroare: main thread is not in main loop	0.00%
46	192.168.125.179:61334	172.161.47.103:443	6	55	Ether / IP / TCP 192.168.125.179:61334 > 172.161.47.103:https A / Raw
----------------------------------------
195.7989	Eroare: main thread is not in main loop	0.00%
46	140.82.112.21:443	192.168.125.179:63796	6	93	Ether / IP / TCP 140.82.112.21:https > 192.168.125.179:63796 PA / Raw
----------------------------------------
201.1974	Eroare: main thread is not in main loop	0.00%
46	192.168.125.179:60257	74.248.74.217:443	6	112	Ether / IP / TCP 192.168.125.179:60257 > 74.248.74.217:https PA / Raw
----------------------------------------
203.2727	Eroare: main thread is not in main loop	0.00%
46	192.168.125.179:60374	108.177.96.188:5228	6	55	Ether / IP / TCP 192.168.125.179:60374 > 108.177.96.188:5228 A / Raw
----------------------------------------
209.5733	Eroare: main thread is not in main loop	0.00%
46	162.247.241.14:443	192.168.125.179:63500	6	54	Ether / IP / TCP 162.247.241.14:https > 192.168.125.179:63500 A
----------------------------------------
212.5862	Eroare: main thread is not in main loop	0.00%
46	192.168.125.179:63458	142.4.216.103:443	6	85	Ether / IP / TCP 192.168.125.179:63458 > 142.4.216.103:https PA / Raw
----------------------------------------
213.8010	Eroare: main thread is not in main loop	0.00%
46	192.168.125.179:63455	142.4.216.103:443	6	85	Ether / IP / TCP 192.168.125.179:63455 > 142.4.216.103:https FPA / Raw
----------------------------------------
215.0021	Eroare: main thread is not in main loop	0.00%
46	192.168.125.179:63455	142.4.216.103:443	6	85	Ether / IP / TCP 192.168.125.179:63455 > 142.4.216.103:https FPA / Raw
----------------------------------------
216.1275	Eroare: main thread is not in main loop	0.00%
46	185.136.68.145:443	192.168.125.179:63802	6	54	Ether / IP / TCP 185.136.68.145:https > 192.168.125.179:63802 A
----------------------------------------
217.2514	Eroare: main thread is not in main loop	0.00%
46	63.176.90.252:443	192.168.125.179:63803	6	54	Ether / IP / TCP 63.176.90.252:https > 192.168.125.179:63803 A
----------------------------------------
219.5777	Eroare: main thread is not in main loop	0.00%
46	192.168.125.179:58500	192.168.125.213:53	17	85	Ether / IP / UDP / DNS Qry b'experimentation.deepl.com.'
----------------------------------------
222.2021	Eroare: main thread is not in main loop	0.00%
46	192.168.125.179:63455	142.4.216.103:443	6	85	Ether / IP / TCP 192.168.125.179:63455 > 142.4.216.103:https FPA / Raw
----------------------------------------
223.6624	Eroare: main thread is not in main loop	0.00%
46	192.168.125.179:63500	162.247.241.14:443	6	55	Ether / IP / TCP 192.168.125.179:63500 > 162.247.241.14:https A / Raw
----------------------------------------
227.7864	Eroare: main thread is not in main loop	0.00%
46	192.168.125.179:60055	20.199.120.151:443	6	55	Ether / IP / TCP 192.168.125.179:60055 > 20.199.120.151:https A / Raw
----------------------------------------
229.2165	Eroare: main thread is not in main loop	0.00%
46	192.168.125.179:60273	4.208.35.46:443	6	105	Ether / IP / TCP 192.168.125.179:60273 > 4.208.35.46:https PA / Raw
----------------------------------------
231.8039	Eroare: main thread is not in main loop	0.00%
46	192.168.125.179:63458	142.4.216.103:443	6	54	Ether / IP / TCP 192.168.125.179:63458 > 142.4.216.103:https RA
----------------------------------------
233.8318	Eroare: main thread is not in main loop	0.00%
46	192.168.125.179:61228	52.16.218.208:443	6	297	Ether / IP / TCP 192.168.125.179:61228 > 52.16.218.208:https PA / Raw
----------------------------------------
234.9268	Eroare: main thread is not in main loop	0.00%
46	185.60.218.53:5222	192.168.125.179:63345	6	125	Ether / IP / TCP 185.60.218.53:5222 > 192.168.125.179:63345 PA / Raw
----------------------------------------
237.8345	Eroare: main thread is not in main loop	0.00%
46	192.168.125.179:63500	162.247.241.14:443	6	1055	Ether / IP / TCP 192.168.125.179:63500 > 162.247.241.14:https PA / Raw
----------------------------------------
240.3588	Eroare: main thread is not in main loop	0.00%
46	52.16.218.208:443	192.168.125.179:61228	6	78	Ether / IP / TCP 52.16.218.208:https > 192.168.125.179:61228 PA / Raw
----------------------------------------
248.4375	Eroare: main thread is not in main loop	0.00%
46	192.168.125.179:60374	108.177.96.188:5228	6	55	Ether / IP / TCP 192.168.125.179:60374 > 108.177.96.188:5228 A / Raw
----------------------------------------
249.8296	Eroare: main thread is not in main loop	0.00%
46	192.168.125.179:61228	52.16.218.208:443	6	298	Ether / IP / TCP 192.168.125.179:61228 > 52.16.218.208:https PA / Raw
----------------------------------------
250.9756	Eroare: main thread is not in main loop	0.00%
46	192.168.125.179:62799	52.123.200.36:443	6	111	Ether / IP / TCP 192.168.125.179:62799 > 52.123.200.36:https PA / Raw
----------------------------------------
253.6335	Eroare: main thread is not in main loop	0.00%
46	162.247.241.14:443	192.168.125.179:63500	6	54	Ether / IP / TCP 162.247.241.14:https > 192.168.125.179:63500 A
----------------------------------------
255.8421	Eroare: main thread is not in main loop	0.00%
46	192.168.125.179:63345	185.60.218.53:5222	6	123	Ether / IP / TCP 192.168.125.179:63345 > 185.60.218.53:5222 PA / Raw
----------------------------------------
257.9574	Eroare: main thread is not in main loop	0.00%
46	192.168.125.179:62651	52.123.134.246:443	6	105	Ether / IP / TCP 192.168.125.179:62651 > 52.123.134.246:https PA / Raw
----------------------------------------
262.6173	Eroare: main thread is not in main loop	0.00%
46	185.60.218.53:5222	192.168.125.179:63345	6	124	Ether / IP / TCP 185.60.218.53:5222 > 192.168.125.179:63345 PA / Raw
----------------------------------------
264.4115	Eroare: main thread is not in main loop	0.00%
46	192.168.125.179:58811	192.168.125.213:53	17	92	Ether / IP / UDP / DNS Qry b'mobile.events.data.microsoft.com.'
----------------------------------------
265.7081	Eroare: main thread is not in main loop	0.00%
46	20.189.173.18:443	192.168.125.179:63821	6	1354	Ether / IP / TCP 20.189.173.18:https > 192.168.125.179:63821 A / Raw
----------------------------------------
268.9950	Eroare: main thread is not in main loop	0.00%
46	162.247.241.14:443	192.168.125.179:63500	6	54	Ether / IP / TCP 162.247.241.14:https > 192.168.125.179:63500 A
----------------------------------------
273.3511	Eroare: main thread is not in main loop	0.00%
46	192.168.125.179:61086	192.168.125.213:53	17	92	Ether / IP / UDP / DNS Qry b'mobile.events.data.microsoft.com.'
----------------------------------------
275.5469	Eroare: main thread is not in main loop	0.00%
46	192.168.125.179:63840	52.182.143.208:443	6	66	Ether / IP / TCP 192.168.125.179:63840 > 52.182.143.208:https S
----------------------------------------
276.6698	Eroare: main thread is not in main loop	0.00%
46	52.182.143.208:443	192.168.125.179:63840	6	1354	Ether / IP / TCP 52.182.143.208:https > 192.168.125.179:63840 A / Raw
----------------------------------------
281.8366	Eroare: main thread is not in main loop	0.00%
46	192.168.125.179:61228	52.16.218.208:443	6	298	Ether / IP / TCP 192.168.125.179:61228 > 52.16.218.208:https PA / Raw
----------------------------------------
283.2469	Eroare: main thread is not in main loop	0.00%
46	192.168.125.179:63500	162.247.241.14:443	6	55	Ether / IP / TCP 192.168.125.179:63500 > 162.247.241.14:https A / Raw
----------------------------------------
293.5941	Eroare: main thread is not in main loop	0.00%
46	192.168.125.179:60374	108.177.96.188:5228	6	55	Ether / IP / TCP 192.168.125.179:60374 > 108.177.96.188:5228 A / Raw
----------------------------------------
297.8349	Eroare: main thread is not in main loop	0.00%
46	192.168.125.179:61228	52.16.218.208:443	6	298	Ether / IP / TCP 192.168.125.179:61228 > 52.16.218.208:https PA / Raw
----------------------------------------
303.0890	Eroare: main thread is not in main loop	0.00%
46	192.168.125.179:62718	52.123.134.246:443	6	105	Ether / IP / TCP 192.168.125.179:62718 > 52.123.134.246:https PA / Raw
----------------------------------------
306.0822	Eroare: main thread is not in main loop	0.00%
46	192.168.125.179:60242	52.123.200.36:443	6	112	Ether / IP / TCP 192.168.125.179:60242 > 52.123.200.36:https PA / Raw
----------------------------------------
309.2184	Eroare: main thread is not in main loop	0.00%
46	192.168.125.179:60273	4.208.35.46:443	6	105	Ether / IP / TCP 192.168.125.179:60273 > 4.208.35.46:https PA / Raw
----------------------------------------
310.9513	Eroare: main thread is not in main loop	0.00%
46	192.168.125.179:63821	20.189.173.18:443	6	55	Ether / IP / TCP 192.168.125.179:63821 > 20.189.173.18:https A / Raw
----------------------------------------
312.1809	Eroare: main thread is not in main loop	0.00%
46	20.189.173.18:443	192.168.125.179:63820	6	66	Ether / IP / TCP 20.189.173.18:https > 192.168.125.179:63820 A
----------------------------------------
313.8324	Eroare: main thread is not in main loop	0.00%
46	192.168.125.179:61228	52.16.218.208:443	6	298	Ether / IP / TCP 192.168.125.179:61228 > 52.16.218.208:https PA / Raw
----------------------------------------
323.8365	Eroare: main thread is not in main loop	0.00%
46	192.168.125.179:63345	185.60.218.53:5222	6	123	Ether / IP / TCP 192.168.125.179:63345 > 185.60.218.53:5222 PA / Raw
----------------------------------------
324.9819	Eroare: main thread is not in main loop	0.00%
46	142.4.216.103:443	192.168.125.179:63815	6	85	Ether / IP / TCP 142.4.216.103:https > 192.168.125.179:63815 PA / Raw
----------------------------------------
326.3700	Eroare: main thread is not in main loop	0.00%
46	192.168.125.179:57407	192.168.125.213:53	17	75	Ether / IP / UDP / DNS Qry b'ssl.gstatic.com.'
----------------------------------------
328.2281	Eroare: main thread is not in main loop	0.00%
46	192.168.125.179:63854	20.189.172.73:443	6	66	Ether / IP / TCP 192.168.125.179:63854 > 20.189.172.73:https S
----------------------------------------
329.4789	Eroare: main thread is not in main loop	0.00%
46	20.189.172.73:443	192.168.125.179:63854	6	157	Ether / IP / TCP 20.189.172.73:https > 192.168.125.179:63854 PA / Raw
----------------------------------------
337.9590	Eroare: main thread is not in main loop	0.00%
46	192.168.125.179:62651	52.123.134.246:443	6	105	Ether / IP / TCP 192.168.125.179:62651 > 52.123.134.246:https PA / Raw
----------------------------------------
339.0658	Eroare: main thread is not in main loop	0.00%
46	185.26.182.123:443	192.168.125.179:63858	6	66	Ether / IP / TCP 185.26.182.123:https > 192.168.125.179:63858 SA
----------------------------------------
343.0836	Eroare: main thread is not in main loop	0.00%
46	192.168.125.179:62718	52.123.134.246:443	6	105	Ether / IP / TCP 192.168.125.179:62718 > 52.123.134.246:https PA / Raw
----------------------------------------
345.8443	Eroare: main thread is not in main loop	0.00%
46	192.168.125.179:61228	52.16.218.208:443	6	298	Ether / IP / TCP 192.168.125.179:61228 > 52.16.218.208:https PA / Raw
----------------------------------------
349.2140	Eroare: main thread is not in main loop	0.00%
46	192.168.125.179:60273	4.208.35.46:443	6	105	Ether / IP / TCP 192.168.125.179:60273 > 4.208.35.46:https PA / Raw
----------------------------------------
351.6063	Eroare: main thread is not in main loop	0.00%
46	192.168.125.179:63511	216.58.212.35:443	17	144	Ether / IP / UDP 192.168.125.179:63511 > 216.58.212.35:https / Raw
----------------------------------------
355.0915	Eroare: main thread is not in main loop	0.00%
46	185.60.218.53:5222	192.168.125.179:63345	6	711	Ether / IP / TCP 185.60.218.53:5222 > 192.168.125.179:63345 PA / Raw
----------------------------------------
356.2744	Eroare: main thread is not in main loop	0.00%
46	192.168.125.179:63821	20.189.173.18:443	6	55	Ether / IP / TCP 192.168.125.179:63821 > 20.189.173.18:https A / Raw
----------------------------------------
357.4696	Eroare: main thread is not in main loop	0.00%
46	20.189.173.18:443	192.168.125.179:63820	6	66	Ether / IP / TCP 20.189.173.18:https > 192.168.125.179:63820 A
----------------------------------------
360.6181	Eroare: main thread is not in main loop	0.00%
46	52.16.218.208:443	192.168.125.179:61228	6	78	Ether / IP / TCP 52.16.218.208:https > 192.168.125.179:61228 PA / Raw
----------------------------------------
361.7463	Eroare: main thread is not in main loop	0.00%
46	13.107.5.93:443	192.168.125.179:63860	6	54	Ether / IP / TCP 13.107.5.93:https > 192.168.125.179:63860 A
----------------------------------------
364.0343	Eroare: main thread is not in main loop	0.00%
46	192.168.125.179:55454	192.168.125.213:53	17	101	Ether / IP / UDP / DNS Qry b'westus-0.in.applicationinsights.azure.com.'
----------------------------------------
365.1719	Eroare: main thread is not in main loop	0.00%
46	20.189.172.73:443	192.168.125.179:63862	6	54	Ether / IP / TCP 20.189.172.73:https > 192.168.125.179:63862 A
----------------------------------------
366.5803	Eroare: main thread is not in main loop	0.00%
46	192.168.125.179:60257	74.248.74.217:443	6	112	Ether / IP / TCP 192.168.125.179:60257 > 74.248.74.217:https PA / Raw
----------------------------------------
373.6081	Eroare: main thread is not in main loop	0.00%
46	192.168.125.179:61334	172.161.47.103:443	6	55	Ether / IP / TCP 192.168.125.179:61334 > 172.161.47.103:https A / Raw
----------------------------------------
376.5993	Eroare: main thread is not in main loop	0.00%
46	192.168.125.179:65324	192.168.125.213:53	17	79	Ether / IP / UDP / DNS Qry b'main.vscode-cdn.net.'
----------------------------------------
377.8307	Eroare: main thread is not in main loop	0.00%
46	192.168.125.179:61228	52.16.218.208:443	6	298	Ether / IP / TCP 192.168.125.179:61228 > 52.16.218.208:https PA / Raw
----------------------------------------
381.7261	Eroare: main thread is not in main loop	0.00%
46	192.168.125.179:56898	216.58.212.35:443	17	1292	Ether / IP / UDP 192.168.125.179:56898 > 216.58.212.35:https / Raw
----------------------------------------
383.0789	Eroare: main thread is not in main loop	0.00%
46	192.168.125.179:62718	52.123.134.246:443	6	105	Ether / IP / TCP 192.168.125.179:62718 > 52.123.134.246:https PA / Raw
----------------------------------------
385.8429	Eroare: main thread is not in main loop	0.00%
46	192.168.125.179:63345	185.60.218.53:5222	6	123	Ether / IP / TCP 192.168.125.179:63345 > 185.60.218.53:5222 PA / Raw
----------------------------------------
388.0769	Eroare: main thread is not in main loop	0.00%
46	172.161.47.103:443	192.168.125.179:61334	6	113	Ether / IP / TCP 172.161.47.103:https > 192.168.125.179:61334 PA / Raw
----------------------------------------
389.2139	Eroare: main thread is not in main loop	0.00%
46	162.247.241.14:443	192.168.125.179:63500	6	54	Ether / IP / TCP 162.247.241.14:https > 192.168.125.179:63500 A
----------------------------------------
391.2499	Eroare: main thread is not in main loop	0.00%
46	20.189.173.18:443	192.168.125.179:63820	6	54	Ether / IP / TCP 20.189.173.18:https > 192.168.125.179:63820 RA
----------------------------------------
393.8298	Eroare: main thread is not in main loop	0.00%
46	192.168.125.179:61228	52.16.218.208:443	6	297	Ether / IP / TCP 192.168.125.179:61228 > 52.16.218.208:https PA / Raw
----------------------------------------
401.7687	Eroare: main thread is not in main loop	0.00%
46	192.168.125.179:63500	162.247.241.14:443	6	54	Ether / IP / TCP 192.168.125.179:63500 > 162.247.241.14:https FA
----------------------------------------
405.6331	Eroare: main thread is not in main loop	0.00%
46	192.168.125.179:56181	192.168.125.213:53	17	91	Ether / IP / UDP / DNS Qry b'teams.events.data.microsoft.com.'
----------------------------------------
406.8071	Eroare: main thread is not in main loop	0.00%
46	52.182.143.210:443	192.168.125.179:63897	6	351	Ether / IP / TCP 52.182.143.210:https > 192.168.125.179:63897 PA / Raw
----------------------------------------
409.8431	Eroare: main thread is not in main loop	0.00%
46	192.168.125.179:61228	52.16.218.208:443	6	298	Ether / IP / TCP 192.168.125.179:61228 > 52.16.218.208:https PA / Raw
----------------------------------------
410.9451	Eroare: main thread is not in main loop	0.00%
46	185.60.218.53:5222	192.168.125.179:63345	6	54	Ether / IP / TCP 185.60.218.53:5222 > 192.168.125.179:63345 A
----------------------------------------
416.3473	Eroare: main thread is not in main loop	0.00%
46	192.168.125.179:60242	52.123.200.36:443	6	112	Ether / IP / TCP 192.168.125.179:60242 > 52.123.200.36:https PA / Raw
----------------------------------------
417.4537	Eroare: main thread is not in main loop	0.00%
46	52.109.28.46:443	192.168.125.179:63899	6	54	Ether / IP / TCP 52.109.28.46:https > 192.168.125.179:63899 A
----------------------------------------
418.7536	Eroare: main thread is not in main loop	0.00%
46	162.247.241.14:443	192.168.125.179:63900	6	985	Ether / IP / TCP 162.247.241.14:https > 192.168.125.179:63900 PA / Raw
----------------------------------------
421.5696	Eroare: main thread is not in main loop	0.00%
46	192.168.125.179:137	192.168.125.255:137	17	92	Ether / IP / UDP / NBNSHeader / NBNSQueryRequest who has '\\DESKTOP-H45KHRK'
----------------------------------------
423.0856	Eroare: main thread is not in main loop	0.00%
