1.1432	Trafic Legitim	66.68%
12	192.168.1.1	192.168.1.2	tcp	http	SF	253	253
----------------------------------------
4.2018	Trafic Legitim	66.68%
13	192.168.1.1	192.168.1.2	tcp	http	S0	0	0
----------------------------------------
7.2682	Trafic Legitim	66.68%
14	192.168.1.1	192.168.1.2	tcp	Z39_50	REJ	0	0
----------------------------------------
8.4345	Atac: NORMAL	98.42%
15	192.168.192.179:57954	192.168.192.165:53	17	80	Ether / IP / UDP / DNS Qry b'speeddials.opera.com.'
----------------------------------------
8.4962	Atac: NORMAL	98.42%
16	192.168.192.179:53065	192.168.192.165:53	17	80	Ether / IP / UDP / DNS Qry b'speeddials.opera.com.'
----------------------------------------
8.5807	Atac: NORMAL	98.42%
17	192.168.192.165:53	192.168.192.179:53065	17	190	Ether / IP / UDP / DNS Ans b'speeddials.geo.opera.com.'
----------------------------------------
8.6485	Atac: NORMAL	98.42%
17	192.168.192.165:53	192.168.192.179:57954	17	202	Ether / IP / UDP / DNS Ans b'speeddials.geo.opera.com.'
----------------------------------------
8.7184	Atac: NORMAL	99.35%
19	192.168.192.179:49201	185.26.182.94:443	6	66	Ether / IP / TCP 192.168.192.179:49201 > 185.26.182.94:https S
----------------------------------------
8.7877	Atac: NORMAL	99.35%
20	185.26.182.94:443	192.168.192.179:49201	6	58	Ether / IP / TCP 185.26.182.94:https > 192.168.192.179:49201 SA
----------------------------------------
8.8500	Atac: NORMAL	99.35%
20	192.168.192.179:49201	185.26.182.94:443	6	54	Ether / IP / TCP 192.168.192.179:49201 > 185.26.182.94:https A
----------------------------------------
8.9194	Atac: NORMAL	99.35%
22	192.168.192.179:49201	185.26.182.94:443	6	1816	Ether / IP / TCP 192.168.192.179:49201 > 185.26.182.94:https PA / Raw
----------------------------------------
8.9856	Atac: NORMAL	99.35%
23	185.26.182.94:443	192.168.192.179:49201	6	54	Ether / IP / TCP 185.26.182.94:https > 192.168.192.179:49201 A
----------------------------------------
9.0511	Atac: NORMAL	99.35%
23	185.26.182.94:443	192.168.192.179:49201	6	54	Ether / IP / TCP 185.26.182.94:https > 192.168.192.179:49201 A
----------------------------------------
9.1768	Atac: NORMAL	99.35%
25	185.26.182.94:443	192.168.192.179:49201	6	1354	Ether / IP / TCP 185.26.182.94:https > 192.168.192.179:49201 A / Raw
----------------------------------------
9.2463	Atac: NORMAL	99.35%
26	185.26.182.94:443	192.168.192.179:49201	6	1354	Ether / IP / TCP 185.26.182.94:https > 192.168.192.179:49201 PA / Raw
----------------------------------------
9.3079	Atac: NORMAL	99.35%
27	185.26.182.94:443	192.168.192.179:49201	6	747	Ether / IP / TCP 185.26.182.94:https > 192.168.192.179:49201 PA / Raw
----------------------------------------
9.3790	Atac: NORMAL	99.35%
27	185.26.182.94:443	192.168.192.179:49201	6	85	Ether / IP / TCP 185.26.182.94:https > 192.168.192.179:49201 PA / Raw
----------------------------------------
9.4396	Atac: NORMAL	99.35%
29	192.168.192.179:49201	185.26.182.94:443	6	54	Ether / IP / TCP 192.168.192.179:49201 > 185.26.182.94:https A
----------------------------------------
9.5087	Atac: NORMAL	99.35%
30	192.168.192.179:49201	185.26.182.94:443	6	54	Ether / IP / TCP 192.168.192.179:49201 > 185.26.182.94:https A
----------------------------------------
9.5783	Atac: NORMAL	98.42%
30	192.168.192.179:68	192.168.192.165:67	17	358	Ether / IP / UDP / BOOTP / DHCP Request
----------------------------------------
9.7174	Atac: NORMAL	98.42%
32	192.168.192.165:67	192.168.192.179:68	17	352	Ether / IP / UDP / BOOTP / DHCP Ack
----------------------------------------
10.3274	Trafic Legitim	66.68%
33	192.168.1.1	192.168.1.2	udp	private	SF	105	146
----------------------------------------
10.3897	Atac: NORMAL	99.35%
33	192.168.192.179:49182	13.89.179.8:443	6	55	Ether / IP / TCP 192.168.192.179:49182 > 13.89.179.8:https A / Raw
----------------------------------------
10.6193	Atac: NORMAL	99.35%
35	13.89.179.8:443	192.168.192.179:49182	6	66	Ether / IP / TCP 13.89.179.8:https > 192.168.192.179:49182 A
----------------------------------------
12.7420	Atac: NORMAL	98.42%
36	192.168.192.179:65249	239.255.255.250:1900	17	179	Ether / IP / UDP 192.168.192.179:65249 > 239.255.255.250:ssdp / Raw
----------------------------------------
13.3945	Trafic Legitim	66.68%
37	192.168.1.1	192.168.1.2	tcp	telnet	SF	122	174
----------------------------------------
14.0670	Atac: NORMAL	99.35%
38	13.107.246.44:443	192.168.192.179:49197	6	93	Ether / IP / TCP 13.107.246.44:https > 192.168.192.179:49197 PA / Raw
----------------------------------------
14.1293	Atac: NORMAL	99.35%
39	13.107.246.44:443	192.168.192.179:49197	6	78	Ether / IP / TCP 13.107.246.44:https > 192.168.192.179:49197 FPA / Raw
----------------------------------------
14.1914	Atac: NORMAL	99.35%
40	192.168.192.179:49197	13.107.246.44:443	6	54	Ether / IP / TCP 192.168.192.179:49197 > 13.107.246.44:https A
----------------------------------------
14.2649	Atac: NORMAL	99.35%
40	192.168.192.179:49197	13.107.246.44:443	6	54	Ether / IP / TCP 192.168.192.179:49197 > 13.107.246.44:https FA
----------------------------------------
14.3304	Atac: NORMAL	99.35%
42	13.107.246.44:443	192.168.192.179:49197	6	78	Ether / IP / TCP 13.107.246.44:https > 192.168.192.179:49197 FPA / Raw
----------------------------------------
14.3929	Atac: NORMAL	99.35%
43	192.168.192.179:49197	13.107.246.44:443	6	66	Ether / IP / TCP 192.168.192.179:49197 > 13.107.246.44:https A
----------------------------------------
14.4597	Atac: NORMAL	99.35%
43	13.107.246.44:443	192.168.192.179:49197	6	54	Ether / IP / TCP 13.107.246.44:https > 192.168.192.179:49197 A
----------------------------------------
15.5314	Atac: NORMAL	99.35%
45	192.168.192.179:64949	52.16.218.208:443	6	295	Ether / IP / TCP 192.168.192.179:64949 > 52.16.218.208:https PA / Raw
----------------------------------------
15.6395	Atac: NORMAL	99.35%
46	52.16.218.208:443	192.168.192.179:64949	6	317	Ether / IP / TCP 52.16.218.208:https > 192.168.192.179:64949 PA / Raw
----------------------------------------
15.7039	Atac: NORMAL	99.35%
46	192.168.192.179:64949	52.16.218.208:443	6	54	Ether / IP / TCP 192.168.192.179:64949 > 52.16.218.208:https A
----------------------------------------
15.7665	Atac: NORMAL	98.42%
48	192.168.192.179:65249	239.255.255.250:1900	17	179	Ether / IP / UDP 192.168.192.179:65249 > 239.255.255.250:ssdp / Raw
----------------------------------------
16.4533	Trafic Legitim	66.68%
49	192.168.1.1	192.168.1.2	tcp	smtp	SF	2599	293
----------------------------------------
18.0632	Atac: NORMAL	99.35%
50	192.168.192.179:64576	142.250.153.188:5228	6	80	Ether / IP / TCP 192.168.192.179:64576 > 142.250.153.188:5228 PA / Raw
----------------------------------------
18.1475	Atac: NORMAL	99.35%
51	142.250.153.188:5228	192.168.192.179:64576	6	54	Ether / IP / TCP 142.250.153.188:5228 > 192.168.192.179:64576 A
----------------------------------------
18.2085	Atac: NORMAL	99.35%
51	142.250.153.188:5228	192.168.192.179:64576	6	80	Ether / IP / TCP 142.250.153.188:5228 > 192.168.192.179:64576 PA / Raw
----------------------------------------
18.2775	Atac: NORMAL	99.35%
53	192.168.192.179:64576	142.250.153.188:5228	6	54	Ether / IP / TCP 192.168.192.179:64576 > 142.250.153.188:5228 A
----------------------------------------
18.7502	Atac: NORMAL	98.42%
54	192.168.192.179:65249	239.255.255.250:1900	17	179	Ether / IP / UDP 192.168.192.179:65249 > 239.255.255.250:ssdp / Raw
----------------------------------------
19.5123	Trafic Legitim	66.68%
55	192.168.1.1	192.168.1.2	tcp	private	REJ	0	0
----------------------------------------
19.6792	Atac: NORMAL	99.35%
56	192.168.192.179:49200	140.82.114.22:443	6	55	Ether / IP / TCP 192.168.192.179:49200 > 140.82.114.22:https A / Raw
----------------------------------------
19.8390	Atac: NORMAL	99.35%
57	140.82.114.22:443	192.168.192.179:49200	6	66	Ether / IP / TCP 140.82.114.22:https > 192.168.192.179:49200 A
----------------------------------------
21.7540	Atac: NORMAL	98.42%
58	192.168.192.179:65249	239.255.255.250:1900	17	179	Ether / IP / UDP 192.168.192.179:65249 > 239.255.255.250:ssdp / Raw
----------------------------------------
22.5726	Trafic Legitim	66.68%
59	192.168.1.1	192.168.1.2	tcp	imap4	RSTO	0	44
----------------------------------------
24.7572	Atac: NORMAL	98.42%
60	192.168.192.179:65249	239.255.255.250:1900	17	179	Ether / IP / UDP 192.168.192.179:65249 > 239.255.255.250:ssdp / Raw
----------------------------------------
24.9728	Atac: NORMAL	99.35%
61	192.168.192.179:65332	18.202.12.139:443	6	55	Ether / IP / TCP 192.168.192.179:65332 > 18.202.12.139:https A / Raw
----------------------------------------
25.1393	Atac: NORMAL	99.35%
62	18.202.12.139:443	192.168.192.179:65332	6	66	Ether / IP / TCP 18.202.12.139:https > 192.168.192.179:65332 A
----------------------------------------
25.6314	Atac: NORMAL	66.68%
63	192.168.1.1	192.168.1.2	tcp	pop_3	SF	32	93
----------------------------------------
25.6865	Atac: NORMAL	99.35%
64	192.168.192.179:49193	3.160.246.68:443	6	55	Ether / IP / TCP 192.168.192.179:49193 > 3.160.246.68:https A / Raw
----------------------------------------
25.7491	Atac: NORMAL	99.35%
65	192.168.192.179:49192	18.165.171.23:443	6	55	Ether / IP / TCP 192.168.192.179:49192 > 18.165.171.23:https A / Raw
----------------------------------------
25.8044	Atac: NORMAL	99.35%
65	192.168.192.179:49194	18.165.171.74:443	6	55	Ether / IP / TCP 192.168.192.179:49194 > 18.165.171.74:https A / Raw
----------------------------------------
25.8808	Atac: NORMAL	99.35%
67	18.165.171.74:443	192.168.192.179:49194	6	66	Ether / IP / TCP 18.165.171.74:https > 192.168.192.179:49194 A
----------------------------------------
25.9442	Atac: NORMAL	99.35%
67	18.165.171.23:443	192.168.192.179:49192	6	66	Ether / IP / TCP 18.165.171.23:https > 192.168.192.179:49192 A
----------------------------------------
26.0077	Atac: NORMAL	99.35%
69	3.160.246.68:443	192.168.192.179:49193	6	66	Ether / IP / TCP 3.160.246.68:https > 192.168.192.179:49193 A
----------------------------------------
