0.0000	Atac: DoS	73.12%
0	142.251.141.36:443	192.168.192.179:59257	17	82	Ether / IP / UDP 142.251.141.36:https > 192.168.192.179:59257 / Raw
----------------------------------------
0.2360	Atac: DoS	73.12%
0	142.251.141.36:443	192.168.192.179:59257	17	1292	Ether / IP / UDP 142.251.141.36:https > 192.168.192.179:59257 / Raw
----------------------------------------
0.3190	Atac: DoS	73.12%
2	142.251.141.36:443	192.168.192.179:59257	17	1292	Ether / IP / UDP 142.251.141.36:https > 192.168.192.179:59257 / Raw
----------------------------------------
0.3887	Atac: DoS	73.12%
3	142.251.141.36:443	192.168.192.179:59257	17	1292	Ether / IP / UDP 142.251.141.36:https > 192.168.192.179:59257 / Raw
----------------------------------------
0.4721	Atac: DoS	73.12%
4	192.168.192.179:59257	142.251.141.36:443	17	1292	Ether / IP / UDP 192.168.192.179:59257 > 142.251.141.36:https / Raw
----------------------------------------
0.5556	Atac: DoS	73.12%
5	142.251.141.36:443	192.168.192.179:59257	17	1292	Ether / IP / UDP 142.251.141.36:https > 192.168.192.179:59257 / Raw
----------------------------------------
0.6315	Atac: DoS	73.12%
5	142.251.141.36:443	192.168.192.179:59257	17	1197	Ether / IP / UDP 142.251.141.36:https > 192.168.192.179:59257 / Raw
----------------------------------------
0.7078	Atac: DoS	73.12%
7	192.168.192.179:59257	142.251.141.36:443	17	82	Ether / IP / UDP 192.168.192.179:59257 > 142.251.141.36:https / Raw
----------------------------------------
0.7789	Atac: DoS	73.12%
8	192.168.192.179:59257	142.251.141.36:443	17	204	Ether / IP / UDP 192.168.192.179:59257 > 142.251.141.36:https / Raw
----------------------------------------
0.8554	Atac: DoS	73.12%
8	192.168.192.179:59257	142.251.141.36:443	17	623	Ether / IP / UDP 192.168.192.179:59257 > 142.251.141.36:https / Raw
----------------------------------------
0.9356	Atac: DoS	73.12%
10	192.168.192.179:59257	142.251.141.36:443	17	189	Ether / IP / UDP 192.168.192.179:59257 > 142.251.141.36:https / Raw
----------------------------------------
1.0243	Atac: DoS	73.12%
11	172.64.155.209:443	192.168.192.179:60151	6	122	Ether / IP / TCP 172.64.155.209:https > 192.168.192.179:60151 PA / Raw
----------------------------------------
1.0986	Atac: DoS	73.12%
12	192.168.192.179:60151	172.64.155.209:443	6	54	Ether / IP / TCP 192.168.192.179:60151 > 172.64.155.209:https A
----------------------------------------
1.1654	Atac: DoS	73.12%
13	172.64.155.209:443	192.168.192.179:60151	6	130	Ether / IP / TCP 172.64.155.209:https > 192.168.192.179:60151 PA / Raw
----------------------------------------
1.2348	Atac: DoS	73.12%
13	192.168.192.179:60151	172.64.155.209:443	6	54	Ether / IP / TCP 192.168.192.179:60151 > 172.64.155.209:https A
----------------------------------------
1.3180	Atac: DoS	73.12%
15	172.64.155.209:443	192.168.192.179:60151	6	130	Ether / IP / TCP 172.64.155.209:https > 192.168.192.179:60151 PA / Raw
----------------------------------------
1.3944	Atac: DoS	73.12%
16	192.168.192.179:60151	172.64.155.209:443	6	54	Ether / IP / TCP 192.168.192.179:60151 > 172.64.155.209:https A
----------------------------------------
1.4637	Atac: DoS	73.12%
16	172.64.155.209:443	192.168.192.179:60151	6	122	Ether / IP / TCP 172.64.155.209:https > 192.168.192.179:60151 PA / Raw
----------------------------------------
1.5331	Atac: DoS	73.12%
18	192.168.192.179:60151	172.64.155.209:443	6	54	Ether / IP / TCP 192.168.192.179:60151 > 172.64.155.209:https A
----------------------------------------
1.6025	Atac: DoS	73.12%
19	172.64.155.209:443	192.168.192.179:60151	6	122	Ether / IP / TCP 172.64.155.209:https > 192.168.192.179:60151 PA / Raw
----------------------------------------
1.6787	Atac: DoS	73.12%
19	192.168.192.179:60151	172.64.155.209:443	6	54	Ether / IP / TCP 192.168.192.179:60151 > 172.64.155.209:https A
----------------------------------------
1.7481	Atac: DoS	73.12%
21	172.64.155.209:443	192.168.192.179:60151	6	130	Ether / IP / TCP 172.64.155.209:https > 192.168.192.179:60151 PA / Raw
----------------------------------------
1.8175	Atac: DoS	73.12%
22	172.64.155.209:443	192.168.192.179:60151	6	122	Ether / IP / TCP 172.64.155.209:https > 192.168.192.179:60151 PA / Raw
----------------------------------------
1.8938	Atac: DoS	73.12%
22	192.168.192.179:60151	172.64.155.209:443	6	54	Ether / IP / TCP 192.168.192.179:60151 > 172.64.155.209:https A
----------------------------------------
1.9655	Atac: DoS	73.12%
24	172.64.155.209:443	192.168.192.179:60151	6	130	Ether / IP / TCP 172.64.155.209:https > 192.168.192.179:60151 PA / Raw
----------------------------------------
2.0465	Atac: DoS	73.12%
25	172.64.155.209:443	192.168.192.179:60151	6	130	Ether / IP / TCP 172.64.155.209:https > 192.168.192.179:60151 PA / Raw
----------------------------------------
2.1178	Atac: DoS	73.12%
26	192.168.192.165:53	192.168.192.179:51232	17	212	Ether / IP / UDP / DNS Ans b'mobile.events.data.trafficmanager.net.'
----------------------------------------
2.1991	Atac: DoS	73.12%
26	192.168.192.165:53	192.168.192.179:56154	17	256	Ether / IP / UDP / DNS Ans b'mobile.events.data.trafficmanager.net.'
----------------------------------------
2.2779	Atac: DoS	73.12%
28	172.64.155.209:443	192.168.192.179:60151	6	130	Ether / IP / TCP 172.64.155.209:https > 192.168.192.179:60151 PA / Raw
----------------------------------------
2.3447	Atac: DoS	73.12%
29	192.168.192.179:60151	172.64.155.209:443	6	54	Ether / IP / TCP 192.168.192.179:60151 > 172.64.155.209:https A
----------------------------------------
2.4210	Atac: DoS	73.12%
30	52.178.17.234:443	192.168.192.179:59855	6	54	Ether / IP / TCP 52.178.17.234:https > 192.168.192.179:59855 A
----------------------------------------
2.4938	Atac: DoS	73.12%
30	52.178.17.234:443	192.168.192.179:59855	6	93	Ether / IP / TCP 52.178.17.234:https > 192.168.192.179:59855 PA / Raw
----------------------------------------
2.5629	Atac: DoS	73.12%
32	52.178.17.234:443	192.168.192.179:59855	6	54	Ether / IP / TCP 52.178.17.234:https > 192.168.192.179:59855 A
----------------------------------------
2.6361	Atac: DoS	73.12%
33	172.64.155.209:443	192.168.192.179:60151	6	130	Ether / IP / TCP 172.64.155.209:https > 192.168.192.179:60151 PA / Raw
----------------------------------------
2.7086	Atac: DoS	73.12%
33	192.168.192.179:59855	52.178.17.234:443	6	54	Ether / IP / TCP 192.168.192.179:59855 > 52.178.17.234:https A
----------------------------------------
2.7749	Atac: DoS	73.12%
35	192.168.192.179:60151	172.64.155.209:443	6	54	Ether / IP / TCP 192.168.192.179:60151 > 172.64.155.209:https A
----------------------------------------
2.8442	Atac: DoS	73.12%
36	172.64.155.209:443	192.168.192.179:60151	6	130	Ether / IP / TCP 172.64.155.209:https > 192.168.192.179:60151 PA / Raw
----------------------------------------
2.9206	Atac: DoS	73.12%
36	52.178.17.234:443	192.168.192.179:59855	6	152	Ether / IP / TCP 52.178.17.234:https > 192.168.192.179:59855 PA / Raw
----------------------------------------
2.9899	Atac: DoS	73.12%
38	192.168.192.179:59855	52.178.17.234:443	6	89	Ether / IP / TCP 192.168.192.179:59855 > 52.178.17.234:https PA / Raw
----------------------------------------
4.6135	Atac: DoS	73.12%
39	172.64.155.209:443	192.168.192.179:60151	6	290	Ether / IP / TCP 172.64.155.209:https > 192.168.192.179:60151 PA / Raw
----------------------------------------
4.6866	Atac: DoS	73.12%
39	172.64.155.209:443	192.168.192.179:60151	6	1354	Ether / IP / TCP 172.64.155.209:https > 192.168.192.179:60151 A / Raw
----------------------------------------
4.7554	Atac: DoS	73.12%
41	172.64.155.209:443	192.168.192.179:60151	6	590	Ether / IP / TCP 172.64.155.209:https > 192.168.192.179:60151 PA / Raw
----------------------------------------
4.8213	Atac: DoS	73.12%
42	192.168.192.179:60151	172.64.155.209:443	6	54	Ether / IP / TCP 192.168.192.179:60151 > 172.64.155.209:https A
----------------------------------------
4.9046	Atac: DoS	73.12%
42	192.168.192.179:60151	172.64.155.209:443	6	54	Ether / IP / TCP 192.168.192.179:60151 > 172.64.155.209:https A
----------------------------------------
4.9740	Atac: DoS	73.12%
44	172.64.155.209:443	192.168.192.179:60151	6	546	Ether / IP / TCP 172.64.155.209:https > 192.168.192.179:60151 PA / Raw
----------------------------------------
5.0503	Atac: DoS	73.12%
45	172.64.155.209:443	192.168.192.179:60151	6	170	Ether / IP / TCP 172.64.155.209:https > 192.168.192.179:60151 PA / Raw
----------------------------------------
5.1474	Atac: DoS	73.12%
46	192.168.192.179:60151	172.64.155.209:443	6	54	Ether / IP / TCP 192.168.192.179:60151 > 172.64.155.209:https A
----------------------------------------
5.2167	Atac: DoS	73.12%
46	172.64.155.209:443	192.168.192.179:60151	6	122	Ether / IP / TCP 172.64.155.209:https > 192.168.192.179:60151 PA / Raw
----------------------------------------
5.2913	Atac: DoS	73.12%
48	192.168.192.179:60151	172.64.155.209:443	6	54	Ether / IP / TCP 192.168.192.179:60151 > 172.64.155.209:https A
----------------------------------------
5.3645	Atac: DoS	73.12%
49	172.64.155.209:443	192.168.192.179:60151	6	130	Ether / IP / TCP 172.64.155.209:https > 192.168.192.179:60151 PA / Raw
----------------------------------------
5.4318	Atac: DoS	73.12%
50	192.168.192.179:60151	172.64.155.209:443	6	54	Ether / IP / TCP 192.168.192.179:60151 > 172.64.155.209:https A
----------------------------------------
5.5012	Atac: DoS	73.12%
50	172.64.155.209:443	192.168.192.179:60151	6	122	Ether / IP / TCP 172.64.155.209:https > 192.168.192.179:60151 PA / Raw
----------------------------------------
5.5705	Atac: DoS	73.12%
52	192.168.192.179:60151	172.64.155.209:443	6	54	Ether / IP / TCP 192.168.192.179:60151 > 172.64.155.209:https A
----------------------------------------
5.6489	Atac: DoS	73.12%
53	172.64.155.209:443	192.168.192.179:60151	6	146	Ether / IP / TCP 172.64.155.209:https > 192.168.192.179:60151 PA / Raw
----------------------------------------
5.7245	Atac: DoS	73.12%
53	192.168.192.179:60151	172.64.155.209:443	6	54	Ether / IP / TCP 192.168.192.179:60151 > 172.64.155.209:https A
----------------------------------------
5.7995	Atac: DoS	73.12%
55	172.64.155.209:443	192.168.192.179:60151	6	122	Ether / IP / TCP 172.64.155.209:https > 192.168.192.179:60151 PA / Raw
----------------------------------------
5.8688	Atac: DoS	73.12%
56	172.64.155.209:443	192.168.192.179:60151	6	146	Ether / IP / TCP 172.64.155.209:https > 192.168.192.179:60151 PA / Raw
----------------------------------------
5.9452	Atac: DoS	73.12%
56	192.168.192.179:60151	172.64.155.209:443	6	54	Ether / IP / TCP 192.168.192.179:60151 > 172.64.155.209:https A
----------------------------------------
6.0145	Atac: DoS	73.12%
58	172.64.155.209:443	192.168.192.179:60151	6	122	Ether / IP / TCP 172.64.155.209:https > 192.168.192.179:60151 PA / Raw
----------------------------------------
6.0909	Atac: DoS	73.12%
59	172.64.155.209:443	192.168.192.179:60151	6	130	Ether / IP / TCP 172.64.155.209:https > 192.168.192.179:60151 PA / Raw
----------------------------------------
6.4866	Atac: DoS	73.12%
60	172.64.155.209:443	192.168.192.179:60151	6	130	Ether / IP / TCP 172.64.155.209:https > 192.168.192.179:60151 PA / Raw
----------------------------------------
6.5657	Atac: DoS	73.12%
60	172.64.155.209:443	192.168.192.179:60151	6	1146	Ether / IP / TCP 172.64.155.209:https > 192.168.192.179:60151 PA / Raw
----------------------------------------
6.6389	Atac: DoS	73.12%
62	192.168.192.179:60151	172.64.155.209:443	6	54	Ether / IP / TCP 192.168.192.179:60151 > 172.64.155.209:https A
----------------------------------------
6.7152	Atac: DoS	73.12%
63	172.64.155.209:443	192.168.192.179:60151	6	194	Ether / IP / TCP 172.64.155.209:https > 192.168.192.179:60151 PA / Raw
----------------------------------------
6.7855	Atac: DoS	73.12%
63	172.64.155.209:443	192.168.192.179:60151	6	138	Ether / IP / TCP 172.64.155.209:https > 192.168.192.179:60151 PA / Raw
----------------------------------------
6.8540	Atac: DoS	73.12%
65	192.168.192.179:60151	172.64.155.209:443	6	54	Ether / IP / TCP 192.168.192.179:60151 > 172.64.155.209:https A
----------------------------------------
6.9329	Atac: DoS	73.12%
66	172.64.155.209:443	192.168.192.179:60151	6	1354	Ether / IP / TCP 172.64.155.209:https > 192.168.192.179:60151 A / Raw
----------------------------------------
7.0105	Atac: DoS	73.12%
67	172.64.155.209:443	192.168.192.179:60151	6	1354	Ether / IP / TCP 172.64.155.209:https > 192.168.192.179:60151 PA / Raw
----------------------------------------
7.0760	Atac: DoS	73.12%
67	172.64.155.209:443	192.168.192.179:60151	6	1354	Ether / IP / TCP 172.64.155.209:https > 192.168.192.179:60151 A / Raw
----------------------------------------
7.1454	Atac: DoS	73.12%
69	172.64.155.209:443	192.168.192.179:60151	6	1354	Ether / IP / TCP 172.64.155.209:https > 192.168.192.179:60151 PA / Raw
----------------------------------------
7.2496	Atac: DoS	73.12%
70	192.168.192.179:60151	172.64.155.209:443	6	54	Ether / IP / TCP 192.168.192.179:60151 > 172.64.155.209:https A
----------------------------------------
7.3198	Atac: DoS	73.12%
71	172.64.155.209:443	192.168.192.179:60151	6	130	Ether / IP / TCP 172.64.155.209:https > 192.168.192.179:60151 PA / Raw
----------------------------------------
7.3910	Atac: DoS	73.12%
71	192.168.192.179:60151	172.64.155.209:443	6	54	Ether / IP / TCP 192.168.192.179:60151 > 172.64.155.209:https A
----------------------------------------
7.4647	Atac: DoS	73.12%
73	172.64.155.209:443	192.168.192.179:60151	6	130	Ether / IP / TCP 172.64.155.209:https > 192.168.192.179:60151 PA / Raw
----------------------------------------
7.5339	Atac: DoS	73.12%
74	172.64.155.209:443	192.168.192.179:60151	6	154	Ether / IP / TCP 172.64.155.209:https > 192.168.192.179:60151 PA / Raw
----------------------------------------
7.6108	Atac: DoS	73.12%
74	192.168.192.179:60151	172.64.155.209:443	6	54	Ether / IP / TCP 192.168.192.179:60151 > 172.64.155.209:https A
----------------------------------------
7.6864	Atac: DoS	73.12%
76	172.64.155.209:443	192.168.192.179:60151	6	130	Ether / IP / TCP 172.64.155.209:https > 192.168.192.179:60151 PA / Raw
----------------------------------------
7.7658	Atac: DoS	73.12%
77	192.168.192.179:60151	172.64.155.209:443	6	54	Ether / IP / TCP 192.168.192.179:60151 > 172.64.155.209:https A
----------------------------------------
7.8431	Atac: DoS	73.12%
78	172.64.155.209:443	192.168.192.179:60151	6	866	Ether / IP / TCP 172.64.155.209:https > 192.168.192.179:60151 PA / Raw
----------------------------------------
7.9154	Atac: DoS	73.12%
78	172.64.155.209:443	192.168.192.179:60151	6	170	Ether / IP / TCP 172.64.155.209:https > 192.168.192.179:60151 PA / Raw
----------------------------------------
7.9847	Atac: DoS	73.12%
80	192.168.192.179:60151	172.64.155.209:443	6	54	Ether / IP / TCP 192.168.192.179:60151 > 172.64.155.209:https A
----------------------------------------
8.0541	Atac: DoS	73.12%
81	172.64.155.209:443	192.168.192.179:60151	6	130	Ether / IP / TCP 172.64.155.209:https > 192.168.192.179:60151 PA / Raw
----------------------------------------
8.1304	Atac: DoS	73.12%
81	172.64.155.209:443	192.168.192.179:60151	6	122	Ether / IP / TCP 172.64.155.209:https > 192.168.192.179:60151 PA / Raw
----------------------------------------
8.1998	Atac: DoS	73.12%
83	192.168.192.179:60151	172.64.155.209:443	6	54	Ether / IP / TCP 192.168.192.179:60151 > 172.64.155.209:https A
----------------------------------------
8.3038	Atac: DoS	73.12%
84	192.168.192.179:60151	172.64.155.209:443	6	54	Ether / IP / TCP 192.168.192.179:60151 > 172.64.155.209:https A
----------------------------------------
8.3732	Atac: DoS	73.12%
85	172.64.155.209:443	192.168.192.179:60151	6	122	Ether / IP / TCP 172.64.155.209:https > 192.168.192.179:60151 PA / Raw
----------------------------------------
8.4356	Atac: DoS	73.12%
85	192.168.192.179:60151	172.64.155.209:443	6	54	Ether / IP / TCP 192.168.192.179:60151 > 172.64.155.209:https A
----------------------------------------
8.5189	Atac: DoS	73.12%
87	172.64.155.209:443	192.168.192.179:60151	6	130	Ether / IP / TCP 172.64.155.209:https > 192.168.192.179:60151 PA / Raw
----------------------------------------
8.5973	Atac: DoS	73.12%
88	172.64.155.209:443	192.168.192.179:60151	6	130	Ether / IP / TCP 172.64.155.209:https > 192.168.192.179:60151 PA / Raw
----------------------------------------
8.6660	Atac: DoS	73.12%
89	192.168.192.179:60151	172.64.155.209:443	6	54	Ether / IP / TCP 192.168.192.179:60151 > 172.64.155.209:https A
----------------------------------------
8.7409	Atac: DoS	73.12%
89	172.64.155.209:443	192.168.192.179:60151	6	130	Ether / IP / TCP 172.64.155.209:https > 192.168.192.179:60151 PA / Raw
----------------------------------------
8.8103	Atac: DoS	73.12%
91	192.168.192.179:60151	172.64.155.209:443	6	54	Ether / IP / TCP 192.168.192.179:60151 > 172.64.155.209:https A
----------------------------------------
8.8796	Atac: DoS	73.12%
92	172.64.155.209:443	192.168.192.179:60151	6	122	Ether / IP / TCP 172.64.155.209:https > 192.168.192.179:60151 PA / Raw
----------------------------------------
8.9514	Atac: DoS	73.12%
92	192.168.192.179:60151	172.64.155.209:443	6	54	Ether / IP / TCP 192.168.192.179:60151 > 172.64.155.209:https A
----------------------------------------
9.0253	Atac: DoS	73.12%
94	172.64.155.209:443	192.168.192.179:60151	6	122	Ether / IP / TCP 172.64.155.209:https > 192.168.192.179:60151 PA / Raw
----------------------------------------
9.0947	Atac: DoS	73.12%
95	192.168.192.179:60151	172.64.155.209:443	6	54	Ether / IP / TCP 192.168.192.179:60151 > 172.64.155.209:https A
----------------------------------------
9.1741	Atac: DoS	73.12%
95	172.64.155.209:443	192.168.192.179:60151	6	122	Ether / IP / TCP 172.64.155.209:https > 192.168.192.179:60151 PA / Raw
----------------------------------------
9.2474	Atac: DoS	73.12%
97	192.168.192.179:60151	172.64.155.209:443	6	54	Ether / IP / TCP 192.168.192.179:60151 > 172.64.155.209:https A
----------------------------------------
9.3653	Atac: DoS	73.12%
98	192.168.192.179:60151	172.64.155.209:443	6	54	Ether / IP / TCP 192.168.192.179:60151 > 172.64.155.209:https A
----------------------------------------
9.4833	Atac: DoS	73.12%
99	172.64.155.209:443	192.168.192.179:60151	6	138	Ether / IP / TCP 172.64.155.209:https > 192.168.192.179:60151 PA / Raw
----------------------------------------
9.5526	Atac: DoS	73.12%
100	192.168.192.179:60151	172.64.155.209:443	6	54	Ether / IP / TCP 192.168.192.179:60151 > 172.64.155.209:https A
----------------------------------------
10.0037	Atac: DoS	73.12%
101	172.64.155.209:443	192.168.192.179:60151	6	962	Ether / IP / TCP 172.64.155.209:https > 192.168.192.179:60151 PA / Raw
----------------------------------------
10.0848	Atac: DoS	73.12%
102	172.64.155.209:443	192.168.192.179:60151	6	170	Ether / IP / TCP 172.64.155.209:https > 192.168.192.179:60151 PA / Raw
----------------------------------------
10.1581	Atac: DoS	73.12%
103	172.64.155.209:443	192.168.192.179:60151	6	122	Ether / IP / TCP 172.64.155.209:https > 192.168.192.179:60151 PA / Raw
----------------------------------------
10.2298	Atac: DoS	73.12%
103	172.64.155.209:443	192.168.192.179:60151	6	130	Ether / IP / TCP 172.64.155.209:https > 192.168.192.179:60151 PA / Raw
----------------------------------------
10.3032	Atac: DoS	73.12%
105	172.64.155.209:443	192.168.192.179:60151	6	122	Ether / IP / TCP 172.64.155.209:https > 192.168.192.179:60151 PA / Raw
----------------------------------------
10.3853	Atac: DoS	73.12%
106	172.64.155.209:443	192.168.192.179:60151	6	122	Ether / IP / TCP 172.64.155.209:https > 192.168.192.179:60151 PA / Raw
----------------------------------------
10.4634	Atac: DoS	73.12%
107	192.168.192.179:60151	172.64.155.209:443	6	54	Ether / IP / TCP 192.168.192.179:60151 > 172.64.155.209:https A
----------------------------------------
10.5347	Atac: DoS	73.12%
107	172.64.155.209:443	192.168.192.179:60151	6	122	Ether / IP / TCP 172.64.155.209:https > 192.168.192.179:60151 PA / Raw
----------------------------------------
10.6121	Atac: DoS	73.12%
109	192.168.192.179:60151	172.64.155.209:443	6	54	Ether / IP / TCP 192.168.192.179:60151 > 172.64.155.209:https A
----------------------------------------
10.6836	Atac: DoS	73.12%
110	172.64.155.209:443	192.168.192.179:60151	6	122	Ether / IP / TCP 172.64.155.209:https > 192.168.192.179:60151 PA / Raw
----------------------------------------
10.7558	Atac: DoS	73.12%
110	192.168.192.179:60151	172.64.155.209:443	6	54	Ether / IP / TCP 192.168.192.179:60151 > 172.64.155.209:https A
----------------------------------------
11.0441	Atac: DoS	73.12%
112	172.64.155.209:443	192.168.192.179:60151	6	170	Ether / IP / TCP 172.64.155.209:https > 192.168.192.179:60151 PA / Raw
----------------------------------------
11.1302	Atac: DoS	73.12%
113	192.168.192.179:60151	172.64.155.209:443	6	89	Ether / IP / TCP 192.168.192.179:60151 > 172.64.155.209:https PA / Raw
----------------------------------------
11.2036	Atac: DoS	73.12%
114	192.168.192.179:60151	172.64.155.209:443	6	89	Ether / IP / TCP 192.168.192.179:60151 > 172.64.155.209:https PA / Raw
----------------------------------------
11.2770	Atac: DoS	73.12%
114	172.64.155.209:443	192.168.192.179:60151	6	54	Ether / IP / TCP 172.64.155.209:https > 192.168.192.179:60151 A
----------------------------------------
11.3492	Atac: DoS	73.12%
116	172.64.155.209:443	192.168.192.179:60151	6	138	Ether / IP / TCP 172.64.155.209:https > 192.168.192.179:60151 PA / Raw
----------------------------------------
11.4546	Atac: DoS	73.12%
117	172.64.155.209:443	192.168.192.179:60151	6	122	Ether / IP / TCP 172.64.155.209:https > 192.168.192.179:60151 PA / Raw
----------------------------------------
11.5296	Atac: DoS	73.12%
118	172.64.155.209:443	192.168.192.179:60151	6	122	Ether / IP / TCP 172.64.155.209:https > 192.168.192.179:60151 PA / Raw
----------------------------------------
11.5994	Atac: DoS	73.12%
119	192.168.192.179:60151	172.64.155.209:443	6	54	Ether / IP / TCP 192.168.192.179:60151 > 172.64.155.209:https A
----------------------------------------
11.6765	Atac: DoS	73.12%
119	172.64.155.209:443	192.168.192.179:60151	6	122	Ether / IP / TCP 172.64.155.209:https > 192.168.192.179:60151 PA / Raw
----------------------------------------
11.7516	Atac: DoS	73.12%
121	172.64.155.209:443	192.168.192.179:60151	6	122	Ether / IP / TCP 172.64.155.209:https > 192.168.192.179:60151 PA / Raw
----------------------------------------
11.8352	Atac: DoS	73.12%
122	192.168.192.179:60151	172.64.155.209:443	6	54	Ether / IP / TCP 192.168.192.179:60151 > 172.64.155.209:https A
----------------------------------------
11.9043	Atac: DoS	73.12%
122	172.64.155.209:443	192.168.192.179:60151	6	130	Ether / IP / TCP 172.64.155.209:https > 192.168.192.179:60151 PA / Raw
----------------------------------------
11.9768	Atac: DoS	73.12%
124	172.64.155.209:443	192.168.192.179:60151	6	122	Ether / IP / TCP 172.64.155.209:https > 192.168.192.179:60151 PA / Raw
----------------------------------------
12.0539	Atac: DoS	73.12%
125	192.168.192.179:60151	172.64.155.209:443	6	54	Ether / IP / TCP 192.168.192.179:60151 > 172.64.155.209:https A
----------------------------------------
12.1274	Atac: DoS	73.12%
126	172.64.155.209:443	192.168.192.179:60151	6	122	Ether / IP / TCP 172.64.155.209:https > 192.168.192.179:60151 PA / Raw
----------------------------------------
12.1985	Atac: DoS	73.12%
126	192.168.192.179:60151	172.64.155.209:443	6	54	Ether / IP / TCP 192.168.192.179:60151 > 172.64.155.209:https A
----------------------------------------
12.2719	Atac: DoS	73.12%
128	172.64.155.209:443	192.168.192.179:60151	6	122	Ether / IP / TCP 172.64.155.209:https > 192.168.192.179:60151 PA / Raw
----------------------------------------
12.3416	Atac: DoS	73.12%
129	192.168.192.179:60151	172.64.155.209:443	6	54	Ether / IP / TCP 192.168.192.179:60151 > 172.64.155.209:https A
----------------------------------------
12.4039	Atac: DoS	73.12%
129	172.64.155.209:443	192.168.192.179:60151	6	122	Ether / IP / TCP 172.64.155.209:https > 192.168.192.179:60151 PA / Raw
----------------------------------------
12.4959	Atac: DoS	73.12%
131	172.64.155.209:443	192.168.192.179:60151	6	130	Ether / IP / TCP 172.64.155.209:https > 192.168.192.179:60151 PA / Raw
----------------------------------------
12.5633	Atac: DoS	73.12%
132	172.64.155.209:443	192.168.192.179:60151	6	594	Ether / IP / TCP 172.64.155.209:https > 192.168.192.179:60151 PA / Raw
----------------------------------------
12.6403	Atac: DoS	73.12%
133	192.168.192.179:60151	172.64.155.209:443	6	54	Ether / IP / TCP 192.168.192.179:60151 > 172.64.155.209:https A
----------------------------------------
12.7102	Atac: DoS	73.12%
133	172.64.155.209:443	192.168.192.179:60151	6	170	Ether / IP / TCP 172.64.155.209:https > 192.168.192.179:60151 PA / Raw
----------------------------------------
12.7783	Atac: DoS	73.12%
135	192.168.192.179:60151	172.64.155.209:443	6	54	Ether / IP / TCP 192.168.192.179:60151 > 172.64.155.209:https A
----------------------------------------
12.8519	Atac: DoS	73.12%
136	172.64.155.209:443	192.168.192.179:60151	6	122	Ether / IP / TCP 172.64.155.209:https > 192.168.192.179:60151 PA / Raw
----------------------------------------
12.9213	Atac: DoS	73.12%
136	192.168.192.179:60151	172.64.155.209:443	6	54	Ether / IP / TCP 192.168.192.179:60151 > 172.64.155.209:https A
----------------------------------------
12.9878	Atac: DoS	73.12%
138	172.64.155.209:443	192.168.192.179:60151	6	130	Ether / IP / TCP 172.64.155.209:https > 192.168.192.179:60151 PA / Raw
----------------------------------------
13.0620	Atac: DoS	73.12%
139	192.168.192.179:60151	172.64.155.209:443	6	54	Ether / IP / TCP 192.168.192.179:60151 > 172.64.155.209:https A
----------------------------------------
13.1303	Atac: DoS	73.12%
139	172.64.155.209:443	192.168.192.179:60151	6	130	Ether / IP / TCP 172.64.155.209:https > 192.168.192.179:60151 PA / Raw
----------------------------------------
13.2035	Atac: DoS	73.12%
139	192.168.192.179:60151	172.64.155.209:443	6	54	Ether / IP / TCP 192.168.192.179:60151 > 172.64.155.209:https A
----------------------------------------
