0.2092	Atac: NORMAL	70.54%
0	192.168.125.179:65304	192.168.125.213:53	17	92	Ether / IP / UDP / DNS Qry b'mobile.events.data.microsoft.com.'
----------------------------------------
0.4835	Atac: NORMAL	70.54%
1	192.168.125.179:65304	192.168.125.213:53	17	92	Ether / IP / UDP / DNS Qry b'mobile.events.data.microsoft.com.'
----------------------------------------
0.5708	Atac: NORMAL	70.54%
1	192.168.125.213:53	192.168.125.179:65304	17	212	Ether / IP / UDP / DNS Ans b'mobile.events.data.trafficmanager.net.'
----------------------------------------
0.6540	Atac: NORMAL	85.75%
3	192.168.125.179:61261	20.42.65.88:443	6	66	Ether / IP / TCP 192.168.125.179:61261 > 20.42.65.88:https S
----------------------------------------
0.7412	Atac: NORMAL	85.75%
4	20.42.65.88:443	192.168.125.179:61261	6	66	Ether / IP / TCP 20.42.65.88:https > 192.168.125.179:61261 SA
----------------------------------------
0.8546	Atac: NORMAL	85.75%
5	192.168.125.179:61261	20.42.65.88:443	6	54	Ether / IP / TCP 192.168.125.179:61261 > 20.42.65.88:https A
----------------------------------------
0.9494	Atac: NORMAL	85.75%
6	192.168.125.179:61261	20.42.65.88:443	6	571	Ether / IP / TCP 192.168.125.179:61261 > 20.42.65.88:https PA / Raw
----------------------------------------
1.3062	Atac: NORMAL	85.75%
7	20.42.65.88:443	192.168.125.179:61261	6	1354	Ether / IP / TCP 20.42.65.88:https > 192.168.125.179:61261 A / Raw
----------------------------------------
1.3825	Atac: NORMAL	85.75%
8	20.42.65.88:443	192.168.125.179:61261	6	1354	Ether / IP / TCP 20.42.65.88:https > 192.168.125.179:61261 A / Raw
----------------------------------------
1.4587	Atac: NORMAL	85.75%
8	20.42.65.88:443	192.168.125.179:61261	6	1354	Ether / IP / TCP 20.42.65.88:https > 192.168.125.179:61261 A / Raw
----------------------------------------
1.5410	Atac: NORMAL	85.75%
10	20.42.65.88:443	192.168.125.179:61261	6	689	Ether / IP / TCP 20.42.65.88:https > 192.168.125.179:61261 PA / Raw
----------------------------------------
1.6470	Atac: NORMAL	85.75%
11	192.168.125.179:61261	20.42.65.88:443	6	54	Ether / IP / TCP 192.168.125.179:61261 > 20.42.65.88:https A
----------------------------------------
1.7393	Atac: NORMAL	85.75%
12	192.168.125.179:61261	20.42.65.88:443	6	54	Ether / IP / TCP 192.168.125.179:61261 > 20.42.65.88:https A
----------------------------------------
1.8219	Atac: NORMAL	85.75%
13	192.168.125.179:61261	20.42.65.88:443	6	2218	Ether / IP / TCP 192.168.125.179:61261 > 20.42.65.88:https PA / Raw
----------------------------------------
1.9097	Atac: NORMAL	85.75%
14	192.168.125.179:60273	4.208.35.46:443	6	104	Ether / IP / TCP 192.168.125.179:60273 > 4.208.35.46:https PA / Raw
----------------------------------------
1.9958	Atac: NORMAL	85.75%
15	20.42.65.88:443	192.168.125.179:61261	6	157	Ether / IP / TCP 20.42.65.88:https > 192.168.125.179:61261 PA / Raw
----------------------------------------
2.0782	Atac: NORMAL	85.75%
15	20.42.65.88:443	192.168.125.179:61261	6	54	Ether / IP / TCP 20.42.65.88:https > 192.168.125.179:61261 A
----------------------------------------
2.1615	Atac: NORMAL	85.75%
17	192.168.125.179:61261	20.42.65.88:443	6	54	Ether / IP / TCP 192.168.125.179:61261 > 20.42.65.88:https A
----------------------------------------
6.0518	Atac: NORMAL	85.75%
18	192.168.125.179:60552	92.123.103.72:443	6	54	Ether / IP / TCP 192.168.125.179:60552 > 92.123.103.72:https FA
----------------------------------------
