10.8024	Atac: NORMAL	70.54%
0	192.168.180.179:54434	142.251.140.35:443	17	1292	Ether / IP / UDP 192.168.180.179:54434 > 142.251.140.35:https / Raw
----------------------------------------
11.0221	Atac: NORMAL	70.54%
1	192.168.180.179:54434	142.251.140.35:443	17	1292	Ether / IP / UDP 192.168.180.179:54434 > 142.251.140.35:https / Raw
----------------------------------------
11.1102	Atac: NORMAL	85.75%
1	52.30.201.170:443	192.168.180.179:59476	6	318	Ether / IP / TCP 52.30.201.170:https > 192.168.180.179:59476 PA / Raw
----------------------------------------
11.1763	Atac: NORMAL	85.75%
3	192.168.180.179:59476	52.30.201.170:443	6	54	Ether / IP / TCP 192.168.180.179:59476 > 52.30.201.170:https A
----------------------------------------
11.9777	Atac: NORMAL	85.75%
4	192.168.180.179:59614	140.82.112.26:443	6	55	Ether / IP / TCP 192.168.180.179:59614 > 140.82.112.26:https A / Raw
----------------------------------------
12.1504	Atac: NORMAL	85.75%
5	140.82.112.26:443	192.168.180.179:59614	6	66	Ether / IP / TCP 140.82.112.26:https > 192.168.180.179:59614 A
----------------------------------------
12.8711	Atac: NORMAL	85.75%
6	140.82.114.22:443	192.168.180.179:59762	6	93	Ether / IP / TCP 140.82.114.22:https > 192.168.180.179:59762 PA / Raw
----------------------------------------
12.9370	Atac: NORMAL	85.75%
6	140.82.114.22:443	192.168.180.179:59762	6	78	Ether / IP / TCP 140.82.114.22:https > 192.168.180.179:59762 PA / Raw
----------------------------------------
13.0020	Atac: NORMAL	85.75%
8	192.168.180.179:59762	140.82.114.22:443	6	54	Ether / IP / TCP 192.168.180.179:59762 > 140.82.114.22:https A
----------------------------------------
13.0671	Atac: NORMAL	85.75%
8	192.168.180.179:59762	140.82.114.22:443	6	54	Ether / IP / TCP 192.168.180.179:59762 > 140.82.114.22:https FA
----------------------------------------
13.1311	Atac: NORMAL	85.75%
10	140.82.114.22:443	192.168.180.179:59762	6	54	Ether / IP / TCP 140.82.114.22:https > 192.168.180.179:59762 FA
----------------------------------------
14.1555	Atac: NORMAL	85.75%
11	20.189.173.5:443	192.168.180.179:59682	6	54	Ether / IP / TCP 20.189.173.5:https > 192.168.180.179:59682 RA
----------------------------------------
19.9619	Atac: NORMAL	85.75%
12	192.168.180.179:59622	140.82.114.25:443	6	55	Ether / IP / TCP 192.168.180.179:59622 > 140.82.114.25:https A / Raw
----------------------------------------
20.1505	Atac: NORMAL	85.75%
13	140.82.114.25:443	192.168.180.179:59622	6	66	Ether / IP / TCP 140.82.114.25:https > 192.168.180.179:59622 A
----------------------------------------
26.1290	Atac: NORMAL	85.75%
14	192.168.180.179:59232	40.101.78.114:443	6	55	Ether / IP / TCP 192.168.180.179:59232 > 40.101.78.114:https A / Raw
----------------------------------------
26.2256	Atac: NORMAL	85.75%
15	40.101.78.114:443	192.168.180.179:59232	6	66	Ether / IP / TCP 40.101.78.114:https > 192.168.180.179:59232 A
----------------------------------------
26.3796	Atac: NORMAL	85.75%
16	192.168.180.179:59398	52.97.168.178:443	6	55	Ether / IP / TCP 192.168.180.179:59398 > 52.97.168.178:https A / Raw
----------------------------------------
26.4675	Atac: NORMAL	85.75%
17	52.97.168.178:443	192.168.180.179:59398	6	66	Ether / IP / TCP 52.97.168.178:https > 192.168.180.179:59398 A
----------------------------------------
26.9554	Atac: NORMAL	85.75%
18	140.82.112.26:443	192.168.180.179:59614	6	80	Ether / IP / TCP 140.82.112.26:https > 192.168.180.179:59614 PA / Raw
----------------------------------------
27.0224	Atac: NORMAL	85.75%
18	192.168.180.179:59614	140.82.112.26:443	6	84	Ether / IP / TCP 192.168.180.179:59614 > 140.82.112.26:https PA / Raw
----------------------------------------
27.0852	Atac: NORMAL	85.75%
20	192.168.180.179:59476	52.30.201.170:443	6	295	Ether / IP / TCP 192.168.180.179:59476 > 52.30.201.170:https PA / Raw
----------------------------------------
27.1512	Atac: NORMAL	85.75%
21	140.82.112.26:443	192.168.180.179:59614	6	54	Ether / IP / TCP 140.82.112.26:https > 192.168.180.179:59614 A
----------------------------------------
27.2172	Atac: NORMAL	85.75%
21	52.30.201.170:443	192.168.180.179:59476	6	319	Ether / IP / TCP 52.30.201.170:https > 192.168.180.179:59476 PA / Raw
----------------------------------------
27.2832	Atac: NORMAL	85.75%
23	192.168.180.179:59476	52.30.201.170:443	6	54	Ether / IP / TCP 192.168.180.179:59476 > 52.30.201.170:https A
----------------------------------------
32.8325	Atac: NORMAL	85.75%
24	192.168.180.179:57067	20.199.120.151:443	6	155	Ether / IP / TCP 192.168.180.179:57067 > 20.199.120.151:https PA / Raw
----------------------------------------
32.9275	Atac: NORMAL	85.75%
25	20.199.120.151:443	192.168.180.179:57067	6	176	Ether / IP / TCP 20.199.120.151:https > 192.168.180.179:57067 PA / Raw
----------------------------------------
33.0015	Atac: NORMAL	85.75%
25	192.168.180.179:57067	20.199.120.151:443	6	187	Ether / IP / TCP 192.168.180.179:57067 > 20.199.120.151:https PA / Raw
----------------------------------------
33.0755	Atac: NORMAL	85.75%
27	192.168.180.179:57067	20.199.120.151:443	6	155	Ether / IP / TCP 192.168.180.179:57067 > 20.199.120.151:https PA / Raw
----------------------------------------
33.1463	Atac: NORMAL	85.75%
28	192.168.180.179:57067	20.199.120.151:443	6	85	Ether / IP / TCP 192.168.180.179:57067 > 20.199.120.151:https PA / Raw
----------------------------------------
33.2103	Atac: NORMAL	85.75%
28	192.168.180.179:57067	20.199.120.151:443	6	54	Ether / IP / TCP 192.168.180.179:57067 > 20.199.120.151:https FA
----------------------------------------
33.2763	Atac: NORMAL	85.75%
30	20.199.120.151:443	192.168.180.179:57067	6	54	Ether / IP / TCP 20.199.120.151:https > 192.168.180.179:57067 A
----------------------------------------
33.3413	Atac: NORMAL	85.75%
31	20.199.120.151:443	192.168.180.179:57067	6	54	Ether / IP / TCP 20.199.120.151:https > 192.168.180.179:57067 A
----------------------------------------
33.4053	Atac: NORMAL	85.75%
31	20.199.120.151:443	192.168.180.179:57067	6	54	Ether / IP / TCP 20.199.120.151:https > 192.168.180.179:57067 FA
----------------------------------------
33.4713	Atac: NORMAL	70.54%
33	192.168.180.179:51082	192.168.180.22:53	17	86	Ether / IP / UDP / DNS Qry b'config.teams.microsoft.com.'
----------------------------------------
33.6010	Atac: NORMAL	85.75%
34	52.123.129.14:443	192.168.180.179:59796	6	1354	Ether / IP / TCP 52.123.129.14:https > 192.168.180.179:59796 A / Raw
----------------------------------------
33.6731	Atac: NORMAL	85.75%
35	52.123.129.14:443	192.168.180.179:59796	6	1354	Ether / IP / TCP 52.123.129.14:https > 192.168.180.179:59796 A / Raw
----------------------------------------
33.7371	Atac: NORMAL	85.75%
35	52.123.129.14:443	192.168.180.179:59796	6	1354	Ether / IP / TCP 52.123.129.14:https > 192.168.180.179:59796 A / Raw
----------------------------------------
33.8020	Atac: NORMAL	85.75%
37	192.168.180.179:59796	52.123.129.14:443	6	54	Ether / IP / TCP 192.168.180.179:59796 > 52.123.129.14:https A
----------------------------------------
33.8671	Atac: NORMAL	85.75%
37	192.168.180.179:59796	52.123.129.14:443	6	54	Ether / IP / TCP 192.168.180.179:59796 > 52.123.129.14:https A
----------------------------------------
33.9307	Atac: NORMAL	85.75%
39	192.168.180.179:59796	52.123.129.14:443	6	54	Ether / IP / TCP 192.168.180.179:59796 > 52.123.129.14:https A
----------------------------------------
34.0027	Atac: NORMAL	85.75%
40	52.123.129.14:443	192.168.180.179:59796	6	1354	Ether / IP / TCP 52.123.129.14:https > 192.168.180.179:59796 A / Raw
----------------------------------------
34.0677	Atac: NORMAL	85.75%
40	192.168.180.179:59796	52.123.129.14:443	6	54	Ether / IP / TCP 192.168.180.179:59796 > 52.123.129.14:https A
----------------------------------------
34.1414	Atac: NORMAL	85.75%
42	52.123.129.14:443	192.168.180.179:59796	6	1354	Ether / IP / TCP 52.123.129.14:https > 192.168.180.179:59796 A / Raw
----------------------------------------
34.2074	Atac: NORMAL	85.75%
43	192.168.180.179:59796	52.123.129.14:443	6	54	Ether / IP / TCP 192.168.180.179:59796 > 52.123.129.14:https A
----------------------------------------
34.2703	Atac: NORMAL	85.75%
43	52.123.129.14:443	192.168.180.179:59796	6	1354	Ether / IP / TCP 52.123.129.14:https > 192.168.180.179:59796 A / Raw
----------------------------------------
34.3363	Atac: NORMAL	85.75%
45	52.123.129.14:443	192.168.180.179:59796	6	475	Ether / IP / TCP 52.123.129.14:https > 192.168.180.179:59796 PA / Raw
----------------------------------------
34.4003	Atac: NORMAL	85.75%
45	192.168.180.179:59796	52.123.129.14:443	6	54	Ether / IP / TCP 192.168.180.179:59796 > 52.123.129.14:https A
----------------------------------------
34.4624	Atac: NORMAL	85.75%
47	192.168.180.179:59796	52.123.129.14:443	6	54	Ether / IP / TCP 192.168.180.179:59796 > 52.123.129.14:https A
----------------------------------------
34.5274	Atac: NORMAL	85.75%
48	52.123.129.14:443	192.168.180.179:59796	6	1354	Ether / IP / TCP 52.123.129.14:https > 192.168.180.179:59796 A / Raw
----------------------------------------
34.7130	Atac: NORMAL	85.75%
49	140.82.114.25:443	192.168.180.179:59622	6	80	Ether / IP / TCP 140.82.114.25:https > 192.168.180.179:59622 PA / Raw
----------------------------------------
34.7810	Atac: NORMAL	85.75%
50	192.168.180.179:59622	140.82.114.25:443	6	84	Ether / IP / TCP 192.168.180.179:59622 > 140.82.114.25:https PA / Raw
----------------------------------------
34.8470	Atac: NORMAL	85.75%
50	192.168.180.179:59796	52.123.129.14:443	6	54	Ether / IP / TCP 192.168.180.179:59796 > 52.123.129.14:https RA
----------------------------------------
34.9290	Atac: NORMAL	85.75%
52	140.82.114.25:443	192.168.180.179:59622	6	54	Ether / IP / TCP 140.82.114.25:https > 192.168.180.179:59622 A
----------------------------------------
40.6387	Atac: NORMAL	85.75%
53	192.168.180.179:59314	108.177.127.188:5228	6	55	Ether / IP / TCP 192.168.180.179:59314 > 108.177.127.188:5228 A / Raw
----------------------------------------
40.7427	Atac: NORMAL	85.75%
54	108.177.127.188:5228	192.168.180.179:59314	6	66	Ether / IP / TCP 108.177.127.188:5228 > 192.168.180.179:59314 A
----------------------------------------
41.1210	Atac: NORMAL	85.75%
55	192.168.180.179:59739	3.160.246.72:443	6	55	Ether / IP / TCP 192.168.180.179:59739 > 3.160.246.72:https A / Raw
----------------------------------------
41.1870	Atac: NORMAL	85.75%
56	3.160.246.72:443	192.168.180.179:59739	6	66	Ether / IP / TCP 3.160.246.72:https > 192.168.180.179:59739 A
----------------------------------------
43.0187	Atac: NORMAL	85.75%
57	192.168.180.179:59476	52.30.201.170:443	6	296	Ether / IP / TCP 192.168.180.179:59476 > 52.30.201.170:https PA / Raw
----------------------------------------
43.1355	Atac: NORMAL	85.75%
58	52.30.201.170:443	192.168.180.179:59476	6	318	Ether / IP / TCP 52.30.201.170:https > 192.168.180.179:59476 PA / Raw
----------------------------------------
43.2005	Atac: NORMAL	85.75%
59	192.168.180.179:59476	52.30.201.170:443	6	54	Ether / IP / TCP 192.168.180.179:59476 > 52.30.201.170:https A
----------------------------------------
59.0249	Atac: NORMAL	85.75%
60	192.168.180.179:59476	52.30.201.170:443	6	296	Ether / IP / TCP 192.168.180.179:59476 > 52.30.201.170:https PA / Raw
----------------------------------------
59.1467	Atac: NORMAL	85.75%
61	52.30.201.170:443	192.168.180.179:59476	6	319	Ether / IP / TCP 52.30.201.170:https > 192.168.180.179:59476 PA / Raw
----------------------------------------
59.2114	Atac: NORMAL	85.75%
61	192.168.180.179:59476	52.30.201.170:443	6	54	Ether / IP / TCP 192.168.180.179:59476 > 52.30.201.170:https A
----------------------------------------
71.2308	Eroare: main thread is not in main loop	0.00%
63	192.168.180.179:59232	40.101.78.114:443	6	55	Ether / IP / TCP 192.168.180.179:59232 > 40.101.78.114:https A / Raw
----------------------------------------
72.3293	Eroare: main thread is not in main loop	0.00%
63	140.82.112.26:443	192.168.180.179:59614	6	66	Ether / IP / TCP 140.82.112.26:https > 192.168.180.179:59614 A
----------------------------------------
75.0235	Eroare: main thread is not in main loop	0.00%
63	192.168.180.179:59476	52.30.201.170:443	6	296	Ether / IP / TCP 192.168.180.179:59476 > 52.30.201.170:https PA / Raw
----------------------------------------
79.9345	Eroare: main thread is not in main loop	0.00%
63	192.168.180.179:59622	140.82.114.25:443	6	55	Ether / IP / TCP 192.168.180.179:59622 > 140.82.114.25:https A / Raw
----------------------------------------
85.7447	Eroare: main thread is not in main loop	0.00%
63	192.168.180.179:59314	108.177.127.188:5228	6	55	Ether / IP / TCP 192.168.180.179:59314 > 108.177.127.188:5228 A / Raw
----------------------------------------
86.9668	Eroare: main thread is not in main loop	0.00%
63	140.82.112.26:443	192.168.180.179:59614	6	80	Ether / IP / TCP 140.82.112.26:https > 192.168.180.179:59614 PA / Raw
----------------------------------------
91.0192	Eroare: main thread is not in main loop	0.00%
63	192.168.180.179:59476	52.30.201.170:443	6	296	Ether / IP / TCP 192.168.180.179:59476 > 52.30.201.170:https PA / Raw
----------------------------------------
95.0443	Eroare: main thread is not in main loop	0.00%
63	140.82.114.25:443	192.168.180.179:59622	6	80	Ether / IP / TCP 140.82.114.25:https > 192.168.180.179:59622 PA / Raw
----------------------------------------
101.0273	Eroare: main thread is not in main loop	0.00%
63	192.168.180.179:50048	192.168.180.22:53	17	74	Ether / IP / UDP / DNS Qry b'api.github.com.'
----------------------------------------
