0.3395	Trafic Legitim	85.75%
0	192.168.125.179:63626	3.126.133.169:443	6	55	Ether / IP / TCP 192.168.125.179:63626 > 3.126.133.169:https A / Raw
----------------------------------------
0.5545	Trafic Legitim	85.75%
1	3.126.133.169:443	192.168.125.179:63626	6	66	Ether / IP / TCP 3.126.133.169:https > 192.168.125.179:63626 A
----------------------------------------
2.3694	Trafic Legitim	85.75%
2	192.168.125.179:63699	104.208.16.92:443	6	172	Ether / IP / TCP 192.168.125.179:63699 > 104.208.16.92:https PA / Raw
----------------------------------------
2.4393	Trafic Legitim	85.75%
2	192.168.125.179:63699	104.208.16.92:443	6	93	Ether / IP / TCP 192.168.125.179:63699 > 104.208.16.92:https PA / Raw
----------------------------------------
2.5213	Trafic Legitim	85.75%
4	192.168.125.179:63699	104.208.16.92:443	6	2328	Ether / IP / TCP 192.168.125.179:63699 > 104.208.16.92:https PA / Raw
----------------------------------------
2.6009	Trafic Legitim	85.75%
5	104.208.16.92:443	192.168.125.179:63699	6	54	Ether / IP / TCP 104.208.16.92:https > 192.168.125.179:63699 A
----------------------------------------
2.6709	Trafic Legitim	85.75%
5	104.208.16.92:443	192.168.125.179:63699	6	93	Ether / IP / TCP 104.208.16.92:https > 192.168.125.179:63699 PA / Raw
----------------------------------------
2.7419	Trafic Legitim	85.75%
7	192.168.125.179:63699	104.208.16.92:443	6	54	Ether / IP / TCP 192.168.125.179:63699 > 104.208.16.92:https A
----------------------------------------
2.8129	Trafic Legitim	85.75%
8	104.208.16.92:443	192.168.125.179:63699	6	54	Ether / IP / TCP 104.208.16.92:https > 192.168.125.179:63699 A
----------------------------------------
2.8928	Trafic Legitim	85.75%
8	104.208.16.92:443	192.168.125.179:63699	6	54	Ether / IP / TCP 104.208.16.92:https > 192.168.125.179:63699 A
----------------------------------------
2.9633	Trafic Legitim	85.75%
10	192.168.125.179:61228	52.16.218.208:443	6	298	Ether / IP / TCP 192.168.125.179:61228 > 52.16.218.208:https PA / Raw
----------------------------------------
3.0363	Trafic Legitim	85.75%
11	104.208.16.92:443	192.168.125.179:63699	6	152	Ether / IP / TCP 104.208.16.92:https > 192.168.125.179:63699 PA / Raw
----------------------------------------
