3.3507	Atac: NORMAL	85.75%
0	52.30.201.170:443	192.168.180.179:61110	6	78	Ether / IP / TCP 52.30.201.170:https > 192.168.180.179:61110 PA / Raw
----------------------------------------
3.5707	Atac: NORMAL	85.75%
0	52.30.201.170:443	192.168.180.179:61110	6	78	Ether / IP / TCP 52.30.201.170:https > 192.168.180.179:61110 PA / Raw
----------------------------------------
3.6356	Atac: NORMAL	85.75%
2	192.168.180.179:61110	52.30.201.170:443	6	66	Ether / IP / TCP 192.168.180.179:61110 > 52.30.201.170:https A
----------------------------------------
3.7026	Atac: NORMAL	85.75%
3	192.168.180.179:61110	52.30.201.170:443	6	82	Ether / IP / TCP 192.168.180.179:61110 > 52.30.201.170:https PA / Raw
----------------------------------------
3.7776	Atac: NORMAL	85.75%
3	52.30.201.170:443	192.168.180.179:61110	6	54	Ether / IP / TCP 52.30.201.170:https > 192.168.180.179:61110 A
----------------------------------------
6.8098	Atac: NORMAL	85.75%
5	192.168.180.179:62075	13.107.246.44:443	6	55	Ether / IP / TCP 192.168.180.179:62075 > 13.107.246.44:https A / Raw
----------------------------------------
6.9269	Atac: NORMAL	85.75%
6	13.107.246.44:443	192.168.180.179:62075	6	66	Ether / IP / TCP 13.107.246.44:https > 192.168.180.179:62075 A
----------------------------------------
7.1245	Atac: NORMAL	85.75%
7	192.168.180.179:62074	140.82.112.21:443	6	55	Ether / IP / TCP 192.168.180.179:62074 > 140.82.112.21:https A / Raw
----------------------------------------
7.3360	Atac: NORMAL	85.75%
8	140.82.112.21:443	192.168.180.179:62074	6	66	Ether / IP / TCP 140.82.112.21:https > 192.168.180.179:62074 A
----------------------------------------
10.5572	Atac: NORMAL	85.75%
9	192.168.180.179:62077	185.26.182.94:443	6	55	Ether / IP / TCP 192.168.180.179:62077 > 185.26.182.94:https A / Raw
----------------------------------------
10.7156	Atac: NORMAL	85.75%
10	185.26.182.94:443	192.168.180.179:62077	6	54	Ether / IP / TCP 185.26.182.94:https > 192.168.180.179:62077 A
----------------------------------------
12.1697	Atac: NORMAL	85.75%
11	192.168.180.179:59314	108.177.127.188:5228	6	55	Ether / IP / TCP 192.168.180.179:59314 > 108.177.127.188:5228 A / Raw
----------------------------------------
12.2633	Atac: NORMAL	85.75%
12	108.177.127.188:5228	192.168.180.179:59314	6	66	Ether / IP / TCP 108.177.127.188:5228 > 192.168.180.179:59314 A
----------------------------------------
12.8812	Atac: NORMAL	85.75%
13	192.168.180.179:62033	20.42.65.93:443	6	55	Ether / IP / TCP 192.168.180.179:62033 > 20.42.65.93:https A / Raw
----------------------------------------
13.0707	Atac: NORMAL	85.75%
14	20.42.65.93:443	192.168.180.179:62033	6	66	Ether / IP / TCP 20.42.65.93:https > 192.168.180.179:62033 A
----------------------------------------
15.8669	Atac: NORMAL	85.75%
15	192.168.180.179:62032	3.160.246.24:443	6	55	Ether / IP / TCP 192.168.180.179:62032 > 3.160.246.24:https A / Raw
----------------------------------------
15.9374	Atac: NORMAL	85.75%
16	3.160.246.24:443	192.168.180.179:62032	6	66	Ether / IP / TCP 3.160.246.24:https > 192.168.180.179:62032 A
----------------------------------------
16.3322	Atac: NORMAL	70.54%
17	192.168.180.179:56998	192.168.180.22:53	17	75	Ether / IP / UDP / DNS Qry b'ssl.gstatic.com.'
----------------------------------------
16.3972	Atac: NORMAL	70.54%
17	192.168.180.179:63159	192.168.180.22:53	17	75	Ether / IP / UDP / DNS Qry b'ssl.gstatic.com.'
----------------------------------------
16.4642	Atac: NORMAL	70.54%
19	192.168.180.22:53	192.168.180.179:56998	17	91	Ether / IP / UDP / DNS Ans 172.217.17.99
----------------------------------------
16.5311	Atac: NORMAL	70.54%
20	192.168.180.22:53	192.168.180.179:63159	17	132	Ether / IP / UDP / DNS Ans
----------------------------------------
16.5990	Atac: NORMAL	70.54%
20	192.168.180.179:62265	172.217.17.99:443	17	1292	Ether / IP / UDP 192.168.180.179:62265 > 172.217.17.99:https / Raw
----------------------------------------
16.6670	Atac: NORMAL	70.54%
22	192.168.180.179:62265	172.217.17.99:443	17	1292	Ether / IP / UDP 192.168.180.179:62265 > 172.217.17.99:https / Raw
----------------------------------------
16.7453	Atac: NORMAL	70.54%
23	192.168.180.179:62265	172.217.17.99:443	17	124	Ether / IP / UDP 192.168.180.179:62265 > 172.217.17.99:https / Raw
----------------------------------------
16.8143	Atac: NORMAL	70.54%
23	192.168.180.179:62265	172.217.17.99:443	17	581	Ether / IP / UDP 192.168.180.179:62265 > 172.217.17.99:https / Raw
----------------------------------------
16.8813	Atac: NORMAL	70.54%
25	172.217.17.99:443	192.168.180.179:62265	17	82	Ether / IP / UDP 172.217.17.99:https > 192.168.180.179:62265 / Raw
----------------------------------------
16.9643	Atac: NORMAL	70.54%
26	172.217.17.99:443	192.168.180.179:62265	17	1292	Ether / IP / UDP 172.217.17.99:https > 192.168.180.179:62265 / Raw
----------------------------------------
17.0333	Atac: NORMAL	70.54%
27	172.217.17.99:443	192.168.180.179:62265	17	1292	Ether / IP / UDP 172.217.17.99:https > 192.168.180.179:62265 / Raw
----------------------------------------
17.0993	Atac: NORMAL	70.54%
27	172.217.17.99:443	192.168.180.179:62265	17	342	Ether / IP / UDP 172.217.17.99:https > 192.168.180.179:62265 / Raw
----------------------------------------
17.1651	Atac: NORMAL	70.54%
29	172.217.17.99:443	192.168.180.179:62265	17	986	Ether / IP / UDP 172.217.17.99:https > 192.168.180.179:62265 / Raw
----------------------------------------
17.2304	Atac: NORMAL	70.54%
29	172.217.17.99:443	192.168.180.179:62265	17	67	Ether / IP / UDP 172.217.17.99:https > 192.168.180.179:62265 / Raw
----------------------------------------
19.1935	Atac: NORMAL	85.75%
31	192.168.180.179:62078	185.26.182.112:443	6	55	Ether / IP / TCP 192.168.180.179:62078 > 185.26.182.112:https A / Raw
----------------------------------------
19.3179	Atac: NORMAL	85.75%
32	185.26.182.112:443	192.168.180.179:62078	6	66	Ether / IP / TCP 185.26.182.112:https > 192.168.180.179:62078 A
----------------------------------------
20.0386	Atac: NORMAL	85.75%
33	192.168.180.179:61123	172.161.47.103:443	6	55	Ether / IP / TCP 192.168.180.179:61123 > 172.161.47.103:https A / Raw
----------------------------------------
20.1385	Atac: NORMAL	85.75%
34	172.161.47.103:443	192.168.180.179:61123	6	66	Ether / IP / TCP 172.161.47.103:https > 192.168.180.179:61123 A
----------------------------------------
20.6247	Atac: NORMAL	85.75%
35	192.168.180.179:61987	104.18.0.22:443	6	55	Ether / IP / TCP 192.168.180.179:61987 > 104.18.0.22:https A / Raw
----------------------------------------
20.7520	Atac: NORMAL	85.75%
36	104.18.0.22:443	192.168.180.179:61987	6	66	Ether / IP / TCP 104.18.0.22:https > 192.168.180.179:61987 A
----------------------------------------
30.8952	Atac: NORMAL	85.75%
37	185.26.182.94:443	192.168.180.179:62077	6	93	Ether / IP / TCP 185.26.182.94:https > 192.168.180.179:62077 PA / Raw
----------------------------------------
30.9615	Atac: NORMAL	85.75%
38	185.26.182.94:443	192.168.180.179:62077	6	78	Ether / IP / TCP 185.26.182.94:https > 192.168.180.179:62077 PA / Raw
----------------------------------------
31.0255	Atac: NORMAL	85.75%
38	185.26.182.94:443	192.168.180.179:62077	6	54	Ether / IP / TCP 185.26.182.94:https > 192.168.180.179:62077 FA
----------------------------------------
31.0905	Atac: NORMAL	85.75%
40	192.168.180.179:62077	185.26.182.94:443	6	54	Ether / IP / TCP 192.168.180.179:62077 > 185.26.182.94:https A
----------------------------------------
31.1565	Atac: NORMAL	85.75%
41	192.168.180.179:62077	185.26.182.94:443	6	54	Ether / IP / TCP 192.168.180.179:62077 > 185.26.182.94:https A
----------------------------------------
31.2225	Atac: NORMAL	85.75%
41	192.168.180.179:62077	185.26.182.94:443	6	54	Ether / IP / TCP 192.168.180.179:62077 > 185.26.182.94:https FA
----------------------------------------
31.2885	Atac: NORMAL	85.75%
43	185.26.182.94:443	192.168.180.179:62077	6	117	Ether / IP / TCP 185.26.182.94:https > 192.168.180.179:62077 FPA / Raw
----------------------------------------
31.3555	Atac: NORMAL	85.75%
43	192.168.180.179:62077	185.26.182.94:443	6	54	Ether / IP / TCP 192.168.180.179:62077 > 185.26.182.94:https A
----------------------------------------
31.4215	Atac: NORMAL	85.75%
45	185.26.182.94:443	192.168.180.179:62077	6	54	Ether / IP / TCP 185.26.182.94:https > 192.168.180.179:62077 A
----------------------------------------
34.8003	Atac: NORMAL	85.75%
46	140.82.114.25:443	192.168.180.179:62038	6	66	Ether / IP / TCP 140.82.114.25:https > 192.168.180.179:62038 A
----------------------------------------
38.0247	Atac: NORMAL	85.75%
47	192.168.180.179:61736	140.82.112.26:443	6	55	Ether / IP / TCP 192.168.180.179:61736 > 140.82.112.26:https A / Raw
----------------------------------------
38.2626	Atac: NORMAL	85.75%
48	140.82.112.26:443	192.168.180.179:61736	6	66	Ether / IP / TCP 140.82.112.26:https > 192.168.180.179:61736 A
----------------------------------------
39.1841	Atac: NORMAL	85.75%
49	185.26.182.112:443	192.168.180.179:62078	6	93	Ether / IP / TCP 185.26.182.112:https > 192.168.180.179:62078 PA / Raw
----------------------------------------
39.2520	Atac: NORMAL	85.75%
49	185.26.182.112:443	192.168.180.179:62078	6	78	Ether / IP / TCP 185.26.182.112:https > 192.168.180.179:62078 PA / Raw
----------------------------------------
39.3170	Atac: NORMAL	85.75%
51	185.26.182.112:443	192.168.180.179:62078	6	54	Ether / IP / TCP 185.26.182.112:https > 192.168.180.179:62078 FA
----------------------------------------
39.3830	Atac: NORMAL	85.75%
51	192.168.180.179:62078	185.26.182.112:443	6	54	Ether / IP / TCP 192.168.180.179:62078 > 185.26.182.112:https A
----------------------------------------
39.4480	Atac: NORMAL	85.75%
53	192.168.180.179:62078	185.26.182.112:443	6	54	Ether / IP / TCP 192.168.180.179:62078 > 185.26.182.112:https A
----------------------------------------
39.5170	Atac: NORMAL	85.75%
54	192.168.180.179:62078	185.26.182.112:443	6	54	Ether / IP / TCP 192.168.180.179:62078 > 185.26.182.112:https FA
----------------------------------------
41.5828	Atac: NORMAL	70.54%
55	192.168.180.179:62265	172.217.17.99:443	17	145	Ether / IP / UDP 192.168.180.179:62265 > 172.217.17.99:https / Raw
----------------------------------------
41.7444	Atac: NORMAL	70.54%
56	172.217.17.99:443	192.168.180.179:62265	17	71	Ether / IP / UDP 172.217.17.99:https > 192.168.180.179:62265 / Raw
----------------------------------------
41.8114	Atac: NORMAL	70.54%
57	172.217.17.99:443	192.168.180.179:62265	17	157	Ether / IP / UDP 172.217.17.99:https > 192.168.180.179:62265 / Raw
----------------------------------------
41.8759	Atac: NORMAL	70.54%
58	192.168.180.179:62265	172.217.17.99:443	17	77	Ether / IP / UDP 192.168.180.179:62265 > 172.217.17.99:https / Raw
----------------------------------------
41.9409	Atac: NORMAL	70.54%
58	172.217.17.99:443	192.168.180.179:62265	17	66	Ether / IP / UDP 172.217.17.99:https > 192.168.180.179:62265 / Raw
----------------------------------------
44.1007	Atac: NORMAL	85.75%
60	20.42.65.93:443	192.168.180.179:62033	6	54	Ether / IP / TCP 20.42.65.93:https > 192.168.180.179:62033 RA
----------------------------------------
48.4543	Eroare: main thread is not in main loop	0.00%
61	192.168.180.179:61110	52.30.201.170:443	6	55	Ether / IP / TCP 192.168.180.179:61110 > 52.30.201.170:https A / Raw
----------------------------------------
51.1690	Eroare: main thread is not in main loop	0.00%
61	192.168.180.179:62040	20.231.128.67:443	6	54	Ether / IP / TCP 192.168.180.179:62040 > 20.231.128.67:https FA
----------------------------------------
52.3402	Eroare: main thread is not in main loop	0.00%
61	192.168.180.179:62074	140.82.112.21:443	6	55	Ether / IP / TCP 192.168.180.179:62074 > 140.82.112.21:https A / Raw
----------------------------------------
57.2727	Eroare: main thread is not in main loop	0.00%
61	192.168.180.179:59314	108.177.127.188:5228	6	55	Ether / IP / TCP 192.168.180.179:59314 > 108.177.127.188:5228 A / Raw
----------------------------------------
59.7661	Eroare: main thread is not in main loop	0.00%
61	104.18.0.22:443	192.168.180.179:61987	6	93	Ether / IP / TCP 104.18.0.22:https > 192.168.180.179:61987 PA / Raw
----------------------------------------
60.9468	Eroare: main thread is not in main loop	0.00%
61	192.168.180.179:62032	3.160.246.24:443	6	55	Ether / IP / TCP 192.168.180.179:62032 > 3.160.246.24:https A / Raw
----------------------------------------
65.1408	Eroare: main thread is not in main loop	0.00%
61	192.168.180.179:61123	172.161.47.103:443	6	55	Ether / IP / TCP 192.168.180.179:61123 > 172.161.47.103:https A / Raw
----------------------------------------
