9.3542	Eroare: Input 0 of layer "functional_1" is incompatible with the layer: expected shape=(None, 42, 1), found shape=(1, 41)	0.00%
0	192.168.192.179:50174	52.30.201.170:443	6	297	Ether / IP / TCP 192.168.192.179:50174 > 52.30.201.170:https PA / Raw
----------------------------------------
9.5223	Eroare: Input 0 of layer "functional_1" is incompatible with the layer: expected shape=(None, 42, 1), found shape=(1, 41)	0.00%
1	52.30.201.170:443	192.168.192.179:50174	6	318	Ether / IP / TCP 52.30.201.170:https > 192.168.192.179:50174 PA / Raw
----------------------------------------
9.6921	Eroare: Input 0 of layer "functional_1" is incompatible with the layer: expected shape=(None, 42, 1), found shape=(1, 41)	0.00%
2	192.168.192.179:50174	52.30.201.170:443	6	54	Ether / IP / TCP 192.168.192.179:50174 > 52.30.201.170:https A
----------------------------------------
12.2226	Eroare: Input 0 of layer "functional_1" is incompatible with the layer: expected shape=(None, 42, 1), found shape=(1, 41)	0.00%
3	52.30.201.170:443	192.168.192.179:50174	6	78	Ether / IP / TCP 52.30.201.170:https > 192.168.192.179:50174 PA / Raw
----------------------------------------
12.3494	Eroare: Input 0 of layer "functional_1" is incompatible with the layer: expected shape=(None, 42, 1), found shape=(1, 41)	0.00%
4	192.168.192.179:50174	52.30.201.170:443	6	82	Ether / IP / TCP 192.168.192.179:50174 > 52.30.201.170:https PA / Raw
----------------------------------------
12.4862	Eroare: Input 0 of layer "functional_1" is incompatible with the layer: expected shape=(None, 42, 1), found shape=(1, 41)	0.00%
5	52.30.201.170:443	192.168.192.179:50174	6	54	Ether / IP / TCP 52.30.201.170:https > 192.168.192.179:50174 A
----------------------------------------
23.9771	Eroare: Input 0 of layer "functional_1" is incompatible with the layer: expected shape=(None, 42, 1), found shape=(1, 41)	0.00%
6	192.168.192.179:51138	140.82.114.25:443	6	55	Ether / IP / TCP 192.168.192.179:51138 > 140.82.114.25:https A / Raw
----------------------------------------
24.1681	Eroare: Input 0 of layer "functional_1" is incompatible with the layer: expected shape=(None, 42, 1), found shape=(1, 41)	0.00%
7	140.82.114.25:443	192.168.192.179:51138	6	66	Ether / IP / TCP 140.82.114.25:https > 192.168.192.179:51138 A
----------------------------------------
25.2360	Eroare: Input 0 of layer "functional_1" is incompatible with the layer: expected shape=(None, 42, 1), found shape=(1, 41)	0.00%
8	192.168.192.179:50088	108.177.96.188:5228	6	55	Ether / IP / TCP 192.168.192.179:50088 > 108.177.96.188:5228 A / Raw
----------------------------------------
25.5259	Eroare: Input 0 of layer "functional_1" is incompatible with the layer: expected shape=(None, 42, 1), found shape=(1, 41)	0.00%
9	52.30.201.170:443	192.168.192.179:50174	6	54	Ether / IP / TCP 52.30.201.170:https > 192.168.192.179:50174 A
----------------------------------------
25.6634	Eroare: Input 0 of layer "functional_1" is incompatible with the layer: expected shape=(None, 42, 1), found shape=(1, 41)	0.00%
10	52.30.201.170:443	192.168.192.179:50174	6	319	Ether / IP / TCP 52.30.201.170:https > 192.168.192.179:50174 PA / Raw
----------------------------------------
25.8461	Eroare: Input 0 of layer "functional_1" is incompatible with the layer: expected shape=(None, 42, 1), found shape=(1, 41)	0.00%
11	192.168.192.179:50174	52.30.201.170:443	6	54	Ether / IP / TCP 192.168.192.179:50174 > 52.30.201.170:https A
----------------------------------------
28.1437	Eroare: Input 0 of layer "functional_1" is incompatible with the layer: expected shape=(None, 42, 1), found shape=(1, 41)	0.00%
12	192.168.192.179:51224	20.189.173.5:443	6	54	Ether / IP / TCP 192.168.192.179:51224 > 20.189.173.5:https FA
----------------------------------------
28.4096	Eroare: Input 0 of layer "functional_1" is incompatible with the layer: expected shape=(None, 42, 1), found shape=(1, 41)	0.00%
13	20.189.173.5:443	192.168.192.179:51224	6	54	Ether / IP / TCP 20.189.173.5:https > 192.168.192.179:51224 FA
----------------------------------------
28.5488	Eroare: Input 0 of layer "functional_1" is incompatible with the layer: expected shape=(None, 42, 1), found shape=(1, 41)	0.00%
14	192.168.192.179:51224	20.189.173.5:443	6	54	Ether / IP / TCP 192.168.192.179:51224 > 20.189.173.5:https A
----------------------------------------
28.9368	Eroare: Input 0 of layer "functional_1" is incompatible with the layer: expected shape=(None, 42, 1), found shape=(1, 41)	0.00%
15	192.168.192.179:51011	20.189.173.10:443	6	55	Ether / IP / TCP 192.168.192.179:51011 > 20.189.173.10:https A / Raw
----------------------------------------
29.2209	Eroare: Input 0 of layer "functional_1" is incompatible with the layer: expected shape=(None, 42, 1), found shape=(1, 41)	0.00%
16	20.189.173.10:443	192.168.192.179:51011	6	66	Ether / IP / TCP 20.189.173.10:https > 192.168.192.179:51011 A
----------------------------------------
38.7008	Eroare: Input 0 of layer "functional_1" is incompatible with the layer: expected shape=(None, 42, 1), found shape=(1, 41)	0.00%
17	140.82.114.25:443	192.168.192.179:51138	6	79	Ether / IP / TCP 140.82.114.25:https > 192.168.192.179:51138 PA / Raw
----------------------------------------
38.8472	Eroare: Input 0 of layer "functional_1" is incompatible with the layer: expected shape=(None, 42, 1), found shape=(1, 41)	0.00%
18	192.168.192.179:51138	140.82.114.25:443	6	83	Ether / IP / TCP 192.168.192.179:51138 > 140.82.114.25:https PA / Raw
----------------------------------------
39.0601	Eroare: Input 0 of layer "functional_1" is incompatible with the layer: expected shape=(None, 42, 1), found shape=(1, 41)	0.00%
19	140.82.114.25:443	192.168.192.179:51138	6	54	Ether / IP / TCP 140.82.114.25:https > 192.168.192.179:51138 A
----------------------------------------
41.3492	Eroare: Input 0 of layer "functional_1" is incompatible with the layer: expected shape=(None, 42, 1), found shape=(1, 41)	0.00%
20	192.168.192.179:50174	52.30.201.170:443	6	296	Ether / IP / TCP 192.168.192.179:50174 > 52.30.201.170:https PA / Raw
----------------------------------------
41.6717	Eroare: main thread is not in main loop	0.00%
20	192.168.192.179:50174	52.30.201.170:443	6	54	Ether / IP / TCP 192.168.192.179:50174 > 52.30.201.170:https A
----------------------------------------
45.0739	Eroare: main thread is not in main loop	0.00%
20	192.168.192.179:53447	192.168.192.165:53	17	92	Ether / IP / UDP / DNS Qry b'mobile.events.data.microsoft.com.'
----------------------------------------
46.2619	Eroare: main thread is not in main loop	0.00%
20	20.189.173.10:443	192.168.192.179:51011	6	54	Ether / IP / TCP 20.189.173.10:https > 192.168.192.179:51011 A
----------------------------------------
53.7190	Eroare: main thread is not in main loop	0.00%
20	192.168.192.179:51917	192.168.192.165:53	17	79	Ether / IP / UDP / DNS Qry b'main.vscode-cdn.net.'
----------------------------------------
57.3471	Eroare: main thread is not in main loop	0.00%
20	192.168.192.179:50174	52.30.201.170:443	6	296	Ether / IP / TCP 192.168.192.179:50174 > 52.30.201.170:https PA / Raw
----------------------------------------
69.3952	Eroare: main thread is not in main loop	0.00%
20	192.168.192.179:52208	192.168.192.165:53	17	75	Ether / IP / UDP / DNS Qry b'chat.mistral.ai.'
----------------------------------------
71.3710	Eroare: main thread is not in main loop	0.00%
20	192.168.192.179:50174	52.30.201.170:443	6	164	Ether / IP / TCP 192.168.192.179:50174 > 52.30.201.170:https PA / Raw
----------------------------------------
72.5489	Eroare: main thread is not in main loop	0.00%
20	192.168.192.179:50174	52.30.201.170:443	6	296	Ether / IP / TCP 192.168.192.179:50174 > 52.30.201.170:https PA / Raw
----------------------------------------
73.8224	Eroare: main thread is not in main loop	0.00%
20	13.89.179.10:443	192.168.192.179:51237	6	54	Ether / IP / TCP 13.89.179.10:https > 192.168.192.179:51237 A
----------------------------------------
78.3482	Eroare: main thread is not in main loop	0.00%
20	192.168.192.179:51011	20.189.173.10:443	6	167	Ether / IP / TCP 192.168.192.179:51011 > 20.189.173.10:https PA / Raw
----------------------------------------
79.5844	Eroare: main thread is not in main loop	0.00%
20	20.189.173.10:443	192.168.192.179:51011	6	54	Ether / IP / TCP 20.189.173.10:https > 192.168.192.179:51011 A
----------------------------------------
83.8780	Eroare: main thread is not in main loop	0.00%
20	192.168.192.179:51138	140.82.114.25:443	6	55	Ether / IP / TCP 192.168.192.179:51138 > 140.82.114.25:https A / Raw
----------------------------------------
85.1461	Eroare: main thread is not in main loop	0.00%
20	13.89.179.10:443	192.168.192.179:51239	6	153	Ether / IP / TCP 13.89.179.10:https > 192.168.192.179:51239 PA / Raw
----------------------------------------
86.3828	Eroare: main thread is not in main loop	0.00%
20	140.82.112.21:443	192.168.192.179:51240	6	66	Ether / IP / TCP 140.82.112.21:https > 192.168.192.179:51240 SA
----------------------------------------
87.6962	Eroare: main thread is not in main loop	0.00%
20	13.89.179.10:443	192.168.192.179:51241	6	66	Ether / IP / TCP 13.89.179.10:https > 192.168.192.179:51241 SA
----------------------------------------
98.9177	Eroare: main thread is not in main loop	0.00%
20	140.82.114.25:443	192.168.192.179:51138	6	79	Ether / IP / TCP 140.82.114.25:https > 192.168.192.179:51138 PA / Raw
----------------------------------------
104.3619	Eroare: main thread is not in main loop	0.00%
20	192.168.192.179:50174	52.30.201.170:443	6	297	Ether / IP / TCP 192.168.192.179:50174 > 52.30.201.170:https PA / Raw
----------------------------------------
115.4772	Eroare: main thread is not in main loop	0.00%
20	192.168.192.179:50088	108.177.96.188:5228	6	55	Ether / IP / TCP 192.168.192.179:50088 > 108.177.96.188:5228 A / Raw
----------------------------------------
120.3539	Eroare: main thread is not in main loop	0.00%
20	192.168.192.179:50174	52.30.201.170:443	6	297	Ether / IP / TCP 192.168.192.179:50174 > 52.30.201.170:https PA / Raw
----------------------------------------
130.3886	Eroare: main thread is not in main loop	0.00%
20	192.168.192.179:64997	142.250.187.131:443	17	145	Ether / IP / UDP 192.168.192.179:64997 > 142.250.187.131:https / Raw
----------------------------------------
132.3448	Eroare: main thread is not in main loop	0.00%
20	192.168.192.179:51011	20.189.173.10:443	6	55	Ether / IP / TCP 192.168.192.179:51011 > 20.189.173.10:https A / Raw
----------------------------------------
136.3706	Eroare: main thread is not in main loop	0.00%
20	192.168.192.179:50174	52.30.201.170:443	6	296	Ether / IP / TCP 192.168.192.179:50174 > 52.30.201.170:https PA / Raw
----------------------------------------
143.9720	Eroare: main thread is not in main loop	0.00%
20	13.107.246.44:443	192.168.192.179:51236	6	93	Ether / IP / TCP 13.107.246.44:https > 192.168.192.179:51236 PA / Raw
----------------------------------------
147.0043	Eroare: main thread is not in main loop	0.00%
20	192.168.192.179:49956	20.199.120.151:443	6	55	Ether / IP / TCP 192.168.192.179:49956 > 20.199.120.151:https A / Raw
----------------------------------------
149.3769	Eroare: main thread is not in main loop	0.00%
20	192.168.192.179:59971	192.168.192.165:53	17	79	Ether / IP / UDP / DNS Qry b'accounts.google.com.'
----------------------------------------
152.3505	Eroare: main thread is not in main loop	0.00%
20	192.168.192.179:50174	52.30.201.170:443	6	297	Ether / IP / TCP 192.168.192.179:50174 > 52.30.201.170:https PA / Raw
----------------------------------------
158.7281	Eroare: main thread is not in main loop	0.00%
20	140.82.114.25:443	192.168.192.179:51138	6	79	Ether / IP / TCP 140.82.114.25:https > 192.168.192.179:51138 PA / Raw
----------------------------------------
160.5694	Eroare: main thread is not in main loop	0.00%
20	192.168.192.179:58165	142.250.187.131:443	17	1292	Ether / IP / UDP 192.168.192.179:58165 > 142.250.187.131:https / Raw
----------------------------------------
168.3520	Eroare: main thread is not in main loop	0.00%
20	192.168.192.179:50174	52.30.201.170:443	6	297	Ether / IP / TCP 192.168.192.179:50174 > 52.30.201.170:https PA / Raw
----------------------------------------
177.6386	Eroare: main thread is not in main loop	0.00%
20	192.168.192.179:51011	20.189.173.10:443	6	55	Ether / IP / TCP 192.168.192.179:51011 > 20.189.173.10:https A / Raw
----------------------------------------
184.3490	Eroare: main thread is not in main loop	0.00%
20	192.168.192.179:50174	52.30.201.170:443	6	297	Ether / IP / TCP 192.168.192.179:50174 > 52.30.201.170:https PA / Raw
----------------------------------------
193.3636	Eroare: main thread is not in main loop	0.00%
20	192.168.192.179:50174	52.30.201.170:443	6	164	Ether / IP / TCP 192.168.192.179:50174 > 52.30.201.170:https PA / Raw
----------------------------------------
200.3517	Eroare: main thread is not in main loop	0.00%
20	192.168.192.179:50174	52.30.201.170:443	6	297	Ether / IP / TCP 192.168.192.179:50174 > 52.30.201.170:https PA / Raw
----------------------------------------
203.2824	Eroare: main thread is not in main loop	0.00%
20	192.168.192.179:50174	52.30.201.170:443	6	164	Ether / IP / TCP 192.168.192.179:50174 > 52.30.201.170:https PA / Raw
----------------------------------------
205.3235	Eroare: main thread is not in main loop	0.00%
20	192.168.192.179:59359	192.168.192.165:53	17	87	Ether / IP / UDP / DNS Qry b'roaming.officeapps.live.com.'
----------------------------------------
207.3830	Eroare: main thread is not in main loop	0.00%
20	140.82.112.21:443	192.168.192.179:51240	6	93	Ether / IP / TCP 140.82.112.21:https > 192.168.192.179:51240 PA / Raw
----------------------------------------
209.3401	Eroare: main thread is not in main loop	0.00%
20	20.189.173.10:443	192.168.192.179:51011	6	54	Ether / IP / TCP 20.189.173.10:https > 192.168.192.179:51011 RA
----------------------------------------
216.3519	Eroare: main thread is not in main loop	0.00%
20	192.168.192.179:50174	52.30.201.170:443	6	297	Ether / IP / TCP 192.168.192.179:50174 > 52.30.201.170:https PA / Raw
----------------------------------------
218.9398	Eroare: main thread is not in main loop	0.00%
20	140.82.114.25:443	192.168.192.179:51138	6	80	Ether / IP / TCP 140.82.114.25:https > 192.168.192.179:51138 PA / Raw
----------------------------------------
232.3533	Eroare: main thread is not in main loop	0.00%
20	192.168.192.179:50174	52.30.201.170:443	6	297	Ether / IP / TCP 192.168.192.179:50174 > 52.30.201.170:https PA / Raw
----------------------------------------
248.3518	Eroare: main thread is not in main loop	0.00%
20	192.168.192.179:50174	52.30.201.170:443	6	297	Ether / IP / TCP 192.168.192.179:50174 > 52.30.201.170:https PA / Raw
----------------------------------------
250.7465	Eroare: main thread is not in main loop	0.00%
20	192.168.192.179:50088	108.177.96.188:5228	6	55	Ether / IP / TCP 192.168.192.179:50088 > 108.177.96.188:5228 A / Raw
----------------------------------------
252.5490	Eroare: main thread is not in main loop	0.00%
20	52.30.201.170:443	192.168.192.179:50174	6	78	Ether / IP / TCP 52.30.201.170:https > 192.168.192.179:50174 PA / Raw
----------------------------------------
264.1759	Eroare: main thread is not in main loop	0.00%
20	192.168.192.179:51138	140.82.114.25:443	6	55	Ether / IP / TCP 192.168.192.179:51138 > 140.82.114.25:https A / Raw
----------------------------------------
278.7548	Eroare: main thread is not in main loop	0.00%
20	140.82.114.25:443	192.168.192.179:51138	6	80	Ether / IP / TCP 140.82.114.25:https > 192.168.192.179:51138 PA / Raw
----------------------------------------
280.3544	Eroare: main thread is not in main loop	0.00%
20	192.168.192.179:50174	52.30.201.170:443	6	297	Ether / IP / TCP 192.168.192.179:50174 > 52.30.201.170:https PA / Raw
----------------------------------------
295.9069	Eroare: main thread is not in main loop	0.00%
20	192.168.192.179:50088	108.177.96.188:5228	6	55	Ether / IP / TCP 192.168.192.179:50088 > 108.177.96.188:5228 A / Raw
----------------------------------------
298.0807	Eroare: main thread is not in main loop	0.00%
20	192.168.192.179:51808	192.168.192.165:53	17	71	Ether / IP / UDP / DNS Qry b'w.deepl.com.'
----------------------------------------
312.3515	Eroare: main thread is not in main loop	0.00%
20	192.168.192.179:50174	52.30.201.170:443	6	297	Ether / IP / TCP 192.168.192.179:50174 > 52.30.201.170:https PA / Raw
----------------------------------------
313.6597	Eroare: main thread is not in main loop	0.00%
20	172.65.225.25:443	192.168.192.179:51243	6	54	Ether / IP / TCP 172.65.225.25:https > 192.168.192.179:51243 A
----------------------------------------
372.4994	Eroare: main thread is not in main loop	0.00%
20	52.30.201.170:443	192.168.192.179:50174	6	78	Ether / IP / TCP 52.30.201.170:https > 192.168.192.179:50174 PA / Raw
----------------------------------------
376.3549	Eroare: main thread is not in main loop	0.00%
20	192.168.192.179:50174	52.30.201.170:443	6	297	Ether / IP / TCP 192.168.192.179:50174 > 52.30.201.170:https PA / Raw
----------------------------------------
384.0384	Eroare: main thread is not in main loop	0.00%
20	192.168.192.179:51138	140.82.114.25:443	6	55	Ether / IP / TCP 192.168.192.179:51138 > 140.82.114.25:https A / Raw
----------------------------------------
385.1368	Eroare: main thread is not in main loop	0.00%
20	20.189.173.13:443	192.168.192.179:51245	6	66	Ether / IP / TCP 20.189.173.13:https > 192.168.192.179:51245 A
----------------------------------------
386.2983	Eroare: main thread is not in main loop	0.00%
20	108.177.96.188:5228	192.168.192.179:50088	6	66	Ether / IP / TCP 108.177.96.188:5228 > 192.168.192.179:50088 A
----------------------------------------
392.1567	Eroare: main thread is not in main loop	0.00%
20	192.168.192.179:49956	20.199.120.151:443	6	55	Ether / IP / TCP 192.168.192.179:49956 > 20.199.120.151:https A / Raw
----------------------------------------
398.7614	Eroare: main thread is not in main loop	0.00%
20	140.82.114.25:443	192.168.192.179:51138	6	80	Ether / IP / TCP 140.82.114.25:https > 192.168.192.179:51138 PA / Raw
----------------------------------------
404.9635	Eroare: main thread is not in main loop	0.00%
20	192.168.192.179:56905	192.168.192.165:53	17	75	Ether / IP / UDP / DNS Qry b'ssl.gstatic.com.'
----------------------------------------
408.3626	Eroare: main thread is not in main loop	0.00%
20	192.168.192.179:50174	52.30.201.170:443	6	297	Ether / IP / TCP 192.168.192.179:50174 > 52.30.201.170:https PA / Raw
----------------------------------------
424.3717	Eroare: main thread is not in main loop	0.00%
20	192.168.192.179:50174	52.30.201.170:443	6	297	Ether / IP / TCP 192.168.192.179:50174 > 52.30.201.170:https PA / Raw
----------------------------------------
429.0876	Eroare: main thread is not in main loop	0.00%
20	192.168.192.179:50088	108.177.96.188:5228	6	80	Ether / IP / TCP 192.168.192.179:50088 > 108.177.96.188:5228 PA / Raw
----------------------------------------
430.1797	Eroare: main thread is not in main loop	0.00%
20	192.168.192.179:51245	20.189.173.13:443	6	55	Ether / IP / TCP 192.168.192.179:51245 > 20.189.173.13:https A / Raw
----------------------------------------
440.3602	Eroare: main thread is not in main loop	0.00%
20	192.168.192.179:50174	52.30.201.170:443	6	296	Ether / IP / TCP 192.168.192.179:50174 > 52.30.201.170:https PA / Raw
----------------------------------------
441.8893	Eroare: main thread is not in main loop	0.00%
20	192.168.192.179:51245	20.189.173.13:443	6	89	Ether / IP / TCP 192.168.192.179:51245 > 20.189.173.13:https PA / Raw
----------------------------------------
443.1823	Eroare: main thread is not in main loop	0.00%
20	13.89.178.27:443	192.168.192.179:51250	6	519	Ether / IP / TCP 13.89.178.27:https > 192.168.192.179:51250 FPA / Raw
----------------------------------------
444.3236	Eroare: main thread is not in main loop	0.00%
20	192.168.192.179:51251	13.89.178.27:443	6	66	Ether / IP / TCP 192.168.192.179:51251 > 13.89.178.27:https S
----------------------------------------
445.4251	Eroare: main thread is not in main loop	0.00%
20	192.168.192.179:51251	13.89.178.27:443	6	54	Ether / IP / TCP 192.168.192.179:51251 > 13.89.178.27:https A
----------------------------------------
447.6801	Eroare: main thread is not in main loop	0.00%
20	192.168.192.179:51270	13.89.178.27:443	6	66	Ether / IP / TCP 192.168.192.179:51270 > 13.89.178.27:https S
----------------------------------------
449.9336	Eroare: main thread is not in main loop	0.00%
20	13.89.178.27:443	192.168.192.179:51270	6	519	Ether / IP / TCP 13.89.178.27:https > 192.168.192.179:51270 FPA / Raw
----------------------------------------
454.3622	Eroare: main thread is not in main loop	0.00%
20	192.168.192.179:50174	52.30.201.170:443	6	164	Ether / IP / TCP 192.168.192.179:50174 > 52.30.201.170:https PA / Raw
----------------------------------------
456.3655	Eroare: main thread is not in main loop	0.00%
20	192.168.192.179:50174	52.30.201.170:443	6	297	Ether / IP / TCP 192.168.192.179:50174 > 52.30.201.170:https PA / Raw
----------------------------------------
458.8950	Eroare: main thread is not in main loop	0.00%
20	140.82.114.25:443	192.168.192.179:51138	6	80	Ether / IP / TCP 140.82.114.25:https > 192.168.192.179:51138 PA / Raw
----------------------------------------
460.3591	Eroare: main thread is not in main loop	0.00%
20	192.168.192.179:65201	142.250.187.131:443	17	1292	Ether / IP / UDP 192.168.192.179:65201 > 142.250.187.131:https / Raw
----------------------------------------
472.3604	Eroare: main thread is not in main loop	0.00%
20	192.168.192.179:50174	52.30.201.170:443	6	296	Ether / IP / TCP 192.168.192.179:50174 > 52.30.201.170:https PA / Raw
----------------------------------------
474.1915	Eroare: main thread is not in main loop	0.00%
20	192.168.192.179:50088	108.177.96.188:5228	6	55	Ether / IP / TCP 192.168.192.179:50088 > 108.177.96.188:5228 A / Raw
----------------------------------------
476.3956	Eroare: main thread is not in main loop	0.00%
20	192.168.192.179:56968	192.168.192.165:53	17	83	Ether / IP / UDP / DNS Qry b'spclient.wg.spotify.com.'
----------------------------------------
487.1849	Eroare: main thread is not in main loop	0.00%
20	192.168.192.179:51245	20.189.173.13:443	6	55	Ether / IP / TCP 192.168.192.179:51245 > 20.189.173.13:https A / Raw
----------------------------------------
488.3654	Eroare: main thread is not in main loop	0.00%
20	192.168.192.179:50174	52.30.201.170:443	6	297	Ether / IP / TCP 192.168.192.179:50174 > 52.30.201.170:https PA / Raw
----------------------------------------
492.2635	Eroare: main thread is not in main loop	0.00%
20	52.30.201.170:443	192.168.192.179:50174	6	78	Ether / IP / TCP 52.30.201.170:https > 192.168.192.179:50174 PA / Raw
----------------------------------------
504.0967	Eroare: main thread is not in main loop	0.00%
20	192.168.192.179:51138	140.82.114.25:443	6	55	Ether / IP / TCP 192.168.192.179:51138 > 140.82.114.25:https A / Raw
----------------------------------------
518.7771	Eroare: main thread is not in main loop	0.00%
20	140.82.114.25:443	192.168.192.179:51138	6	80	Ether / IP / TCP 140.82.114.25:https > 192.168.192.179:51138 PA / Raw
----------------------------------------
520.3599	Eroare: main thread is not in main loop	0.00%
20	192.168.192.179:50174	52.30.201.170:443	6	297	Ether / IP / TCP 192.168.192.179:50174 > 52.30.201.170:https PA / Raw
----------------------------------------
532.4865	Eroare: main thread is not in main loop	0.00%
20	192.168.192.179:51245	20.189.173.13:443	6	55	Ether / IP / TCP 192.168.192.179:51245 > 20.189.173.13:https A / Raw
----------------------------------------
536.3604	Eroare: main thread is not in main loop	0.00%
20	192.168.192.179:50174	52.30.201.170:443	6	296	Ether / IP / TCP 192.168.192.179:50174 > 52.30.201.170:https PA / Raw
----------------------------------------
552.3573	Eroare: main thread is not in main loop	0.00%
20	192.168.192.179:50174	52.30.201.170:443	6	296	Ether / IP / TCP 192.168.192.179:50174 > 52.30.201.170:https PA / Raw
----------------------------------------
563.9937	Eroare: main thread is not in main loop	0.00%
20	192.168.192.179:51138	140.82.114.25:443	6	55	Ether / IP / TCP 192.168.192.179:51138 > 140.82.114.25:https A / Raw
----------------------------------------
565.6192	Eroare: main thread is not in main loop	0.00%
20	20.189.173.13:443	192.168.192.179:51245	6	54	Ether / IP / TCP 20.189.173.13:https > 192.168.192.179:51245 RA
----------------------------------------
568.3579	Eroare: main thread is not in main loop	0.00%
20	192.168.192.179:50174	52.30.201.170:443	6	297	Ether / IP / TCP 192.168.192.179:50174 > 52.30.201.170:https PA / Raw
----------------------------------------
578.9033	Eroare: main thread is not in main loop	0.00%
20	140.82.114.25:443	192.168.192.179:51138	6	95	Ether / IP / TCP 140.82.114.25:https > 192.168.192.179:51138 PA / Raw
----------------------------------------
580.1746	Eroare: main thread is not in main loop	0.00%
20	140.82.114.25:443	192.168.192.179:51138	6	78	Ether / IP / TCP 140.82.114.25:https > 192.168.192.179:51138 PA / Raw
----------------------------------------
584.3637	Eroare: main thread is not in main loop	0.00%
20	192.168.192.179:50174	52.30.201.170:443	6	297	Ether / IP / TCP 192.168.192.179:50174 > 52.30.201.170:https PA / Raw
----------------------------------------
594.6263	Eroare: main thread is not in main loop	0.00%
20	192.168.192.179:56617	192.168.192.165:53	17	92	Ether / IP / UDP / DNS Qry b'mobile.events.data.microsoft.com.'
----------------------------------------
595.7779	Eroare: main thread is not in main loop	0.00%
20	192.168.192.179:51297	13.69.239.72:443	6	66	Ether / IP / TCP 192.168.192.179:51297 > 13.69.239.72:https S
----------------------------------------
597.7880	Eroare: main thread is not in main loop	0.00%
20	192.168.192.179:51297	13.69.239.72:443	6	66	Ether / IP / TCP 192.168.192.179:51297 > 13.69.239.72:https S
----------------------------------------
599.8627	Eroare: main thread is not in main loop	0.00%
20	192.168.192.179:50629	92.123.103.67:443	6	54	Ether / IP / TCP 192.168.192.179:50629 > 92.123.103.67:https FA
----------------------------------------
601.0728	Eroare: main thread is not in main loop	0.00%
20	192.168.192.179:64224	192.168.192.165:53	17	85	Ether / IP / UDP / DNS Qry b'login.microsoftonline.com.'
----------------------------------------
602.2218	Eroare: main thread is not in main loop	0.00%
20	52.97.160.2:443	192.168.192.179:51305	6	66	Ether / IP / TCP 52.97.160.2:https > 192.168.192.179:51305 SA
----------------------------------------
603.7532	Eroare: main thread is not in main loop	0.00%
20	192.168.192.179:51308	20.190.147.7:443	6	54	Ether / IP / TCP 192.168.192.179:51308 > 20.190.147.7:https RA
----------------------------------------
604.8571	Eroare: main thread is not in main loop	0.00%
20	13.107.213.254:443	192.168.192.179:51312	6	1354	Ether / IP / TCP 13.107.213.254:https > 192.168.192.179:51312 A / Raw
----------------------------------------
605.9364	Eroare: main thread is not in main loop	0.00%
20	34.36.133.15:443	192.168.192.179:51314	6	93	Ether / IP / TCP 34.36.133.15:https > 192.168.192.179:51314 PA / Raw
----------------------------------------
607.0572	Eroare: main thread is not in main loop	0.00%
20	185.199.109.133:443	192.168.192.179:51318	6	54	Ether / IP / TCP 185.199.109.133:https > 192.168.192.179:51318 A
----------------------------------------
608.2363	Eroare: main thread is not in main loop	0.00%
20	185.199.109.133:443	192.168.192.179:51318	6	1354	Ether / IP / TCP 185.199.109.133:https > 192.168.192.179:51318 PA / Raw
----------------------------------------
609.4352	Eroare: main thread is not in main loop	0.00%
20	185.199.109.133:443	192.168.192.179:51318	6	1354	Ether / IP / TCP 185.199.109.133:https > 192.168.192.179:51318 PA / Raw
----------------------------------------
610.5828	Eroare: main thread is not in main loop	0.00%
20	185.199.109.133:443	192.168.192.179:51318	6	1354	Ether / IP / TCP 185.199.109.133:https > 192.168.192.179:51318 PA / Raw
----------------------------------------
611.6912	Eroare: main thread is not in main loop	0.00%
20	185.199.109.133:443	192.168.192.179:51318	6	1354	Ether / IP / TCP 185.199.109.133:https > 192.168.192.179:51318 A / Raw
----------------------------------------
612.8219	Eroare: main thread is not in main loop	0.00%
20	185.199.109.133:443	192.168.192.179:51318	6	1354	Ether / IP / TCP 185.199.109.133:https > 192.168.192.179:51318 A / Raw
----------------------------------------
613.9075	Eroare: main thread is not in main loop	0.00%
20	185.199.109.133:443	192.168.192.179:51318	6	1354	Ether / IP / TCP 185.199.109.133:https > 192.168.192.179:51318 A / Raw
----------------------------------------
615.0639	Eroare: main thread is not in main loop	0.00%
20	185.199.109.133:443	192.168.192.179:51318	6	1354	Ether / IP / TCP 185.199.109.133:https > 192.168.192.179:51318 A / Raw
----------------------------------------
616.1821	Eroare: main thread is not in main loop	0.00%
20	192.168.192.179:51318	185.199.109.133:443	6	102	Ether / IP / TCP 192.168.192.179:51318 > 185.199.109.133:https PA / Raw
----------------------------------------
617.3030	Eroare: main thread is not in main loop	0.00%
20	185.199.109.133:443	192.168.192.179:51318	6	1354	Ether / IP / TCP 185.199.109.133:https > 192.168.192.179:51318 A / Raw
----------------------------------------
618.4544	Eroare: main thread is not in main loop	0.00%
20	192.168.192.179:51082	192.168.192.165:53	17	92	Ether / IP / UDP / DNS Qry b'mobile.events.data.microsoft.com.'
----------------------------------------
619.5159	Eroare: main thread is not in main loop	0.00%
20	185.199.109.133:443	192.168.192.179:51318	6	1354	Ether / IP / TCP 185.199.109.133:https > 192.168.192.179:51318 A / Raw
----------------------------------------
620.7439	Eroare: main thread is not in main loop	0.00%
20	192.168.192.179:62307	192.168.192.165:53	17	78	Ether / IP / UDP / DNS Qry b'wdcp.microsoft.com.'
----------------------------------------
621.8200	Eroare: main thread is not in main loop	0.00%
20	185.199.109.133:443	192.168.192.179:51318	6	1354	Ether / IP / TCP 185.199.109.133:https > 192.168.192.179:51318 A / Raw
----------------------------------------
622.9001	Eroare: main thread is not in main loop	0.00%
20	185.199.109.133:443	192.168.192.179:51318	6	1354	Ether / IP / TCP 185.199.109.133:https > 192.168.192.179:51318 PA / Raw
----------------------------------------
624.0203	Eroare: main thread is not in main loop	0.00%
20	185.199.109.133:443	192.168.192.179:51318	6	1354	Ether / IP / TCP 185.199.109.133:https > 192.168.192.179:51318 A / Raw
----------------------------------------
625.1351	Eroare: main thread is not in main loop	0.00%
20	185.199.109.133:443	192.168.192.179:51318	6	1354	Ether / IP / TCP 185.199.109.133:https > 192.168.192.179:51318 A / Raw
----------------------------------------
626.2106	Eroare: main thread is not in main loop	0.00%
20	192.168.192.179:51299	92.123.103.67:443	6	54	Ether / IP / TCP 192.168.192.179:51299 > 92.123.103.67:https FA
----------------------------------------
627.3687	Eroare: main thread is not in main loop	0.00%
20	185.199.109.133:443	192.168.192.179:51318	6	1354	Ether / IP / TCP 185.199.109.133:https > 192.168.192.179:51318 A / Raw
----------------------------------------
628.5971	Eroare: main thread is not in main loop	0.00%
20	185.199.109.133:443	192.168.192.179:51318	6	1354	Ether / IP / TCP 185.199.109.133:https > 192.168.192.179:51318 A / Raw
----------------------------------------
629.7781	Eroare: main thread is not in main loop	0.00%
20	185.199.109.133:443	192.168.192.179:51318	6	1354	Ether / IP / TCP 185.199.109.133:https > 192.168.192.179:51318 PA / Raw
----------------------------------------
630.9022	Eroare: main thread is not in main loop	0.00%
20	185.199.109.133:443	192.168.192.179:51318	6	1354	Ether / IP / TCP 185.199.109.133:https > 192.168.192.179:51318 PA / Raw
----------------------------------------
632.0832	Eroare: main thread is not in main loop	0.00%
20	185.199.109.133:443	192.168.192.179:51318	6	1354	Ether / IP / TCP 185.199.109.133:https > 192.168.192.179:51318 A / Raw
----------------------------------------
633.1766	Eroare: main thread is not in main loop	0.00%
20	185.199.109.133:443	192.168.192.179:51318	6	1354	Ether / IP / TCP 185.199.109.133:https > 192.168.192.179:51318 A / Raw
----------------------------------------
634.3025	Eroare: main thread is not in main loop	0.00%
20	185.199.109.133:443	192.168.192.179:51318	6	1354	Ether / IP / TCP 185.199.109.133:https > 192.168.192.179:51318 PA / Raw
----------------------------------------
635.4320	Eroare: main thread is not in main loop	0.00%
20	185.199.109.133:443	192.168.192.179:51318	6	1354	Ether / IP / TCP 185.199.109.133:https > 192.168.192.179:51318 PA / Raw
----------------------------------------
636.5557	Eroare: main thread is not in main loop	0.00%
20	185.199.109.133:443	192.168.192.179:51318	6	1354	Ether / IP / TCP 185.199.109.133:https > 192.168.192.179:51318 A / Raw
----------------------------------------
637.6392	Eroare: main thread is not in main loop	0.00%
20	185.199.109.133:443	192.168.192.179:51318	6	1354	Ether / IP / TCP 185.199.109.133:https > 192.168.192.179:51318 PA / Raw
----------------------------------------
638.8135	Eroare: main thread is not in main loop	0.00%
20	192.168.192.179:51318	185.199.109.133:443	6	54	Ether / IP / TCP 192.168.192.179:51318 > 185.199.109.133:https A
----------------------------------------
640.0603	Eroare: main thread is not in main loop	0.00%
20	185.199.109.133:443	192.168.192.179:51318	6	1354	Ether / IP / TCP 185.199.109.133:https > 192.168.192.179:51318 PA / Raw
----------------------------------------
641.3295	Eroare: main thread is not in main loop	0.00%
20	185.199.109.133:443	192.168.192.179:51318	6	1354	Ether / IP / TCP 185.199.109.133:https > 192.168.192.179:51318 PA / Raw
----------------------------------------
642.4959	Eroare: main thread is not in main loop	0.00%
20	185.199.109.133:443	192.168.192.179:51318	6	1354	Ether / IP / TCP 185.199.109.133:https > 192.168.192.179:51318 PA / Raw
----------------------------------------
643.9414	Eroare: main thread is not in main loop	0.00%
20	185.199.109.133:443	192.168.192.179:51318	6	1354	Ether / IP / TCP 185.199.109.133:https > 192.168.192.179:51318 A / Raw
----------------------------------------
645.2112	Eroare: main thread is not in main loop	0.00%
20	185.199.109.133:443	192.168.192.179:51318	6	1354	Ether / IP / TCP 185.199.109.133:https > 192.168.192.179:51318 PA / Raw
----------------------------------------
646.3957	Eroare: main thread is not in main loop	0.00%
20	185.199.109.133:443	192.168.192.179:51318	6	1354	Ether / IP / TCP 185.199.109.133:https > 192.168.192.179:51318 A / Raw
----------------------------------------
647.5463	Eroare: main thread is not in main loop	0.00%
20	185.199.109.133:443	192.168.192.179:51318	6	1354	Ether / IP / TCP 185.199.109.133:https > 192.168.192.179:51318 PA / Raw
----------------------------------------
648.7922	Eroare: main thread is not in main loop	0.00%
20	192.168.192.179:51389	104.18.22.152:443	6	66	Ether / IP / TCP 192.168.192.179:51389 > 104.18.22.152:https S
----------------------------------------
650.0333	Eroare: main thread is not in main loop	0.00%
20	185.199.109.133:443	192.168.192.179:51318	6	1354	Ether / IP / TCP 185.199.109.133:https > 192.168.192.179:51318 A / Raw
----------------------------------------
651.1715	Eroare: main thread is not in main loop	0.00%
20	185.199.109.133:443	192.168.192.179:51318	6	1354	Ether / IP / TCP 185.199.109.133:https > 192.168.192.179:51318 PA / Raw
----------------------------------------
652.3557	Eroare: main thread is not in main loop	0.00%
20	192.168.192.179:51316	140.82.121.3:443	6	78	Ether / IP / TCP 192.168.192.179:51316 > 140.82.121.3:https FPA / Raw
----------------------------------------
653.5283	Eroare: main thread is not in main loop	0.00%
20	185.199.109.133:443	192.168.192.179:51318	6	1354	Ether / IP / TCP 185.199.109.133:https > 192.168.192.179:51318 A / Raw
----------------------------------------
654.7126	Eroare: main thread is not in main loop	0.00%
20	185.199.109.133:443	192.168.192.179:51318	6	1354	Ether / IP / TCP 185.199.109.133:https > 192.168.192.179:51318 A / Raw
----------------------------------------
655.8968	Eroare: main thread is not in main loop	0.00%
20	192.168.192.179:54317	192.168.192.165:53	17	79	Ether / IP / UDP / DNS Qry b'main.vscode-cdn.net.'
----------------------------------------
657.0685	Eroare: main thread is not in main loop	0.00%
20	185.199.109.133:443	192.168.192.179:51318	6	1354	Ether / IP / TCP 185.199.109.133:https > 192.168.192.179:51318 PA / Raw
----------------------------------------
658.2731	Eroare: main thread is not in main loop	0.00%
20	185.199.109.133:443	192.168.192.179:51318	6	1354	Ether / IP / TCP 185.199.109.133:https > 192.168.192.179:51318 PA / Raw
----------------------------------------
659.4689	Eroare: main thread is not in main loop	0.00%
20	192.168.192.179:51318	185.199.109.133:443	6	102	Ether / IP / TCP 192.168.192.179:51318 > 185.199.109.133:https PA / Raw
----------------------------------------
660.6933	Eroare: main thread is not in main loop	0.00%
20	192.168.192.179:50174	52.30.201.170:443	6	54	Ether / IP / TCP 192.168.192.179:50174 > 52.30.201.170:https A
----------------------------------------
661.9209	Eroare: main thread is not in main loop	0.00%
20	185.199.109.133:443	192.168.192.179:51318	6	1354	Ether / IP / TCP 185.199.109.133:https > 192.168.192.179:51318 A / Raw
----------------------------------------
663.0518	Eroare: main thread is not in main loop	0.00%
20	185.199.109.133:443	192.168.192.179:51318	6	1354	Ether / IP / TCP 185.199.109.133:https > 192.168.192.179:51318 PA / Raw
----------------------------------------
664.2158	Eroare: main thread is not in main loop	0.00%
20	185.199.109.133:443	192.168.192.179:51318	6	1354	Ether / IP / TCP 185.199.109.133:https > 192.168.192.179:51318 A / Raw
----------------------------------------
665.3712	Eroare: main thread is not in main loop	0.00%
20	185.199.109.133:443	192.168.192.179:51318	6	1354	Ether / IP / TCP 185.199.109.133:https > 192.168.192.179:51318 A / Raw
----------------------------------------
666.4983	Eroare: main thread is not in main loop	0.00%
20	185.199.109.133:443	192.168.192.179:51318	6	1354	Ether / IP / TCP 185.199.109.133:https > 192.168.192.179:51318 PA / Raw
----------------------------------------
667.7351	Eroare: main thread is not in main loop	0.00%
20	185.199.109.133:443	192.168.192.179:51318	6	1354	Ether / IP / TCP 185.199.109.133:https > 192.168.192.179:51318 PA / Raw
----------------------------------------
668.8979	Eroare: main thread is not in main loop	0.00%
20	185.199.109.133:443	192.168.192.179:51318	6	1354	Ether / IP / TCP 185.199.109.133:https > 192.168.192.179:51318 A / Raw
----------------------------------------
670.3372	Eroare: main thread is not in main loop	0.00%
20	185.199.109.133:443	192.168.192.179:51318	6	1354	Ether / IP / TCP 185.199.109.133:https > 192.168.192.179:51318 PA / Raw
----------------------------------------
671.5355	Eroare: main thread is not in main loop	0.00%
20	185.199.109.133:443	192.168.192.179:51318	6	1354	Ether / IP / TCP 185.199.109.133:https > 192.168.192.179:51318 A / Raw
----------------------------------------
672.8121	Eroare: main thread is not in main loop	0.00%
20	185.199.109.133:443	192.168.192.179:51318	6	1354	Ether / IP / TCP 185.199.109.133:https > 192.168.192.179:51318 A / Raw
----------------------------------------
674.0371	Eroare: main thread is not in main loop	0.00%
20	185.199.109.133:443	192.168.192.179:51318	6	1354	Ether / IP / TCP 185.199.109.133:https > 192.168.192.179:51318 PA / Raw
----------------------------------------
675.2245	Eroare: main thread is not in main loop	0.00%
