3.8903	Atac: NORMAL	85.75%
0	192.168.180.179:60418	40.101.70.18:443	6	55	Ether / IP / TCP 192.168.180.179:60418 > 40.101.70.18:https A / Raw
----------------------------------------
13.6483	Atac: NORMAL	85.75%
1	140.82.114.25:443	192.168.180.179:60690	6	80	Ether / IP / TCP 140.82.114.25:https > 192.168.180.179:60690 PA / Raw
----------------------------------------
13.7145	Atac: NORMAL	85.75%
2	192.168.180.179:60690	140.82.114.25:443	6	84	Ether / IP / TCP 192.168.180.179:60690 > 140.82.114.25:https PA / Raw
----------------------------------------
13.8536	Atac: NORMAL	85.75%
3	140.82.114.25:443	192.168.180.179:60690	6	54	Ether / IP / TCP 140.82.114.25:https > 192.168.180.179:60690 A
----------------------------------------
14.8771	Atac: NORMAL	85.75%
4	40.101.70.18:443	192.168.180.179:60418	6	54	Ether / IP / TCP 40.101.70.18:https > 192.168.180.179:60418 RA
----------------------------------------
17.0301	Atac: NORMAL	85.75%
5	52.97.128.2:443	192.168.180.179:60491	6	54	Ether / IP / TCP 52.97.128.2:https > 192.168.180.179:60491 RA
----------------------------------------
18.0038	Atac: NORMAL	85.75%
6	192.168.180.179:59314	108.177.127.188:5228	6	55	Ether / IP / TCP 192.168.180.179:59314 > 108.177.127.188:5228 A / Raw
----------------------------------------
18.1553	Atac: NORMAL	85.75%
7	108.177.127.188:5228	192.168.180.179:59314	6	66	Ether / IP / TCP 108.177.127.188:5228 > 192.168.180.179:59314 A
----------------------------------------
18.9766	Atac: NORMAL	85.75%
8	140.82.112.25:443	192.168.180.179:60797	6	79	Ether / IP / TCP 140.82.112.25:https > 192.168.180.179:60797 PA / Raw
----------------------------------------
19.0439	Atac: NORMAL	85.75%
9	192.168.180.179:60797	140.82.112.25:443	6	83	Ether / IP / TCP 192.168.180.179:60797 > 140.82.112.25:https PA / Raw
----------------------------------------
19.1797	Atac: NORMAL	85.75%
10	140.82.112.25:443	192.168.180.179:60797	6	54	Ether / IP / TCP 140.82.112.25:https > 192.168.180.179:60797 A
----------------------------------------
28.5669	Atac: NORMAL	85.75%
11	192.168.180.179:60950	34.36.133.15:443	6	55	Ether / IP / TCP 192.168.180.179:60950 > 34.36.133.15:https A / Raw
----------------------------------------
28.7075	Atac: NORMAL	85.75%
12	34.36.133.15:443	192.168.180.179:60950	6	66	Ether / IP / TCP 34.36.133.15:https > 192.168.180.179:60950 A
----------------------------------------
28.8046	Atac: NORMAL	85.75%
13	140.82.121.4:443	192.168.180.179:60951	6	93	Ether / IP / TCP 140.82.121.4:https > 192.168.180.179:60951 PA / Raw
----------------------------------------
28.8701	Atac: NORMAL	85.75%
14	140.82.121.4:443	192.168.180.179:60951	6	78	Ether / IP / TCP 140.82.121.4:https > 192.168.180.179:60951 PA / Raw
----------------------------------------
28.9360	Atac: NORMAL	85.75%
15	140.82.121.4:443	192.168.180.179:60951	6	54	Ether / IP / TCP 140.82.121.4:https > 192.168.180.179:60951 FA
----------------------------------------
29.0010	Atac: NORMAL	85.75%
15	192.168.180.179:60951	140.82.121.4:443	6	54	Ether / IP / TCP 192.168.180.179:60951 > 140.82.121.4:https A
----------------------------------------
29.0670	Atac: NORMAL	85.75%
17	192.168.180.179:60951	140.82.121.4:443	6	54	Ether / IP / TCP 192.168.180.179:60951 > 140.82.121.4:https A
----------------------------------------
29.1330	Atac: NORMAL	85.75%
17	192.168.180.179:60951	140.82.121.4:443	6	78	Ether / IP / TCP 192.168.180.179:60951 > 140.82.121.4:https PA / Raw
----------------------------------------
29.1990	Atac: NORMAL	85.75%
19	192.168.180.179:60951	140.82.121.4:443	6	54	Ether / IP / TCP 192.168.180.179:60951 > 140.82.121.4:https FA
----------------------------------------
29.2771	Atac: NORMAL	85.75%
20	140.82.121.4:443	192.168.180.179:60951	6	54	Ether / IP / TCP 140.82.121.4:https > 192.168.180.179:60951 R
----------------------------------------
29.4440	Atac: NORMAL	85.75%
21	192.168.180.179:60952	185.199.110.133:443	6	55	Ether / IP / TCP 192.168.180.179:60952 > 185.199.110.133:https A / Raw
----------------------------------------
29.5213	Atac: NORMAL	85.75%
22	185.199.110.133:443	192.168.180.179:60952	6	66	Ether / IP / TCP 185.199.110.133:https > 192.168.180.179:60952 A
----------------------------------------
37.7720	Atac: NORMAL	85.75%
23	192.168.180.179:60949	13.107.246.44:443	6	55	Ether / IP / TCP 192.168.180.179:60949 > 13.107.246.44:https A / Raw
----------------------------------------
37.8498	Atac: NORMAL	85.75%
24	13.107.246.44:443	192.168.180.179:60949	6	66	Ether / IP / TCP 13.107.246.44:https > 192.168.180.179:60949 A
----------------------------------------
43.9011	Atac: NORMAL	85.75%
25	192.168.180.179:60946	52.168.112.67:443	6	55	Ether / IP / TCP 192.168.180.179:60946 > 52.168.112.67:https A / Raw
----------------------------------------
44.1651	Atac: NORMAL	85.75%
26	52.168.112.67:443	192.168.180.179:60946	6	66	Ether / IP / TCP 52.168.112.67:https > 192.168.180.179:60946 A
----------------------------------------
51.6828	Eroare: main thread is not in main loop	0.00%
27	192.168.180.179:58499	192.168.180.22:53	17	75	Ether / IP / UDP / DNS Qry b'ssl.gstatic.com.'
----------------------------------------
52.8081	Eroare: main thread is not in main loop	0.00%
27	192.168.180.179:54369	142.251.140.35:443	17	74	Ether / IP / UDP 192.168.180.179:54369 > 142.251.140.35:https / Raw
----------------------------------------
58.7173	Eroare: main thread is not in main loop	0.00%
27	192.168.180.179:60950	34.36.133.15:443	6	55	Ether / IP / TCP 192.168.180.179:60950 > 34.36.133.15:https A / Raw
----------------------------------------
63.1587	Eroare: main thread is not in main loop	0.00%
27	192.168.180.179:59314	108.177.127.188:5228	6	55	Ether / IP / TCP 192.168.180.179:59314 > 108.177.127.188:5228 A / Raw
----------------------------------------
64.4411	Eroare: main thread is not in main loop	0.00%
27	140.82.112.25:443	192.168.180.179:60797	6	66	Ether / IP / TCP 140.82.112.25:https > 192.168.180.179:60797 A
----------------------------------------
71.2047	Eroare: main thread is not in main loop	0.00%
27	192.168.180.179:62233	192.168.180.22:53	17	74	Ether / IP / UDP / DNS Qry b'api.github.com.'
----------------------------------------
72.7476	Eroare: main thread is not in main loop	0.00%
27	192.168.180.179:52018	192.168.180.22:53	17	87	Ether / IP / UDP / DNS Qry b'roaming.officeapps.live.com.'
----------------------------------------
77.7846	Eroare: main thread is not in main loop	0.00%
27	192.168.180.179:54369	142.251.140.35:443	17	145	Ether / IP / UDP 192.168.180.179:54369 > 142.251.140.35:https / Raw
----------------------------------------
78.9155	Eroare: main thread is not in main loop	0.00%
27	140.82.112.25:443	192.168.180.179:60797	6	54	Ether / IP / TCP 140.82.112.25:https > 192.168.180.179:60797 A
----------------------------------------
82.5284	Eroare: main thread is not in main loop	0.00%
27	13.107.246.44:443	192.168.180.179:60949	6	93	Ether / IP / TCP 13.107.246.44:https > 192.168.180.179:60949 PA / Raw
----------------------------------------
83.7954	Eroare: main thread is not in main loop	0.00%
27	13.107.246.44:443	192.168.180.179:60949	6	78	Ether / IP / TCP 13.107.246.44:https > 192.168.180.179:60949 FPA / Raw
----------------------------------------
84.9215	Eroare: main thread is not in main loop	0.00%
27	13.107.246.44:443	192.168.180.179:60949	6	78	Ether / IP / TCP 13.107.246.44:https > 192.168.180.179:60949 FPA / Raw
----------------------------------------
87.5066	Eroare: main thread is not in main loop	0.00%
27	192.168.180.179:57142	20.199.120.85:443	6	155	Ether / IP / TCP 192.168.180.179:57142 > 20.199.120.85:https PA / Raw
----------------------------------------
88.6083	Eroare: main thread is not in main loop	0.00%
27	34.36.133.15:443	192.168.180.179:60950	6	54	Ether / IP / TCP 34.36.133.15:https > 192.168.180.179:60950 A
----------------------------------------
102.1376	Eroare: main thread is not in main loop	0.00%
27	140.82.121.5:443	192.168.180.179:60953	6	93	Ether / IP / TCP 140.82.121.5:https > 192.168.180.179:60953 PA / Raw
----------------------------------------
107.9049	Eroare: main thread is not in main loop	0.00%
27	192.168.180.179:51713	142.251.140.35:443	17	1292	Ether / IP / UDP 192.168.180.179:51713 > 142.251.140.35:https / Raw
----------------------------------------
118.8077	Eroare: main thread is not in main loop	0.00%
27	192.168.180.179:60690	140.82.114.25:443	6	55	Ether / IP / TCP 192.168.180.179:60690 > 140.82.114.25:https A / Raw
----------------------------------------
