8.4180	Atac: NORMAL	85.75%
0	192.168.180.179:57142	20.199.120.85:443	6	55	Ether / IP / TCP 192.168.180.179:57142 > 20.199.120.85:https A / Raw
----------------------------------------
8.6510	Atac: NORMAL	85.75%
1	20.199.120.85:443	192.168.180.179:57142	6	66	Ether / IP / TCP 20.199.120.85:https > 192.168.180.179:57142 A
----------------------------------------
10.4720	Atac: NORMAL	85.75%
2	192.168.180.179:58930	20.42.65.88:443	6	172	Ether / IP / TCP 192.168.180.179:58930 > 20.42.65.88:https PA / Raw
----------------------------------------
10.5420	Atac: NORMAL	85.75%
2	192.168.180.179:58930	20.42.65.88:443	6	93	Ether / IP / TCP 192.168.180.179:58930 > 20.42.65.88:https PA / Raw
----------------------------------------
10.6120	Atac: NORMAL	85.75%
4	192.168.180.179:58930	20.42.65.88:443	6	2327	Ether / IP / TCP 192.168.180.179:58930 > 20.42.65.88:https PA / Raw
----------------------------------------
10.7823	Atac: NORMAL	85.75%
5	20.42.65.88:443	192.168.180.179:58930	6	54	Ether / IP / TCP 20.42.65.88:https > 192.168.180.179:58930 A
----------------------------------------
10.8543	Atac: NORMAL	85.75%
6	20.42.65.88:443	192.168.180.179:58930	6	93	Ether / IP / TCP 20.42.65.88:https > 192.168.180.179:58930 PA / Raw
----------------------------------------
10.9293	Atac: NORMAL	85.75%
7	20.42.65.88:443	192.168.180.179:58930	6	54	Ether / IP / TCP 20.42.65.88:https > 192.168.180.179:58930 A
----------------------------------------
10.9983	Atac: NORMAL	85.75%
7	20.42.65.88:443	192.168.180.179:58930	6	54	Ether / IP / TCP 20.42.65.88:https > 192.168.180.179:58930 A
----------------------------------------
11.0673	Atac: NORMAL	85.75%
9	192.168.180.179:58930	20.42.65.88:443	6	54	Ether / IP / TCP 192.168.180.179:58930 > 20.42.65.88:https A
----------------------------------------
11.5792	Atac: NORMAL	85.75%
10	192.168.180.179:58930	20.42.65.88:443	6	89	Ether / IP / TCP 192.168.180.179:58930 > 20.42.65.88:https PA / Raw
----------------------------------------
11.6483	Atac: NORMAL	85.75%
10	20.42.65.88:443	192.168.180.179:58930	6	54	Ether / IP / TCP 20.42.65.88:https > 192.168.180.179:58930 A
----------------------------------------
11.9300	Atac: NORMAL	85.75%
12	20.42.65.88:443	192.168.180.179:58930	6	66	Ether / IP / TCP 20.42.65.88:https > 192.168.180.179:58930 A
----------------------------------------
22.0602	Eroare: main thread is not in main loop	0.00%
13	192.168.180.179:49940	192.168.180.22:53	17	92	Ether / IP / UDP / DNS Qry b'mobile.events.data.microsoft.com.'
----------------------------------------
23.1784	Eroare: main thread is not in main loop	0.00%
13	20.189.173.8:443	192.168.180.179:58936	6	1354	Ether / IP / TCP 20.189.173.8:https > 192.168.180.179:58936 A / Raw
----------------------------------------
24.4071	Eroare: main thread is not in main loop	0.00%
13	20.189.173.8:443	192.168.180.179:58937	6	54	Ether / IP / TCP 20.189.173.8:https > 192.168.180.179:58937 A
----------------------------------------
26.2751	Eroare: main thread is not in main loop	0.00%
13	192.168.180.179:58938	20.189.173.8:443	6	66	Ether / IP / TCP 192.168.180.179:58938 > 20.189.173.8:https S
----------------------------------------
27.4512	Eroare: main thread is not in main loop	0.00%
13	20.189.173.8:443	192.168.180.179:58938	6	54	Ether / IP / TCP 20.189.173.8:https > 192.168.180.179:58938 A
----------------------------------------
28.5787	Eroare: main thread is not in main loop	0.00%
13	140.82.121.6:443	192.168.180.179:58939	6	1354	Ether / IP / TCP 140.82.121.6:https > 192.168.180.179:58939 A / Raw
----------------------------------------
29.7424	Eroare: main thread is not in main loop	0.00%
13	20.250.119.64:443	192.168.180.179:58940	6	54	Ether / IP / TCP 20.250.119.64:https > 192.168.180.179:58940 A
----------------------------------------
31.1256	Eroare: main thread is not in main loop	0.00%
13	20.189.173.8:443	192.168.180.179:58941	6	54	Ether / IP / TCP 20.189.173.8:https > 192.168.180.179:58941 A
----------------------------------------
35.1216	Eroare: main thread is not in main loop	0.00%
13	192.168.180.179:58884	104.18.1.22:443	6	55	Ether / IP / TCP 192.168.180.179:58884 > 104.18.1.22:https A / Raw
----------------------------------------
38.8640	Eroare: main thread is not in main loop	0.00%
13	192.168.180.179:63869	192.168.180.22:53	17	92	Ether / IP / UDP / DNS Qry b'mobile.events.data.microsoft.com.'
----------------------------------------
40.7951	Eroare: main thread is not in main loop	0.00%
13	192.168.180.179:62692	192.168.180.22:53	17	74	Ether / IP / UDP / DNS Qry b'ecs.office.com.'
----------------------------------------
42.1299	Eroare: main thread is not in main loop	0.00%
13	192.168.180.179:58944	52.168.117.168:443	6	66	Ether / IP / TCP 192.168.180.179:58944 > 52.168.117.168:https S
----------------------------------------
43.2760	Eroare: main thread is not in main loop	0.00%
13	140.82.113.21:443	192.168.180.179:58945	6	1354	Ether / IP / TCP 140.82.113.21:https > 192.168.180.179:58945 A / Raw
----------------------------------------
44.4002	Eroare: main thread is not in main loop	0.00%
13	52.168.117.168:443	192.168.180.179:58946	6	66	Ether / IP / TCP 52.168.117.168:https > 192.168.180.179:58946 SA
----------------------------------------
49.0604	Eroare: main thread is not in main loop	0.00%
13	192.168.180.179:58943	52.123.128.14:443	6	677	Ether / IP / TCP 192.168.180.179:58943 > 52.123.128.14:https PA / Raw
----------------------------------------
51.3786	Eroare: main thread is not in main loop	0.00%
13	192.168.180.179:60344	192.168.180.22:53	17	92	Ether / IP / UDP / DNS Qry b'mobile.events.data.microsoft.com.'
----------------------------------------
56.3570	Eroare: main thread is not in main loop	0.00%
13	192.168.180.179:58935	35.186.224.24:443	6	54	Ether / IP / TCP 192.168.180.179:58935 > 35.186.224.24:https FA
----------------------------------------
58.7129	Eroare: main thread is not in main loop	0.00%
13	140.82.121.6:443	192.168.180.179:58939	6	93	Ether / IP / TCP 140.82.121.6:https > 192.168.180.179:58939 PA / Raw
----------------------------------------
60.5878	Eroare: main thread is not in main loop	0.00%
13	192.168.180.179:51387	192.168.180.22:53	17	92	Ether / IP / UDP / DNS Qry b'mobile.events.data.microsoft.com.'
----------------------------------------
61.7710	Eroare: main thread is not in main loop	0.00%
13	192.168.180.179:58947	13.69.109.130:443	6	66	Ether / IP / TCP 192.168.180.179:58947 > 13.69.109.130:https S
----------------------------------------
63.7782	Eroare: main thread is not in main loop	0.00%
13	192.168.180.179:58947	13.69.109.130:443	6	66	Ether / IP / TCP 192.168.180.179:58947 > 13.69.109.130:https S
----------------------------------------
65.0575	Eroare: main thread is not in main loop	0.00%
13	20.42.65.88:443	192.168.180.179:58930	6	54	Ether / IP / TCP 20.42.65.88:https > 192.168.180.179:58930 A
----------------------------------------
67.7800	Eroare: main thread is not in main loop	0.00%
13	192.168.180.179:58947	13.69.109.130:443	6	66	Ether / IP / TCP 192.168.180.179:58947 > 13.69.109.130:https S
----------------------------------------
71.8910	Eroare: main thread is not in main loop	0.00%
13	192.168.180.179:58948	13.69.109.130:443	6	66	Ether / IP / TCP 192.168.180.179:58948 > 13.69.109.130:https S
----------------------------------------
75.7840	Eroare: main thread is not in main loop	0.00%
13	192.168.180.179:58947	13.69.109.130:443	6	66	Ether / IP / TCP 192.168.180.179:58947 > 13.69.109.130:https S
----------------------------------------
79.8919	Eroare: main thread is not in main loop	0.00%
13	192.168.180.179:58948	13.69.109.130:443	6	66	Ether / IP / TCP 192.168.180.179:58948 > 13.69.109.130:https S
----------------------------------------
88.8348	Eroare: main thread is not in main loop	0.00%
13	192.168.180.179:58835	140.82.113.26:443	6	55	Ether / IP / TCP 192.168.180.179:58835 > 140.82.113.26:https A / Raw
----------------------------------------
90.1716	Eroare: main thread is not in main loop	0.00%
13	192.168.180.179:59008	13.69.109.130:443	6	66	Ether / IP / TCP 192.168.180.179:59008 > 13.69.109.130:https S
----------------------------------------
92.1777	Eroare: main thread is not in main loop	0.00%
13	192.168.180.179:59008	13.69.109.130:443	6	66	Ether / IP / TCP 192.168.180.179:59008 > 13.69.109.130:https S
----------------------------------------
96.1905	Eroare: main thread is not in main loop	0.00%
13	192.168.180.179:59008	13.69.109.130:443	6	66	Ether / IP / TCP 192.168.180.179:59008 > 13.69.109.130:https S
----------------------------------------
103.8732	Eroare: main thread is not in main loop	0.00%
13	140.82.113.26:443	192.168.180.179:58835	6	79	Ether / IP / TCP 140.82.113.26:https > 192.168.180.179:58835 PA / Raw
----------------------------------------
110.0629	Eroare: main thread is not in main loop	0.00%
13	192.168.180.179:58930	20.42.65.88:443	6	55	Ether / IP / TCP 192.168.180.179:58930 > 20.42.65.88:https A / Raw
----------------------------------------
113.2948	Eroare: main thread is not in main loop	0.00%
13	192.168.180.179:58943	52.123.128.14:443	6	54	Ether / IP / TCP 192.168.180.179:58943 > 52.123.128.14:https FA
----------------------------------------
125.3261	Eroare: main thread is not in main loop	0.00%
13	192.168.180.179:58884	104.18.1.22:443	6	55	Ether / IP / TCP 192.168.180.179:58884 > 104.18.1.22:https A / Raw
----------------------------------------
126.4988	Eroare: main thread is not in main loop	0.00%
13	20.189.173.11:443	192.168.180.179:59017	6	685	Ether / IP / TCP 20.189.173.11:https > 192.168.180.179:59017 PA / Raw
----------------------------------------
142.2604	Eroare: main thread is not in main loop	0.00%
13	192.168.180.179:61027	192.168.180.22:53	17	79	Ether / IP / UDP / DNS Qry b'main.vscode-cdn.net.'
----------------------------------------
149.0837	Eroare: main thread is not in main loop	0.00%
13	192.168.180.179:58835	140.82.113.26:443	6	55	Ether / IP / TCP 192.168.180.179:58835 > 140.82.113.26:https A / Raw
----------------------------------------
155.3662	Eroare: main thread is not in main loop	0.00%
13	192.168.180.179:58930	20.42.65.88:443	6	55	Ether / IP / TCP 192.168.180.179:58930 > 20.42.65.88:https A / Raw
----------------------------------------
163.6762	Eroare: main thread is not in main loop	0.00%
13	140.82.113.26:443	192.168.180.179:58835	6	79	Ether / IP / TCP 140.82.113.26:https > 192.168.180.179:58835 PA / Raw
----------------------------------------
165.2082	Eroare: main thread is not in main loop	0.00%
13	140.82.113.21:443	192.168.180.179:58945	6	93	Ether / IP / TCP 140.82.113.21:https > 192.168.180.179:58945 PA / Raw
----------------------------------------
166.4267	Eroare: main thread is not in main loop	0.00%
13	192.168.180.179:58945	140.82.113.21:443	6	110	Ether / IP / TCP 192.168.180.179:58945 > 140.82.113.21:https FPA / Raw
----------------------------------------
167.6347	Eroare: main thread is not in main loop	0.00%
13	192.168.180.179:58945	140.82.113.21:443	6	110	Ether / IP / TCP 192.168.180.179:58945 > 140.82.113.21:https FPA / Raw
----------------------------------------
168.8357	Eroare: main thread is not in main loop	0.00%
13	192.168.180.179:58945	140.82.113.21:443	6	110	Ether / IP / TCP 192.168.180.179:58945 > 140.82.113.21:https FPA / Raw
----------------------------------------
170.0400	Eroare: main thread is not in main loop	0.00%
13	192.168.180.179:58945	140.82.113.21:443	6	110	Ether / IP / TCP 192.168.180.179:58945 > 140.82.113.21:https FPA / Raw
----------------------------------------
172.4439	Eroare: main thread is not in main loop	0.00%
13	192.168.180.179:58945	140.82.113.21:443	6	110	Ether / IP / TCP 192.168.180.179:58945 > 140.82.113.21:https FPA / Raw
----------------------------------------
177.2477	Eroare: main thread is not in main loop	0.00%
13	192.168.180.179:58945	140.82.113.21:443	6	110	Ether / IP / TCP 192.168.180.179:58945 > 140.82.113.21:https FPA / Raw
----------------------------------------
178.9644	Eroare: main thread is not in main loop	0.00%
13	192.168.180.179:57067	20.199.120.151:443	6	55	Ether / IP / TCP 192.168.180.179:57067 > 20.199.120.151:https A / Raw
----------------------------------------
180.5902	Eroare: main thread is not in main loop	0.00%
13	52.123.128.14:443	192.168.180.179:59016	6	54	Ether / IP / TCP 52.123.128.14:https > 192.168.180.179:59016 RA
----------------------------------------
186.8588	Eroare: main thread is not in main loop	0.00%
13	192.168.180.179:58945	140.82.113.21:443	6	54	Ether / IP / TCP 192.168.180.179:58945 > 140.82.113.21:https RA
----------------------------------------
188.0439	Eroare: main thread is not in main loop	0.00%
13	13.107.246.44:443	192.168.180.179:59018	6	66	Ether / IP / TCP 13.107.246.44:https > 192.168.180.179:59018 A
----------------------------------------
192.7571	Eroare: main thread is not in main loop	0.00%
13	20.42.65.88:443	192.168.180.179:58930	6	54	Ether / IP / TCP 20.42.65.88:https > 192.168.180.179:58930 RA
----------------------------------------
208.8846	Eroare: main thread is not in main loop	0.00%
13	192.168.180.179:58835	140.82.113.26:443	6	55	Ether / IP / TCP 192.168.180.179:58835 > 140.82.113.26:https A / Raw
----------------------------------------
224.3992	Eroare: main thread is not in main loop	0.00%
13	140.82.113.26:443	192.168.180.179:58835	6	79	Ether / IP / TCP 140.82.113.26:https > 192.168.180.179:58835 PA / Raw
----------------------------------------
232.7965	Eroare: main thread is not in main loop	0.00%
13	13.107.246.44:443	192.168.180.179:59018	6	93	Ether / IP / TCP 13.107.246.44:https > 192.168.180.179:59018 PA / Raw
----------------------------------------
241.4593	Eroare: main thread is not in main loop	0.00%
13	192.168.180.179:57142	20.199.120.85:443	6	155	Ether / IP / TCP 192.168.180.179:57142 > 20.199.120.85:https PA / Raw
----------------------------------------
242.6259	Eroare: main thread is not in main loop	0.00%
13	140.82.121.5:443	192.168.180.179:59019	6	133	Ether / IP / TCP 140.82.121.5:https > 192.168.180.179:59019 PA / Raw
----------------------------------------
254.6909	Eroare: main thread is not in main loop	0.00%
13	192.168.180.179:58884	104.18.1.22:443	6	55	Ether / IP / TCP 192.168.180.179:58884 > 104.18.1.22:https A / Raw
----------------------------------------
263.0062	Eroare: main thread is not in main loop	0.00%
13	192.168.180.179:56450	192.168.180.22:53	17	92	Ether / IP / UDP / DNS Qry b'mobile.events.data.microsoft.com.'
----------------------------------------
264.1180	Eroare: main thread is not in main loop	0.00%
13	192.168.180.179:59020	51.105.71.136:443	6	66	Ether / IP / TCP 192.168.180.179:59020 > 51.105.71.136:https S
----------------------------------------
265.8553	Eroare: main thread is not in main loop	0.00%
13	192.168.180.179:59022	51.105.71.136:443	6	66	Ether / IP / TCP 192.168.180.179:59022 > 51.105.71.136:https S
----------------------------------------
267.8601	Eroare: main thread is not in main loop	0.00%
13	192.168.180.179:59022	51.105.71.136:443	6	66	Ether / IP / TCP 192.168.180.179:59022 > 51.105.71.136:https S
----------------------------------------
269.6112	Eroare: main thread is not in main loop	0.00%
13	192.168.180.179:58835	140.82.113.26:443	6	55	Ether / IP / TCP 192.168.180.179:58835 > 140.82.113.26:https A / Raw
----------------------------------------
271.8670	Eroare: main thread is not in main loop	0.00%
13	192.168.180.179:59022	51.105.71.136:443	6	66	Ether / IP / TCP 192.168.180.179:59022 > 51.105.71.136:https S
----------------------------------------
278.1382	Eroare: main thread is not in main loop	0.00%
13	192.168.180.179:59020	51.105.71.136:443	6	66	Ether / IP / TCP 192.168.180.179:59020 > 51.105.71.136:https S
----------------------------------------
279.8728	Eroare: main thread is not in main loop	0.00%
13	192.168.180.179:59022	51.105.71.136:443	6	66	Ether / IP / TCP 192.168.180.179:59022 > 51.105.71.136:https S
----------------------------------------
283.8960	Eroare: main thread is not in main loop	0.00%
13	140.82.113.26:443	192.168.180.179:58835	6	80	Ether / IP / TCP 140.82.113.26:https > 192.168.180.179:58835 PA / Raw
----------------------------------------
287.5029	Eroare: main thread is not in main loop	0.00%
13	192.168.180.179:59023	51.105.71.136:443	6	66	Ether / IP / TCP 192.168.180.179:59023 > 51.105.71.136:https S
----------------------------------------
288.7669	Eroare: main thread is not in main loop	0.00%
13	192.168.180.179:59024	51.105.71.136:443	6	66	Ether / IP / TCP 192.168.180.179:59024 > 51.105.71.136:https S
----------------------------------------
290.5171	Eroare: main thread is not in main loop	0.00%
13	192.168.180.179:59023	51.105.71.136:443	6	66	Ether / IP / TCP 192.168.180.179:59023 > 51.105.71.136:https S
----------------------------------------
294.5280	Eroare: main thread is not in main loop	0.00%
13	192.168.180.179:59023	51.105.71.136:443	6	66	Ether / IP / TCP 192.168.180.179:59023 > 51.105.71.136:https S
----------------------------------------
295.9778	Eroare: main thread is not in main loop	0.00%
13	192.168.180.179:49406	192.168.180.22:53	17	92	Ether / IP / UDP / DNS Qry b'mobile.events.data.microsoft.com.'
----------------------------------------
297.0835	Eroare: main thread is not in main loop	0.00%
13	192.168.180.179:59025	51.105.71.136:443	6	66	Ether / IP / TCP 192.168.180.179:59025 > 51.105.71.136:https S
----------------------------------------
299.0887	Eroare: main thread is not in main loop	0.00%
13	192.168.180.179:59025	51.105.71.136:443	6	66	Ether / IP / TCP 192.168.180.179:59025 > 51.105.71.136:https S
----------------------------------------
302.5399	Eroare: main thread is not in main loop	0.00%
13	192.168.180.179:59023	51.105.71.136:443	6	66	Ether / IP / TCP 192.168.180.179:59023 > 51.105.71.136:https S
----------------------------------------
303.6769	Eroare: main thread is not in main loop	0.00%
13	20.44.10.123:443	192.168.180.179:59026	6	153	Ether / IP / TCP 20.44.10.123:https > 192.168.180.179:59026 PA / Raw
----------------------------------------
304.8130	Eroare: main thread is not in main loop	0.00%
13	20.44.10.123:443	192.168.180.179:59027	6	581	Ether / IP / TCP 20.44.10.123:https > 192.168.180.179:59027 PA / Raw
----------------------------------------
306.4980	Eroare: main thread is not in main loop	0.00%
13	192.168.180.179:59029	51.105.71.136:443	6	66	Ether / IP / TCP 192.168.180.179:59029 > 51.105.71.136:https S
----------------------------------------
308.5036	Eroare: main thread is not in main loop	0.00%
13	192.168.180.179:59029	51.105.71.136:443	6	66	Ether / IP / TCP 192.168.180.179:59029 > 51.105.71.136:https S
----------------------------------------
311.1130	Eroare: main thread is not in main loop	0.00%
13	192.168.180.179:59025	51.105.71.136:443	6	66	Ether / IP / TCP 192.168.180.179:59025 > 51.105.71.136:https S
----------------------------------------
312.5046	Eroare: main thread is not in main loop	0.00%
13	192.168.180.179:59029	51.105.71.136:443	6	66	Ether / IP / TCP 192.168.180.179:59029 > 51.105.71.136:https S
----------------------------------------
314.8282	Eroare: main thread is not in main loop	0.00%
13	192.168.180.179:59056	51.105.71.136:443	6	66	Ether / IP / TCP 192.168.180.179:59056 > 51.105.71.136:https S
----------------------------------------
318.8364	Eroare: main thread is not in main loop	0.00%
13	192.168.180.179:59056	51.105.71.136:443	6	66	Ether / IP / TCP 192.168.180.179:59056 > 51.105.71.136:https S
----------------------------------------
320.1032	Eroare: main thread is not in main loop	0.00%
13	192.168.180.179:60387	192.168.180.22:53	17	92	Ether / IP / UDP / DNS Qry b'mobile.events.data.microsoft.com.'
----------------------------------------
321.3775	Eroare: main thread is not in main loop	0.00%
13	20.44.10.123:443	192.168.180.179:59063	6	54	Ether / IP / TCP 20.44.10.123:https > 192.168.180.179:59063 A
----------------------------------------
326.8419	Eroare: main thread is not in main loop	0.00%
13	192.168.180.179:59056	51.105.71.136:443	6	66	Ether / IP / TCP 192.168.180.179:59056 > 51.105.71.136:https S
----------------------------------------
329.1029	Eroare: main thread is not in main loop	0.00%
13	192.168.180.179:58835	140.82.113.26:443	6	55	Ether / IP / TCP 192.168.180.179:58835 > 140.82.113.26:https A / Raw
----------------------------------------
331.5064	Eroare: main thread is not in main loop	0.00%
13	192.168.180.179:59089	192.168.180.22:53	17	86	Ether / IP / UDP / DNS Qry b'checkappexec.microsoft.com.'
----------------------------------------
336.7615	Eroare: main thread is not in main loop	0.00%
13	192.168.180.179:49434	192.168.180.22:53	17	92	Ether / IP / UDP / DNS Qry b'mobile.events.data.microsoft.com.'
----------------------------------------
337.8611	Eroare: main thread is not in main loop	0.00%
13	192.168.180.179:59065	20.42.73.31:443	6	54	Ether / IP / TCP 192.168.180.179:59065 > 20.42.73.31:https A
----------------------------------------
343.8539	Eroare: main thread is not in main loop	0.00%
13	140.82.113.26:443	192.168.180.179:58835	6	80	Ether / IP / TCP 140.82.113.26:https > 192.168.180.179:58835 PA / Raw
----------------------------------------
345.3815	Eroare: main thread is not in main loop	0.00%
13	192.168.180.179:62994	192.168.180.22:53	17	92	Ether / IP / UDP / DNS Qry b'mobile.events.data.microsoft.com.'
----------------------------------------
346.5754	Eroare: main thread is not in main loop	0.00%
13	20.189.173.4:443	192.168.180.179:59066	6	157	Ether / IP / TCP 20.189.173.4:https > 192.168.180.179:59066 PA / Raw
----------------------------------------
382.8853	Eroare: main thread is not in main loop	0.00%
13	192.168.180.179:59065	20.42.73.31:443	6	55	Ether / IP / TCP 192.168.180.179:59065 > 20.42.73.31:https A / Raw
----------------------------------------
389.0318	Eroare: main thread is not in main loop	0.00%
13	192.168.180.179:58835	140.82.113.26:443	6	55	Ether / IP / TCP 192.168.180.179:58835 > 140.82.113.26:https A / Raw
----------------------------------------
404.5582	Eroare: main thread is not in main loop	0.00%
13	140.82.113.26:443	192.168.180.179:58835	6	80	Ether / IP / TCP 140.82.113.26:https > 192.168.180.179:58835 PA / Raw
----------------------------------------
410.7072	Eroare: main thread is not in main loop	0.00%
13	192.168.180.179:55617	192.168.180.22:53	17	92	Ether / IP / UDP / DNS Qry b'mobile.events.data.microsoft.com.'
----------------------------------------
413.3839	Eroare: main thread is not in main loop	0.00%
13	192.168.180.179:59027	20.44.10.123:443	6	54	Ether / IP / TCP 192.168.180.179:59027 > 20.44.10.123:https FA
----------------------------------------
424.0802	Eroare: main thread is not in main loop	0.00%
13	192.168.180.179:57067	20.199.120.151:443	6	55	Ether / IP / TCP 192.168.180.179:57067 > 20.199.120.151:https A / Raw
----------------------------------------
425.3152	Eroare: main thread is not in main loop	0.00%
13	44.213.14.188:443	192.168.180.179:59094	6	54	Ether / IP / TCP 44.213.14.188:https > 192.168.180.179:59094 A
----------------------------------------
427.9350	Eroare: main thread is not in main loop	0.00%
13	192.168.180.179:59094	44.213.14.188:443	6	54	Ether / IP / TCP 192.168.180.179:59094 > 44.213.14.188:https FA
----------------------------------------
436.6060	Eroare: main thread is not in main loop	0.00%
13	192.168.180.179:49447	192.168.180.22:53	17	80	Ether / IP / UDP / DNS Qry b'win10-trt.msedge.net.'
----------------------------------------
442.8973	Eroare: main thread is not in main loop	0.00%
13	192.168.180.179:62315	192.168.180.22:53	17	79	Ether / IP / UDP / DNS Qry b'main.vscode-cdn.net.'
----------------------------------------
444.0293	Eroare: main thread is not in main loop	0.00%
13	20.42.73.31:443	192.168.180.179:59065	6	54	Ether / IP / TCP 20.42.73.31:https > 192.168.180.179:59065 A
----------------------------------------
449.9229	Eroare: main thread is not in main loop	0.00%
13	140.82.113.26:443	192.168.180.179:58835	6	66	Ether / IP / TCP 140.82.113.26:https > 192.168.180.179:58835 A
----------------------------------------
463.8208	Eroare: main thread is not in main loop	0.00%
13	140.82.113.26:443	192.168.180.179:58835	6	80	Ether / IP / TCP 140.82.113.26:https > 192.168.180.179:58835 PA / Raw
----------------------------------------
468.1732	Eroare: main thread is not in main loop	0.00%
13	192.168.180.179:49331	192.168.180.22:53	17	69	Ether / IP / UDP / DNS Qry b'unpkg.com.'
----------------------------------------
469.3069	Eroare: main thread is not in main loop	0.00%
13	52.168.117.169:443	192.168.180.179:59118	6	54	Ether / IP / TCP 52.168.117.169:https > 192.168.180.179:59118 A
----------------------------------------
486.6199	Eroare: main thread is not in main loop	0.00%
13	192.168.180.179:57142	20.199.120.85:443	6	55	Ether / IP / TCP 192.168.180.179:57142 > 20.199.120.85:https A / Raw
----------------------------------------
488.4522	Eroare: main thread is not in main loop	0.00%
13	192.168.180.179:59095	13.107.246.44:443	6	55	Ether / IP / TCP 192.168.180.179:59095 > 13.107.246.44:https A / Raw
----------------------------------------
509.0351	Eroare: main thread is not in main loop	0.00%
13	192.168.180.179:58835	140.82.113.26:443	6	55	Ether / IP / TCP 192.168.180.179:58835 > 140.82.113.26:https A / Raw
----------------------------------------
512.1542	Eroare: main thread is not in main loop	0.00%
13	48.209.162.134:443	192.168.180.179:59064	6	100	Ether / IP / TCP 48.209.162.134:https > 192.168.180.179:59064 PA / Raw
----------------------------------------
514.1453	Eroare: main thread is not in main loop	0.00%
13	192.168.180.179:59065	20.42.73.31:443	6	55	Ether / IP / TCP 192.168.180.179:59065 > 20.42.73.31:https A / Raw
----------------------------------------
523.9318	Eroare: main thread is not in main loop	0.00%
13	140.82.113.26:443	192.168.180.179:58835	6	80	Ether / IP / TCP 140.82.113.26:https > 192.168.180.179:58835 PA / Raw
----------------------------------------
533.6083	Eroare: main thread is not in main loop	0.00%
13	192.168.180.179:59095	13.107.246.44:443	6	55	Ether / IP / TCP 192.168.180.179:59095 > 13.107.246.44:https A / Raw
----------------------------------------
556.1581	Eroare: main thread is not in main loop	0.00%
13	192.168.180.179:59064	192.168.180.22:53	17	74	Ether / IP / UDP / DNS Qry b'api.github.com.'
----------------------------------------
559.4450	Eroare: main thread is not in main loop	0.00%
13	192.168.180.179:59065	20.42.73.31:443	6	55	Ether / IP / TCP 192.168.180.179:59065 > 20.42.73.31:https A / Raw
----------------------------------------
569.1371	Eroare: main thread is not in main loop	0.00%
13	192.168.180.179:58835	140.82.113.26:443	6	55	Ether / IP / TCP 192.168.180.179:58835 > 140.82.113.26:https A / Raw
----------------------------------------
584.0426	Eroare: main thread is not in main loop	0.00%
13	140.82.113.26:443	192.168.180.179:58835	6	80	Ether / IP / TCP 140.82.113.26:https > 192.168.180.179:58835 PA / Raw
----------------------------------------
587.0113	Eroare: main thread is not in main loop	0.00%
13	140.82.121.6:443	192.168.180.179:59153	6	93	Ether / IP / TCP 140.82.121.6:https > 192.168.180.179:59153 PA / Raw
----------------------------------------
589.9115	Eroare: main thread is not in main loop	0.00%
13	20.42.73.31:443	192.168.180.179:59065	6	54	Ether / IP / TCP 20.42.73.31:https > 192.168.180.179:59065 RA
----------------------------------------
629.1879	Eroare: main thread is not in main loop	0.00%
13	192.168.180.179:58835	140.82.113.26:443	6	55	Ether / IP / TCP 192.168.180.179:58835 > 140.82.113.26:https A / Raw
----------------------------------------
643.9494	Eroare: main thread is not in main loop	0.00%
13	140.82.113.26:443	192.168.180.179:58835	6	80	Ether / IP / TCP 140.82.113.26:https > 192.168.180.179:58835 PA / Raw
----------------------------------------
669.1891	Eroare: main thread is not in main loop	0.00%
13	192.168.180.179:57067	20.199.120.151:443	6	55	Ether / IP / TCP 192.168.180.179:57067 > 20.199.120.151:https A / Raw
----------------------------------------
689.1634	Eroare: main thread is not in main loop	0.00%
13	192.168.180.179:58835	140.82.113.26:443	6	55	Ether / IP / TCP 192.168.180.179:58835 > 140.82.113.26:https A / Raw
----------------------------------------
703.9637	Eroare: main thread is not in main loop	0.00%
13	140.82.113.26:443	192.168.180.179:58835	6	95	Ether / IP / TCP 140.82.113.26:https > 192.168.180.179:58835 PA / Raw
----------------------------------------
705.0974	Eroare: main thread is not in main loop	0.00%
13	140.82.113.26:443	192.168.180.179:58835	6	78	Ether / IP / TCP 140.82.113.26:https > 192.168.180.179:58835 PA / Raw
----------------------------------------
706.2423	Eroare: main thread is not in main loop	0.00%
13	192.168.180.22:53	192.168.180.179:54346	17	111	Ether / IP / UDP / DNS Ans b'live.github.com.'
----------------------------------------
708.7040	Eroare: main thread is not in main loop	0.00%
13	192.168.180.179:51085	192.168.180.22:53	17	78	Ether / IP / UDP / DNS Qry b'www.virustotal.com.'
----------------------------------------
709.9021	Eroare: main thread is not in main loop	0.00%
13	3.125.5.82:443	192.168.180.179:59222	6	792	Ether / IP / TCP 3.125.5.82:https > 192.168.180.179:59222 PA / Raw
----------------------------------------
711.0991	Eroare: main thread is not in main loop	0.00%
13	3.125.5.82:443	192.168.180.179:59224	6	792	Ether / IP / TCP 3.125.5.82:https > 192.168.180.179:59224 PA / Raw
----------------------------------------
712.5347	Eroare: main thread is not in main loop	0.00%
13	192.168.180.179:53024	192.168.180.22:53	17	78	Ether / IP / UDP / DNS Qry b'edge.microsoft.com.'
----------------------------------------
713.8717	Eroare: main thread is not in main loop	0.00%
13	192.168.180.179:59233	52.123.128.14:443	6	66	Ether / IP / TCP 192.168.180.179:59233 > 52.123.128.14:https S
----------------------------------------
715.6202	Eroare: main thread is not in main loop	0.00%
13	150.171.27.11:443	192.168.180.179:59227	6	54	Ether / IP / TCP 150.171.27.11:https > 192.168.180.179:59227 R
----------------------------------------
716.7782	Eroare: main thread is not in main loop	0.00%
13	192.168.180.179:60216	40.101.78.114:443	17	1292	Ether / IP / UDP 192.168.180.179:60216 > 40.101.78.114:https / Raw
----------------------------------------
719.1470	Eroare: main thread is not in main loop	0.00%
13	150.171.28.11:443	192.168.180.179:59225	6	1354	Ether / IP / TCP 150.171.28.11:https > 192.168.180.179:59225 A / Raw
----------------------------------------
723.9456	Eroare: main thread is not in main loop	0.00%
13	150.171.28.11:443	192.168.180.179:59225	6	1354	Ether / IP / TCP 150.171.28.11:https > 192.168.180.179:59225 A / Raw
----------------------------------------
731.7608	Eroare: main thread is not in main loop	0.00%
13	192.168.180.179:57142	20.199.120.85:443	6	55	Ether / IP / TCP 192.168.180.179:57142 > 20.199.120.85:https A / Raw
----------------------------------------
736.6219	Eroare: main thread is not in main loop	0.00%
13	192.168.180.179:56036	192.168.180.22:53	17	79	Ether / IP / UDP / DNS Qry b'default.exp-tas.com.'
----------------------------------------
737.7869	Eroare: main thread is not in main loop	0.00%
13	192.168.180.179:59238	13.107.5.93:443	6	66	Ether / IP / TCP 192.168.180.179:59238 > 13.107.5.93:https S
----------------------------------------
739.0594	Eroare: main thread is not in main loop	0.00%
13	20.189.172.76:443	192.168.180.179:59240	6	157	Ether / IP / TCP 20.189.172.76:https > 192.168.180.179:59240 PA / Raw
----------------------------------------
740.5127	Eroare: main thread is not in main loop	0.00%
13	192.168.180.179:59243	13.107.5.93:443	6	66	Ether / IP / TCP 192.168.180.179:59243 > 13.107.5.93:https S
----------------------------------------
741.8607	Eroare: main thread is not in main loop	0.00%
13	20.189.172.76:443	192.168.180.179:59248	6	1354	Ether / IP / TCP 20.189.172.76:https > 192.168.180.179:59248 A / Raw
----------------------------------------
743.4481	Eroare: main thread is not in main loop	0.00%
13	192.168.180.179:61449	192.168.180.22:53	17	79	Ether / IP / UDP / DNS Qry b'main.vscode-cdn.net.'
----------------------------------------
744.7480	Eroare: main thread is not in main loop	0.00%
13	20.189.172.76:443	192.168.180.179:59252	6	153	Ether / IP / TCP 20.189.172.76:https > 192.168.180.179:59252 PA / Raw
----------------------------------------
746.0205	Eroare: main thread is not in main loop	0.00%
13	140.82.121.5:443	192.168.180.179:59253	6	1354	Ether / IP / TCP 140.82.121.5:https > 192.168.180.179:59253 A / Raw
----------------------------------------
747.3014	Eroare: main thread is not in main loop	0.00%
13	20.189.172.76:443	192.168.180.179:59255	6	157	Ether / IP / TCP 20.189.172.76:https > 192.168.180.179:59255 PA / Raw
----------------------------------------
752.2216	Eroare: main thread is not in main loop	0.00%
13	192.168.180.179:59220	140.82.113.25:443	6	55	Ether / IP / TCP 192.168.180.179:59220 > 140.82.113.25:https A / Raw
----------------------------------------
753.4575	Eroare: main thread is not in main loop	0.00%
13	20.189.173.25:443	192.168.180.179:59257	6	66	Ether / IP / TCP 20.189.173.25:https > 192.168.180.179:59257 SA
----------------------------------------
754.6636	Eroare: main thread is not in main loop	0.00%
13	20.189.173.25:443	192.168.180.179:59257	6	54	Ether / IP / TCP 20.189.173.25:https > 192.168.180.179:59257 A
----------------------------------------
757.5746	Eroare: main thread is not in main loop	0.00%
13	192.168.180.179:59258	92.123.103.80:443	6	66	Ether / IP / TCP 192.168.180.179:59258 > 92.123.103.80:https S
----------------------------------------
758.7026	Eroare: main thread is not in main loop	0.00%
13	192.168.180.179:59261	52.97.168.178:443	6	2077	Ether / IP / TCP 192.168.180.179:59261 > 52.97.168.178:https PA / Raw
----------------------------------------
759.7956	Eroare: main thread is not in main loop	0.00%
13	192.168.180.179:59289	194.124.204.71:443	6	577	Ether / IP / TCP 192.168.180.179:59289 > 194.124.204.71:https PA / Raw
----------------------------------------
760.8945	Eroare: main thread is not in main loop	0.00%
13	13.107.18.254:443	192.168.180.179:59311	6	66	Ether / IP / TCP 13.107.18.254:https > 192.168.180.179:59311 SA
----------------------------------------
761.9913	Eroare: main thread is not in main loop	0.00%
13	172.217.17.99:443	192.168.180.179:54391	17	570	Ether / IP / UDP 172.217.17.99:https > 192.168.180.179:54391 / Raw
----------------------------------------
763.0946	Eroare: main thread is not in main loop	0.00%
13	18.165.171.47:443	192.168.180.179:59324	6	1354	Ether / IP / TCP 18.165.171.47:https > 192.168.180.179:59324 PA / Raw
----------------------------------------
764.1995	Eroare: main thread is not in main loop	0.00%
13	185.26.182.123:443	192.168.180.179:59335	6	956	Ether / IP / TCP 185.26.182.123:https > 192.168.180.179:59335 PA / Raw
----------------------------------------
765.3714	Eroare: main thread is not in main loop	0.00%
13	192.168.180.179:59324	18.165.171.47:443	6	196	Ether / IP / TCP 192.168.180.179:59324 > 18.165.171.47:https PA / Raw
----------------------------------------
766.4814	Eroare: main thread is not in main loop	0.00%
13	192.168.180.179:59324	18.165.171.47:443	6	54	Ether / IP / TCP 192.168.180.179:59324 > 18.165.171.47:https A
----------------------------------------
767.7330	Eroare: main thread is not in main loop	0.00%
13	192.168.180.179:59324	18.165.171.47:443	6	234	Ether / IP / TCP 192.168.180.179:59324 > 18.165.171.47:https PA / Raw
----------------------------------------
771.4017	Eroare: main thread is not in main loop	0.00%
13	192.168.180.179:59308	140.82.113.21:443	6	78	Ether / IP / TCP 192.168.180.179:59308 > 140.82.113.21:https FPA / Raw
----------------------------------------
772.5285	Eroare: main thread is not in main loop	0.00%
13	150.171.28.11:443	192.168.180.179:59337	6	1354	Ether / IP / TCP 150.171.28.11:https > 192.168.180.179:59337 A / Raw
----------------------------------------
776.2746	Eroare: main thread is not in main loop	0.00%
13	140.82.121.5:443	192.168.180.179:59253	6	93	Ether / IP / TCP 140.82.121.5:https > 192.168.180.179:59253 PA / Raw
----------------------------------------
778.1053	Eroare: main thread is not in main loop	0.00%
13	92.123.103.80:443	192.168.180.179:59258	6	85	Ether / IP / TCP 92.123.103.80:https > 192.168.180.179:59258 PA / Raw
----------------------------------------
781.4951	Eroare: main thread is not in main loop	0.00%
13	192.168.180.179:59308	140.82.113.21:443	6	54	Ether / IP / TCP 192.168.180.179:59308 > 140.82.113.21:https RA
----------------------------------------
783.1415	Eroare: main thread is not in main loop	0.00%
13	52.123.128.14:443	192.168.180.179:59233	6	54	Ether / IP / TCP 52.123.128.14:https > 192.168.180.179:59233 RA
----------------------------------------
784.2428	Eroare: main thread is not in main loop	0.00%
13	142.250.187.142:443	192.168.180.179:57999	17	132	Ether / IP / UDP 142.250.187.142:https > 192.168.180.179:57999 / Raw
----------------------------------------
785.9891	Eroare: main thread is not in main loop	0.00%
13	192.168.180.179:59244	13.107.246.44:443	6	55	Ether / IP / TCP 192.168.180.179:59244 > 13.107.246.44:https A / Raw
----------------------------------------
787.1081	Eroare: main thread is not in main loop	0.00%
13	172.217.17.99:443	192.168.180.179:54391	17	70	Ether / IP / UDP 172.217.17.99:https > 192.168.180.179:54391 / Raw
----------------------------------------
788.7286	Eroare: main thread is not in main loop	0.00%
13	192.168.180.179:59250	13.107.246.44:443	6	55	Ether / IP / TCP 192.168.180.179:59250 > 13.107.246.44:https A / Raw
----------------------------------------
791.9995	Eroare: main thread is not in main loop	0.00%
13	192.168.180.179:59256	140.82.114.21:443	6	55	Ether / IP / TCP 192.168.180.179:59256 > 140.82.114.21:https A / Raw
----------------------------------------
793.1653	Eroare: main thread is not in main loop	0.00%
13	192.168.180.179:59321	35.156.252.134:443	6	170	Ether / IP / TCP 192.168.180.179:59321 > 35.156.252.134:https PA / Raw
----------------------------------------
794.5660	Eroare: main thread is not in main loop	0.00%
13	192.168.180.179:61229	172.217.17.138:443	17	239	Ether / IP / UDP 192.168.180.179:61229 > 172.217.17.138:https / Raw
----------------------------------------
797.1395	Eroare: main thread is not in main loop	0.00%
13	192.168.180.179:56414	192.168.180.22:53	17	92	Ether / IP / UDP / DNS Qry b'mobile.events.data.microsoft.com.'
----------------------------------------
798.2345	Eroare: main thread is not in main loop	0.00%
13	20.189.173.25:443	192.168.180.179:59375	6	1354	Ether / IP / TCP 20.189.173.25:https > 192.168.180.179:59375 A / Raw
----------------------------------------
802.1437	Eroare: main thread is not in main loop	0.00%
13	192.168.180.179:52610	192.168.180.22:53	17	77	Ether / IP / UDP / DNS Qry b'sirius.mwbsys.com.'
----------------------------------------
803.2424	Eroare: main thread is not in main loop	0.00%
13	3.160.246.24:443	192.168.180.179:59377	6	1354	Ether / IP / TCP 3.160.246.24:https > 192.168.180.179:59377 A / Raw
----------------------------------------
804.3414	Eroare: main thread is not in main loop	0.00%
13	3.160.246.24:443	192.168.180.179:59377	6	1354	Ether / IP / TCP 3.160.246.24:https > 192.168.180.179:59377 A / Raw
----------------------------------------
805.4433	Eroare: main thread is not in main loop	0.00%
13	3.160.246.24:443	192.168.180.179:59377	6	1354	Ether / IP / TCP 3.160.246.24:https > 192.168.180.179:59377 A / Raw
----------------------------------------
806.5442	Eroare: main thread is not in main loop	0.00%
13	3.160.246.24:443	192.168.180.179:59377	6	1354	Ether / IP / TCP 3.160.246.24:https > 192.168.180.179:59377 A / Raw
----------------------------------------
807.6636	Eroare: main thread is not in main loop	0.00%
13	3.160.246.24:443	192.168.180.179:59377	6	1354	Ether / IP / TCP 3.160.246.24:https > 192.168.180.179:59377 PA / Raw
