0.0664	Atac: NORMAL	85.75%
0	192.168.125.179:63351	13.107.246.44:443	6	54	Ether / IP / TCP 192.168.125.179:63351 > 13.107.246.44:https FA
----------------------------------------
2.0952	Atac: NORMAL	85.75%
1	192.168.125.179:64062	20.189.173.28:443	6	172	Ether / IP / TCP 192.168.125.179:64062 > 20.189.173.28:https PA / Raw
----------------------------------------
2.1692	Atac: NORMAL	85.75%
2	192.168.125.179:64062	20.189.173.28:443	6	2328	Ether / IP / TCP 192.168.125.179:64062 > 20.189.173.28:https PA / Raw
----------------------------------------
2.3362	Atac: NORMAL	85.75%
3	20.189.173.28:443	192.168.125.179:64062	6	54	Ether / IP / TCP 20.189.173.28:https > 192.168.125.179:64062 A
----------------------------------------
2.4096	Atac: NORMAL	85.75%
4	192.168.125.179:63347	92.123.103.72:443	6	54	Ether / IP / TCP 192.168.125.179:63347 > 92.123.103.72:https RA
----------------------------------------
2.4806	Atac: NORMAL	85.75%
5	20.189.173.28:443	192.168.125.179:64062	6	153	Ether / IP / TCP 20.189.173.28:https > 192.168.125.179:64062 PA / Raw
----------------------------------------
2.5516	Atac: NORMAL	85.75%
5	192.168.125.179:64062	20.189.173.28:443	6	89	Ether / IP / TCP 192.168.125.179:64062 > 20.189.173.28:https PA / Raw
----------------------------------------
2.7153	Atac: NORMAL	85.75%
7	192.168.125.179:64076	104.46.162.226:443	6	66	Ether / IP / TCP 192.168.125.179:64076 > 104.46.162.226:https S
----------------------------------------
2.7943	Atac: NORMAL	85.75%
8	192.168.125.179:60273	4.208.35.46:443	6	105	Ether / IP / TCP 192.168.125.179:60273 > 4.208.35.46:https PA / Raw
----------------------------------------
2.8663	Atac: NORMAL	85.75%
8	20.189.173.28:443	192.168.125.179:64062	6	54	Ether / IP / TCP 20.189.173.28:https > 192.168.125.179:64062 A
----------------------------------------
2.9383	Atac: NORMAL	85.75%
10	4.208.35.46:443	192.168.125.179:60273	6	94	Ether / IP / TCP 4.208.35.46:https > 192.168.125.179:60273 PA / Raw
----------------------------------------
3.4579	Atac: NORMAL	85.75%
11	192.168.125.179:60374	108.177.96.188:5228	6	55	Ether / IP / TCP 192.168.125.179:60374 > 108.177.96.188:5228 A / Raw
----------------------------------------
3.6203	Atac: NORMAL	85.75%
12	108.177.96.188:5228	192.168.125.179:60374	6	66	Ether / IP / TCP 108.177.96.188:5228 > 192.168.125.179:60374 A
----------------------------------------
3.7188	Atac: NORMAL	85.75%
13	192.168.125.179:64076	104.46.162.226:443	6	66	Ether / IP / TCP 192.168.125.179:64076 > 104.46.162.226:https S
----------------------------------------
3.9834	Atac: NORMAL	85.75%
14	192.168.125.179:64077	104.46.162.226:443	6	66	Ether / IP / TCP 192.168.125.179:64077 > 104.46.162.226:https S
----------------------------------------
5.7287	Atac: NORMAL	85.75%
15	192.168.125.179:64076	104.46.162.226:443	6	66	Ether / IP / TCP 192.168.125.179:64076 > 104.46.162.226:https S
----------------------------------------
5.9884	Atac: NORMAL	85.75%
16	192.168.125.179:64077	104.46.162.226:443	6	66	Ether / IP / TCP 192.168.125.179:64077 > 104.46.162.226:https S
----------------------------------------
7.2717	Atac: NORMAL	70.54%
17	192.168.125.179:137	192.168.125.255:137	17	92	Ether / IP / UDP / NBNSHeader / NBNSQueryRequest who has '\\DESKTOP-H45KHRK'
----------------------------------------
7.3477	Atac: NORMAL	85.75%
18	192.168.125.179:61228	52.16.218.208:443	6	297	Ether / IP / TCP 192.168.125.179:61228 > 52.16.218.208:https PA / Raw
----------------------------------------
7.5418	Atac: NORMAL	85.75%
19	52.16.218.208:443	192.168.125.179:61228	6	320	Ether / IP / TCP 52.16.218.208:https > 192.168.125.179:61228 PA / Raw
----------------------------------------
7.6138	Atac: NORMAL	85.75%
19	192.168.125.179:61228	52.16.218.208:443	6	54	Ether / IP / TCP 192.168.125.179:61228 > 52.16.218.208:https A
----------------------------------------
7.7214	Atac: NORMAL	85.75%
21	162.247.241.14:443	192.168.125.179:63936	6	54	Ether / IP / TCP 162.247.241.14:https > 192.168.125.179:63936 A
----------------------------------------
7.7976	Atac: NORMAL	85.75%
22	192.168.125.179:63936	162.247.241.14:443	6	54	Ether / IP / TCP 192.168.125.179:63936 > 162.247.241.14:https A
----------------------------------------
8.0279	Atac: NORMAL	70.54%
23	192.168.125.179:137	192.168.125.255:137	17	92	Ether / IP / UDP / NBNSHeader / NBNSQueryRequest who has '\\DESKTOP-H45KHRK'
----------------------------------------
8.7861	Atac: NORMAL	70.54%
24	192.168.125.179:137	192.168.125.255:137	17	92	Ether / IP / UDP / NBNSHeader / NBNSQueryRequest who has '\\DESKTOP-H45KHRK'
----------------------------------------
9.3635	Atac: NORMAL	85.75%
25	192.168.125.179:63345	185.60.218.53:5222	6	123	Ether / IP / TCP 192.168.125.179:63345 > 185.60.218.53:5222 PA / Raw
----------------------------------------
9.5584	Atac: NORMAL	85.75%
26	185.60.218.53:5222	192.168.125.179:63345	6	54	Ether / IP / TCP 185.60.218.53:5222 > 192.168.125.179:63345 A
----------------------------------------
9.6294	Atac: NORMAL	85.75%
27	185.60.218.53:5222	192.168.125.179:63345	6	125	Ether / IP / TCP 185.60.218.53:5222 > 192.168.125.179:63345 PA / Raw
----------------------------------------
9.7014	Atac: NORMAL	85.75%
27	192.168.125.179:63345	185.60.218.53:5222	6	54	Ether / IP / TCP 192.168.125.179:63345 > 185.60.218.53:5222 A
----------------------------------------
9.7714	Atac: NORMAL	85.75%
29	192.168.125.179:64076	104.46.162.226:443	6	66	Ether / IP / TCP 192.168.125.179:64076 > 104.46.162.226:https S
----------------------------------------
9.9972	Atac: NORMAL	85.75%
30	192.168.125.179:64077	104.46.162.226:443	6	66	Ether / IP / TCP 192.168.125.179:64077 > 104.46.162.226:https S
----------------------------------------
13.8136	Atac: NORMAL	85.75%
31	192.168.125.179:64027	52.123.128.14:443	6	55	Ether / IP / TCP 192.168.125.179:64027 > 52.123.128.14:https A / Raw
----------------------------------------
13.9621	Atac: NORMAL	85.75%
32	52.123.128.14:443	192.168.125.179:64027	6	66	Ether / IP / TCP 52.123.128.14:https > 192.168.125.179:64027 A
----------------------------------------
15.3623	Atac: NORMAL	70.54%
33	192.168.125.179:137	192.168.125.255:137	17	92	Ether / IP / UDP / NBNSHeader / NBNSQueryRequest who has '\\DESKTOP-H45KHRK'
----------------------------------------
15.4389	Atac: NORMAL	85.75%
34	192.168.125.179:64028	52.123.129.14:443	6	55	Ether / IP / TCP 192.168.125.179:64028 > 52.123.129.14:https A / Raw
----------------------------------------
15.5171	Atac: NORMAL	85.75%
35	192.168.125.179:62799	52.123.200.36:443	6	111	Ether / IP / TCP 192.168.125.179:62799 > 52.123.200.36:https PA / Raw
----------------------------------------
15.5871	Atac: NORMAL	85.75%
35	192.168.125.179:60242	52.123.200.36:443	6	112	Ether / IP / TCP 192.168.125.179:60242 > 52.123.200.36:https PA / Raw
----------------------------------------
15.6551	Atac: NORMAL	85.75%
37	52.123.129.14:443	192.168.125.179:64028	6	66	Ether / IP / TCP 52.123.129.14:https > 192.168.125.179:64028 A
----------------------------------------
15.7291	Atac: NORMAL	85.75%
38	52.123.200.36:443	192.168.125.179:60242	6	101	Ether / IP / TCP 52.123.200.36:https > 192.168.125.179:60242 PA / Raw
----------------------------------------
15.8071	Atac: NORMAL	85.75%
38	52.123.200.36:443	192.168.125.179:62799	6	100	Ether / IP / TCP 52.123.200.36:https > 192.168.125.179:62799 PA / Raw
----------------------------------------
15.8731	Atac: NORMAL	85.75%
40	192.168.125.179:62799	52.123.200.36:443	6	54	Ether / IP / TCP 192.168.125.179:62799 > 52.123.200.36:https A
----------------------------------------
15.9592	Atac: NORMAL	85.75%
41	192.168.125.179:60242	52.123.200.36:443	6	54	Ether / IP / TCP 192.168.125.179:60242 > 52.123.200.36:https A
----------------------------------------
16.0321	Atac: NORMAL	85.75%
41	192.168.125.179:64078	13.69.116.104:443	6	66	Ether / IP / TCP 192.168.125.179:64078 > 13.69.116.104:https S
----------------------------------------
16.1011	Atac: NORMAL	70.54%
43	192.168.125.179:61027	192.168.125.213:53	17	95	Ether / IP / UDP / DNS Qry b'eu-mobile.events.data.microsoft.com.'
----------------------------------------
16.1691	Atac: NORMAL	70.54%
44	192.168.125.179:53648	192.168.125.213:53	17	95	Ether / IP / UDP / DNS Qry b'eu-mobile.events.data.microsoft.com.'
----------------------------------------
16.8184	Atac: NORMAL	85.75%
45	192.168.125.179:64078	13.69.116.104:443	6	66	Ether / IP / TCP 192.168.125.179:64078 > 13.69.116.104:https S
----------------------------------------
16.8874	Atac: NORMAL	70.54%
46	192.168.125.179:137	192.168.125.255:137	17	92	Ether / IP / UDP / NBNSHeader / NBNSQueryRequest who has '\\DESKTOP-H45KHRK'
----------------------------------------
17.2209	Atac: NORMAL	85.75%
47	192.168.125.179:63351	13.107.246.44:443	6	54	Ether / IP / TCP 192.168.125.179:63351 > 13.107.246.44:https RA
----------------------------------------
17.7465	Atac: NORMAL	85.75%
48	192.168.125.179:64076	104.46.162.226:443	6	66	Ether / IP / TCP 192.168.125.179:64076 > 104.46.162.226:https S
----------------------------------------
18.0118	Atac: NORMAL	85.75%
49	192.168.125.179:64077	104.46.162.226:443	6	66	Ether / IP / TCP 192.168.125.179:64077 > 104.46.162.226:https S
----------------------------------------
18.8292	Atac: NORMAL	85.75%
50	192.168.125.179:64078	13.69.116.104:443	6	66	Ether / IP / TCP 192.168.125.179:64078 > 13.69.116.104:https S
----------------------------------------
20.8399	Atac: NORMAL	85.75%
51	192.168.125.179:60257	74.248.74.217:443	6	112	Ether / IP / TCP 192.168.125.179:60257 > 74.248.74.217:https PA / Raw
----------------------------------------
20.9270	Atac: NORMAL	85.75%
52	74.248.74.217:443	192.168.125.179:60257	6	101	Ether / IP / TCP 74.248.74.217:https > 192.168.125.179:60257 PA / Raw
----------------------------------------
20.9990	Atac: NORMAL	85.75%
52	192.168.125.179:60257	74.248.74.217:443	6	54	Ether / IP / TCP 192.168.125.179:60257 > 74.248.74.217:https A
----------------------------------------
22.0021	Atac: NORMAL	85.75%
54	192.168.125.179:61334	172.161.47.103:443	6	55	Ether / IP / TCP 192.168.125.179:61334 > 172.161.47.103:https A / Raw
----------------------------------------
22.0717	Atac: NORMAL	85.75%
55	192.168.125.179:64065	150.171.27.11:443	6	55	Ether / IP / TCP 192.168.125.179:64065 > 150.171.27.11:https A / Raw
----------------------------------------
22.1527	Atac: NORMAL	85.75%
55	150.171.27.11:443	192.168.125.179:64065	6	66	Ether / IP / TCP 150.171.27.11:https > 192.168.125.179:64065 A
----------------------------------------
22.2332	Atac: NORMAL	85.75%
57	172.161.47.103:443	192.168.125.179:61334	6	66	Ether / IP / TCP 172.161.47.103:https > 192.168.125.179:61334 A
----------------------------------------
22.8376	Atac: NORMAL	85.75%
58	192.168.125.179:64078	13.69.116.104:443	6	66	Ether / IP / TCP 192.168.125.179:64078 > 13.69.116.104:https S
----------------------------------------
23.0872	Atac: NORMAL	85.75%
59	162.247.241.14:443	192.168.125.179:63936	6	54	Ether / IP / TCP 162.247.241.14:https > 192.168.125.179:63936 A
----------------------------------------
23.1582	Atac: NORMAL	85.75%
60	192.168.125.179:63936	162.247.241.14:443	6	54	Ether / IP / TCP 192.168.125.179:63936 > 162.247.241.14:https A
----------------------------------------
23.3499	Atac: NORMAL	85.75%
61	192.168.125.179:61228	52.16.218.208:443	6	297	Ether / IP / TCP 192.168.125.179:61228 > 52.16.218.208:https PA / Raw
----------------------------------------
23.4850	Atac: NORMAL	85.75%
62	52.16.218.208:443	192.168.125.179:61228	6	320	Ether / IP / TCP 52.16.218.208:https > 192.168.125.179:61228 PA / Raw
----------------------------------------
23.5560	Atac: NORMAL	85.75%
62	192.168.125.179:61228	52.16.218.208:443	6	54	Ether / IP / TCP 192.168.125.179:61228 > 52.16.218.208:https A
----------------------------------------
23.6270	Atac: NORMAL	85.75%
64	192.168.125.179:64067	150.171.27.11:443	6	55	Ether / IP / TCP 192.168.125.179:64067 > 150.171.27.11:https A / Raw
----------------------------------------
23.6970	Atac: NORMAL	85.75%
65	150.171.27.11:443	192.168.125.179:64067	6	66	Ether / IP / TCP 150.171.27.11:https > 192.168.125.179:64067 A
----------------------------------------
24.4948	Eroare: main thread is not in main loop	0.00%
66	192.168.125.179:137	192.168.125.255:137	17	92	Ether / IP / UDP / NBNSHeader / NBNSQueryRequest who has '\\DESKTOP-H45KHRK'
----------------------------------------
25.9914	Eroare: main thread is not in main loop	0.00%
66	192.168.125.179:64066	3.160.246.23:443	6	55	Ether / IP / TCP 192.168.125.179:64066 > 3.160.246.23:https A / Raw
----------------------------------------
30.3593	Eroare: main thread is not in main loop	0.00%
66	192.168.125.179:63345	185.60.218.53:5222	6	123	Ether / IP / TCP 192.168.125.179:63345 > 185.60.218.53:5222 PA / Raw
----------------------------------------
31.4861	Eroare: main thread is not in main loop	0.00%
66	192.168.125.179:62651	52.123.134.246:443	6	105	Ether / IP / TCP 192.168.125.179:62651 > 52.123.134.246:https PA / Raw
----------------------------------------
32.6996	Eroare: main thread is not in main loop	0.00%
66	34.120.195.249:443	192.168.125.179:63981	6	66	Ether / IP / TCP 34.120.195.249:https > 192.168.125.179:63981 A
----------------------------------------
34.6281	Eroare: main thread is not in main loop	0.00%
66	192.168.125.179:56463	192.168.125.213:53	17	88	Ether / IP / UDP / DNS Qry b'ab-merchandise.opera-api.com.'
----------------------------------------
35.7556	Eroare: main thread is not in main loop	0.00%
66	192.168.125.179:64080	185.26.182.112:443	6	54	Ether / IP / TCP 192.168.125.179:64080 > 185.26.182.112:https A
----------------------------------------
36.8535	Eroare: main thread is not in main loop	0.00%
66	52.109.89.19:443	192.168.125.179:64084	6	1354	Ether / IP / TCP 52.109.89.19:https > 192.168.125.179:64084 A / Raw
----------------------------------------
39.2934	Eroare: main thread is not in main loop	0.00%
66	192.168.125.179:64062	20.189.173.28:443	6	172	Ether / IP / TCP 192.168.125.179:64062 > 20.189.173.28:https PA / Raw
----------------------------------------
40.4277	Eroare: main thread is not in main loop	0.00%
66	20.189.173.28:443	192.168.125.179:64062	6	66	Ether / IP / TCP 20.189.173.28:https > 192.168.125.179:64062 A
----------------------------------------
42.7271	Eroare: main thread is not in main loop	0.00%
66	192.168.125.179:60273	4.208.35.46:443	6	105	Ether / IP / TCP 192.168.125.179:60273 > 4.208.35.46:https PA / Raw
----------------------------------------
46.6653	Eroare: main thread is not in main loop	0.00%
66	18.165.171.117:443	192.168.125.179:63980	6	93	Ether / IP / TCP 18.165.171.117:https > 192.168.125.179:63980 PA / Raw
----------------------------------------
48.6229	Eroare: main thread is not in main loop	0.00%
66	192.168.125.179:60374	108.177.96.188:5228	6	55	Ether / IP / TCP 192.168.125.179:60374 > 108.177.96.188:5228 A / Raw
----------------------------------------
50.3679	Eroare: main thread is not in main loop	0.00%
66	192.168.125.179:64117	185.26.182.111:443	6	66	Ether / IP / TCP 192.168.125.179:64117 > 185.26.182.111:https S
----------------------------------------
51.7998	Eroare: main thread is not in main loop	0.00%
66	162.247.241.14:443	192.168.125.179:63936	6	535	Ether / IP / TCP 162.247.241.14:https > 192.168.125.179:63936 PA / Raw
----------------------------------------
53.0755	Eroare: main thread is not in main loop	0.00%
66	52.182.143.215:443	192.168.125.179:64036	6	54	Ether / IP / TCP 52.182.143.215:https > 192.168.125.179:64036 RA
----------------------------------------
55.3094	Eroare: main thread is not in main loop	0.00%
66	18.165.171.117:443	192.168.125.179:63976	6	93	Ether / IP / TCP 18.165.171.117:https > 192.168.125.179:63976 PA / Raw
----------------------------------------
58.3643	Eroare: main thread is not in main loop	0.00%
66	192.168.125.179:63345	185.60.218.53:5222	6	123	Ether / IP / TCP 192.168.125.179:63345 > 185.60.218.53:5222 PA / Raw
----------------------------------------
60.3310	Eroare: main thread is not in main loop	0.00%
66	192.168.125.179:137	192.168.125.255:137	17	92	Ether / IP / UDP / NBNSHeader / NBNSQueryRequest who has '\\DESKTOP-H45KHRK'
----------------------------------------
61.8498	Eroare: main thread is not in main loop	0.00%
66	192.168.125.179:137	192.168.125.255:137	17	92	Ether / IP / UDP / NBNSHeader / NBNSQueryRequest who has '\\DESKTOP-H45KHRK'
----------------------------------------
67.1460	Eroare: main thread is not in main loop	0.00%
66	162.247.241.14:443	192.168.125.179:63936	6	54	Ether / IP / TCP 162.247.241.14:https > 192.168.125.179:63936 A
----------------------------------------
70.6015	Eroare: main thread is not in main loop	0.00%
66	192.168.125.179:60242	52.123.200.36:443	6	112	Ether / IP / TCP 192.168.125.179:60242 > 52.123.200.36:https PA / Raw
----------------------------------------
75.6375	Eroare: main thread is not in main loop	0.00%
66	185.60.218.53:5222	192.168.125.179:63345	6	124	Ether / IP / TCP 185.60.218.53:5222 > 192.168.125.179:63345 PA / Raw
----------------------------------------
76.7320	Eroare: main thread is not in main loop	0.00%
66	52.123.134.246:443	192.168.125.179:62718	6	94	Ether / IP / TCP 52.123.134.246:https > 192.168.125.179:62718 PA / Raw
----------------------------------------
80.5785	Eroare: main thread is not in main loop	0.00%
66	192.168.125.179:63985	40.99.148.82:443	6	55	Ether / IP / TCP 192.168.125.179:63985 > 40.99.148.82:https A / Raw
----------------------------------------
82.2808	Eroare: main thread is not in main loop	0.00%
66	192.168.125.179:64074	150.171.27.11:443	6	55	Ether / IP / TCP 192.168.125.179:64074 > 150.171.27.11:https A / Raw
----------------------------------------
85.4380	Eroare: main thread is not in main loop	0.00%
66	192.168.125.179:64062	20.189.173.28:443	6	55	Ether / IP / TCP 192.168.125.179:64062 > 20.189.173.28:https A / Raw
----------------------------------------
87.3617	Eroare: main thread is not in main loop	0.00%
66	192.168.125.179:61228	52.16.218.208:443	6	298	Ether / IP / TCP 192.168.125.179:61228 > 52.16.218.208:https PA / Raw
----------------------------------------
88.5095	Eroare: main thread is not in main loop	0.00%
66	185.60.218.53:5222	192.168.125.179:63345	6	54	Ether / IP / TCP 185.60.218.53:5222 > 192.168.125.179:63345 A
----------------------------------------
93.4111	Eroare: main thread is not in main loop	0.00%
66	192.168.125.179:57800	192.168.125.213:53	17	74	Ether / IP / UDP / DNS Qry b'login.live.com.'
----------------------------------------
94.5714	Eroare: main thread is not in main loop	0.00%
66	192.168.125.179:55589	192.168.125.213:53	17	89	Ether / IP / UDP / DNS Qry b'v10.events.data.microsoft.com.'
----------------------------------------
95.7491	Eroare: main thread is not in main loop	0.00%
66	52.168.117.171:443	192.168.125.179:64126	6	54	Ether / IP / TCP 52.168.117.171:https > 192.168.125.179:64126 A
----------------------------------------
96.8762	Eroare: main thread is not in main loop	0.00%
66	162.247.241.14:443	192.168.125.179:63936	6	66	Ether / IP / TCP 162.247.241.14:https > 192.168.125.179:63936 A
----------------------------------------
100.8140	Eroare: main thread is not in main loop	0.00%
66	185.26.182.118:443	192.168.125.179:64081	6	93	Ether / IP / TCP 185.26.182.118:https > 192.168.125.179:64081 PA / Raw
----------------------------------------
102.0287	Eroare: main thread is not in main loop	0.00%
66	185.26.182.112:443	192.168.125.179:64080	6	78	Ether / IP / TCP 185.26.182.112:https > 192.168.125.179:64080 FPA / Raw
----------------------------------------
103.3478	Eroare: main thread is not in main loop	0.00%
66	192.168.125.179:61228	52.16.218.208:443	6	297	Ether / IP / TCP 192.168.125.179:61228 > 52.16.218.208:https PA / Raw
----------------------------------------
107.3577	Eroare: main thread is not in main loop	0.00%
66	192.168.125.179:63345	185.60.218.53:5222	6	123	Ether / IP / TCP 192.168.125.179:63345 > 185.60.218.53:5222 PA / Raw
----------------------------------------
111.2607	Eroare: main thread is not in main loop	0.00%
66	192.168.125.179:137	192.168.125.255:137	17	92	Ether / IP / UDP / NBNSHeader / NBNSQueryRequest who has '\\DESKTOP-H45KHRK'
----------------------------------------
114.7322	Eroare: main thread is not in main loop	0.00%
66	185.60.218.53:5222	192.168.125.179:63345	6	188	Ether / IP / TCP 185.60.218.53:5222 > 192.168.125.179:63345 PA / Raw
----------------------------------------
115.8524	Eroare: main thread is not in main loop	0.00%
66	185.26.182.111:443	192.168.125.179:64117	6	93	Ether / IP / TCP 185.26.182.111:https > 192.168.125.179:64117 PA / Raw
----------------------------------------
117.4898	Eroare: main thread is not in main loop	0.00%
66	150.171.27.11:443	192.168.125.179:64074	6	54	Ether / IP / TCP 150.171.27.11:https > 192.168.125.179:64074 RA
----------------------------------------
119.3587	Eroare: main thread is not in main loop	0.00%
66	192.168.125.179:61228	52.16.218.208:443	6	298	Ether / IP / TCP 192.168.125.179:61228 > 52.16.218.208:https PA / Raw
----------------------------------------
122.6871	Eroare: main thread is not in main loop	0.00%
66	192.168.125.179:137	192.168.125.255:137	17	92	Ether / IP / UDP / NBNSHeader / NBNSQueryRequest who has '\\DESKTOP-H45KHRK'
----------------------------------------
124.2024	Eroare: main thread is not in main loop	0.00%
66	192.168.125.179:137	192.168.125.255:137	17	92	Ether / IP / UDP / NBNSHeader / NBNSQueryRequest who has '\\DESKTOP-H45KHRK'
----------------------------------------
125.6409	Eroare: main thread is not in main loop	0.00%
66	192.168.125.179:63985	40.99.148.82:443	6	55	Ether / IP / TCP 192.168.125.179:63985 > 40.99.148.82:https A / Raw
----------------------------------------
126.8087	Eroare: main thread is not in main loop	0.00%
66	172.161.47.103:443	192.168.125.179:61334	6	66	Ether / IP / TCP 172.161.47.103:https > 192.168.125.179:61334 A
----------------------------------------
130.7250	Eroare: main thread is not in main loop	0.00%
66	192.168.125.179:64062	20.189.173.28:443	6	55	Ether / IP / TCP 192.168.125.179:64062 > 20.189.173.28:https A / Raw
----------------------------------------
135.3619	Eroare: main thread is not in main loop	0.00%
66	192.168.125.179:61228	52.16.218.208:443	6	297	Ether / IP / TCP 192.168.125.179:61228 > 52.16.218.208:https PA / Raw
----------------------------------------
138.9577	Eroare: main thread is not in main loop	0.00%
66	192.168.125.179:60374	108.177.96.188:5228	6	55	Ether / IP / TCP 192.168.125.179:60374 > 108.177.96.188:5228 A / Raw
----------------------------------------
140.1205	Eroare: main thread is not in main loop	0.00%
66	192.168.125.213:53	192.168.125.179:63985	17	91	Ether / IP / UDP / DNS Ans 142.250.187.131
----------------------------------------
143.0023	Eroare: main thread is not in main loop	0.00%
66	162.247.241.14:443	192.168.125.179:63936	6	54	Ether / IP / TCP 162.247.241.14:https > 192.168.125.179:63936 A
----------------------------------------
148.3561	Eroare: main thread is not in main loop	0.00%
66	192.168.125.179:63345	185.60.218.53:5222	6	123	Ether / IP / TCP 192.168.125.179:63345 > 185.60.218.53:5222 PA / Raw
----------------------------------------
151.3593	Eroare: main thread is not in main loop	0.00%
66	192.168.125.179:61228	52.16.218.208:443	6	298	Ether / IP / TCP 192.168.125.179:61228 > 52.16.218.208:https PA / Raw
----------------------------------------
156.6016	Eroare: main thread is not in main loop	0.00%
66	192.168.125.179:62718	52.123.134.246:443	6	105	Ether / IP / TCP 192.168.125.179:62718 > 52.123.134.246:https PA / Raw
----------------------------------------
161.4837	Eroare: main thread is not in main loop	0.00%
66	192.168.125.179:64066	3.160.246.23:443	6	55	Ether / IP / TCP 192.168.125.179:64066 > 3.160.246.23:https A / Raw
----------------------------------------
162.6560	Eroare: main thread is not in main loop	0.00%
66	216.58.212.10:443	192.168.125.179:61879	17	63	Ether / IP / UDP 216.58.212.10:https > 192.168.125.179:61879 / Raw
----------------------------------------
165.3497	Eroare: main thread is not in main loop	0.00%
66	192.168.125.179:56150	142.250.187.131:443	17	145	Ether / IP / UDP 192.168.125.179:56150 > 142.250.187.131:https / Raw
----------------------------------------
167.3522	Eroare: main thread is not in main loop	0.00%
66	192.168.125.179:61228	52.16.218.208:443	6	298	Ether / IP / TCP 192.168.125.179:61228 > 52.16.218.208:https PA / Raw
----------------------------------------
170.3610	Eroare: main thread is not in main loop	0.00%
66	192.168.125.179:63345	185.60.218.53:5222	6	123	Ether / IP / TCP 192.168.125.179:63345 > 185.60.218.53:5222 PA / Raw
----------------------------------------
171.7915	Eroare: main thread is not in main loop	0.00%
66	162.247.241.14:443	192.168.125.179:63936	6	535	Ether / IP / TCP 162.247.241.14:https > 192.168.125.179:63936 PA / Raw
----------------------------------------
173.8265	Eroare: main thread is not in main loop	0.00%
66	52.16.218.208:443	192.168.125.179:61228	6	78	Ether / IP / TCP 52.16.218.208:https > 192.168.125.179:61228 PA / Raw
----------------------------------------
174.9439	Eroare: main thread is not in main loop	0.00%
66	20.189.172.73:443	192.168.125.179:64130	6	153	Ether / IP / TCP 20.189.172.73:https > 192.168.125.179:64130 PA / Raw
----------------------------------------
177.4861	Eroare: main thread is not in main loop	0.00%
66	192.168.125.179:64132	20.189.172.73:443	6	66	Ether / IP / TCP 192.168.125.179:64132 > 20.189.172.73:https S
----------------------------------------
178.7645	Eroare: main thread is not in main loop	0.00%
66	20.189.172.73:443	192.168.125.179:64132	6	157	Ether / IP / TCP 20.189.172.73:https > 192.168.125.179:64132 PA / Raw
----------------------------------------
180.1066	Eroare: main thread is not in main loop	0.00%
66	20.189.172.73:443	192.168.125.179:64134	6	66	Ether / IP / TCP 20.189.172.73:https > 192.168.125.179:64134 SA
----------------------------------------
182.1229	Eroare: main thread is not in main loop	0.00%
66	192.168.125.179:64136	20.189.172.73:443	6	66	Ether / IP / TCP 192.168.125.179:64136 > 20.189.172.73:https S
----------------------------------------
183.3530	Eroare: main thread is not in main loop	0.00%
66	192.168.125.179:61228	52.16.218.208:443	6	298	Ether / IP / TCP 192.168.125.179:61228 > 52.16.218.208:https PA / Raw
----------------------------------------
185.2107	Eroare: main thread is not in main loop	0.00%
66	192.168.125.179:61634	192.168.125.213:53	17	101	Ether / IP / UDP / DNS Qry b'westus-0.in.applicationinsights.azure.com.'
----------------------------------------
186.3996	Eroare: main thread is not in main loop	0.00%
66	20.189.172.73:443	192.168.125.179:64138	6	54	Ether / IP / TCP 20.189.172.73:https > 192.168.125.179:64138 A
----------------------------------------
187.6876	Eroare: main thread is not in main loop	0.00%
66	192.168.125.179:137	192.168.125.255:137	17	92	Ether / IP / UDP / NBNSHeader / NBNSQueryRequest who has '\\DESKTOP-H45KHRK'
----------------------------------------
188.9170	Eroare: main thread is not in main loop	0.00%
66	20.189.172.73:443	192.168.125.179:64140	6	157	Ether / IP / TCP 20.189.172.73:https > 192.168.125.179:64140 PA / Raw
----------------------------------------
190.0339	Eroare: main thread is not in main loop	0.00%
66	140.82.121.6:443	192.168.125.179:64141	6	1354	Ether / IP / TCP 140.82.121.6:https > 192.168.125.179:64141 A / Raw
----------------------------------------
191.2549	Eroare: main thread is not in main loop	0.00%
66	20.189.172.73:443	192.168.125.179:64143	6	157	Ether / IP / TCP 20.189.172.73:https > 192.168.125.179:64143 PA / Raw
----------------------------------------
192.3655	Eroare: main thread is not in main loop	0.00%
66	192.168.125.179:64146	13.107.42.16:443	6	54	Ether / IP / TCP 192.168.125.179:64146 > 13.107.42.16:https A
----------------------------------------
194.8042	Eroare: main thread is not in main loop	0.00%
66	192.168.125.179:137	192.168.125.255:137	17	92	Ether / IP / UDP / NBNSHeader / NBNSQueryRequest who has '\\DESKTOP-H45KHRK'
----------------------------------------
196.3262	Eroare: main thread is not in main loop	0.00%
66	192.168.125.179:137	192.168.125.255:137	17	92	Ether / IP / UDP / NBNSHeader / NBNSQueryRequest who has '\\DESKTOP-H45KHRK'
----------------------------------------
199.3539	Eroare: main thread is not in main loop	0.00%
66	192.168.125.179:61228	52.16.218.208:443	6	298	Ether / IP / TCP 192.168.125.179:61228 > 52.16.218.208:https PA / Raw
----------------------------------------
200.9049	Eroare: main thread is not in main loop	0.00%
66	51.116.246.105:443	192.168.125.179:64118	6	54	Ether / IP / TCP 51.116.246.105:https > 192.168.125.179:64118 RA
----------------------------------------
202.2895	Eroare: main thread is not in main loop	0.00%
66	162.247.241.14:443	192.168.125.179:63936	6	54	Ether / IP / TCP 162.247.241.14:https > 192.168.125.179:63936 A
----------------------------------------
203.4230	Eroare: main thread is not in main loop	0.00%
66	192.168.125.179:64125	23.67.160.244:80	6	54	Ether / IP / TCP 192.168.125.179:64125 > 23.67.160.244:http FA
----------------------------------------
204.5706	Eroare: main thread is not in main loop	0.00%
66	140.82.112.22:443	192.168.125.179:64148	6	66	Ether / IP / TCP 140.82.112.22:https > 192.168.125.179:64148 SA
----------------------------------------
210.5341	Eroare: main thread is not in main loop	0.00%
66	192.168.125.179:137	192.168.125.255:137	17	92	Ether / IP / UDP / NBNSHeader / NBNSQueryRequest who has '\\DESKTOP-H45KHRK'
----------------------------------------
212.0585	Eroare: main thread is not in main loop	0.00%
66	192.168.125.179:137	192.168.125.255:137	17	92	Ether / IP / UDP / NBNSHeader / NBNSQueryRequest who has '\\DESKTOP-H45KHRK'
----------------------------------------
215.3504	Eroare: main thread is not in main loop	0.00%
66	192.168.125.179:61228	52.16.218.208:443	6	297	Ether / IP / TCP 192.168.125.179:61228 > 52.16.218.208:https PA / Raw
----------------------------------------
216.7989	Eroare: main thread is not in main loop	0.00%
66	192.168.125.179:63936	162.247.241.14:443	6	55	Ether / IP / TCP 192.168.125.179:63936 > 162.247.241.14:https A / Raw
----------------------------------------
220.4373	Eroare: main thread is not in main loop	0.00%
66	140.82.121.6:443	192.168.125.179:64141	6	93	Ether / IP / TCP 140.82.121.6:https > 192.168.125.179:64141 PA / Raw
----------------------------------------
222.3589	Eroare: main thread is not in main loop	0.00%
66	192.168.125.179:63345	185.60.218.53:5222	6	123	Ether / IP / TCP 192.168.125.179:63345 > 185.60.218.53:5222 PA / Raw
----------------------------------------
226.8008	Eroare: main thread is not in main loop	0.00%
66	192.168.125.179:60374	108.177.96.188:5228	6	80	Ether / IP / TCP 192.168.125.179:60374 > 108.177.96.188:5228 PA / Raw
----------------------------------------
231.3653	Eroare: main thread is not in main loop	0.00%
66	192.168.125.179:61228	52.16.218.208:443	6	298	Ether / IP / TCP 192.168.125.179:61228 > 52.16.218.208:https PA / Raw
----------------------------------------
235.8780	Eroare: main thread is not in main loop	0.00%
66	192.168.125.179:60242	52.123.200.36:443	6	112	Ether / IP / TCP 192.168.125.179:60242 > 52.123.200.36:https PA / Raw
----------------------------------------
240.3641	Eroare: main thread is not in main loop	0.00%
66	192.168.125.179:63345	185.60.218.53:5222	6	123	Ether / IP / TCP 192.168.125.179:63345 > 185.60.218.53:5222 PA / Raw
----------------------------------------
242.7248	Eroare: main thread is not in main loop	0.00%
66	192.168.125.179:60273	4.208.35.46:443	6	105	Ether / IP / TCP 192.168.125.179:60273 > 4.208.35.46:https PA / Raw
----------------------------------------
247.3568	Eroare: main thread is not in main loop	0.00%
66	192.168.125.179:61228	52.16.218.208:443	6	298	Ether / IP / TCP 192.168.125.179:61228 > 52.16.218.208:https PA / Raw
----------------------------------------
257.5805	Eroare: main thread is not in main loop	0.00%
66	185.60.218.53:5222	192.168.125.179:63345	6	460	Ether / IP / TCP 185.60.218.53:5222 > 192.168.125.179:63345 PA / Raw
----------------------------------------
258.9127	Eroare: main thread is not in main loop	0.00%
66	185.60.218.53:5222	192.168.125.179:63345	6	508	Ether / IP / TCP 185.60.218.53:5222 > 192.168.125.179:63345 PA / Raw
----------------------------------------
262.1879	Eroare: main thread is not in main loop	0.00%
66	172.161.47.103:443	192.168.125.179:61334	6	66	Ether / IP / TCP 172.161.47.103:https > 192.168.125.179:61334 A
----------------------------------------
263.3564	Eroare: main thread is not in main loop	0.00%
66	192.168.125.179:61228	52.16.218.208:443	6	298	Ether / IP / TCP 192.168.125.179:61228 > 52.16.218.208:https PA / Raw
----------------------------------------
264.4578	Eroare: main thread is not in main loop	0.00%
66	192.168.125.179:64149	108.141.37.120:443	6	147	Ether / IP / TCP 192.168.125.179:64149 > 108.141.37.120:https PA / Raw
----------------------------------------
268.2266	Eroare: main thread is not in main loop	0.00%
66	185.60.218.53:5222	192.168.125.179:63345	6	439	Ether / IP / TCP 185.60.218.53:5222 > 192.168.125.179:63345 PA / Raw
----------------------------------------
269.4466	Eroare: main thread is not in main loop	0.00%
66	192.168.125.179:63345	185.60.218.53:5222	6	123	Ether / IP / TCP 192.168.125.179:63345 > 185.60.218.53:5222 PA / Raw
----------------------------------------
271.4799	Eroare: main thread is not in main loop	0.00%
66	192.168.125.179:62651	52.123.134.246:443	6	105	Ether / IP / TCP 192.168.125.179:62651 > 52.123.134.246:https PA / Raw
----------------------------------------
275.6261	Eroare: main thread is not in main loop	0.00%
66	185.60.218.53:5222	192.168.125.179:63345	6	541	Ether / IP / TCP 185.60.218.53:5222 > 192.168.125.179:63345 PA / Raw
----------------------------------------
276.7282	Eroare: main thread is not in main loop	0.00%
66	52.123.134.246:443	192.168.125.179:62718	6	94	Ether / IP / TCP 52.123.134.246:https > 192.168.125.179:62718 PA / Raw
----------------------------------------
279.3539	Eroare: main thread is not in main loop	0.00%
66	192.168.125.179:61228	52.16.218.208:443	6	298	Ether / IP / TCP 192.168.125.179:61228 > 52.16.218.208:https PA / Raw
----------------------------------------
281.2837	Eroare: main thread is not in main loop	0.00%
66	192.168.125.179:64144	140.82.112.22:443	6	55	Ether / IP / TCP 192.168.125.179:64144 > 140.82.112.22:https A / Raw
----------------------------------------
282.5327	Eroare: main thread is not in main loop	0.00%
66	192.168.125.179:63815	142.4.216.103:443	6	85	Ether / IP / TCP 192.168.125.179:63815 > 142.4.216.103:https FPA / Raw
----------------------------------------
284.0661	Eroare: main thread is not in main loop	0.00%
66	192.168.125.179:63815	142.4.216.103:443	6	85	Ether / IP / TCP 192.168.125.179:63815 > 142.4.216.103:https FPA / Raw
----------------------------------------
286.0857	Eroare: main thread is not in main loop	0.00%
66	192.168.125.179:63815	142.4.216.103:443	6	85	Ether / IP / TCP 192.168.125.179:63815 > 142.4.216.103:https FPA / Raw
----------------------------------------
290.1278	Eroare: main thread is not in main loop	0.00%
66	192.168.125.179:63815	142.4.216.103:443	6	85	Ether / IP / TCP 192.168.125.179:63815 > 142.4.216.103:https FPA / Raw
----------------------------------------
291.3514	Eroare: main thread is not in main loop	0.00%
66	192.168.125.179:63936	162.247.241.14:443	6	1055	Ether / IP / TCP 192.168.125.179:63936 > 162.247.241.14:https PA / Raw
----------------------------------------
293.8222	Eroare: main thread is not in main loop	0.00%
66	52.16.218.208:443	192.168.125.179:61228	6	78	Ether / IP / TCP 52.16.218.208:https > 192.168.125.179:61228 PA / Raw
----------------------------------------
295.3595	Eroare: main thread is not in main loop	0.00%
66	192.168.125.179:61228	52.16.218.208:443	6	298	Ether / IP / TCP 192.168.125.179:61228 > 52.16.218.208:https PA / Raw
----------------------------------------
298.2005	Eroare: main thread is not in main loop	0.00%
66	192.168.125.179:63815	142.4.216.103:443	6	85	Ether / IP / TCP 192.168.125.179:63815 > 142.4.216.103:https FPA / Raw
----------------------------------------
307.2037	Eroare: main thread is not in main loop	0.00%
66	192.168.125.179:61334	172.161.47.103:443	6	55	Ether / IP / TCP 192.168.125.179:61334 > 172.161.47.103:https A / Raw
----------------------------------------
311.0269	Eroare: main thread is not in main loop	0.00%
66	140.82.112.22:443	192.168.125.179:64144	6	93	Ether / IP / TCP 140.82.112.22:https > 192.168.125.179:64144 PA / Raw
----------------------------------------
314.3303	Eroare: main thread is not in main loop	0.00%
66	192.168.125.179:63815	142.4.216.103:443	6	54	Ether / IP / TCP 192.168.125.179:63815 > 142.4.216.103:https RA
----------------------------------------
316.1490	Eroare: main thread is not in main loop	0.00%
66	185.60.218.53:5222	192.168.125.179:63345	6	525	Ether / IP / TCP 185.60.218.53:5222 > 192.168.125.179:63345 PA / Raw
----------------------------------------
321.8744	Eroare: main thread is not in main loop	0.00%
66	172.161.47.103:443	192.168.125.179:61334	6	113	Ether / IP / TCP 172.161.47.103:https > 192.168.125.179:61334 PA / Raw
----------------------------------------
324.5708	Eroare: main thread is not in main loop	0.00%
66	185.60.218.53:5222	192.168.125.179:63345	6	1354	Ether / IP / TCP 185.60.218.53:5222 > 192.168.125.179:63345 A / Raw
----------------------------------------
327.3584	Eroare: main thread is not in main loop	0.00%
66	192.168.125.179:61228	52.16.218.208:443	6	298	Ether / IP / TCP 192.168.125.179:61228 > 52.16.218.208:https PA / Raw
----------------------------------------
330.7615	Eroare: main thread is not in main loop	0.00%
66	192.168.125.179:54728	192.168.125.213:53	17	81	Ether / IP / UDP / DNS Qry b'events.gfe.nvidia.com.'
----------------------------------------
333.0139	Eroare: main thread is not in main loop	0.00%
66	192.168.125.179:60055	20.199.120.151:443	6	55	Ether / IP / TCP 192.168.125.179:60055 > 20.199.120.151:https A / Raw
----------------------------------------
335.4571	Eroare: main thread is not in main loop	0.00%
66	192.168.125.179:58006	192.168.125.213:53	17	87	Ether / IP / UDP / DNS Qry b'prod.otel.kaizen.nvidia.com.'
----------------------------------------
336.7949	Eroare: main thread is not in main loop	0.00%
66	192.168.125.179:63936	162.247.241.14:443	6	55	Ether / IP / TCP 192.168.125.179:63936 > 162.247.241.14:https A / Raw
----------------------------------------
343.3554	Eroare: main thread is not in main loop	0.00%
66	192.168.125.179:61228	52.16.218.208:443	6	298	Ether / IP / TCP 192.168.125.179:61228 > 52.16.218.208:https PA / Raw
----------------------------------------
344.4417	Eroare: main thread is not in main loop	0.00%
66	185.60.218.53:5222	192.168.125.179:63345	6	439	Ether / IP / TCP 185.60.218.53:5222 > 192.168.125.179:63345 PA / Raw
----------------------------------------
346.0798	Eroare: main thread is not in main loop	0.00%
66	192.168.125.179:62799	52.123.200.36:443	6	111	Ether / IP / TCP 192.168.125.179:62799 > 52.123.200.36:https PA / Raw
----------------------------------------
351.0368	Eroare: main thread is not in main loop	0.00%
66	192.168.125.179:50539	192.168.125.213:53	17	74	Ether / IP / UDP / DNS Qry b'ecs.office.com.'
----------------------------------------
352.2621	Eroare: main thread is not in main loop	0.00%
66	162.247.241.14:443	192.168.125.179:63936	6	535	Ether / IP / TCP 162.247.241.14:https > 192.168.125.179:63936 PA / Raw
----------------------------------------
355.4036	Eroare: main thread is not in main loop	0.00%
66	185.60.218.53:5222	192.168.125.179:63345	6	54	Ether / IP / TCP 185.60.218.53:5222 > 192.168.125.179:63345 A
----------------------------------------
356.6057	Eroare: main thread is not in main loop	0.00%
66	192.168.125.179:62718	52.123.134.246:443	6	105	Ether / IP / TCP 192.168.125.179:62718 > 52.123.134.246:https PA / Raw
----------------------------------------
358.8126	Eroare: main thread is not in main loop	0.00%
66	185.60.218.53:5222	192.168.125.179:63345	6	1354	Ether / IP / TCP 185.60.218.53:5222 > 192.168.125.179:63345 A / Raw
----------------------------------------
362.1881	Eroare: main thread is not in main loop	0.00%
66	192.168.125.179:60374	108.177.96.188:5228	6	55	Ether / IP / TCP 192.168.125.179:60374 > 108.177.96.188:5228 A / Raw
----------------------------------------
363.6744	Eroare: main thread is not in main loop	0.00%
66	192.168.125.179:137	192.168.125.255:137	17	92	Ether / IP / UDP / NBNSHeader / NBNSQueryRequest who has '\\DESKTOP-H45KHRK'
----------------------------------------
365.2056	Eroare: main thread is not in main loop	0.00%
66	192.168.125.179:137	192.168.125.255:137	17	92	Ether / IP / UDP / NBNSHeader / NBNSQueryRequest who has '\\DESKTOP-H45KHRK'
----------------------------------------
367.0090	Eroare: main thread is not in main loop	0.00%
66	192.168.125.179:61334	172.161.47.103:443	6	55	Ether / IP / TCP 192.168.125.179:61334 > 172.161.47.103:https A / Raw
----------------------------------------
373.3606	Eroare: main thread is not in main loop	0.00%
66	192.168.125.179:63345	185.60.218.53:5222	6	467	Ether / IP / TCP 192.168.125.179:63345 > 185.60.218.53:5222 PA / Raw
----------------------------------------
375.3652	Eroare: main thread is not in main loop	0.00%
66	192.168.125.179:61228	52.16.218.208:443	6	298	Ether / IP / TCP 192.168.125.179:61228 > 52.16.218.208:https PA / Raw
----------------------------------------
378.3568	Eroare: main thread is not in main loop	0.00%
66	192.168.125.179:63345	185.60.218.53:5222	6	123	Ether / IP / TCP 192.168.125.179:63345 > 185.60.218.53:5222 PA / Raw
----------------------------------------
383.3284	Eroare: main thread is not in main loop	0.00%
66	162.247.241.14:443	192.168.125.179:63936	6	54	Ether / IP / TCP 162.247.241.14:https > 192.168.125.179:63936 A
----------------------------------------
391.3510	Eroare: main thread is not in main loop	0.00%
66	192.168.125.179:61228	52.16.218.208:443	6	298	Ether / IP / TCP 192.168.125.179:61228 > 52.16.218.208:https PA / Raw
----------------------------------------
395.0089	Eroare: main thread is not in main loop	0.00%
66	192.168.125.179:51865	192.168.125.213:53	17	91	Ether / IP / UDP / DNS Qry b'teams.events.data.microsoft.com.'
----------------------------------------
396.1272	Eroare: main thread is not in main loop	0.00%
66	192.168.125.179:64153	52.168.112.66:443	6	54	Ether / IP / TCP 192.168.125.179:64153 > 52.168.112.66:https A
----------------------------------------
397.2762	Eroare: main thread is not in main loop	0.00%
66	192.168.125.179:63936	162.247.241.14:443	6	55	Ether / IP / TCP 192.168.125.179:63936 > 162.247.241.14:https A / Raw
----------------------------------------
401.1833	Eroare: main thread is not in main loop	0.00%
66	192.168.125.179:60242	52.123.200.36:443	6	112	Ether / IP / TCP 192.168.125.179:60242 > 52.123.200.36:https PA / Raw
----------------------------------------
402.7279	Eroare: main thread is not in main loop	0.00%
66	192.168.125.179:60273	4.208.35.46:443	6	105	Ether / IP / TCP 192.168.125.179:60273 > 4.208.35.46:https PA / Raw
----------------------------------------
404.0434	Eroare: main thread is not in main loop	0.00%
66	192.168.125.179:137	192.168.125.255:137	17	92	Ether / IP / UDP / NBNSHeader / NBNSQueryRequest who has '\\DESKTOP-H45KHRK'
----------------------------------------
405.5619	Eroare: main thread is not in main loop	0.00%
66	192.168.125.179:137	192.168.125.255:137	17	92	Ether / IP / UDP / NBNSHeader / NBNSQueryRequest who has '\\DESKTOP-H45KHRK'
----------------------------------------
407.3522	Eroare: main thread is not in main loop	0.00%
66	192.168.125.179:60374	108.177.96.188:5228	6	55	Ether / IP / TCP 192.168.125.179:60374 > 108.177.96.188:5228 A / Raw
----------------------------------------
411.3569	Eroare: main thread is not in main loop	0.00%
66	192.168.125.179:63936	162.247.241.14:443	6	1055	Ether / IP / TCP 192.168.125.179:63936 > 162.247.241.14:https PA / Raw
----------------------------------------
413.8352	Eroare: main thread is not in main loop	0.00%
66	52.16.218.208:443	192.168.125.179:61228	6	78	Ether / IP / TCP 52.16.218.208:https > 192.168.125.179:61228 PA / Raw
----------------------------------------
423.3779	Eroare: main thread is not in main loop	0.00%
66	192.168.125.179:61228	52.16.218.208:443	6	298	Ether / IP / TCP 192.168.125.179:61228 > 52.16.218.208:https PA / Raw
----------------------------------------
426.5579	Eroare: main thread is not in main loop	0.00%
66	192.168.125.179:62718	192.168.125.213:53	17	80	Ether / IP / UDP / DNS Qry b'autoupdate.opera.com.'
----------------------------------------
428.4360	Eroare: main thread is not in main loop	0.00%
66	185.60.218.53:5222	192.168.125.179:63345	6	229	Ether / IP / TCP 185.60.218.53:5222 > 192.168.125.179:63345 PA / Raw
----------------------------------------
431.4821	Eroare: main thread is not in main loop	0.00%
66	192.168.125.179:62651	52.123.134.246:443	6	105	Ether / IP / TCP 192.168.125.179:62651 > 52.123.134.246:https PA / Raw
----------------------------------------
435.7382	Eroare: main thread is not in main loop	0.00%
66	192.168.125.179:63206	192.168.125.213:53	17	79	Ether / IP / UDP / DNS Qry b'default.exp-tas.com.'
----------------------------------------
437.7821	Eroare: main thread is not in main loop	0.00%
66	192.168.125.179:50322	192.168.125.213:53	17	101	Ether / IP / UDP / DNS Qry b'westus-0.in.applicationinsights.azure.com.'
----------------------------------------
438.8962	Eroare: main thread is not in main loop	0.00%
66	13.107.5.93:443	192.168.125.179:64163	6	54	Ether / IP / TCP 13.107.5.93:https > 192.168.125.179:64163 A
----------------------------------------
440.0491	Eroare: main thread is not in main loop	0.00%
66	142.250.187.131:443	192.168.125.179:59425	17	82	Ether / IP / UDP 142.250.187.131:https > 192.168.125.179:59425 / Raw
----------------------------------------
441.2160	Eroare: main thread is not in main loop	0.00%
66	52.168.112.66:443	192.168.125.179:64153	6	66	Ether / IP / TCP 52.168.112.66:https > 192.168.125.179:64153 A
----------------------------------------
442.4026	Eroare: main thread is not in main loop	0.00%
66	162.247.241.14:443	192.168.125.179:63936	6	54	Ether / IP / TCP 162.247.241.14:https > 192.168.125.179:63936 A
----------------------------------------
444.3061	Eroare: main thread is not in main loop	0.00%
66	192.168.125.179:64164	13.107.5.93:443	6	54	Ether / IP / TCP 192.168.125.179:64164 > 13.107.5.93:https FA
----------------------------------------
448.0761	Eroare: main thread is not in main loop	0.00%
66	192.168.125.179:137	192.168.125.255:137	17	92	Ether / IP / UDP / NBNSHeader / NBNSQueryRequest who has '\\DESKTOP-H45KHRK'
----------------------------------------
449.5829	Eroare: main thread is not in main loop	0.00%
66	192.168.125.179:137	192.168.125.255:137	17	92	Ether / IP / UDP / NBNSHeader / NBNSQueryRequest who has '\\DESKTOP-H45KHRK'
----------------------------------------
452.5064	Eroare: main thread is not in main loop	0.00%
66	192.168.125.179:60374	108.177.96.188:5228	6	55	Ether / IP / TCP 192.168.125.179:60374 > 108.177.96.188:5228 A / Raw
----------------------------------------
455.3483	Eroare: main thread is not in main loop	0.00%
66	192.168.125.179:61228	52.16.218.208:443	6	297	Ether / IP / TCP 192.168.125.179:61228 > 52.16.218.208:https PA / Raw
----------------------------------------
456.4927	Eroare: main thread is not in main loop	0.00%
66	192.168.125.179:60242	52.123.200.36:443	6	54	Ether / IP / TCP 192.168.125.179:60242 > 52.123.200.36:https A
----------------------------------------
461.6728	Eroare: main thread is not in main loop	0.00%
66	74.248.74.217:443	192.168.125.179:60257	6	101	Ether / IP / TCP 74.248.74.217:https > 192.168.125.179:60257 PA / Raw
----------------------------------------
465.1306	Eroare: main thread is not in main loop	0.00%
66	192.168.125.179:59425	142.250.187.131:443	17	145	Ether / IP / UDP 192.168.125.179:59425 > 142.250.187.131:https / Raw
----------------------------------------
471.3596	Eroare: main thread is not in main loop	0.00%
66	192.168.125.179:61228	52.16.218.208:443	6	298	Ether / IP / TCP 192.168.125.179:61228 > 52.16.218.208:https PA / Raw
----------------------------------------
475.3622	Eroare: main thread is not in main loop	0.00%
66	192.168.125.179:63345	185.60.218.53:5222	6	123	Ether / IP / TCP 192.168.125.179:63345 > 185.60.218.53:5222 PA / Raw
----------------------------------------
476.6089	Eroare: main thread is not in main loop	0.00%
66	192.168.125.179:62718	52.123.134.246:443	6	105	Ether / IP / TCP 192.168.125.179:62718 > 52.123.134.246:https PA / Raw
----------------------------------------
477.8611	Eroare: main thread is not in main loop	0.00%
66	20.189.172.76:443	192.168.125.179:64170	6	66	Ether / IP / TCP 20.189.172.76:https > 192.168.125.179:64170 SA
----------------------------------------
482.7354	Eroare: main thread is not in main loop	0.00%
66	192.168.125.179:60273	4.208.35.46:443	6	105	Ether / IP / TCP 192.168.125.179:60273 > 4.208.35.46:https PA / Raw
----------------------------------------
486.2336	Eroare: main thread is not in main loop	0.00%
66	192.168.125.179:64153	52.168.112.66:443	6	55	Ether / IP / TCP 192.168.125.179:64153 > 52.168.112.66:https A / Raw
----------------------------------------
487.3510	Eroare: main thread is not in main loop	0.00%
66	192.168.125.179:61228	52.16.218.208:443	6	298	Ether / IP / TCP 192.168.125.179:61228 > 52.16.218.208:https PA / Raw
----------------------------------------
491.2526	Eroare: main thread is not in main loop	0.00%
66	52.123.128.14:443	192.168.125.179:64154	6	54	Ether / IP / TCP 52.123.128.14:https > 192.168.125.179:64154 RA
----------------------------------------
492.2719	Eroare: main thread is not in main loop	0.00%
66	13.107.42.16:443	192.168.125.179:64171	6	54	Ether / IP / TCP 13.107.42.16:https > 192.168.125.179:64171 A
----------------------------------------
495.2674	Eroare: main thread is not in main loop	0.00%
66	192.168.125.179:64800	142.250.187.131:443	17	1292	Ether / IP / UDP 192.168.125.179:64800 > 142.250.187.131:https / Raw
----------------------------------------
497.6068	Eroare: main thread is not in main loop	0.00%
66	192.168.125.179:60374	108.177.96.188:5228	6	55	Ether / IP / TCP 192.168.125.179:60374 > 108.177.96.188:5228 A / Raw
----------------------------------------
502.4782	Eroare: main thread is not in main loop	0.00%
66	192.168.125.179:61334	172.161.47.103:443	6	55	Ether / IP / TCP 192.168.125.179:61334 > 172.161.47.103:https A / Raw
----------------------------------------
511.4472	Eroare: main thread is not in main loop	0.00%
66	192.168.125.179:62799	52.123.200.36:443	6	111	Ether / IP / TCP 192.168.125.179:62799 > 52.123.200.36:https PA / Raw
----------------------------------------
513.3221	Eroare: main thread is not in main loop	0.00%
66	192.168.125.179:55455	192.168.125.213:53	17	85	Ether / IP / UDP / DNS Qry b'login.microsoftonline.com.'
----------------------------------------
514.3722	Eroare: main thread is not in main loop	0.00%
66	192.168.125.213:53	192.168.125.179:55062	17	207	Ether / IP / UDP / DNS Ans b'ags.privatelink.msidentity.com.'
----------------------------------------
515.4599	Eroare: main thread is not in main loop	0.00%
66	20.190.147.12:443	192.168.125.179:64175	6	92	Ether / IP / TCP 20.190.147.12:https > 192.168.125.179:64175 PA / Raw
----------------------------------------
516.5951	Eroare: main thread is not in main loop	0.00%
66	192.168.125.179:62718	52.123.134.246:443	6	105	Ether / IP / TCP 192.168.125.179:62718 > 52.123.134.246:https PA / Raw
----------------------------------------
519.3584	Eroare: main thread is not in main loop	0.00%
66	192.168.125.179:61228	52.16.218.208:443	6	298	Ether / IP / TCP 192.168.125.179:61228 > 52.16.218.208:https PA / Raw
----------------------------------------
522.7323	Eroare: main thread is not in main loop	0.00%
66	192.168.125.179:60273	4.208.35.46:443	6	105	Ether / IP / TCP 192.168.125.179:60273 > 4.208.35.46:https PA / Raw
----------------------------------------
528.3533	Eroare: main thread is not in main loop	0.00%
66	192.168.125.179:63345	185.60.218.53:5222	6	123	Ether / IP / TCP 192.168.125.179:63345 > 185.60.218.53:5222 PA / Raw
----------------------------------------
531.3495	Eroare: main thread is not in main loop	0.00%
66	192.168.125.179:63936	162.247.241.14:443	6	1055	Ether / IP / TCP 192.168.125.179:63936 > 162.247.241.14:https PA / Raw
----------------------------------------
533.8613	Eroare: main thread is not in main loop	0.00%
66	52.16.218.208:443	192.168.125.179:61228	6	78	Ether / IP / TCP 52.16.218.208:https > 192.168.125.179:61228 PA / Raw
----------------------------------------
535.3582	Eroare: main thread is not in main loop	0.00%
66	192.168.125.179:61228	52.16.218.208:443	6	298	Ether / IP / TCP 192.168.125.179:61228 > 52.16.218.208:https PA / Raw
----------------------------------------
538.0396	Eroare: main thread is not in main loop	0.00%
66	192.168.125.179:64172	13.107.246.44:443	6	55	Ether / IP / TCP 192.168.125.179:64172 > 13.107.246.44:https A / Raw
----------------------------------------
542.3511	Eroare: main thread is not in main loop	0.00%
66	192.168.125.179:57468	192.168.125.213:53	17	84	Ether / IP / UDP / DNS Qry b'ocws.officeapps.live.com.'
----------------------------------------
547.4675	Eroare: main thread is not in main loop	0.00%
66	162.247.241.14:443	192.168.125.179:63936	6	54	Ether / IP / TCP 162.247.241.14:https > 192.168.125.179:63936 A
----------------------------------------
550.8609	Eroare: main thread is not in main loop	0.00%
66	192.168.125.179:64182	52.109.88.188:443	6	2274	Ether / IP / TCP 192.168.125.179:64182 > 52.109.88.188:https PA / Raw
----------------------------------------
556.5959	Eroare: main thread is not in main loop	0.00%
66	192.168.125.179:62718	52.123.134.246:443	6	105	Ether / IP / TCP 192.168.125.179:62718 > 52.123.134.246:https PA / Raw
----------------------------------------
558.6544	Eroare: main thread is not in main loop	0.00%
66	192.168.125.179:64182	52.109.88.188:443	6	54	Ether / IP / TCP 192.168.125.179:64182 > 52.109.88.188:https RA
----------------------------------------
560.3056	Eroare: main thread is not in main loop	0.00%
66	192.168.125.179:137	192.168.125.255:137	17	92	Ether / IP / UDP / NBNSHeader / NBNSQueryRequest who has '\\DESKTOP-H45KHRK'
----------------------------------------
