1.4896	Trafic Legitim	73.12%
0	192.168.192.179:52167	142.250.187.99:443	17	1292	Ether / IP / UDP 192.168.192.179:52167 > 142.250.187.99:https / Raw
----------------------------------------
1.7060	Trafic Legitim	73.12%
0	192.168.192.179:52167	142.250.187.99:443	17	1292	Ether / IP / UDP 192.168.192.179:52167 > 142.250.187.99:https / Raw
----------------------------------------
1.7754	Trafic Legitim	73.12%
2	192.168.192.179:52167	142.250.187.99:443	17	118	Ether / IP / UDP 192.168.192.179:52167 > 142.250.187.99:https / Raw
----------------------------------------
1.8514	Trafic Legitim	73.12%
3	192.168.192.179:52167	142.250.187.99:443	17	581	Ether / IP / UDP 192.168.192.179:52167 > 142.250.187.99:https / Raw
----------------------------------------
1.9280	Trafic Legitim	73.12%
3	142.250.187.99:443	192.168.192.179:52167	17	82	Ether / IP / UDP 142.250.187.99:https > 192.168.192.179:52167 / Raw
----------------------------------------
3.5246	Trafic Legitim	73.12%
5	192.168.192.179:59855	52.178.17.234:443	6	172	Ether / IP / TCP 192.168.192.179:59855 > 52.178.17.234:https PA / Raw
----------------------------------------
3.5885	Trafic Legitim	73.12%
5	192.168.192.179:59855	52.178.17.234:443	6	93	Ether / IP / TCP 192.168.192.179:59855 > 52.178.17.234:https PA / Raw
----------------------------------------
3.6570	Trafic Legitim	73.12%
7	192.168.192.179:59855	52.178.17.234:443	6	2325	Ether / IP / TCP 192.168.192.179:59855 > 52.178.17.234:https PA / Raw
----------------------------------------
3.7127	Trafic Legitim	73.12%
7	52.178.17.234:443	192.168.192.179:59855	6	54	Ether / IP / TCP 52.178.17.234:https > 192.168.192.179:59855 A
----------------------------------------
3.7906	Trafic Legitim	73.12%
9	52.178.17.234:443	192.168.192.179:59855	6	93	Ether / IP / TCP 52.178.17.234:https > 192.168.192.179:59855 PA / Raw
----------------------------------------
3.8513	Trafic Legitim	73.12%
10	52.178.17.234:443	192.168.192.179:59855	6	54	Ether / IP / TCP 52.178.17.234:https > 192.168.192.179:59855 A
----------------------------------------
3.9207	Trafic Legitim	73.12%
10	192.168.192.179:59855	52.178.17.234:443	6	54	Ether / IP / TCP 192.168.192.179:59855 > 52.178.17.234:https A
----------------------------------------
5.9648	Trafic Legitim	73.12%
12	192.168.192.179:59826	13.107.5.93:443	6	55	Ether / IP / TCP 192.168.192.179:59826 > 13.107.5.93:https A / Raw
----------------------------------------
6.0487	Trafic Legitim	73.12%
13	13.107.5.93:443	192.168.192.179:59826	6	66	Ether / IP / TCP 13.107.5.93:https > 192.168.192.179:59826 A
----------------------------------------
7.8301	Trafic Legitim	73.12%
14	192.168.192.179:59831	13.107.246.44:443	6	55	Ether / IP / TCP 192.168.192.179:59831 > 13.107.246.44:https A / Raw
----------------------------------------
7.8957	Trafic Legitim	73.12%
14	13.107.246.44:443	192.168.192.179:59831	6	66	Ether / IP / TCP 13.107.246.44:https > 192.168.192.179:59831 A
----------------------------------------
8.0155	Trafic Legitim	73.12%
16	192.168.192.179:59830	140.82.114.22:443	6	55	Ether / IP / TCP 192.168.192.179:59830 > 140.82.114.22:https A / Raw
----------------------------------------
8.2029	Trafic Legitim	73.12%
17	140.82.114.22:443	192.168.192.179:59830	6	66	Ether / IP / TCP 140.82.114.22:https > 192.168.192.179:59830 A
----------------------------------------
