0.4764	Eroare: Input 0 of layer "functional_1" is incompatible with the layer: expected shape=(None, 42, 1), found shape=(1, 41)	0.00%
0	52.30.201.170:443	192.168.125.179:60385	6	78	Ether / IP / TCP 52.30.201.170:https > 192.168.125.179:60385 PA / Raw
----------------------------------------
0.5969	Eroare: Input 0 of layer "functional_1" is incompatible with the layer: expected shape=(None, 42, 1), found shape=(1, 41)	0.00%
1	192.168.125.179:60385	52.30.201.170:443	6	82	Ether / IP / TCP 192.168.125.179:60385 > 52.30.201.170:https PA / Raw
----------------------------------------
0.6454	Eroare: Input 0 of layer "functional_1" is incompatible with the layer: expected shape=(None, 42, 1), found shape=(1, 41)	0.00%
1	52.30.201.170:443	192.168.125.179:60385	6	54	Ether / IP / TCP 52.30.201.170:https > 192.168.125.179:60385 A
----------------------------------------
0.7853	Eroare: Input 0 of layer "functional_1" is incompatible with the layer: expected shape=(None, 42, 1), found shape=(1, 41)	0.00%
3	192.168.125.179:60385	52.30.201.170:443	6	298	Ether / IP / TCP 192.168.125.179:60385 > 52.30.201.170:https PA / Raw
----------------------------------------
0.9439	Eroare: Input 0 of layer "functional_1" is incompatible with the layer: expected shape=(None, 42, 1), found shape=(1, 41)	0.00%
4	52.30.201.170:443	192.168.125.179:60385	6	54	Ether / IP / TCP 52.30.201.170:https > 192.168.125.179:60385 A
----------------------------------------
2.5255	Eroare: Input 0 of layer "functional_1" is incompatible with the layer: expected shape=(None, 42, 1), found shape=(1, 41)	0.00%
5	192.168.125.179:60796	20.42.65.94:443	6	172	Ether / IP / TCP 192.168.125.179:60796 > 20.42.65.94:https PA / Raw
----------------------------------------
2.5737	Eroare: Input 0 of layer "functional_1" is incompatible with the layer: expected shape=(None, 42, 1), found shape=(1, 41)	0.00%
6	192.168.125.179:60796	20.42.65.94:443	6	2325	Ether / IP / TCP 192.168.125.179:60796 > 20.42.65.94:https PA / Raw
----------------------------------------
2.7338	Eroare: Input 0 of layer "functional_1" is incompatible with the layer: expected shape=(None, 42, 1), found shape=(1, 41)	0.00%
7	20.42.65.94:443	192.168.125.179:60796	6	54	Ether / IP / TCP 20.42.65.94:https > 192.168.125.179:60796 A
----------------------------------------
2.7817	Eroare: Input 0 of layer "functional_1" is incompatible with the layer: expected shape=(None, 42, 1), found shape=(1, 41)	0.00%
8	20.42.65.94:443	192.168.125.179:60796	6	178	Ether / IP / TCP 20.42.65.94:https > 192.168.125.179:60796 PA / Raw
----------------------------------------
2.8303	Eroare: Input 0 of layer "functional_1" is incompatible with the layer: expected shape=(None, 42, 1), found shape=(1, 41)	0.00%
8	192.168.125.179:60796	20.42.65.94:443	6	89	Ether / IP / TCP 192.168.125.179:60796 > 20.42.65.94:https PA / Raw
----------------------------------------
2.9766	Eroare: Input 0 of layer "functional_1" is incompatible with the layer: expected shape=(None, 42, 1), found shape=(1, 41)	0.00%
10	20.42.65.94:443	192.168.125.179:60796	6	54	Ether / IP / TCP 20.42.65.94:https > 192.168.125.179:60796 A
----------------------------------------
3.4276	Eroare: Input 0 of layer "functional_1" is incompatible with the layer: expected shape=(None, 42, 1), found shape=(1, 41)	0.00%
11	192.168.125.179:60254	52.123.134.246:443	6	104	Ether / IP / TCP 192.168.125.179:60254 > 52.123.134.246:https PA / Raw
----------------------------------------
3.5518	Eroare: Input 0 of layer "functional_1" is incompatible with the layer: expected shape=(None, 42, 1), found shape=(1, 41)	0.00%
12	52.123.134.246:443	192.168.125.179:60254	6	93	Ether / IP / TCP 52.123.134.246:https > 192.168.125.179:60254 PA / Raw
----------------------------------------
3.6283	Eroare: Input 0 of layer "functional_1" is incompatible with the layer: expected shape=(None, 42, 1), found shape=(1, 41)	0.00%
13	192.168.125.179:60254	52.123.134.246:443	6	54	Ether / IP / TCP 192.168.125.179:60254 > 52.123.134.246:https A
----------------------------------------
4.6412	Eroare: Input 0 of layer "functional_1" is incompatible with the layer: expected shape=(None, 42, 1), found shape=(1, 41)	0.00%
14	192.168.125.179:60440	172.64.155.209:443	6	55	Ether / IP / TCP 192.168.125.179:60440 > 172.64.155.209:https A / Raw
----------------------------------------
4.8680	Eroare: Input 0 of layer "functional_1" is incompatible with the layer: expected shape=(None, 42, 1), found shape=(1, 41)	0.00%
15	172.64.155.209:443	192.168.125.179:60440	6	66	Ether / IP / TCP 172.64.155.209:https > 192.168.125.179:60440 A
----------------------------------------
6.1605	Eroare: main thread is not in main loop	0.00%
15	192.168.125.179:60273	4.208.35.46:443	6	104	Ether / IP / TCP 192.168.125.179:60273 > 4.208.35.46:https PA / Raw
----------------------------------------
8.4358	Eroare: main thread is not in main loop	0.00%
15	192.168.125.179:60242	52.123.200.36:443	6	111	Ether / IP / TCP 192.168.125.179:60242 > 52.123.200.36:https PA / Raw
----------------------------------------
9.7072	Eroare: main thread is not in main loop	0.00%
15	185.60.218.53:443	192.168.125.179:60778	6	93	Ether / IP / TCP 185.60.218.53:https > 192.168.125.179:60778 PA / Raw
----------------------------------------
10.7948	Eroare: main thread is not in main loop	0.00%
15	13.89.179.14:443	192.168.125.179:60800	6	157	Ether / IP / TCP 13.89.179.14:https > 192.168.125.179:60800 PA / Raw
----------------------------------------
12.3852	Eroare: main thread is not in main loop	0.00%
15	13.107.246.44:443	192.168.125.179:60582	6	78	Ether / IP / TCP 13.107.246.44:https > 192.168.125.179:60582 FPA / Raw
----------------------------------------
13.9748	Eroare: main thread is not in main loop	0.00%
15	192.168.125.179:60579	140.82.114.22:443	6	55	Ether / IP / TCP 192.168.125.179:60579 > 140.82.114.22:https A / Raw
----------------------------------------
15.1956	Eroare: main thread is not in main loop	0.00%
15	192.168.125.179:53627	192.168.125.213:53	17	78	Ether / IP / UDP / DNS Qry b'edge.microsoft.com.'
----------------------------------------
16.3511	Eroare: main thread is not in main loop	0.00%
15	192.168.125.179:60625	140.82.114.22:443	6	55	Ether / IP / TCP 192.168.125.179:60625 > 140.82.114.22:https A / Raw
----------------------------------------
18.5588	Eroare: main thread is not in main loop	0.00%
15	192.168.125.179:60796	20.42.65.94:443	6	173	Ether / IP / TCP 192.168.125.179:60796 > 20.42.65.94:https PA / Raw
----------------------------------------
19.9032	Eroare: main thread is not in main loop	0.00%
15	192.168.125.179:49232	192.168.125.213:53	17	92	Ether / IP / UDP / DNS Qry b'mobile.events.data.microsoft.com.'
----------------------------------------
28.3250	Eroare: main thread is not in main loop	0.00%
15	192.168.125.179:60561	23.67.160.244:80	6	54	Ether / IP / TCP 192.168.125.179:60561 > 23.67.160.244:http FA
----------------------------------------
30.4409	Eroare: main thread is not in main loop	0.00%
15	192.168.125.179:60448	185.199.110.154:443	6	55	Ether / IP / TCP 192.168.125.179:60448 > 185.199.110.154:https A / Raw
----------------------------------------
31.5021	Eroare: main thread is not in main loop	0.00%
15	192.168.125.179:60541	52.98.229.98:443	6	55	Ether / IP / TCP 192.168.125.179:60541 > 52.98.229.98:https A / Raw
----------------------------------------
32.7808	Eroare: main thread is not in main loop	0.00%
15	192.168.125.179:60385	52.30.201.170:443	6	298	Ether / IP / TCP 192.168.125.179:60385 > 52.30.201.170:https PA / Raw
----------------------------------------
36.2195	Eroare: main thread is not in main loop	0.00%
15	92.123.103.72:443	192.168.125.179:60552	6	85	Ether / IP / TCP 92.123.103.72:https > 192.168.125.179:60552 PA / Raw
----------------------------------------
37.3505	Eroare: main thread is not in main loop	0.00%
15	13.107.246.44:443	192.168.125.179:60564	6	93	Ether / IP / TCP 13.107.246.44:https > 192.168.125.179:60564 PA / Raw
----------------------------------------
38.4602	Eroare: main thread is not in main loop	0.00%
15	192.168.125.179:60799	52.123.244.29:443	6	55	Ether / IP / TCP 192.168.125.179:60799 > 52.123.244.29:https A / Raw
----------------------------------------
42.9219	Eroare: main thread is not in main loop	0.00%
15	192.168.125.179:53168	192.168.125.213:53	17	92	Ether / IP / UDP / DNS Qry b'mobile.events.data.microsoft.com.'
----------------------------------------
44.1415	Eroare: main thread is not in main loop	0.00%
15	20.42.73.26:443	192.168.125.179:60803	6	54	Ether / IP / TCP 20.42.73.26:https > 192.168.125.179:60803 A
----------------------------------------
45.1927	Eroare: main thread is not in main loop	0.00%
15	192.168.125.179:60796	20.42.65.94:443	6	173	Ether / IP / TCP 192.168.125.179:60796 > 20.42.65.94:https PA / Raw
----------------------------------------
46.2567	Eroare: main thread is not in main loop	0.00%
15	4.208.35.46:443	192.168.125.179:60273	6	93	Ether / IP / TCP 4.208.35.46:https > 192.168.125.179:60273 PA / Raw
----------------------------------------
47.5451	Eroare: main thread is not in main loop	0.00%
15	13.107.42.18:443	192.168.125.179:60581	6	54	Ether / IP / TCP 13.107.42.18:https > 192.168.125.179:60581 RA
----------------------------------------
48.7925	Eroare: main thread is not in main loop	0.00%
15	192.168.125.179:60385	52.30.201.170:443	6	298	Ether / IP / TCP 192.168.125.179:60385 > 52.30.201.170:https PA / Raw
----------------------------------------
49.8746	Eroare: main thread is not in main loop	0.00%
15	192.168.125.179:60440	172.64.155.209:443	6	55	Ether / IP / TCP 192.168.125.179:60440 > 172.64.155.209:https A / Raw
----------------------------------------
57.3996	Eroare: main thread is not in main loop	0.00%
15	104.117.76.56:443	192.168.125.179:60498	6	85	Ether / IP / TCP 104.117.76.56:https > 192.168.125.179:60498 PA / Raw
----------------------------------------
60.5051	Eroare: main thread is not in main loop	0.00%
15	192.168.125.179:60801	150.171.28.11:443	6	55	Ether / IP / TCP 192.168.125.179:60801 > 150.171.28.11:https A / Raw
----------------------------------------
61.7111	Eroare: main thread is not in main loop	0.00%
15	192.168.125.179:60374	108.177.96.188:5228	6	55	Ether / IP / TCP 192.168.125.179:60374 > 108.177.96.188:5228 A / Raw
----------------------------------------
63.5660	Eroare: main thread is not in main loop	0.00%
15	192.168.125.179:60242	52.123.200.36:443	6	111	Ether / IP / TCP 192.168.125.179:60242 > 52.123.200.36:https PA / Raw
----------------------------------------
64.7805	Eroare: main thread is not in main loop	0.00%
15	192.168.125.179:60385	52.30.201.170:443	6	297	Ether / IP / TCP 192.168.125.179:60385 > 52.30.201.170:https PA / Raw
----------------------------------------
65.8703	Eroare: main thread is not in main loop	0.00%
15	185.60.218.53:443	192.168.125.179:60773	6	54	Ether / IP / TCP 185.60.218.53:https > 192.168.125.179:60773 A
----------------------------------------
67.0612	Eroare: main thread is not in main loop	0.00%
15	20.189.173.10:443	192.168.125.179:60805	6	54	Ether / IP / TCP 20.189.173.10:https > 192.168.125.179:60805 A
----------------------------------------
75.5817	Eroare: main thread is not in main loop	0.00%
15	192.168.125.179:60448	185.199.110.154:443	6	55	Ether / IP / TCP 192.168.125.179:60448 > 185.199.110.154:https A / Raw
----------------------------------------
76.6881	Eroare: main thread is not in main loop	0.00%
15	52.98.229.98:443	192.168.125.179:60541	6	66	Ether / IP / TCP 52.98.229.98:https > 192.168.125.179:60541 A
----------------------------------------
78.5595	Eroare: main thread is not in main loop	0.00%
15	192.168.125.179:60218	52.123.134.246:443	6	104	Ether / IP / TCP 192.168.125.179:60218 > 52.123.134.246:https PA / Raw
----------------------------------------
80.7846	Eroare: main thread is not in main loop	0.00%
15	192.168.125.179:60385	52.30.201.170:443	6	298	Ether / IP / TCP 192.168.125.179:60385 > 52.30.201.170:https PA / Raw
----------------------------------------
83.4292	Eroare: main thread is not in main loop	0.00%
15	192.168.125.179:60254	52.123.134.246:443	6	104	Ether / IP / TCP 192.168.125.179:60254 > 52.123.134.246:https PA / Raw
----------------------------------------
86.1616	Eroare: main thread is not in main loop	0.00%
15	192.168.125.179:60273	4.208.35.46:443	6	104	Ether / IP / TCP 192.168.125.179:60273 > 4.208.35.46:https PA / Raw
----------------------------------------
94.9718	Eroare: main thread is not in main loop	0.00%
15	192.168.125.179:60440	172.64.155.209:443	6	55	Ether / IP / TCP 192.168.125.179:60440 > 172.64.155.209:https A / Raw
----------------------------------------
96.7859	Eroare: main thread is not in main loop	0.00%
15	192.168.125.179:60385	52.30.201.170:443	6	298	Ether / IP / TCP 192.168.125.179:60385 > 52.30.201.170:https PA / Raw
----------------------------------------
97.8644	Eroare: main thread is not in main loop	0.00%
15	192.168.125.213:53	192.168.125.179:61433	17	212	Ether / IP / UDP / DNS Ans b'mobile.events.data.trafficmanager.net.'
----------------------------------------
98.9584	Eroare: main thread is not in main loop	0.00%
15	20.189.173.10:443	192.168.125.179:60806	6	54	Ether / IP / TCP 20.189.173.10:https > 192.168.125.179:60806 A
----------------------------------------
101.1310	Eroare: main thread is not in main loop	0.00%
15	192.168.125.179:60796	20.42.65.94:443	6	172	Ether / IP / TCP 192.168.125.179:60796 > 20.42.65.94:https PA / Raw
----------------------------------------
102.1843	Eroare: main thread is not in main loop	0.00%
15	20.189.173.10:443	192.168.125.179:60807	6	157	Ether / IP / TCP 20.189.173.10:https > 192.168.125.179:60807 PA / Raw
----------------------------------------
103.4363	Eroare: main thread is not in main loop	0.00%
15	192.168.125.179:60775	104.18.0.22:443	6	55	Ether / IP / TCP 192.168.125.179:60775 > 104.18.0.22:https A / Raw
----------------------------------------
105.5924	Eroare: main thread is not in main loop	0.00%
15	192.168.125.179:60801	150.171.28.11:443	6	55	Ether / IP / TCP 192.168.125.179:60801 > 150.171.28.11:https A / Raw
----------------------------------------
106.7857	Eroare: main thread is not in main loop	0.00%
15	192.168.125.179:60773	185.60.218.53:443	6	123	Ether / IP / TCP 192.168.125.179:60773 > 185.60.218.53:https PA / Raw
----------------------------------------
112.7861	Eroare: main thread is not in main loop	0.00%
15	192.168.125.179:60385	52.30.201.170:443	6	298	Ether / IP / TCP 192.168.125.179:60385 > 52.30.201.170:https PA / Raw
----------------------------------------
116.7705	Eroare: main thread is not in main loop	0.00%
15	192.168.125.179:51686	192.168.125.213:53	17	71	Ether / IP / UDP / DNS Qry b'w.deepl.com.'
----------------------------------------
118.5775	Eroare: main thread is not in main loop	0.00%
15	192.168.125.179:60218	52.123.134.246:443	6	104	Ether / IP / TCP 192.168.125.179:60218 > 52.123.134.246:https PA / Raw
----------------------------------------
120.4146	Eroare: main thread is not in main loop	0.00%
15	52.30.201.170:443	192.168.125.179:60385	6	78	Ether / IP / TCP 52.30.201.170:https > 192.168.125.179:60385 PA / Raw
----------------------------------------
121.7038	Eroare: main thread is not in main loop	0.00%
15	192.168.125.179:60541	52.98.229.98:443	6	55	Ether / IP / TCP 192.168.125.179:60541 > 52.98.229.98:https A / Raw
----------------------------------------
123.4257	Eroare: main thread is not in main loop	0.00%
15	192.168.125.179:60254	52.123.134.246:443	6	104	Ether / IP / TCP 192.168.125.179:60254 > 52.123.134.246:https PA / Raw
----------------------------------------
126.1675	Eroare: main thread is not in main loop	0.00%
15	192.168.125.179:60273	4.208.35.46:443	6	104	Ether / IP / TCP 192.168.125.179:60273 > 4.208.35.46:https PA / Raw
----------------------------------------
128.7929	Eroare: main thread is not in main loop	0.00%
15	192.168.125.179:60385	52.30.201.170:443	6	298	Ether / IP / TCP 192.168.125.179:60385 > 52.30.201.170:https PA / Raw
----------------------------------------
129.8964	Eroare: main thread is not in main loop	0.00%
15	185.60.218.53:443	192.168.125.179:60773	6	54	Ether / IP / TCP 185.60.218.53:https > 192.168.125.179:60773 A
----------------------------------------
132.5135	Eroare: main thread is not in main loop	0.00%
15	192.168.125.179:62702	192.168.125.213:53	17	80	Ether / IP / UDP / DNS Qry b'autoupdate.opera.com.'
----------------------------------------
134.7883	Eroare: main thread is not in main loop	0.00%
15	192.168.125.179:60385	52.30.201.170:443	6	164	Ether / IP / TCP 192.168.125.179:60385 > 52.30.201.170:https PA / Raw
----------------------------------------
139.9415	Eroare: main thread is not in main loop	0.00%
15	150.171.28.11:443	192.168.125.179:60801	6	54	Ether / IP / TCP 150.171.28.11:https > 192.168.125.179:60801 RA
----------------------------------------
144.4367	Eroare: main thread is not in main loop	0.00%
15	185.199.110.154:443	192.168.125.179:60448	6	105	Ether / IP / TCP 185.199.110.154:https > 192.168.125.179:60448 PA / Raw
----------------------------------------
146.3595	Eroare: main thread is not in main loop	0.00%
15	192.168.125.179:60796	20.42.65.94:443	6	55	Ether / IP / TCP 192.168.125.179:60796 > 20.42.65.94:https A / Raw
----------------------------------------
147.9330	Eroare: main thread is not in main loop	0.00%
15	172.65.225.25:443	192.168.125.179:60808	6	54	Ether / IP / TCP 172.65.225.25:https > 192.168.125.179:60808 A
----------------------------------------
151.9327	Eroare: main thread is not in main loop	0.00%
15	192.168.125.179:60374	108.177.96.188:5228	6	55	Ether / IP / TCP 192.168.125.179:60374 > 108.177.96.188:5228 A / Raw
----------------------------------------
155.7943	Eroare: main thread is not in main loop	0.00%
15	192.168.125.179:60773	185.60.218.53:443	6	123	Ether / IP / TCP 192.168.125.179:60773 > 185.60.218.53:https PA / Raw
----------------------------------------
158.5635	Eroare: main thread is not in main loop	0.00%
15	192.168.125.179:60218	52.123.134.246:443	6	104	Ether / IP / TCP 192.168.125.179:60218 > 52.123.134.246:https PA / Raw
----------------------------------------
160.7875	Eroare: main thread is not in main loop	0.00%
15	192.168.125.179:60385	52.30.201.170:443	6	297	Ether / IP / TCP 192.168.125.179:60385 > 52.30.201.170:https PA / Raw
----------------------------------------
162.5249	Eroare: main thread is not in main loop	0.00%
15	192.168.125.179:60808	172.65.225.25:443	6	55	Ether / IP / TCP 192.168.125.179:60808 > 172.65.225.25:https A / Raw
----------------------------------------
163.5972	Eroare: main thread is not in main loop	0.00%
15	52.123.134.246:443	192.168.125.179:60254	6	93	Ether / IP / TCP 52.123.134.246:https > 192.168.125.179:60254 PA / Raw
----------------------------------------
166.1612	Eroare: main thread is not in main loop	0.00%
15	192.168.125.179:60273	4.208.35.46:443	6	104	Ether / IP / TCP 192.168.125.179:60273 > 4.208.35.46:https PA / Raw
----------------------------------------
173.7497	Eroare: main thread is not in main loop	0.00%
15	192.168.125.179:60242	52.123.200.36:443	6	111	Ether / IP / TCP 192.168.125.179:60242 > 52.123.200.36:https PA / Raw
----------------------------------------
176.7991	Eroare: main thread is not in main loop	0.00%
15	192.168.125.179:60385	52.30.201.170:443	6	297	Ether / IP / TCP 192.168.125.179:60385 > 52.30.201.170:https PA / Raw
----------------------------------------
177.9815	Eroare: main thread is not in main loop	0.00%
15	192.168.125.179:60809	185.26.182.124:443	6	55	Ether / IP / TCP 192.168.125.179:60809 > 185.26.182.124:https A / Raw
----------------------------------------
181.4462	Eroare: main thread is not in main loop	0.00%
15	192.168.125.179:54488	192.168.125.213:53	17	91	Ether / IP / UDP / DNS Qry b'teams.events.data.microsoft.com.'
----------------------------------------
185.2603	Eroare: main thread is not in main loop	0.00%
15	192.168.125.179:60440	172.64.155.209:443	6	55	Ether / IP / TCP 192.168.125.179:60440 > 172.64.155.209:https A / Raw
----------------------------------------
191.5996	Eroare: main thread is not in main loop	0.00%
15	192.168.125.179:60796	20.42.65.94:443	6	55	Ether / IP / TCP 192.168.125.179:60796 > 20.42.65.94:https A / Raw
----------------------------------------
192.7889	Eroare: main thread is not in main loop	0.00%
15	192.168.125.179:60385	52.30.201.170:443	6	298	Ether / IP / TCP 192.168.125.179:60385 > 52.30.201.170:https PA / Raw
----------------------------------------
194.7119	Eroare: main thread is not in main loop	0.00%
15	185.60.218.53:443	192.168.125.179:60773	6	242	Ether / IP / TCP 185.60.218.53:https > 192.168.125.179:60773 PA / Raw
----------------------------------------
196.9196	Eroare: main thread is not in main loop	0.00%
15	192.168.125.179:60055	20.199.120.151:443	6	55	Ether / IP / TCP 192.168.125.179:60055 > 20.199.120.151:https A / Raw
----------------------------------------
197.9925	Eroare: main thread is not in main loop	0.00%
15	185.26.182.124:443	192.168.125.179:60809	6	78	Ether / IP / TCP 185.26.182.124:https > 192.168.125.179:60809 PA / Raw
----------------------------------------
203.4288	Eroare: main thread is not in main loop	0.00%
15	192.168.125.179:60254	52.123.134.246:443	6	104	Ether / IP / TCP 192.168.125.179:60254 > 52.123.134.246:https PA / Raw
----------------------------------------
206.1705	Eroare: main thread is not in main loop	0.00%
15	192.168.125.179:60273	4.208.35.46:443	6	104	Ether / IP / TCP 192.168.125.179:60273 > 4.208.35.46:https PA / Raw
----------------------------------------
208.7803	Eroare: main thread is not in main loop	0.00%
15	192.168.125.179:60385	52.30.201.170:443	6	297	Ether / IP / TCP 192.168.125.179:60385 > 52.30.201.170:https PA / Raw
----------------------------------------
211.5749	Eroare: main thread is not in main loop	0.00%
15	192.168.125.179:60289	52.98.240.114:443	6	55	Ether / IP / TCP 192.168.125.179:60289 > 52.98.240.114:https A / Raw
----------------------------------------
219.1193	Eroare: main thread is not in main loop	0.00%
15	192.168.125.179:57140	192.168.125.213:53	17	79	Ether / IP / UDP / DNS Qry b'main.vscode-cdn.net.'
----------------------------------------
223.7197	Eroare: main thread is not in main loop	0.00%
15	192.168.125.179:52971	192.168.125.213:53	17	75	Ether / IP / UDP / DNS Qry b'ssl.gstatic.com.'
----------------------------------------
224.8914	Eroare: main thread is not in main loop	0.00%
15	52.30.201.170:443	192.168.125.179:60385	6	320	Ether / IP / TCP 52.30.201.170:https > 192.168.125.179:60385 PA / Raw
----------------------------------------
225.9782	Eroare: main thread is not in main loop	0.00%
15	192.168.125.179:60773	185.60.218.53:443	6	54	Ether / IP / TCP 192.168.125.179:60773 > 185.60.218.53:https A
----------------------------------------
227.0591	Eroare: main thread is not in main loop	0.00%
15	192.168.125.179:60810	13.69.239.79:443	6	55	Ether / IP / TCP 192.168.125.179:60810 > 13.69.239.79:https A / Raw
----------------------------------------
228.8667	Eroare: main thread is not in main loop	0.00%
15	192.168.125.179:60242	52.123.200.36:443	6	111	Ether / IP / TCP 192.168.125.179:60242 > 52.123.200.36:https PA / Raw
----------------------------------------
230.3258	Eroare: main thread is not in main loop	0.00%
15	192.168.125.179:60440	172.64.155.209:443	6	55	Ether / IP / TCP 192.168.125.179:60440 > 172.64.155.209:https A / Raw
----------------------------------------
231.9161	Eroare: main thread is not in main loop	0.00%
15	192.168.125.179:60257	74.248.74.217:443	6	111	Ether / IP / TCP 192.168.125.179:60257 > 74.248.74.217:https PA / Raw
----------------------------------------
236.6327	Eroare: main thread is not in main loop	0.00%
15	185.60.218.53:443	192.168.125.179:60773	6	334	Ether / IP / TCP 185.60.218.53:https > 192.168.125.179:60773 PA / Raw
----------------------------------------
238.5713	Eroare: main thread is not in main loop	0.00%
15	192.168.125.179:60218	52.123.134.246:443	6	104	Ether / IP / TCP 192.168.125.179:60218 > 52.123.134.246:https PA / Raw
----------------------------------------
240.4151	Eroare: main thread is not in main loop	0.00%
15	52.30.201.170:443	192.168.125.179:60385	6	78	Ether / IP / TCP 52.30.201.170:https > 192.168.125.179:60385 PA / Raw
----------------------------------------
242.1999	Eroare: main thread is not in main loop	0.00%
15	192.168.125.179:60374	108.177.96.188:5228	6	55	Ether / IP / TCP 192.168.125.179:60374 > 108.177.96.188:5228 A / Raw
----------------------------------------
243.4241	Eroare: main thread is not in main loop	0.00%
15	192.168.125.179:60254	52.123.134.246:443	6	104	Ether / IP / TCP 192.168.125.179:60254 > 52.123.134.246:https PA / Raw
----------------------------------------
246.1677	Eroare: main thread is not in main loop	0.00%
15	192.168.125.179:60273	4.208.35.46:443	6	104	Ether / IP / TCP 192.168.125.179:60273 > 4.208.35.46:https PA / Raw
----------------------------------------
248.9416	Eroare: main thread is not in main loop	0.00%
15	192.168.125.179:55782	216.58.212.35:443	17	144	Ether / IP / UDP 192.168.125.179:55782 > 216.58.212.35:https / Raw
----------------------------------------
254.7846	Eroare: main thread is not in main loop	0.00%
15	192.168.125.179:60773	185.60.218.53:443	6	123	Ether / IP / TCP 192.168.125.179:60773 > 185.60.218.53:https PA / Raw
----------------------------------------
256.7383	Eroare: main thread is not in main loop	0.00%
15	192.168.125.179:60289	52.98.240.114:443	6	55	Ether / IP / TCP 192.168.125.179:60289 > 52.98.240.114:https A / Raw
----------------------------------------
258.7302	Eroare: main thread is not in main loop	0.00%
15	192.168.125.179:60813	51.104.15.252:443	6	66	Ether / IP / TCP 192.168.125.179:60813 > 51.104.15.252:https S
----------------------------------------
261.7400	Eroare: main thread is not in main loop	0.00%
15	192.168.125.179:60813	51.104.15.252:443	6	66	Ether / IP / TCP 192.168.125.179:60813 > 51.104.15.252:https S
----------------------------------------
264.8775	Eroare: main thread is not in main loop	0.00%
15	13.107.246.44:443	192.168.125.179:60811	6	66	Ether / IP / TCP 13.107.246.44:https > 192.168.125.179:60811 A
----------------------------------------
265.9469	Eroare: main thread is not in main loop	0.00%
15	104.208.16.89:443	192.168.125.179:60814	6	1354	Ether / IP / TCP 104.208.16.89:https > 192.168.125.179:60814 A / Raw
----------------------------------------
269.0755	Eroare: main thread is not in main loop	0.00%
15	192.168.125.179:60814	104.208.16.89:443	6	172	Ether / IP / TCP 192.168.125.179:60814 > 104.208.16.89:https PA / Raw
----------------------------------------
270.2692	Eroare: main thread is not in main loop	0.00%
15	104.208.16.89:443	192.168.125.179:60815	6	54	Ether / IP / TCP 104.208.16.89:https > 192.168.125.179:60815 A
----------------------------------------
271.9557	Eroare: main thread is not in main loop	0.00%
15	192.168.125.179:59852	192.168.125.213:53	17	92	Ether / IP / UDP / DNS Qry b'mobile.events.data.microsoft.com.'
----------------------------------------
273.0399	Eroare: main thread is not in main loop	0.00%
15	104.208.16.89:443	192.168.125.179:60816	6	54	Ether / IP / TCP 104.208.16.89:https > 192.168.125.179:60816 A
----------------------------------------
274.7899	Eroare: main thread is not in main loop	0.00%
15	192.168.125.179:61717	192.168.125.213:53	17	91	Ether / IP / UDP / DNS Qry b'settings-win.data.microsoft.com.'
----------------------------------------
275.8606	Eroare: main thread is not in main loop	0.00%
15	172.217.17.138:443	192.168.125.179:51754	17	833	Ether / IP / UDP 172.217.17.138:https > 192.168.125.179:51754 / Raw
----------------------------------------
276.9515	Eroare: main thread is not in main loop	0.00%
15	192.168.125.179:60820	52.123.128.14:443	6	1183	Ether / IP / TCP 192.168.125.179:60820 > 52.123.128.14:https PA / Raw
----------------------------------------
278.0319	Eroare: main thread is not in main loop	0.00%
15	192.168.125.179:60820	52.123.128.14:443	6	54	Ether / IP / TCP 192.168.125.179:60820 > 52.123.128.14:https A
----------------------------------------
279.0938	Eroare: main thread is not in main loop	0.00%
15	140.82.114.21:443	192.168.125.179:60824	6	1354	Ether / IP / TCP 140.82.114.21:https > 192.168.125.179:60824 A / Raw
----------------------------------------
280.2533	Eroare: main thread is not in main loop	0.00%
15	20.42.65.84:443	192.168.125.179:60826	6	66	Ether / IP / TCP 20.42.65.84:https > 192.168.125.179:60826 SA
----------------------------------------
282.1063	Eroare: main thread is not in main loop	0.00%
15	20.42.65.84:443	192.168.125.179:60827	6	519	Ether / IP / TCP 20.42.65.84:https > 192.168.125.179:60827 FPA / Raw
----------------------------------------
283.2284	Eroare: main thread is not in main loop	0.00%
15	20.42.65.84:443	192.168.125.179:60828	6	153	Ether / IP / TCP 20.42.65.84:https > 192.168.125.179:60828 PA / Raw
----------------------------------------
286.1560	Eroare: main thread is not in main loop	0.00%
15	192.168.125.179:60273	4.208.35.46:443	6	104	Ether / IP / TCP 192.168.125.179:60273 > 4.208.35.46:https PA / Raw
----------------------------------------
287.3171	Eroare: main thread is not in main loop	0.00%
15	20.42.65.84:443	192.168.125.179:60829	6	66	Ether / IP / TCP 20.42.65.84:https > 192.168.125.179:60829 SA
----------------------------------------
288.7847	Eroare: main thread is not in main loop	0.00%
15	192.168.125.179:60385	52.30.201.170:443	6	298	Ether / IP / TCP 192.168.125.179:60385 > 52.30.201.170:https PA / Raw
----------------------------------------
290.5126	Eroare: main thread is not in main loop	0.00%
15	192.168.125.179:50584	192.168.125.213:53	17	92	Ether / IP / UDP / DNS Qry b'mobile.events.data.microsoft.com.'
----------------------------------------
291.7194	Eroare: main thread is not in main loop	0.00%
15	13.89.179.9:443	192.168.125.179:60830	6	54	Ether / IP / TCP 13.89.179.9:https > 192.168.125.179:60830 A
----------------------------------------
294.2807	Eroare: main thread is not in main loop	0.00%
15	192.168.125.179:60824	140.82.114.21:443	6	14354	Ether / IP / TCP 192.168.125.179:60824 > 140.82.114.21:https A / Raw
----------------------------------------
295.5750	Eroare: main thread is not in main loop	0.00%
15	192.168.125.179:60824	140.82.114.21:443	6	25627	Ether / IP / TCP 192.168.125.179:60824 > 140.82.114.21:https PA / Raw
----------------------------------------
297.7287	Eroare: main thread is not in main loop	0.00%
15	192.168.125.179:60820	52.123.128.14:443	6	54	Ether / IP / TCP 192.168.125.179:60820 > 52.123.128.14:https RA
----------------------------------------
300.3557	Eroare: main thread is not in main loop	0.00%
15	192.168.125.179:60812	185.60.218.53:443	6	55	Ether / IP / TCP 192.168.125.179:60812 > 185.60.218.53:https A / Raw
----------------------------------------
301.8391	Eroare: main thread is not in main loop	0.00%
15	192.168.125.179:60289	52.98.240.114:443	6	55	Ether / IP / TCP 192.168.125.179:60289 > 52.98.240.114:https A / Raw
----------------------------------------
304.7890	Eroare: main thread is not in main loop	0.00%
15	192.168.125.179:60385	52.30.201.170:443	6	298	Ether / IP / TCP 192.168.125.179:60385 > 52.30.201.170:https PA / Raw
----------------------------------------
309.5490	Eroare: main thread is not in main loop	0.00%
15	13.69.239.79:443	192.168.125.179:60810	6	54	Ether / IP / TCP 13.69.239.79:https > 192.168.125.179:60810 RA
----------------------------------------
313.3702	Eroare: main thread is not in main loop	0.00%
15	192.168.125.179:60825	20.250.119.64:443	6	17036	Ether / IP / TCP 192.168.125.179:60825 > 20.250.119.64:https PA / Raw
----------------------------------------
314.4460	Eroare: main thread is not in main loop	0.00%
15	172.64.155.209:443	192.168.125.179:60440	6	54	Ether / IP / TCP 172.64.155.209:https > 192.168.125.179:60440 A
----------------------------------------
315.6003	Eroare: main thread is not in main loop	0.00%
15	192.168.125.179:60814	104.208.16.89:443	6	172	Ether / IP / TCP 192.168.125.179:60814 > 104.208.16.89:https PA / Raw
----------------------------------------
316.7351	Eroare: main thread is not in main loop	0.00%
15	20.250.119.64:443	192.168.125.179:60825	6	496	Ether / IP / TCP 20.250.119.64:https > 192.168.125.179:60825 PA / Raw
----------------------------------------
318.3303	Eroare: main thread is not in main loop	0.00%
15	192.168.125.179:60814	104.208.16.89:443	6	167	Ether / IP / TCP 192.168.125.179:60814 > 104.208.16.89:https PA / Raw
----------------------------------------
320.4241	Eroare: main thread is not in main loop	0.00%
15	185.60.218.53:443	192.168.125.179:60812	6	93	Ether / IP / TCP 185.60.218.53:https > 192.168.125.179:60812 PA / Raw
----------------------------------------
323.4275	Eroare: main thread is not in main loop	0.00%
15	192.168.125.179:60254	52.123.134.246:443	6	104	Ether / IP / TCP 192.168.125.179:60254 > 52.123.134.246:https PA / Raw
----------------------------------------
326.1669	Eroare: main thread is not in main loop	0.00%
15	192.168.125.179:60273	4.208.35.46:443	6	104	Ether / IP / TCP 192.168.125.179:60273 > 4.208.35.46:https PA / Raw
----------------------------------------
328.3764	Eroare: main thread is not in main loop	0.00%
15	192.168.125.179:60824	140.82.114.21:443	6	62669	Ether / IP / TCP 192.168.125.179:60824 > 140.82.114.21:https PA / Raw
----------------------------------------
329.7039	Eroare: main thread is not in main loop	0.00%
15	140.82.114.21:443	192.168.125.179:60824	6	516	Ether / IP / TCP 140.82.114.21:https > 192.168.125.179:60824 PA / Raw
----------------------------------------
332.4390	Eroare: main thread is not in main loop	0.00%
15	192.168.125.179:60374	108.177.96.188:5228	6	55	Ether / IP / TCP 192.168.125.179:60374 > 108.177.96.188:5228 A / Raw
----------------------------------------
336.2288	Eroare: main thread is not in main loop	0.00%
15	192.168.125.179:60818	35.186.224.24:443	6	54	Ether / IP / TCP 192.168.125.179:60818 > 35.186.224.24:https FA
----------------------------------------
339.0609	Eroare: main thread is not in main loop	0.00%
15	192.168.125.179:60242	52.123.200.36:443	6	111	Ether / IP / TCP 192.168.125.179:60242 > 52.123.200.36:https PA / Raw
----------------------------------------
341.2653	Eroare: main thread is not in main loop	0.00%
15	192.168.125.179:60814	104.208.16.89:443	6	167	Ether / IP / TCP 192.168.125.179:60814 > 104.208.16.89:https PA / Raw
----------------------------------------
344.7893	Eroare: main thread is not in main loop	0.00%
15	192.168.125.179:60773	185.60.218.53:443	6	123	Ether / IP / TCP 192.168.125.179:60773 > 185.60.218.53:https PA / Raw
----------------------------------------
346.9527	Eroare: main thread is not in main loop	0.00%
15	192.168.125.179:60289	52.98.240.114:443	6	55	Ether / IP / TCP 192.168.125.179:60289 > 52.98.240.114:https A / Raw
----------------------------------------
352.8069	Eroare: main thread is not in main loop	0.00%
15	192.168.125.179:60385	52.30.201.170:443	6	298	Ether / IP / TCP 192.168.125.179:60385 > 52.30.201.170:https PA / Raw
----------------------------------------
358.5665	Eroare: main thread is not in main loop	0.00%
15	192.168.125.179:60218	52.123.134.246:443	6	104	Ether / IP / TCP 192.168.125.179:60218 > 52.123.134.246:https PA / Raw
----------------------------------------
360.4170	Eroare: main thread is not in main loop	0.00%
15	52.30.201.170:443	192.168.125.179:60385	6	78	Ether / IP / TCP 52.30.201.170:https > 192.168.125.179:60385 PA / Raw
----------------------------------------
363.1431	Eroare: main thread is not in main loop	0.00%
15	52.123.134.246:443	192.168.125.179:60218	6	1179	Ether / IP / TCP 52.123.134.246:https > 192.168.125.179:60218 PA / Raw
----------------------------------------
366.1677	Eroare: main thread is not in main loop	0.00%
15	192.168.125.179:60273	4.208.35.46:443	6	104	Ether / IP / TCP 192.168.125.179:60273 > 4.208.35.46:https PA / Raw
----------------------------------------
368.1580	Eroare: main thread is not in main loop	0.00%
15	104.18.0.22:443	192.168.125.179:60775	6	93	Ether / IP / TCP 104.18.0.22:https > 192.168.125.179:60775 PA / Raw
----------------------------------------
372.7908	Eroare: main thread is not in main loop	0.00%
15	192.168.125.179:60773	185.60.218.53:443	6	123	Ether / IP / TCP 192.168.125.179:60773 > 185.60.218.53:https PA / Raw
----------------------------------------
374.7880	Eroare: main thread is not in main loop	0.00%
15	192.168.125.179:60385	52.30.201.170:443	6	164	Ether / IP / TCP 192.168.125.179:60385 > 52.30.201.170:https PA / Raw
----------------------------------------
376.7943	Eroare: main thread is not in main loop	0.00%
15	185.60.218.53:443	192.168.125.179:60773	6	1354	Ether / IP / TCP 185.60.218.53:https > 192.168.125.179:60773 A / Raw
----------------------------------------
382.7946	Eroare: main thread is not in main loop	0.00%
15	192.168.125.179:60773	185.60.218.53:443	6	444	Ether / IP / TCP 192.168.125.179:60773 > 185.60.218.53:https PA / Raw
----------------------------------------
384.8014	Eroare: main thread is not in main loop	0.00%
15	192.168.125.179:60385	52.30.201.170:443	6	298	Ether / IP / TCP 192.168.125.179:60385 > 52.30.201.170:https PA / Raw
----------------------------------------
386.0212	Eroare: main thread is not in main loop	0.00%
15	192.168.125.179:60821	20.190.181.23:443	6	54	Ether / IP / TCP 192.168.125.179:60821 > 20.190.181.23:https FA
----------------------------------------
392.0614	Eroare: main thread is not in main loop	0.00%
15	192.168.125.179:60289	52.98.240.114:443	6	55	Ether / IP / TCP 192.168.125.179:60289 > 52.98.240.114:https A / Raw
----------------------------------------
394.1837	Eroare: main thread is not in main loop	0.00%
15	192.168.125.179:60239	52.123.200.36:443	6	111	Ether / IP / TCP 192.168.125.179:60239 > 52.123.200.36:https PA / Raw
----------------------------------------
397.2515	Eroare: main thread is not in main loop	0.00%
15	192.168.125.179:60257	74.248.74.217:443	6	111	Ether / IP / TCP 192.168.125.179:60257 > 74.248.74.217:https PA / Raw
----------------------------------------
398.5710	Eroare: main thread is not in main loop	0.00%
15	192.168.125.179:60218	52.123.134.246:443	6	104	Ether / IP / TCP 192.168.125.179:60218 > 52.123.134.246:https PA / Raw
----------------------------------------
400.7836	Eroare: main thread is not in main loop	0.00%
15	192.168.125.179:60385	52.30.201.170:443	6	298	Ether / IP / TCP 192.168.125.179:60385 > 52.30.201.170:https PA / Raw
----------------------------------------
403.4280	Eroare: main thread is not in main loop	0.00%
15	192.168.125.179:60254	52.123.134.246:443	6	104	Ether / IP / TCP 192.168.125.179:60254 > 52.123.134.246:https PA / Raw
----------------------------------------
406.1723	Eroare: main thread is not in main loop	0.00%
15	192.168.125.179:60273	4.208.35.46:443	6	104	Ether / IP / TCP 192.168.125.179:60273 > 4.208.35.46:https PA / Raw
----------------------------------------
412.7899	Eroare: main thread is not in main loop	0.00%
15	192.168.125.179:60773	185.60.218.53:443	6	123	Ether / IP / TCP 192.168.125.179:60773 > 185.60.218.53:https PA / Raw
----------------------------------------
415.1964	Eroare: main thread is not in main loop	0.00%
15	185.60.218.53:443	192.168.125.179:60773	6	243	Ether / IP / TCP 185.60.218.53:https > 192.168.125.179:60773 PA / Raw
----------------------------------------
416.8002	Eroare: main thread is not in main loop	0.00%
15	192.168.125.179:60385	52.30.201.170:443	6	298	Ether / IP / TCP 192.168.125.179:60385 > 52.30.201.170:https PA / Raw
----------------------------------------
420.0123	Eroare: main thread is not in main loop	0.00%
15	108.177.96.188:5228	192.168.125.179:60374	6	54	Ether / IP / TCP 108.177.96.188:5228 > 192.168.125.179:60374 A
----------------------------------------
431.8252	Eroare: main thread is not in main loop	0.00%
