2.1711	Atac: NORMAL	85.75%
0	52.109.102.2:443	192.168.125.179:61350	6	98	Ether / IP / TCP 52.109.102.2:https > 192.168.125.179:61350 PA / Raw
----------------------------------------
2.4281	Atac: NORMAL	85.75%
1	192.168.125.179:61350	52.109.102.2:443	6	54	Ether / IP / TCP 192.168.125.179:61350 > 52.109.102.2:https A
----------------------------------------
3.7552	Atac: NORMAL	85.75%
2	192.168.125.179:61325	52.16.218.208:443	6	55	Ether / IP / TCP 192.168.125.179:61325 > 52.16.218.208:https A / Raw
----------------------------------------
3.9082	Atac: NORMAL	85.75%
3	172.65.225.25:443	192.168.125.179:61488	6	54	Ether / IP / TCP 172.65.225.25:https > 192.168.125.179:61488 A
----------------------------------------
3.9972	Atac: NORMAL	85.75%
4	192.168.125.179:61488	172.65.225.25:443	6	54	Ether / IP / TCP 192.168.125.179:61488 > 172.65.225.25:https A
----------------------------------------
4.1862	Atac: NORMAL	85.75%
5	192.168.125.179:61228	52.16.218.208:443	6	298	Ether / IP / TCP 192.168.125.179:61228 > 52.16.218.208:https PA / Raw
----------------------------------------
4.3432	Atac: NORMAL	85.75%
6	52.16.218.208:443	192.168.125.179:61228	6	321	Ether / IP / TCP 52.16.218.208:https > 192.168.125.179:61228 PA / Raw
----------------------------------------
4.4222	Atac: NORMAL	85.75%
7	192.168.125.179:61228	52.16.218.208:443	6	54	Ether / IP / TCP 192.168.125.179:61228 > 52.16.218.208:https A
----------------------------------------
6.1863	Atac: NORMAL	85.75%
8	192.168.125.179:60773	185.60.218.53:443	6	123	Ether / IP / TCP 192.168.125.179:60773 > 185.60.218.53:https PA / Raw
----------------------------------------
6.2733	Atac: NORMAL	85.75%
9	185.60.218.53:443	192.168.125.179:60773	6	54	Ether / IP / TCP 185.60.218.53:https > 192.168.125.179:60773 A
----------------------------------------
6.3533	Atac: NORMAL	85.75%
10	185.60.218.53:443	192.168.125.179:60773	6	125	Ether / IP / TCP 185.60.218.53:https > 192.168.125.179:60773 PA / Raw
----------------------------------------
6.4363	Atac: NORMAL	85.75%
11	192.168.125.179:60773	185.60.218.53:443	6	54	Ether / IP / TCP 192.168.125.179:60773 > 185.60.218.53:https A
----------------------------------------
6.8193	Atac: NORMAL	85.75%
12	192.168.125.179:61334	172.161.47.103:443	6	55	Ether / IP / TCP 192.168.125.179:61334 > 172.161.47.103:https A / Raw
----------------------------------------
6.9653	Atac: NORMAL	85.75%
13	172.161.47.103:443	192.168.125.179:61334	6	66	Ether / IP / TCP 172.161.47.103:https > 192.168.125.179:61334 A
----------------------------------------
8.7604	Atac: NORMAL	85.75%
14	52.16.218.208:443	192.168.125.179:61228	6	78	Ether / IP / TCP 52.16.218.208:https > 192.168.125.179:61228 PA / Raw
----------------------------------------
8.8394	Atac: NORMAL	85.75%
14	192.168.125.179:61228	52.16.218.208:443	6	82	Ether / IP / TCP 192.168.125.179:61228 > 52.16.218.208:https PA / Raw
----------------------------------------
8.9234	Atac: NORMAL	85.75%
16	52.16.218.208:443	192.168.125.179:61228	6	54	Ether / IP / TCP 52.16.218.208:https > 192.168.125.179:61228 A
----------------------------------------
9.3394	Atac: NORMAL	85.75%
17	192.168.125.179:61479	20.190.181.5:443	6	54	Ether / IP / TCP 192.168.125.179:61479 > 20.190.181.5:https FA
----------------------------------------
9.4434	Atac: NORMAL	85.75%
18	20.190.181.5:443	192.168.125.179:61479	6	54	Ether / IP / TCP 20.190.181.5:https > 192.168.125.179:61479 FA
----------------------------------------
10.0414	Atac: NORMAL	85.75%
19	20.190.181.5:443	192.168.125.179:61479	6	54	Ether / IP / TCP 20.190.181.5:https > 192.168.125.179:61479 FA
----------------------------------------
10.1194	Atac: NORMAL	85.75%
19	192.168.125.179:61479	20.190.181.5:443	6	54	Ether / IP / TCP 192.168.125.179:61479 > 20.190.181.5:https A
----------------------------------------
10.8305	Atac: NORMAL	70.54%
21	192.168.125.179:49588	192.168.125.213:53	17	83	Ether / IP / UDP / DNS Qry b'spclient.wg.spotify.com.'
----------------------------------------
10.9275	Atac: NORMAL	70.54%
22	192.168.125.179:49588	192.168.125.213:53	17	83	Ether / IP / UDP / DNS Qry b'spclient.wg.spotify.com.'
----------------------------------------
11.0175	Atac: NORMAL	70.54%
23	192.168.125.213:53	192.168.125.179:49588	17	132	Ether / IP / UDP / DNS Ans b'edge-web.dual-gslb.spotify.com.'
----------------------------------------
11.1035	Atac: NORMAL	85.75%
23	192.168.125.179:61489	35.186.224.24:443	6	66	Ether / IP / TCP 192.168.125.179:61489 > 35.186.224.24:https S
----------------------------------------
11.1855	Atac: NORMAL	70.54%
25	192.168.125.213:53	192.168.125.179:49588	17	143	Ether / IP / UDP / DNS Ans b'edge-web.dual-gslb.spotify.com.'
----------------------------------------
11.3035	Atac: NORMAL	85.75%
26	35.186.224.24:443	192.168.125.179:61489	6	1354	Ether / IP / TCP 35.186.224.24:https > 192.168.125.179:61489 PA / Raw
----------------------------------------
11.3835	Atac: NORMAL	85.75%
27	35.186.224.24:443	192.168.125.179:61489	6	396	Ether / IP / TCP 35.186.224.24:https > 192.168.125.179:61489 PA / Raw
----------------------------------------
11.4715	Atac: NORMAL	85.75%
28	35.186.224.24:443	192.168.125.179:61489	6	237	Ether / IP / TCP 35.186.224.24:https > 192.168.125.179:61489 PA / Raw
----------------------------------------
11.5735	Atac: NORMAL	85.75%
29	192.168.125.179:61489	35.186.224.24:443	6	54	Ether / IP / TCP 192.168.125.179:61489 > 35.186.224.24:https A
----------------------------------------
11.6525	Atac: NORMAL	85.75%
30	192.168.125.179:61489	35.186.224.24:443	6	54	Ether / IP / TCP 192.168.125.179:61489 > 35.186.224.24:https A
----------------------------------------
11.7995	Atac: NORMAL	70.54%
31	192.168.125.179:137	192.168.125.255:137	17	92	Ether / IP / UDP / NBNSHeader / NBNSQueryRequest who has '\\DESKTOP-H45KHRK'
----------------------------------------
12.3655	Atac: NORMAL	85.75%
32	52.109.102.2:443	192.168.125.179:61350	6	98	Ether / IP / TCP 52.109.102.2:https > 192.168.125.179:61350 PA / Raw
----------------------------------------
12.4405	Atac: NORMAL	85.75%
33	192.168.125.179:61350	52.109.102.2:443	6	54	Ether / IP / TCP 192.168.125.179:61350 > 52.109.102.2:https A
----------------------------------------
12.5595	Atac: NORMAL	70.54%
34	192.168.125.179:137	192.168.125.255:137	17	92	Ether / IP / UDP / NBNSHeader / NBNSQueryRequest who has '\\DESKTOP-H45KHRK'
----------------------------------------
15.4377	Atac: NORMAL	85.75%
35	192.168.125.179:61485	13.107.246.44:443	6	55	Ether / IP / TCP 192.168.125.179:61485 > 13.107.246.44:https A / Raw
----------------------------------------
15.5167	Atac: NORMAL	85.75%
36	192.168.125.179:61484	13.107.246.44:443	6	55	Ether / IP / TCP 192.168.125.179:61484 > 13.107.246.44:https A / Raw
----------------------------------------
15.6137	Atac: NORMAL	85.75%
37	13.107.246.44:443	192.168.125.179:61485	6	66	Ether / IP / TCP 13.107.246.44:https > 192.168.125.179:61485 A
----------------------------------------
15.6987	Atac: NORMAL	85.75%
37	13.107.246.44:443	192.168.125.179:61484	6	66	Ether / IP / TCP 13.107.246.44:https > 192.168.125.179:61484 A
----------------------------------------
18.0528	Atac: NORMAL	70.54%
39	192.168.125.179:137	192.168.125.255:137	17	92	Ether / IP / UDP / NBNSHeader / NBNSQueryRequest who has '\\DESKTOP-H45KHRK'
----------------------------------------
18.8148	Atac: NORMAL	70.54%
40	192.168.125.179:137	192.168.125.255:137	17	92	Ether / IP / UDP / NBNSHeader / NBNSQueryRequest who has '\\DESKTOP-H45KHRK'
----------------------------------------
19.3198	Atac: NORMAL	85.75%
41	172.65.225.25:443	192.168.125.179:61488	6	54	Ether / IP / TCP 172.65.225.25:https > 192.168.125.179:61488 A
----------------------------------------
19.5748	Atac: NORMAL	70.54%
42	192.168.125.179:137	192.168.125.255:137	17	92	Ether / IP / UDP / NBNSHeader / NBNSQueryRequest who has '\\DESKTOP-H45KHRK'
----------------------------------------
20.1799	Atac: NORMAL	85.75%
43	192.168.125.179:61228	52.16.218.208:443	6	298	Ether / IP / TCP 192.168.125.179:61228 > 52.16.218.208:https PA / Raw
----------------------------------------
20.3179	Atac: NORMAL	85.75%
44	52.16.218.208:443	192.168.125.179:61228	6	54	Ether / IP / TCP 52.16.218.208:https > 192.168.125.179:61228 A
----------------------------------------
20.3969	Atac: NORMAL	85.75%
45	52.16.218.208:443	192.168.125.179:61228	6	325	Ether / IP / TCP 52.16.218.208:https > 192.168.125.179:61228 PA / Raw
----------------------------------------
22.3670	Atac: NORMAL	85.75%
46	52.109.102.2:443	192.168.125.179:61350	6	98	Ether / IP / TCP 52.109.102.2:https > 192.168.125.179:61350 PA / Raw
----------------------------------------
22.4540	Atac: NORMAL	85.75%
47	192.168.125.179:61350	52.109.102.2:443	6	54	Ether / IP / TCP 192.168.125.179:61350 > 52.109.102.2:https A
----------------------------------------
24.1790	Atac: NORMAL	85.75%
48	192.168.125.179:60773	185.60.218.53:443	6	123	Ether / IP / TCP 192.168.125.179:60773 > 185.60.218.53:https PA / Raw
----------------------------------------
24.2710	Atac: NORMAL	85.75%
48	185.60.218.53:443	192.168.125.179:60773	6	54	Ether / IP / TCP 185.60.218.53:https > 192.168.125.179:60773 A
----------------------------------------
24.3571	Atac: NORMAL	85.75%
50	185.60.218.53:443	192.168.125.179:60773	6	125	Ether / IP / TCP 185.60.218.53:https > 192.168.125.179:60773 PA / Raw
----------------------------------------
24.4441	Atac: NORMAL	85.75%
51	192.168.125.179:60773	185.60.218.53:443	6	54	Ether / IP / TCP 192.168.125.179:60773 > 185.60.218.53:https A
----------------------------------------
27.4492	Atac: NORMAL	85.75%
52	192.168.125.179:60239	52.123.200.36:443	6	111	Ether / IP / TCP 192.168.125.179:60239 > 52.123.200.36:https PA / Raw
----------------------------------------
27.5292	Atac: NORMAL	85.75%
53	192.168.125.179:60242	52.123.200.36:443	6	111	Ether / IP / TCP 192.168.125.179:60242 > 52.123.200.36:https PA / Raw
----------------------------------------
27.6152	Atac: NORMAL	85.75%
54	52.123.200.36:443	192.168.125.179:60239	6	100	Ether / IP / TCP 52.123.200.36:https > 192.168.125.179:60239 PA / Raw
----------------------------------------
28.3732	Atac: NORMAL	85.75%
55	192.168.125.179:60055	20.199.120.151:443	6	55	Ether / IP / TCP 192.168.125.179:60055 > 20.199.120.151:https A / Raw
----------------------------------------
28.4712	Atac: NORMAL	85.75%
56	20.199.120.151:443	192.168.125.179:60055	6	66	Ether / IP / TCP 20.199.120.151:https > 192.168.125.179:60055 A
----------------------------------------
29.1003	Atac: NORMAL	85.75%
57	192.168.125.179:61487	20.52.64.201:443	6	55	Ether / IP / TCP 192.168.125.179:61487 > 20.52.64.201:https A / Raw
----------------------------------------
29.1993	Atac: NORMAL	85.75%
58	20.52.64.201:443	192.168.125.179:61487	6	66	Ether / IP / TCP 20.52.64.201:https > 192.168.125.179:61487 A
----------------------------------------
29.9623	Atac: NORMAL	85.75%
59	192.168.125.179:60218	52.123.134.246:443	6	105	Ether / IP / TCP 192.168.125.179:60218 > 52.123.134.246:https PA / Raw
----------------------------------------
