0.0921	Atac: NORMAL	85.75%
0	18.157.122.248:443	192.168.180.179:59328	6	93	Ether / IP / TCP 18.157.122.248:https > 192.168.180.179:59328 PA / Raw
----------------------------------------
0.2887	Atac: NORMAL	85.75%
1	18.157.122.248:443	192.168.180.179:59328	6	78	Ether / IP / TCP 18.157.122.248:https > 192.168.180.179:59328 PA / Raw
----------------------------------------
0.3658	Atac: NORMAL	85.75%
2	18.157.122.248:443	192.168.180.179:59328	6	54	Ether / IP / TCP 18.157.122.248:https > 192.168.180.179:59328 FA
----------------------------------------
0.4307	Atac: NORMAL	85.75%
2	192.168.180.179:59328	18.157.122.248:443	6	54	Ether / IP / TCP 192.168.180.179:59328 > 18.157.122.248:https A
----------------------------------------
0.5059	Atac: NORMAL	85.75%
4	192.168.180.179:59328	18.157.122.248:443	6	54	Ether / IP / TCP 192.168.180.179:59328 > 18.157.122.248:https A
----------------------------------------
0.5695	Atac: NORMAL	85.75%
4	192.168.180.179:59328	18.157.122.248:443	6	54	Ether / IP / TCP 192.168.180.179:59328 > 18.157.122.248:https FA
----------------------------------------
0.6328	Atac: NORMAL	85.75%
6	18.157.122.248:443	192.168.180.179:59328	6	54	Ether / IP / TCP 18.157.122.248:https > 192.168.180.179:59328 A
----------------------------------------
4.2554	Atac: NORMAL	85.75%
7	140.82.113.25:443	192.168.180.179:59220	6	79	Ether / IP / TCP 140.82.113.25:https > 192.168.180.179:59220 PA / Raw
----------------------------------------
4.3196	Atac: NORMAL	85.75%
7	192.168.180.179:59220	140.82.113.25:443	6	83	Ether / IP / TCP 192.168.180.179:59220 > 140.82.113.25:https PA / Raw
----------------------------------------
4.4089	Atac: NORMAL	85.75%
9	140.82.113.25:443	192.168.180.179:59220	6	54	Ether / IP / TCP 140.82.113.25:https > 192.168.180.179:59220 A
----------------------------------------
14.1770	Atac: NORMAL	85.75%
10	20.42.65.89:443	192.168.180.179:59395	6	54	Ether / IP / TCP 20.42.65.89:https > 192.168.180.179:59395 RA
----------------------------------------
14.5389	Atac: NORMAL	85.75%
11	192.168.180.179:59314	108.177.127.188:5228	6	55	Ether / IP / TCP 192.168.180.179:59314 > 108.177.127.188:5228 A / Raw
----------------------------------------
14.6870	Atac: NORMAL	85.75%
12	108.177.127.188:5228	192.168.180.179:59314	6	66	Ether / IP / TCP 108.177.127.188:5228 > 192.168.180.179:59314 A
----------------------------------------
16.3061	Atac: NORMAL	85.75%
13	192.168.180.179:59374	172.217.17.138:443	6	55	Ether / IP / TCP 192.168.180.179:59374 > 172.217.17.138:https A / Raw
----------------------------------------
16.4279	Atac: NORMAL	85.75%
14	172.217.17.138:443	192.168.180.179:59374	6	54	Ether / IP / TCP 172.217.17.138:https > 192.168.180.179:59374 R
----------------------------------------
19.9398	Atac: NORMAL	85.75%
15	52.123.128.14:443	192.168.180.179:59399	6	54	Ether / IP / TCP 52.123.128.14:https > 192.168.180.179:59399 RA
----------------------------------------
25.7059	Atac: NORMAL	85.75%
16	192.168.180.179:59338	92.122.18.57:443	6	55	Ether / IP / TCP 192.168.180.179:59338 > 92.122.18.57:https A / Raw
----------------------------------------
25.8490	Atac: NORMAL	85.75%
17	92.122.18.57:443	192.168.180.179:59338	6	66	Ether / IP / TCP 92.122.18.57:https > 192.168.180.179:59338 A
----------------------------------------
26.7441	Atac: NORMAL	85.75%
18	192.168.180.179:59427	13.107.246.44:443	6	55	Ether / IP / TCP 192.168.180.179:59427 > 13.107.246.44:https A / Raw
----------------------------------------
26.8733	Atac: NORMAL	85.75%
19	13.107.246.44:443	192.168.180.179:59427	6	66	Ether / IP / TCP 13.107.246.44:https > 192.168.180.179:59427 A
----------------------------------------
40.2391	Atac: NORMAL	85.75%
20	192.168.180.179:59232	40.101.78.114:443	6	55	Ether / IP / TCP 192.168.180.179:59232 > 40.101.78.114:https A / Raw
----------------------------------------
40.3910	Atac: NORMAL	85.75%
21	40.101.78.114:443	192.168.180.179:59232	6	66	Ether / IP / TCP 40.101.78.114:https > 192.168.180.179:59232 A
----------------------------------------
40.8456	Atac: NORMAL	85.75%
22	192.168.180.179:59398	52.97.168.178:443	6	55	Ether / IP / TCP 192.168.180.179:59398 > 52.97.168.178:https A / Raw
----------------------------------------
41.0052	Atac: NORMAL	85.75%
23	52.97.168.178:443	192.168.180.179:59398	6	66	Ether / IP / TCP 52.97.168.178:https > 192.168.180.179:59398 A
----------------------------------------
42.1841	Atac: NORMAL	85.75%
24	192.168.180.179:59428	142.251.140.10:443	6	55	Ether / IP / TCP 192.168.180.179:59428 > 142.251.140.10:https A / Raw
----------------------------------------
42.3375	Atac: NORMAL	85.75%
25	142.251.140.10:443	192.168.180.179:59428	6	66	Ether / IP / TCP 142.251.140.10:https > 192.168.180.179:59428 A
----------------------------------------
43.3340	Atac: NORMAL	85.75%
26	192.168.180.179:59304	140.82.112.26:443	6	55	Ether / IP / TCP 192.168.180.179:59304 > 140.82.112.26:https A / Raw
----------------------------------------
43.5654	Atac: NORMAL	85.75%
27	140.82.112.26:443	192.168.180.179:59304	6	66	Ether / IP / TCP 140.82.112.26:https > 192.168.180.179:59304 A
----------------------------------------
48.8839	Atac: NORMAL	70.54%
28	192.168.180.179:58595	192.168.180.22:53	17	75	Ether / IP / UDP / DNS Qry b'ssl.gstatic.com.'
----------------------------------------
48.9477	Atac: NORMAL	70.54%
28	192.168.180.179:63557	192.168.180.22:53	17	75	Ether / IP / UDP / DNS Qry b'ssl.gstatic.com.'
----------------------------------------
49.0249	Atac: NORMAL	70.54%
30	192.168.180.22:53	192.168.180.179:58595	17	91	Ether / IP / UDP / DNS Ans 172.217.17.99
----------------------------------------
49.0924	Atac: NORMAL	70.54%
31	192.168.180.22:53	192.168.180.179:63557	17	132	Ether / IP / UDP / DNS Ans
----------------------------------------
49.1604	Atac: NORMAL	70.54%
31	192.168.180.179:55350	172.217.17.99:443	17	1292	Ether / IP / UDP 192.168.180.179:55350 > 172.217.17.99:https / Raw
----------------------------------------
49.2274	Atac: NORMAL	70.54%
33	192.168.180.179:55350	172.217.17.99:443	17	1292	Ether / IP / UDP 192.168.180.179:55350 > 172.217.17.99:https / Raw
----------------------------------------
49.2934	Atac: NORMAL	70.54%
34	192.168.180.179:55350	172.217.17.99:443	17	124	Ether / IP / UDP 192.168.180.179:55350 > 172.217.17.99:https / Raw
----------------------------------------
49.3584	Atac: NORMAL	70.54%
34	192.168.180.179:55350	172.217.17.99:443	17	581	Ether / IP / UDP 192.168.180.179:55350 > 172.217.17.99:https / Raw
----------------------------------------
49.4227	Atac: NORMAL	70.54%
36	172.217.17.99:443	192.168.180.179:55350	17	82	Ether / IP / UDP 172.217.17.99:https > 192.168.180.179:55350 / Raw
----------------------------------------
49.4881	Atac: NORMAL	70.54%
37	172.217.17.99:443	192.168.180.179:55350	17	1292	Ether / IP / UDP 172.217.17.99:https > 192.168.180.179:55350 / Raw
----------------------------------------
49.6087	Atac: NORMAL	85.75%
38	140.82.113.25:443	192.168.180.179:59220	6	66	Ether / IP / TCP 140.82.113.25:https > 192.168.180.179:59220 A
----------------------------------------
58.0082	Atac: NORMAL	85.75%
39	140.82.112.26:443	192.168.180.179:59304	6	79	Ether / IP / TCP 140.82.112.26:https > 192.168.180.179:59304 PA / Raw
----------------------------------------
58.0762	Atac: NORMAL	85.75%
39	192.168.180.179:59304	140.82.112.26:443	6	83	Ether / IP / TCP 192.168.180.179:59304 > 140.82.112.26:https PA / Raw
----------------------------------------
58.1447	Atac: NORMAL	85.75%
41	140.82.112.26:443	192.168.180.179:59304	6	54	Ether / IP / TCP 140.82.112.26:https > 192.168.180.179:59304 A
----------------------------------------
59.6950	Eroare: main thread is not in main loop	0.00%
42	192.168.180.179:59314	108.177.127.188:5228	6	55	Ether / IP / TCP 192.168.180.179:59314 > 108.177.127.188:5228 A / Raw
----------------------------------------
64.1489	Eroare: main thread is not in main loop	0.00%
42	140.82.113.25:443	192.168.180.179:59220	6	79	Ether / IP / TCP 140.82.113.25:https > 192.168.180.179:59220 PA / Raw
----------------------------------------
70.8523	Eroare: main thread is not in main loop	0.00%
42	192.168.180.179:59338	92.122.18.57:443	6	55	Ether / IP / TCP 192.168.180.179:59338 > 92.122.18.57:https A / Raw
----------------------------------------
72.1360	Eroare: main thread is not in main loop	0.00%
42	13.107.246.44:443	192.168.180.179:59427	6	93	Ether / IP / TCP 13.107.246.44:https > 192.168.180.179:59427 PA / Raw
----------------------------------------
74.1489	Eroare: main thread is not in main loop	0.00%
42	192.168.180.179:55350	172.217.17.99:443	17	144	Ether / IP / UDP 192.168.180.179:55350 > 172.217.17.99:https / Raw
----------------------------------------
85.3976	Eroare: main thread is not in main loop	0.00%
42	192.168.180.179:59232	40.101.78.114:443	6	55	Ether / IP / TCP 192.168.180.179:59232 > 40.101.78.114:https A / Raw
----------------------------------------
87.3500	Eroare: main thread is not in main loop	0.00%
42	192.168.180.179:59428	142.251.140.10:443	6	55	Ether / IP / TCP 192.168.180.179:59428 > 142.251.140.10:https A / Raw
----------------------------------------
94.4754	Eroare: main thread is not in main loop	0.00%
42	192.168.180.179:63190	192.168.180.22:53	17	92	Ether / IP / UDP / DNS Qry b'mobile.events.data.microsoft.com.'
----------------------------------------
95.7189	Eroare: main thread is not in main loop	0.00%
42	192.168.180.179:59429	52.182.143.208:443	6	1354	Ether / IP / TCP 192.168.180.179:59429 > 52.182.143.208:https PA / Raw
----------------------------------------
97.0414	Eroare: main thread is not in main loop	0.00%
42	52.182.143.208:443	192.168.180.179:59430	6	153	Ether / IP / TCP 52.182.143.208:https > 192.168.180.179:59430 PA / Raw
----------------------------------------
101.5854	Eroare: main thread is not in main loop	0.00%
42	192.168.180.179:64451	192.168.180.22:53	17	92	Ether / IP / UDP / DNS Qry b'mobile.events.data.microsoft.com.'
----------------------------------------
102.8045	Eroare: main thread is not in main loop	0.00%
42	192.168.180.179:59431	20.189.173.15:443	6	491	Ether / IP / TCP 192.168.180.179:59431 > 20.189.173.15:https PA / Raw
----------------------------------------
104.0819	Eroare: main thread is not in main loop	0.00%
42	20.189.173.15:443	192.168.180.179:59431	6	54	Ether / IP / TCP 20.189.173.15:https > 192.168.180.179:59431 A
----------------------------------------
109.3647	Eroare: main thread is not in main loop	0.00%
42	192.168.180.179:59220	140.82.113.25:443	6	55	Ether / IP / TCP 192.168.180.179:59220 > 140.82.113.25:https A / Raw
----------------------------------------
115.8681	Eroare: main thread is not in main loop	0.00%
42	192.168.180.179:59338	92.122.18.57:443	6	55	Ether / IP / TCP 192.168.180.179:59338 > 92.122.18.57:https A / Raw
----------------------------------------
117.1198	Eroare: main thread is not in main loop	0.00%
42	20.189.173.11:443	192.168.180.179:59432	6	153	Ether / IP / TCP 20.189.173.11:https > 192.168.180.179:59432 PA / Raw
----------------------------------------
121.6971	Eroare: main thread is not in main loop	0.00%
42	192.168.180.179:49225	192.168.180.22:53	17	70	Ether / IP / UDP / DNS Qry b'github.com.'
----------------------------------------
122.7946	Eroare: main thread is not in main loop	0.00%
42	140.82.121.3:443	192.168.180.179:59435	6	54	Ether / IP / TCP 140.82.121.3:https > 192.168.180.179:59435 A
----------------------------------------
124.2390	Eroare: main thread is not in main loop	0.00%
42	140.82.113.25:443	192.168.180.179:59220	6	79	Ether / IP / TCP 140.82.113.25:https > 192.168.180.179:59220 PA / Raw
----------------------------------------
125.3517	Eroare: main thread is not in main loop	0.00%
42	192.168.180.179:51344	192.168.180.22:53	17	86	Ether / IP / UDP / DNS Qry b'checkappexec.microsoft.com.'
----------------------------------------
127.9149	Eroare: main thread is not in main loop	0.00%
42	192.168.180.179:137	192.168.180.255:137	17	92	Ether / IP / UDP / NBNSHeader / NBNSQueryRequest who has '\\DESKTOP-H45KHRK'
----------------------------------------
129.4298	Eroare: main thread is not in main loop	0.00%
42	192.168.180.179:137	192.168.180.255:137	17	92	Ether / IP / UDP / NBNSHeader / NBNSQueryRequest who has '\\DESKTOP-H45KHRK'
----------------------------------------
130.6599	Eroare: main thread is not in main loop	0.00%
42	192.168.180.179:59232	40.101.78.114:443	6	55	Ether / IP / TCP 192.168.180.179:59232 > 40.101.78.114:https A / Raw
----------------------------------------
132.5023	Eroare: main thread is not in main loop	0.00%
42	192.168.180.179:59428	142.251.140.10:443	6	55	Ether / IP / TCP 192.168.180.179:59428 > 142.251.140.10:https A / Raw
----------------------------------------
140.9562	Eroare: main thread is not in main loop	0.00%
42	192.168.180.179:59429	52.182.143.208:443	6	55	Ether / IP / TCP 192.168.180.179:59429 > 52.182.143.208:https A / Raw
----------------------------------------
149.9319	Eroare: main thread is not in main loop	0.00%
42	192.168.180.179:59314	108.177.127.188:5228	6	55	Ether / IP / TCP 192.168.180.179:59314 > 108.177.127.188:5228 A / Raw
----------------------------------------
155.1039	Eroare: main thread is not in main loop	0.00%
42	140.82.121.6:443	192.168.180.179:59439	6	93	Ether / IP / TCP 140.82.121.6:https > 192.168.180.179:59439 PA / Raw
----------------------------------------
159.2779	Eroare: main thread is not in main loop	0.00%
42	192.168.180.179:57142	20.199.120.85:443	6	55	Ether / IP / TCP 192.168.180.179:57142 > 20.199.120.85:https A / Raw
----------------------------------------
160.9688	Eroare: main thread is not in main loop	0.00%
42	192.168.180.179:59338	92.122.18.57:443	6	55	Ether / IP / TCP 192.168.180.179:59338 > 92.122.18.57:https A / Raw
----------------------------------------
163.2611	Eroare: main thread is not in main loop	0.00%
42	140.82.112.26:443	192.168.180.179:59304	6	66	Ether / IP / TCP 140.82.112.26:https > 192.168.180.179:59304 A
----------------------------------------
169.4006	Eroare: main thread is not in main loop	0.00%
42	192.168.180.179:59220	140.82.113.25:443	6	55	Ether / IP / TCP 192.168.180.179:59220 > 140.82.113.25:https A / Raw
----------------------------------------
175.7435	Eroare: main thread is not in main loop	0.00%
42	192.168.180.179:59232	40.101.78.114:443	6	55	Ether / IP / TCP 192.168.180.179:59232 > 40.101.78.114:https A / Raw
----------------------------------------
177.5428	Eroare: main thread is not in main loop	0.00%
42	192.168.180.179:59428	142.251.140.10:443	6	55	Ether / IP / TCP 192.168.180.179:59428 > 142.251.140.10:https A / Raw
----------------------------------------
184.0667	Eroare: main thread is not in main loop	0.00%
42	140.82.113.25:443	192.168.180.179:59220	6	79	Ether / IP / TCP 140.82.113.25:https > 192.168.180.179:59220 PA / Raw
----------------------------------------
186.2033	Eroare: main thread is not in main loop	0.00%
42	192.168.180.179:59429	52.182.143.208:443	6	55	Ether / IP / TCP 192.168.180.179:59429 > 52.182.143.208:https A / Raw
----------------------------------------
188.7367	Eroare: main thread is not in main loop	0.00%
42	192.168.180.179:57067	20.199.120.151:443	6	55	Ether / IP / TCP 192.168.180.179:57067 > 20.199.120.151:https A / Raw
----------------------------------------
195.1608	Eroare: main thread is not in main loop	0.00%
42	192.168.180.179:59314	108.177.127.188:5228	6	55	Ether / IP / TCP 192.168.180.179:59314 > 108.177.127.188:5228 A / Raw
----------------------------------------
206.0301	Eroare: main thread is not in main loop	0.00%
42	192.168.180.179:59338	92.122.18.57:443	6	55	Ether / IP / TCP 192.168.180.179:59338 > 92.122.18.57:https A / Raw
----------------------------------------
208.9880	Eroare: main thread is not in main loop	0.00%
42	192.168.180.179:59161	192.168.180.22:53	17	77	Ether / IP / UDP / DNS Qry b'get.geo.opera.com.'
----------------------------------------
210.1164	Eroare: main thread is not in main loop	0.00%
42	192.168.180.179:59446	82.145.216.16:443	6	1354	Ether / IP / TCP 192.168.180.179:59446 > 82.145.216.16:https PA / Raw
----------------------------------------
211.2103	Eroare: main thread is not in main loop	0.00%
42	142.251.140.78:443	192.168.180.179:63894	17	82	Ether / IP / UDP 142.251.140.78:https > 192.168.180.179:63894 / Raw
----------------------------------------
212.3085	Eroare: main thread is not in main loop	0.00%
42	192.168.180.179:61195	142.251.140.4:443	17	76	Ether / IP / UDP 192.168.180.179:61195 > 142.251.140.4:https / Raw
----------------------------------------
213.4354	Eroare: main thread is not in main loop	0.00%
42	192.168.180.179:54806	64.233.184.84:443	17	538	Ether / IP / UDP 192.168.180.179:54806 > 64.233.184.84:https / Raw
----------------------------------------
215.4398	Eroare: main thread is not in main loop	0.00%
42	192.168.180.179:59452	82.145.216.15:443	6	113	Ether / IP / TCP 192.168.180.179:59452 > 82.145.216.15:https PA / Raw
----------------------------------------
219.9181	Eroare: main thread is not in main loop	0.00%
42	142.251.140.4:443	192.168.180.179:59445	6	54	Ether / IP / TCP 142.251.140.4:https > 192.168.180.179:59445 FA
----------------------------------------
221.3483	Eroare: main thread is not in main loop	0.00%
42	192.168.180.179:59398	52.97.168.178:443	6	55	Ether / IP / TCP 192.168.180.179:59398 > 52.97.168.178:https A / Raw
----------------------------------------
223.2302	Eroare: main thread is not in main loop	0.00%
42	192.168.180.179:59304	140.82.112.26:443	6	55	Ether / IP / TCP 192.168.180.179:59304 > 140.82.112.26:https A / Raw
----------------------------------------
227.1831	Eroare: main thread is not in main loop	0.00%
42	192.168.180.179:61195	142.251.140.4:443	17	1292	Ether / IP / UDP 192.168.180.179:61195 > 142.251.140.4:https / Raw
----------------------------------------
229.2363	Eroare: main thread is not in main loop	0.00%
42	192.168.180.179:59220	140.82.113.25:443	6	55	Ether / IP / TCP 192.168.180.179:59220 > 140.82.113.25:https A / Raw
----------------------------------------
230.3466	Eroare: main thread is not in main loop	0.00%
42	52.109.28.47:443	192.168.180.179:59458	6	66	Ether / IP / TCP 52.109.28.47:https > 192.168.180.179:59458 SA
----------------------------------------
238.1573	Eroare: main thread is not in main loop	0.00%
42	140.82.112.26:443	192.168.180.179:59304	6	79	Ether / IP / TCP 140.82.112.26:https > 192.168.180.179:59304 PA / Raw
----------------------------------------
240.1624	Eroare: main thread is not in main loop	0.00%
42	192.168.180.179:59314	108.177.127.188:5228	6	55	Ether / IP / TCP 192.168.180.179:59314 > 108.177.127.188:5228 A / Raw
----------------------------------------
241.9364	Eroare: main thread is not in main loop	0.00%
42	192.168.180.179:53414	192.168.180.22:53	17	85	Ether / IP / UDP / DNS Qry b'experimentation.deepl.com.'
----------------------------------------
244.0407	Eroare: main thread is not in main loop	0.00%
42	140.82.113.25:443	192.168.180.179:59220	6	80	Ether / IP / TCP 140.82.113.25:https > 192.168.180.179:59220 PA / Raw
----------------------------------------
254.3667	Eroare: main thread is not in main loop	0.00%
42	192.168.180.179:59441	185.26.182.72:443	6	55	Ether / IP / TCP 192.168.180.179:59441 > 185.26.182.72:https A / Raw
----------------------------------------
255.4976	Eroare: main thread is not in main loop	0.00%
42	192.168.180.179:59446	82.145.216.16:443	6	55	Ether / IP / TCP 192.168.180.179:59446 > 82.145.216.16:https A / Raw
----------------------------------------
256.6091	Eroare: main thread is not in main loop	0.00%
42	192.168.180.179:59454	142.250.187.98:443	6	55	Ether / IP / TCP 192.168.180.179:59454 > 142.250.187.98:https A / Raw
----------------------------------------
257.7127	Eroare: main thread is not in main loop	0.00%
42	192.168.180.179:59457	216.58.212.46:443	6	55	Ether / IP / TCP 192.168.180.179:59457 > 216.58.212.46:https A / Raw
----------------------------------------
260.5386	Eroare: main thread is not in main loop	0.00%
42	192.168.180.179:59452	82.145.216.15:443	6	55	Ether / IP / TCP 192.168.180.179:59452 > 82.145.216.15:https A / Raw
----------------------------------------
264.9192	Eroare: main thread is not in main loop	0.00%
42	192.168.180.179:59445	142.251.140.4:443	6	55	Ether / IP / TCP 192.168.180.179:59445 > 142.251.140.4:https A / Raw
----------------------------------------
266.4376	Eroare: main thread is not in main loop	0.00%
42	192.168.180.179:59398	52.97.168.178:443	6	55	Ether / IP / TCP 192.168.180.179:59398 > 52.97.168.178:https A / Raw
----------------------------------------
270.4740	Eroare: main thread is not in main loop	0.00%
42	82.145.216.16:443	192.168.180.179:59446	6	93	Ether / IP / TCP 82.145.216.16:https > 192.168.180.179:59446 PA / Raw
----------------------------------------
274.3625	Eroare: main thread is not in main loop	0.00%
42	185.26.182.72:443	192.168.180.179:59441	6	78	Ether / IP / TCP 185.26.182.72:https > 192.168.180.179:59441 PA / Raw
----------------------------------------
275.6029	Eroare: main thread is not in main loop	0.00%
42	185.26.182.71:443	192.168.180.179:59443	6	78	Ether / IP / TCP 185.26.182.71:https > 192.168.180.179:59443 PA / Raw
----------------------------------------
280.7688	Eroare: main thread is not in main loop	0.00%
42	82.145.216.15:443	192.168.180.179:59452	6	93	Ether / IP / TCP 82.145.216.15:https > 192.168.180.179:59452 PA / Raw
----------------------------------------
281.8688	Eroare: main thread is not in main loop	0.00%
42	13.107.246.44:443	192.168.180.179:59459	6	54	Ether / IP / TCP 13.107.246.44:https > 192.168.180.179:59459 A
----------------------------------------
283.3115	Eroare: main thread is not in main loop	0.00%
42	192.168.180.179:59304	140.82.112.26:443	6	55	Ether / IP / TCP 192.168.180.179:59304 > 140.82.112.26:https A / Raw
----------------------------------------
285.2677	Eroare: main thread is not in main loop	0.00%
42	192.168.180.179:59314	108.177.127.188:5228	6	55	Ether / IP / TCP 192.168.180.179:59314 > 108.177.127.188:5228 A / Raw
----------------------------------------
289.2396	Eroare: main thread is not in main loop	0.00%
42	192.168.180.179:59220	140.82.113.25:443	6	55	Ether / IP / TCP 192.168.180.179:59220 > 140.82.113.25:https A / Raw
----------------------------------------
297.9302	Eroare: main thread is not in main loop	0.00%
42	140.82.112.26:443	192.168.180.179:59304	6	80	Ether / IP / TCP 140.82.112.26:https > 192.168.180.179:59304 PA / Raw
----------------------------------------
300.2417	Eroare: main thread is not in main loop	0.00%
42	192.168.180.179:59338	92.122.18.57:443	6	55	Ether / IP / TCP 192.168.180.179:59338 > 92.122.18.57:https A / Raw
----------------------------------------
301.6725	Eroare: main thread is not in main loop	0.00%
42	192.168.180.179:59454	142.250.187.98:443	6	55	Ether / IP / TCP 192.168.180.179:59454 > 142.250.187.98:https A / Raw
----------------------------------------
302.7717	Eroare: main thread is not in main loop	0.00%
42	192.168.180.179:59457	216.58.212.46:443	6	55	Ether / IP / TCP 192.168.180.179:59457 > 216.58.212.46:https A / Raw
----------------------------------------
304.0733	Eroare: main thread is not in main loop	0.00%
42	140.82.113.25:443	192.168.180.179:59220	6	80	Ether / IP / TCP 140.82.113.25:https > 192.168.180.179:59220 PA / Raw
----------------------------------------
306.0188	Eroare: main thread is not in main loop	0.00%
42	48.209.144.71:443	192.168.180.179:59440	6	100	Ether / IP / TCP 48.209.144.71:https > 192.168.180.179:59440 PA / Raw
----------------------------------------
310.8131	Eroare: main thread is not in main loop	0.00%
42	192.168.180.179:58480	192.168.180.22:53	17	80	Ether / IP / UDP / DNS Qry b'autoupdate.opera.com.'
----------------------------------------
315.4863	Eroare: main thread is not in main loop	0.00%
42	192.168.180.179:59446	82.145.216.16:443	6	55	Ether / IP / TCP 192.168.180.179:59446 > 82.145.216.16:https A / Raw
----------------------------------------
319.9753	Eroare: main thread is not in main loop	0.00%
42	192.168.180.179:59442	185.26.182.71:443	6	55	Ether / IP / TCP 192.168.180.179:59442 > 185.26.182.71:https A / Raw
----------------------------------------
327.0264	Eroare: main thread is not in main loop	0.00%
42	192.168.180.179:59459	13.107.246.44:443	6	55	Ether / IP / TCP 192.168.180.179:59459 > 13.107.246.44:https A / Raw
----------------------------------------
330.3655	Eroare: main thread is not in main loop	0.00%
42	192.168.180.179:59314	108.177.127.188:5228	6	55	Ether / IP / TCP 192.168.180.179:59314 > 108.177.127.188:5228 A / Raw
----------------------------------------
333.1775	Eroare: main thread is not in main loop	0.00%
42	192.168.180.179:49508	192.168.180.22:53	17	78	Ether / IP / UDP / DNS Qry b'www.googleapis.com.'
----------------------------------------
343.1519	Eroare: main thread is not in main loop	0.00%
42	192.168.180.179:59304	140.82.112.26:443	6	55	Ether / IP / TCP 192.168.180.179:59304 > 140.82.112.26:https A / Raw
----------------------------------------
345.6953	Eroare: main thread is not in main loop	0.00%
42	192.168.180.179:59449	142.251.140.65:443	6	55	Ether / IP / TCP 192.168.180.179:59449 > 142.251.140.65:https A / Raw
----------------------------------------
346.8199	Eroare: main thread is not in main loop	0.00%
42	192.168.180.179:59454	142.250.187.98:443	6	55	Ether / IP / TCP 192.168.180.179:59454 > 142.250.187.98:https A / Raw
----------------------------------------
347.9410	Eroare: main thread is not in main loop	0.00%
42	216.58.212.46:443	192.168.180.179:59457	6	66	Ether / IP / TCP 216.58.212.46:https > 192.168.180.179:59457 A
----------------------------------------
349.0858	Eroare: main thread is not in main loop	0.00%
42	172.217.17.99:443	192.168.180.179:65053	17	82	Ether / IP / UDP 172.217.17.99:https > 192.168.180.179:65053 / Raw
----------------------------------------
356.1227	Eroare: main thread is not in main loop	0.00%
42	192.168.180.179:59232	40.101.78.114:443	6	55	Ether / IP / TCP 192.168.180.179:59232 > 40.101.78.114:https A / Raw
----------------------------------------
358.5172	Eroare: main thread is not in main loop	0.00%
42	140.82.112.26:443	192.168.180.179:59304	6	80	Ether / IP / TCP 140.82.112.26:https > 192.168.180.179:59304 PA / Raw
----------------------------------------
364.2118	Eroare: main thread is not in main loop	0.00%
42	140.82.113.25:443	192.168.180.179:59220	6	80	Ether / IP / TCP 140.82.113.25:https > 192.168.180.179:59220 PA / Raw
----------------------------------------
368.2777	Eroare: main thread is not in main loop	0.00%
42	192.168.180.179:55646	192.168.180.22:53	17	77	Ether / IP / UDP / DNS Qry b'get.geo.opera.com.'
----------------------------------------
369.3751	Eroare: main thread is not in main loop	0.00%
42	192.168.180.22:53	192.168.180.179:61614	17	102	Ether / IP / UDP / DNS Ans 172.217.17.142
----------------------------------------
370.4779	Eroare: main thread is not in main loop	0.00%
42	142.251.140.4:443	192.168.180.179:59817	17	72	Ether / IP / UDP 142.251.140.4:https > 192.168.180.179:59817 / Raw
----------------------------------------
371.6011	Eroare: main thread is not in main loop	0.00%
42	104.18.22.152:443	192.168.180.179:54183	17	70	Ether / IP / UDP 104.18.22.152:https > 192.168.180.179:54183 / Raw
----------------------------------------
372.7948	Eroare: main thread is not in main loop	0.00%
42	185.26.182.118:443	192.168.180.179:59471	6	54	Ether / IP / TCP 185.26.182.118:https > 192.168.180.179:59471 A
----------------------------------------
373.9508	Eroare: main thread is not in main loop	0.00%
42	34.243.42.17:443	192.168.180.179:59475	6	857	Ether / IP / TCP 34.243.42.17:https > 192.168.180.179:59475 PA / Raw
----------------------------------------
375.4981	Eroare: main thread is not in main loop	0.00%
42	192.168.180.179:59314	108.177.127.188:5228	6	55	Ether / IP / TCP 192.168.180.179:59314 > 108.177.127.188:5228 A / Raw
----------------------------------------
376.6334	Eroare: main thread is not in main loop	0.00%
42	104.18.22.152:443	192.168.180.179:54183	17	66	Ether / IP / UDP 104.18.22.152:https > 192.168.180.179:54183 / Raw
----------------------------------------
377.7438	Eroare: main thread is not in main loop	0.00%
42	192.168.180.179:54183	104.18.22.152:443	17	92	Ether / IP / UDP 192.168.180.179:54183 > 104.18.22.152:https / Raw
----------------------------------------
389.3504	Eroare: main thread is not in main loop	0.00%
42	192.168.180.179:59476	52.30.201.170:443	6	295	Ether / IP / TCP 192.168.180.179:59476 > 52.30.201.170:https PA / Raw
----------------------------------------
390.4992	Eroare: main thread is not in main loop	0.00%
42	104.18.22.152:443	192.168.180.179:54183	17	537	Ether / IP / UDP 104.18.22.152:https > 192.168.180.179:54183 / Raw
----------------------------------------
391.6303	Eroare: main thread is not in main loop	0.00%
42	192.168.180.179:54183	104.18.22.152:443	17	1292	Ether / IP / UDP 192.168.180.179:54183 > 104.18.22.152:https / Raw
----------------------------------------
393.5867	Eroare: main thread is not in main loop	0.00%
42	192.168.180.179:54183	104.18.22.152:443	17	1292	Ether / IP / UDP 192.168.180.179:54183 > 104.18.22.152:https / Raw
----------------------------------------
397.7211	Eroare: main thread is not in main loop	0.00%
42	192.168.180.179:54183	104.18.22.152:443	17	1292	Ether / IP / UDP 192.168.180.179:54183 > 104.18.22.152:https / Raw
----------------------------------------
401.2062	Eroare: main thread is not in main loop	0.00%
42	192.168.180.179:59232	40.101.78.114:443	6	55	Ether / IP / TCP 192.168.180.179:59232 > 40.101.78.114:https A / Raw
----------------------------------------
403.6421	Eroare: main thread is not in main loop	0.00%
42	194.124.205.65:443	192.168.180.179:59472	6	93	Ether / IP / TCP 194.124.205.65:https > 192.168.180.179:59472 PA / Raw
----------------------------------------
409.3994	Eroare: main thread is not in main loop	0.00%
42	192.168.180.179:59220	140.82.113.25:443	6	55	Ether / IP / TCP 192.168.180.179:59220 > 140.82.113.25:https A / Raw
----------------------------------------
412.7344	Eroare: main thread is not in main loop	0.00%
42	192.168.180.179:54183	104.18.22.152:443	17	1292	Ether / IP / UDP 192.168.180.179:54183 > 104.18.22.152:https / Raw
----------------------------------------
414.1074	Eroare: main thread is not in main loop	0.00%
42	192.168.180.179:59463	185.26.182.72:443	6	55	Ether / IP / TCP 192.168.180.179:59463 > 185.26.182.72:https A / Raw
----------------------------------------
415.2393	Eroare: main thread is not in main loop	0.00%
42	192.168.180.179:59468	82.145.216.15:443	6	55	Ether / IP / TCP 192.168.180.179:59468 > 82.145.216.15:https A / Raw
----------------------------------------
416.4255	Eroare: main thread is not in main loop	0.00%
42	20.42.73.30:443	192.168.180.179:59477	6	54	Ether / IP / TCP 20.42.73.30:https > 192.168.180.179:59477 A
----------------------------------------
417.5191	Eroare: main thread is not in main loop	0.00%
42	104.16.79.73:443	192.168.180.179:59470	6	66	Ether / IP / TCP 104.16.79.73:https > 192.168.180.179:59470 A
----------------------------------------
418.9674	Eroare: main thread is not in main loop	0.00%
42	192.168.180.179:59475	34.243.42.17:443	6	55	Ether / IP / TCP 192.168.180.179:59475 > 34.243.42.17:https A / Raw
----------------------------------------
420.4166	Eroare: main thread is not in main loop	0.00%
42	192.168.180.179:59476	52.30.201.170:443	6	296	Ether / IP / TCP 192.168.180.179:59476 > 52.30.201.170:https PA / Raw
----------------------------------------
421.7378	Eroare: main thread is not in main loop	0.00%
42	192.168.180.179:59471	185.26.182.118:443	6	55	Ether / IP / TCP 192.168.180.179:59471 > 185.26.182.118:https A / Raw
----------------------------------------
424.0508	Eroare: main thread is not in main loop	0.00%
42	140.82.113.25:443	192.168.180.179:59220	6	80	Ether / IP / TCP 140.82.113.25:https > 192.168.180.179:59220 PA / Raw
----------------------------------------
426.6813	Eroare: main thread is not in main loop	0.00%
42	192.168.180.179:63386	192.168.180.22:53	17	92	Ether / IP / UDP / DNS Qry b'mobile.events.data.microsoft.com.'
----------------------------------------
427.8644	Eroare: main thread is not in main loop	0.00%
42	20.42.73.30:443	192.168.180.179:59501	6	54	Ether / IP / TCP 20.42.73.30:https > 192.168.180.179:59501 A
----------------------------------------
429.4898	Eroare: main thread is not in main loop	0.00%
42	82.145.216.16:443	192.168.180.179:59465	6	93	Ether / IP / TCP 82.145.216.16:https > 192.168.180.179:59465 PA / Raw
----------------------------------------
433.6619	Eroare: main thread is not in main loop	0.00%
42	185.26.182.71:443	192.168.180.179:59461	6	78	Ether / IP / TCP 185.26.182.71:https > 192.168.180.179:59461 PA / Raw
----------------------------------------
434.7818	Eroare: main thread is not in main loop	0.00%
42	82.145.216.16:443	192.168.180.179:59464	6	54	Ether / IP / TCP 82.145.216.16:https > 192.168.180.179:59464 A
----------------------------------------
436.4171	Eroare: main thread is not in main loop	0.00%
42	192.168.180.179:59428	142.251.140.10:443	6	55	Ether / IP / TCP 192.168.180.179:59428 > 142.251.140.10:https A / Raw
----------------------------------------
438.4338	Eroare: main thread is not in main loop	0.00%
42	192.168.180.179:50105	192.168.180.22:53	17	74	Ether / IP / UDP / DNS Qry b'api.github.com.'
----------------------------------------
439.6519	Eroare: main thread is not in main loop	0.00%
42	20.42.73.30:443	192.168.180.179:59486	6	54	Ether / IP / TCP 20.42.73.30:https > 192.168.180.179:59486 A
----------------------------------------
441.7444	Eroare: main thread is not in main loop	0.00%
42	185.26.182.118:443	192.168.180.179:59471	6	93	Ether / IP / TCP 185.26.182.118:https > 192.168.180.179:59471 PA / Raw
----------------------------------------
443.9303	Eroare: main thread is not in main loop	0.00%
42	192.168.180.179:59486	20.42.73.30:443	6	167	Ether / IP / TCP 192.168.180.179:59486 > 20.42.73.30:https PA / Raw
----------------------------------------
446.3113	Eroare: main thread is not in main loop	0.00%
42	192.168.180.179:59232	40.101.78.114:443	6	55	Ether / IP / TCP 192.168.180.179:59232 > 40.101.78.114:https A / Raw
----------------------------------------
450.0557	Eroare: main thread is not in main loop	0.00%
42	192.168.180.179:59486	20.42.73.30:443	6	167	Ether / IP / TCP 192.168.180.179:59486 > 20.42.73.30:https PA / Raw
----------------------------------------
451.2554	Eroare: main thread is not in main loop	0.00%
42	142.251.140.10:443	192.168.180.179:59428	6	127	Ether / IP / TCP 142.251.140.10:https > 192.168.180.179:59428 PA / Raw
----------------------------------------
452.4232	Eroare: main thread is not in main loop	0.00%
42	192.168.180.179:59476	52.30.201.170:443	6	296	Ether / IP / TCP 192.168.180.179:59476 > 52.30.201.170:https PA / Raw
----------------------------------------
453.9383	Eroare: main thread is not in main loop	0.00%
42	192.168.180.179:59486	20.42.73.30:443	6	167	Ether / IP / TCP 192.168.180.179:59486 > 20.42.73.30:https PA / Raw
----------------------------------------
