0.0150	Atac: normal	56.23%
4	13.107.246.44:443	192.168.125.179:61485	6	54	Ether / IP / TCP 13.107.246.44:https > 192.168.125.179:61485 A
----------------------------------------
0.1140	Atac: normal	56.23%
5	13.107.246.44:443	192.168.125.179:61484	6	54	Ether / IP / TCP 13.107.246.44:https > 192.168.125.179:61484 A
----------------------------------------
0.2140	Atac: normal	56.23%
6	13.107.246.44:443	192.168.125.179:61484	6	125	Ether / IP / TCP 13.107.246.44:https > 192.168.125.179:61484 PA / Raw
----------------------------------------
0.3070	Atac: normal	56.23%
7	13.107.246.44:443	192.168.125.179:61485	6	341	Ether / IP / TCP 13.107.246.44:https > 192.168.125.179:61485 PA / Raw
----------------------------------------
0.4150	Atac: normal	56.23%
8	13.107.246.44:443	192.168.125.179:61485	6	341	Ether / IP / TCP 13.107.246.44:https > 192.168.125.179:61485 PA / Raw
----------------------------------------
0.5090	Atac: normal	56.23%
8	13.107.246.44:443	192.168.125.179:61485	6	125	Ether / IP / TCP 13.107.246.44:https > 192.168.125.179:61485 PA / Raw
----------------------------------------
0.5910	Atac: normal	56.23%
10	13.107.246.44:443	192.168.125.179:61485	6	432	Ether / IP / TCP 13.107.246.44:https > 192.168.125.179:61485 PA / Raw
----------------------------------------
0.6770	Atac: normal	56.23%
11	13.107.246.44:443	192.168.125.179:61484	6	1354	Ether / IP / TCP 13.107.246.44:https > 192.168.125.179:61484 A / Raw
----------------------------------------
0.7610	Atac: normal	56.23%
12	13.107.246.44:443	192.168.125.179:61484	6	1354	Ether / IP / TCP 13.107.246.44:https > 192.168.125.179:61484 PA / Raw
----------------------------------------
0.8420	Atac: normal	56.23%
12	13.107.246.44:443	192.168.125.179:61484	6	1354	Ether / IP / TCP 13.107.246.44:https > 192.168.125.179:61484 A / Raw
----------------------------------------
0.9220	Atac: normal	56.23%
14	13.107.246.44:443	192.168.125.179:61484	6	1354	Ether / IP / TCP 13.107.246.44:https > 192.168.125.179:61484 PA / Raw
----------------------------------------
1.6751	Atac: normal	56.23%
15	52.109.102.2:443	192.168.125.179:61350	6	98	Ether / IP / TCP 52.109.102.2:https > 192.168.125.179:61350 PA / Raw
----------------------------------------
1.7751	Atac: normal	56.23%
16	192.168.125.179:61350	52.109.102.2:443	6	54	Ether / IP / TCP 192.168.125.179:61350 > 52.109.102.2:https A
----------------------------------------
1.8861	Atac: normal	56.23%
17	192.168.125.179:61228	52.16.218.208:443	6	297	Ether / IP / TCP 192.168.125.179:61228 > 52.16.218.208:https PA / Raw
----------------------------------------
2.0431	Atac: normal	56.23%
18	52.16.218.208:443	192.168.125.179:61228	6	320	Ether / IP / TCP 52.16.218.208:https > 192.168.125.179:61228 PA / Raw
----------------------------------------
2.1451	Atac: normal	56.23%
19	52.123.200.36:443	192.168.125.179:60239	6	100	Ether / IP / TCP 52.123.200.36:https > 192.168.125.179:60239 PA / Raw
----------------------------------------
2.2451	Atac: normal	56.23%
20	192.168.125.179:60242	52.123.200.36:443	6	111	Ether / IP / TCP 192.168.125.179:60242 > 52.123.200.36:https PA / Raw
----------------------------------------
2.3411	Atac: normal	56.23%
21	192.168.125.179:60239	52.123.200.36:443	6	54	Ether / IP / TCP 192.168.125.179:60239 > 52.123.200.36:https A
----------------------------------------
2.4401	Atac: normal	56.23%
22	52.123.200.36:443	192.168.125.179:60242	6	100	Ether / IP / TCP 52.123.200.36:https > 192.168.125.179:60242 PA / Raw
----------------------------------------
2.5331	Atac: normal	56.23%
22	192.168.125.179:60242	52.123.200.36:443	6	54	Ether / IP / TCP 192.168.125.179:60242 > 52.123.200.36:https A
----------------------------------------
5.2452	Atac: normal	56.23%
24	192.168.125.179:61372	140.82.112.26:443	6	55	Ether / IP / TCP 192.168.125.179:61372 > 140.82.112.26:https A / Raw
----------------------------------------
5.3372	Atac: normal	56.23%
25	192.168.125.179:60257	74.248.74.217:443	6	111	Ether / IP / TCP 192.168.125.179:60257 > 74.248.74.217:https PA / Raw
----------------------------------------
5.4492	Atac: normal	56.23%
26	74.248.74.217:443	192.168.125.179:60257	6	100	Ether / IP / TCP 74.248.74.217:https > 192.168.125.179:60257 PA / Raw
----------------------------------------
5.5372	Atac: normal	56.23%
26	192.168.125.179:60257	74.248.74.217:443	6	54	Ether / IP / TCP 192.168.125.179:60257 > 74.248.74.217:https A
----------------------------------------
5.6262	Atac: normal	56.23%
28	140.82.112.26:443	192.168.125.179:61372	6	66	Ether / IP / TCP 140.82.112.26:https > 192.168.125.179:61372 A
----------------------------------------
8.7174	Eroare: main thread is not in main loop	0.00%
29	192.168.125.179:137	192.168.125.255:137	17	92	Ether / IP / UDP / NBNSHeader / NBNSQueryRequest who has '\\DESKTOP-H45KHRK'
----------------------------------------
10.2424	Eroare: main thread is not in main loop	0.00%
29	192.168.125.179:137	192.168.125.255:137	17	92	Ether / IP / UDP / NBNSHeader / NBNSQueryRequest who has '\\DESKTOP-H45KHRK'
----------------------------------------
11.6845	Eroare: main thread is not in main loop	0.00%
29	52.109.102.2:443	192.168.125.179:61350	6	98	Ether / IP / TCP 52.109.102.2:https > 192.168.125.179:61350 PA / Raw
----------------------------------------
13.1566	Eroare: main thread is not in main loop	0.00%
29	192.168.125.179:55181	192.168.125.213:53	17	92	Ether / IP / UDP / DNS Qry b'mobile.events.data.microsoft.com.'
----------------------------------------
15.8467	Eroare: main thread is not in main loop	0.00%
29	192.168.125.179:60374	108.177.96.188:5228	6	55	Ether / IP / TCP 192.168.125.179:60374 > 108.177.96.188:5228 A / Raw
----------------------------------------
17.7918	Eroare: main thread is not in main loop	0.00%
29	192.168.125.179:59654	192.168.125.213:53	17	71	Ether / IP / UDP / DNS Qry b'w.deepl.com.'
----------------------------------------
19.6788	Eroare: main thread is not in main loop	0.00%
29	192.168.125.179:60218	52.123.134.246:443	6	105	Ether / IP / TCP 192.168.125.179:60218 > 52.123.134.246:https PA / Raw
----------------------------------------
21.8949	Eroare: main thread is not in main loop	0.00%
29	52.109.102.2:443	192.168.125.179:61350	6	98	Ether / IP / TCP 52.109.102.2:https > 192.168.125.179:61350 PA / Raw
----------------------------------------
24.5371	Eroare: main thread is not in main loop	0.00%
29	192.168.125.179:60254	52.123.134.246:443	6	105	Ether / IP / TCP 192.168.125.179:60254 > 52.123.134.246:https PA / Raw
----------------------------------------
27.2622	Eroare: main thread is not in main loop	0.00%
29	192.168.125.179:60273	4.208.35.46:443	6	105	Ether / IP / TCP 192.168.125.179:60273 > 4.208.35.46:https PA / Raw
----------------------------------------
31.8804	Eroare: main thread is not in main loop	0.00%
29	52.109.102.2:443	192.168.125.179:61350	6	98	Ether / IP / TCP 52.109.102.2:https > 192.168.125.179:61350 PA / Raw
----------------------------------------
33.4645	Eroare: main thread is not in main loop	0.00%
29	192.168.125.179:61325	52.16.218.208:443	6	55	Ether / IP / TCP 192.168.125.179:61325 > 52.16.218.208:https A / Raw
----------------------------------------
35.8946	Eroare: main thread is not in main loop	0.00%
29	192.168.125.179:60773	185.60.218.53:443	6	123	Ether / IP / TCP 192.168.125.179:60773 > 185.60.218.53:https PA / Raw
----------------------------------------
38.4717	Eroare: main thread is not in main loop	0.00%
29	52.16.218.208:443	192.168.125.179:61228	6	78	Ether / IP / TCP 52.16.218.208:https > 192.168.125.179:61228 PA / Raw
----------------------------------------
39.7497	Eroare: main thread is not in main loop	0.00%
29	20.190.181.5:443	192.168.125.179:61479	6	54	Ether / IP / TCP 20.190.181.5:https > 192.168.125.179:61479 FA
----------------------------------------
40.9238	Eroare: main thread is not in main loop	0.00%
29	35.186.224.24:443	192.168.125.179:61489	6	365	Ether / IP / TCP 35.186.224.24:https > 192.168.125.179:61489 PA / Raw
----------------------------------------
42.0738	Eroare: main thread is not in main loop	0.00%
29	52.109.102.2:443	192.168.125.179:61350	6	98	Ether / IP / TCP 52.109.102.2:https > 192.168.125.179:61350 PA / Raw
----------------------------------------
45.1450	Eroare: main thread is not in main loop	0.00%
29	192.168.125.179:61485	13.107.246.44:443	6	55	Ether / IP / TCP 192.168.125.179:61485 > 13.107.246.44:https A / Raw
----------------------------------------
47.7621	Eroare: main thread is not in main loop	0.00%
29	192.168.125.179:137	192.168.125.255:137	17	92	Ether / IP / UDP / NBNSHeader / NBNSQueryRequest who has '\\DESKTOP-H45KHRK'
----------------------------------------
49.0291	Eroare: main thread is not in main loop	0.00%
29	172.65.225.25:443	192.168.125.179:61488	6	54	Ether / IP / TCP 172.65.225.25:https > 192.168.125.179:61488 A
----------------------------------------
52.0753	Eroare: main thread is not in main loop	0.00%
29	52.109.102.2:443	192.168.125.179:61350	6	98	Ether / IP / TCP 52.109.102.2:https > 192.168.125.179:61350 PA / Raw
----------------------------------------
53.8873	Eroare: main thread is not in main loop	0.00%
29	192.168.125.179:60773	185.60.218.53:443	6	123	Ether / IP / TCP 192.168.125.179:60773 > 185.60.218.53:https PA / Raw
----------------------------------------
57.1575	Eroare: main thread is not in main loop	0.00%
29	192.168.125.179:60239	52.123.200.36:443	6	111	Ether / IP / TCP 192.168.125.179:60239 > 52.123.200.36:https PA / Raw
----------------------------------------
58.8085	Eroare: main thread is not in main loop	0.00%
29	192.168.125.179:61487	20.52.64.201:443	6	55	Ether / IP / TCP 192.168.125.179:61487 > 20.52.64.201:https A / Raw
----------------------------------------
60.3406	Eroare: main thread is not in main loop	0.00%
29	192.168.125.179:60257	74.248.74.217:443	6	111	Ether / IP / TCP 192.168.125.179:60257 > 74.248.74.217:https PA / Raw
----------------------------------------
62.0747	Eroare: main thread is not in main loop	0.00%
29	52.109.102.2:443	192.168.125.179:61350	6	98	Ether / IP / TCP 52.109.102.2:https > 192.168.125.179:61350 PA / Raw
----------------------------------------
63.1947	Eroare: main thread is not in main loop	0.00%
29	52.16.218.208:443	192.168.125.179:61325	6	78	Ether / IP / TCP 52.16.218.208:https > 192.168.125.179:61325 PA / Raw
----------------------------------------
64.5478	Eroare: main thread is not in main loop	0.00%
29	192.168.125.179:60254	52.123.134.246:443	6	105	Ether / IP / TCP 192.168.125.179:60254 > 52.123.134.246:https PA / Raw
----------------------------------------
65.8888	Eroare: main thread is not in main loop	0.00%
29	192.168.125.179:61228	52.16.218.208:443	6	297	Ether / IP / TCP 192.168.125.179:61228 > 52.16.218.208:https PA / Raw
----------------------------------------
67.2719	Eroare: main thread is not in main loop	0.00%
29	192.168.125.179:60273	4.208.35.46:443	6	105	Ether / IP / TCP 192.168.125.179:60273 > 4.208.35.46:https PA / Raw
----------------------------------------
70.8881	Eroare: main thread is not in main loop	0.00%
29	192.168.125.179:60773	185.60.218.53:443	6	123	Ether / IP / TCP 192.168.125.179:60773 > 185.60.218.53:https PA / Raw
----------------------------------------
72.4271	Eroare: main thread is not in main loop	0.00%
29	52.109.102.2:443	192.168.125.179:61350	6	98	Ether / IP / TCP 52.109.102.2:https > 192.168.125.179:61350 PA / Raw
----------------------------------------
78.4715	Eroare: main thread is not in main loop	0.00%
29	172.65.225.25:443	192.168.125.179:61488	6	93	Ether / IP / TCP 172.65.225.25:https > 192.168.125.179:61488 PA / Raw
----------------------------------------
80.1296	Eroare: main thread is not in main loop	0.00%
29	140.82.112.26:443	192.168.125.179:61372	6	80	Ether / IP / TCP 140.82.112.26:https > 192.168.125.179:61372 PA / Raw
----------------------------------------
81.6776	Eroare: main thread is not in main loop	0.00%
29	192.168.125.179:61334	172.161.47.103:443	6	55	Ether / IP / TCP 192.168.125.179:61334 > 172.161.47.103:https A / Raw
----------------------------------------
82.7977	Eroare: main thread is not in main loop	0.00%
29	20.190.181.5:443	192.168.125.179:61490	6	54	Ether / IP / TCP 20.190.181.5:https > 192.168.125.179:61490 A
----------------------------------------
83.9057	Eroare: main thread is not in main loop	0.00%
29	40.79.173.41:443	192.168.125.179:61495	6	54	Ether / IP / TCP 40.79.173.41:https > 192.168.125.179:61495 A
----------------------------------------
86.1038	Eroare: main thread is not in main loop	0.00%
29	52.98.229.114:443	192.168.125.179:61482	6	54	Ether / IP / TCP 52.98.229.114:https > 192.168.125.179:61482 FA
----------------------------------------
87.3706	Eroare: main thread is not in main loop	0.00%
29	52.168.117.173:443	192.168.125.179:61502	6	74	Ether / IP / TCP 52.168.117.173:https > 192.168.125.179:61502 SA
----------------------------------------
88.7156	Eroare: main thread is not in main loop	0.00%
29	52.168.117.173:443	192.168.125.179:61502	6	879	Ether / IP / TCP 52.168.117.173:https > 192.168.125.179:61502 PA / Raw
----------------------------------------
90.0047	Eroare: main thread is not in main loop	0.00%
29	13.107.246.44:443	192.168.125.179:61484	6	93	Ether / IP / TCP 13.107.246.44:https > 192.168.125.179:61484 PA / Raw
----------------------------------------
92.8738	Eroare: main thread is not in main loop	0.00%
29	52.109.102.2:443	192.168.125.179:61350	6	98	Ether / IP / TCP 52.109.102.2:https > 192.168.125.179:61350 PA / Raw
----------------------------------------
97.8970	Eroare: main thread is not in main loop	0.00%
29	192.168.125.179:61228	52.16.218.208:443	6	297	Ether / IP / TCP 192.168.125.179:61228 > 52.16.218.208:https PA / Raw
----------------------------------------
99.0441	Eroare: main thread is not in main loop	0.00%
29	185.60.218.53:443	192.168.125.179:60773	6	117	Ether / IP / TCP 185.60.218.53:https > 192.168.125.179:60773 PA / Raw
----------------------------------------
101.0301	Eroare: main thread is not in main loop	0.00%
29	192.168.125.179:61489	35.186.224.24:443	6	54	Ether / IP / TCP 192.168.125.179:61489 > 35.186.224.24:https FA
----------------------------------------
102.6752	Eroare: main thread is not in main loop	0.00%
29	52.109.102.2:443	192.168.125.179:61350	6	98	Ether / IP / TCP 52.109.102.2:https > 192.168.125.179:61350 PA / Raw
----------------------------------------
103.9143	Eroare: main thread is not in main loop	0.00%
29	192.168.125.179:61487	20.52.64.201:443	6	55	Ether / IP / TCP 192.168.125.179:61487 > 20.52.64.201:https A / Raw
----------------------------------------
106.0604	Eroare: main thread is not in main loop	0.00%
29	192.168.125.179:60374	108.177.96.188:5228	6	55	Ether / IP / TCP 192.168.125.179:60374 > 108.177.96.188:5228 A / Raw
----------------------------------------
107.2704	Eroare: main thread is not in main loop	0.00%
29	192.168.125.179:60273	4.208.35.46:443	6	105	Ether / IP / TCP 192.168.125.179:60273 > 4.208.35.46:https PA / Raw
----------------------------------------
108.4965	Eroare: main thread is not in main loop	0.00%
29	52.16.218.208:443	192.168.125.179:61325	6	66	Ether / IP / TCP 52.16.218.208:https > 192.168.125.179:61325 A
----------------------------------------
112.2676	Eroare: main thread is not in main loop	0.00%
29	192.168.125.179:60239	52.123.200.36:443	6	111	Ether / IP / TCP 192.168.125.179:60239 > 52.123.200.36:https PA / Raw
----------------------------------------
113.8947	Eroare: main thread is not in main loop	0.00%
29	192.168.125.179:61228	52.16.218.208:443	6	298	Ether / IP / TCP 192.168.125.179:61228 > 52.16.218.208:https PA / Raw
----------------------------------------
115.4678	Eroare: main thread is not in main loop	0.00%
29	192.168.125.179:60257	74.248.74.217:443	6	111	Ether / IP / TCP 192.168.125.179:60257 > 74.248.74.217:https PA / Raw
----------------------------------------
122.9501	Eroare: main thread is not in main loop	0.00%
29	52.109.102.2:443	192.168.125.179:61350	6	98	Ether / IP / TCP 52.109.102.2:https > 192.168.125.179:61350 PA / Raw
----------------------------------------
124.6132	Eroare: main thread is not in main loop	0.00%
29	192.168.125.179:59148	192.168.125.213:53	17	75	Ether / IP / UDP / DNS Qry b'ssl.gstatic.com.'
----------------------------------------
126.8403	Eroare: main thread is not in main loop	0.00%
29	192.168.125.179:61334	172.161.47.103:443	6	55	Ether / IP / TCP 192.168.125.179:61334 > 172.161.47.103:https A / Raw
----------------------------------------
129.8924	Eroare: main thread is not in main loop	0.00%
29	192.168.125.179:61228	52.16.218.208:443	6	297	Ether / IP / TCP 192.168.125.179:61228 > 52.16.218.208:https PA / Raw
----------------------------------------
133.0795	Eroare: main thread is not in main loop	0.00%
29	52.109.102.2:443	192.168.125.179:61350	6	98	Ether / IP / TCP 52.109.102.2:https > 192.168.125.179:61350 PA / Raw
----------------------------------------
139.6688	Eroare: main thread is not in main loop	0.00%
29	192.168.125.179:60218	52.123.134.246:443	6	105	Ether / IP / TCP 192.168.125.179:60218 > 52.123.134.246:https PA / Raw
----------------------------------------
143.1140	Eroare: main thread is not in main loop	0.00%
29	52.109.102.2:443	192.168.125.179:61350	6	98	Ether / IP / TCP 52.109.102.2:https > 192.168.125.179:61350 PA / Raw
----------------------------------------
144.5380	Eroare: main thread is not in main loop	0.00%
29	192.168.125.179:60254	52.123.134.246:443	6	105	Ether / IP / TCP 192.168.125.179:60254 > 52.123.134.246:https PA / Raw
----------------------------------------
145.8971	Eroare: main thread is not in main loop	0.00%
29	192.168.125.179:61228	52.16.218.208:443	6	298	Ether / IP / TCP 192.168.125.179:61228 > 52.16.218.208:https PA / Raw
----------------------------------------
147.2721	Eroare: main thread is not in main loop	0.00%
29	192.168.125.179:60273	4.208.35.46:443	6	105	Ether / IP / TCP 192.168.125.179:60273 > 4.208.35.46:https PA / Raw
----------------------------------------
149.0472	Eroare: main thread is not in main loop	0.00%
29	192.168.125.179:61490	20.190.181.5:443	6	54	Ether / IP / TCP 192.168.125.179:61490 > 20.190.181.5:https FA
----------------------------------------
151.2343	Eroare: main thread is not in main loop	0.00%
29	192.168.125.179:60374	108.177.96.188:5228	6	55	Ether / IP / TCP 192.168.125.179:60374 > 108.177.96.188:5228 A / Raw
----------------------------------------
153.3204	Eroare: main thread is not in main loop	0.00%
29	52.109.102.2:443	192.168.125.179:61350	6	98	Ether / IP / TCP 52.109.102.2:https > 192.168.125.179:61350 PA / Raw
----------------------------------------
158.4726	Eroare: main thread is not in main loop	0.00%
29	52.16.218.208:443	192.168.125.179:61228	6	78	Ether / IP / TCP 52.16.218.208:https > 192.168.125.179:61228 PA / Raw
----------------------------------------
160.8927	Eroare: main thread is not in main loop	0.00%
29	192.168.125.179:60773	185.60.218.53:443	6	123	Ether / IP / TCP 192.168.125.179:60773 > 185.60.218.53:https PA / Raw
----------------------------------------
162.0648	Eroare: main thread is not in main loop	0.00%
29	52.16.218.208:443	192.168.125.179:61228	6	54	Ether / IP / TCP 52.16.218.208:https > 192.168.125.179:61228 A
----------------------------------------
163.2798	Eroare: main thread is not in main loop	0.00%
29	52.109.102.2:443	192.168.125.179:61350	6	98	Ether / IP / TCP 52.109.102.2:https > 192.168.125.179:61350 PA / Raw
----------------------------------------
166.4744	Eroare: main thread is not in main loop	0.00%
29	185.60.218.53:443	192.168.125.179:60773	6	1354	Ether / IP / TCP 185.60.218.53:https > 192.168.125.179:60773 A / Raw
----------------------------------------
167.6024	Eroare: main thread is not in main loop	0.00%
29	192.168.125.179:60242	52.123.200.36:443	6	54	Ether / IP / TCP 192.168.125.179:60242 > 52.123.200.36:https A
----------------------------------------
170.5915	Eroare: main thread is not in main loop	0.00%
29	192.168.125.179:60257	74.248.74.217:443	6	111	Ether / IP / TCP 192.168.125.179:60257 > 74.248.74.217:https PA / Raw
----------------------------------------
171.9606	Eroare: main thread is not in main loop	0.00%
29	192.168.125.179:61334	172.161.47.103:443	6	55	Ether / IP / TCP 192.168.125.179:61334 > 172.161.47.103:https A / Raw
----------------------------------------
173.5118	Eroare: main thread is not in main loop	0.00%
29	52.109.102.2:443	192.168.125.179:61350	6	98	Ether / IP / TCP 52.109.102.2:https > 192.168.125.179:61350 PA / Raw
----------------------------------------
175.2502	Eroare: main thread is not in main loop	0.00%
29	192.168.125.179:61495	40.79.173.41:443	6	55	Ether / IP / TCP 192.168.125.179:61495 > 40.79.173.41:https A / Raw
----------------------------------------
177.8995	Eroare: main thread is not in main loop	0.00%
29	192.168.125.179:61228	52.16.218.208:443	6	298	Ether / IP / TCP 192.168.125.179:61228 > 52.16.218.208:https PA / Raw
----------------------------------------
179.6730	Eroare: main thread is not in main loop	0.00%
29	192.168.125.179:60218	52.123.134.246:443	6	105	Ether / IP / TCP 192.168.125.179:60218 > 52.123.134.246:https PA / Raw
----------------------------------------
183.1852	Eroare: main thread is not in main loop	0.00%
29	52.16.218.208:443	192.168.125.179:61325	6	78	Ether / IP / TCP 52.16.218.208:https > 192.168.125.179:61325 PA / Raw
----------------------------------------
184.5303	Eroare: main thread is not in main loop	0.00%
29	192.168.125.179:60254	52.123.134.246:443	6	105	Ether / IP / TCP 192.168.125.179:60254 > 52.123.134.246:https PA / Raw
----------------------------------------
186.3114	Eroare: main thread is not in main loop	0.00%
29	172.161.47.103:443	192.168.125.179:61334	6	113	Ether / IP / TCP 172.161.47.103:https > 192.168.125.179:61334 PA / Raw
----------------------------------------
187.4041	Eroare: main thread is not in main loop	0.00%
29	192.168.125.179:60273	4.208.35.46:443	6	54	Ether / IP / TCP 192.168.125.179:60273 > 4.208.35.46:https A
----------------------------------------
193.8982	Eroare: main thread is not in main loop	0.00%
29	192.168.125.179:61228	52.16.218.208:443	6	298	Ether / IP / TCP 192.168.125.179:61228 > 52.16.218.208:https PA / Raw
----------------------------------------
196.3733	Eroare: main thread is not in main loop	0.00%
29	192.168.125.179:61501	20.190.147.3:443	6	54	Ether / IP / TCP 192.168.125.179:61501 > 20.190.147.3:https FA
----------------------------------------
200.1193	Eroare: main thread is not in main loop	0.00%
29	140.82.112.26:443	192.168.125.179:61372	6	80	Ether / IP / TCP 140.82.112.26:https > 192.168.125.179:61372 PA / Raw
----------------------------------------
203.9194	Eroare: main thread is not in main loop	0.00%
29	52.109.102.2:443	192.168.125.179:61350	6	98	Ether / IP / TCP 52.109.102.2:https > 192.168.125.179:61350 PA / Raw
----------------------------------------
207.8078	Eroare: main thread is not in main loop	0.00%
29	192.168.125.179:54868	192.168.125.213:53	17	92	Ether / IP / UDP / DNS Qry b'mobile.events.data.microsoft.com.'
----------------------------------------
209.0239	Eroare: main thread is not in main loop	0.00%
29	13.89.179.13:443	192.168.125.179:61633	6	54	Ether / IP / TCP 13.89.179.13:https > 192.168.125.179:61633 A
----------------------------------------
210.1949	Eroare: main thread is not in main loop	0.00%
29	192.168.125.179:61634	13.89.179.13:443	6	66	Ether / IP / TCP 192.168.125.179:61634 > 13.89.179.13:https S
----------------------------------------
212.8933	Eroare: main thread is not in main loop	0.00%
29	192.168.125.179:60773	185.60.218.53:443	6	123	Ether / IP / TCP 192.168.125.179:60773 > 185.60.218.53:https PA / Raw
----------------------------------------
214.1591	Eroare: main thread is not in main loop	0.00%
29	52.109.102.2:443	192.168.125.179:61350	6	98	Ether / IP / TCP 52.109.102.2:https > 192.168.125.179:61350 PA / Raw
----------------------------------------
219.6739	Eroare: main thread is not in main loop	0.00%
29	192.168.125.179:60218	52.123.134.246:443	6	105	Ether / IP / TCP 192.168.125.179:60218 > 52.123.134.246:https PA / Raw
----------------------------------------
222.5183	Eroare: main thread is not in main loop	0.00%
29	192.168.125.179:60239	52.123.200.36:443	6	111	Ether / IP / TCP 192.168.125.179:60239 > 52.123.200.36:https PA / Raw
----------------------------------------
224.3983	Eroare: main thread is not in main loop	0.00%
29	52.109.102.2:443	192.168.125.179:61350	6	98	Ether / IP / TCP 52.109.102.2:https > 192.168.125.179:61350 PA / Raw
----------------------------------------
225.7204	Eroare: main thread is not in main loop	0.00%
29	192.168.125.179:60257	74.248.74.217:443	6	111	Ether / IP / TCP 192.168.125.179:60257 > 74.248.74.217:https PA / Raw
----------------------------------------
227.2755	Eroare: main thread is not in main loop	0.00%
29	192.168.125.179:60273	4.208.35.46:443	6	105	Ether / IP / TCP 192.168.125.179:60273 > 4.208.35.46:https PA / Raw
----------------------------------------
228.4182	Eroare: main thread is not in main loop	0.00%
29	52.16.218.208:443	192.168.125.179:61325	6	66	Ether / IP / TCP 52.16.218.208:https > 192.168.125.179:61325 A
----------------------------------------
231.4144	Eroare: main thread is not in main loop	0.00%
29	192.168.125.179:61334	172.161.47.103:443	6	55	Ether / IP / TCP 192.168.125.179:61334 > 172.161.47.103:https A / Raw
----------------------------------------
234.6338	Eroare: main thread is not in main loop	0.00%
29	52.109.102.2:443	192.168.125.179:61350	6	98	Ether / IP / TCP 52.109.102.2:https > 192.168.125.179:61350 PA / Raw
----------------------------------------
241.5449	Eroare: main thread is not in main loop	0.00%
29	192.168.125.179:60374	108.177.96.188:5228	6	55	Ether / IP / TCP 192.168.125.179:60374 > 108.177.96.188:5228 A / Raw
----------------------------------------
244.8820	Eroare: main thread is not in main loop	0.00%
29	52.109.102.2:443	192.168.125.179:61350	6	98	Ether / IP / TCP 52.109.102.2:https > 192.168.125.179:61350 PA / Raw
----------------------------------------
245.9891	Eroare: main thread is not in main loop	0.00%
29	185.60.218.53:443	192.168.125.179:60773	6	54	Ether / IP / TCP 185.60.218.53:https > 192.168.125.179:60773 A
----------------------------------------
253.9465	Eroare: main thread is not in main loop	0.00%
29	192.168.125.179:60055	20.199.120.151:443	6	155	Ether / IP / TCP 192.168.125.179:60055 > 20.199.120.151:https PA / Raw
----------------------------------------
255.1216	Eroare: main thread is not in main loop	0.00%
29	52.109.102.2:443	192.168.125.179:61350	6	98	Ether / IP / TCP 52.109.102.2:https > 192.168.125.179:61350 PA / Raw
----------------------------------------
257.8997	Eroare: main thread is not in main loop	0.00%
29	192.168.125.179:61228	52.16.218.208:443	6	297	Ether / IP / TCP 192.168.125.179:61228 > 52.16.218.208:https PA / Raw
----------------------------------------
259.0168	Eroare: main thread is not in main loop	0.00%
29	185.60.218.53:443	192.168.125.179:60773	6	125	Ether / IP / TCP 185.60.218.53:https > 192.168.125.179:60773 PA / Raw
----------------------------------------
260.1228	Eroare: main thread is not in main loop	0.00%
29	140.82.112.26:443	192.168.125.179:61372	6	80	Ether / IP / TCP 140.82.112.26:https > 192.168.125.179:61372 PA / Raw
----------------------------------------
264.5429	Eroare: main thread is not in main loop	0.00%
29	192.168.125.179:60254	52.123.134.246:443	6	105	Ether / IP / TCP 192.168.125.179:60254 > 52.123.134.246:https PA / Raw
----------------------------------------
267.2790	Eroare: main thread is not in main loop	0.00%
29	192.168.125.179:60273	4.208.35.46:443	6	105	Ether / IP / TCP 192.168.125.179:60273 > 4.208.35.46:https PA / Raw
----------------------------------------
270.4011	Eroare: main thread is not in main loop	0.00%
29	192.168.125.179:63244	192.168.125.213:53	17	80	Ether / IP / UDP / DNS Qry b'autoupdate.opera.com.'
----------------------------------------
273.4202	Eroare: main thread is not in main loop	0.00%
29	192.168.125.179:61325	52.16.218.208:443	6	55	Ether / IP / TCP 192.168.125.179:61325 > 52.16.218.208:https A / Raw
----------------------------------------
275.2853	Eroare: main thread is not in main loop	0.00%
29	52.109.102.2:443	192.168.125.179:61350	6	98	Ether / IP / TCP 52.109.102.2:https > 192.168.125.179:61350 PA / Raw
----------------------------------------
276.5054	Eroare: main thread is not in main loop	0.00%
29	192.168.125.179:61334	172.161.47.103:443	6	55	Ether / IP / TCP 192.168.125.179:61334 > 172.161.47.103:https A / Raw
----------------------------------------
277.6724	Eroare: main thread is not in main loop	0.00%
29	192.168.125.179:60239	52.123.200.36:443	6	111	Ether / IP / TCP 192.168.125.179:60239 > 52.123.200.36:https PA / Raw
----------------------------------------
280.8476	Eroare: main thread is not in main loop	0.00%
29	192.168.125.179:60257	74.248.74.217:443	6	111	Ether / IP / TCP 192.168.125.179:60257 > 74.248.74.217:https PA / Raw
----------------------------------------
285.5238	Eroare: main thread is not in main loop	0.00%
29	52.109.102.2:443	192.168.125.179:61350	6	98	Ether / IP / TCP 52.109.102.2:https > 192.168.125.179:61350 PA / Raw
----------------------------------------
286.7308	Eroare: main thread is not in main loop	0.00%
29	192.168.125.179:60374	108.177.96.188:5228	6	55	Ether / IP / TCP 192.168.125.179:60374 > 108.177.96.188:5228 A / Raw
----------------------------------------
289.8920	Eroare: main thread is not in main loop	0.00%
29	192.168.125.179:61228	52.16.218.208:443	6	298	Ether / IP / TCP 192.168.125.179:61228 > 52.16.218.208:https PA / Raw
----------------------------------------
295.2836	Eroare: main thread is not in main loop	0.00%
29	52.109.102.2:443	192.168.125.179:61350	6	98	Ether / IP / TCP 52.109.102.2:https > 192.168.125.179:61350 PA / Raw
----------------------------------------
297.0387	Eroare: main thread is not in main loop	0.00%
29	185.60.218.53:443	192.168.125.179:60773	6	151	Ether / IP / TCP 185.60.218.53:https > 192.168.125.179:60773 PA / Raw
----------------------------------------
299.6718	Eroare: main thread is not in main loop	0.00%
29	192.168.125.179:60218	52.123.134.246:443	6	105	Ether / IP / TCP 192.168.125.179:60218 > 52.123.134.246:https PA / Raw
----------------------------------------
300.9149	Eroare: main thread is not in main loop	0.00%
29	192.168.125.179:60773	185.60.218.53:443	6	128	Ether / IP / TCP 192.168.125.179:60773 > 185.60.218.53:https PA / Raw
----------------------------------------
303.4450	Eroare: main thread is not in main loop	0.00%
29	52.16.218.208:443	192.168.125.179:61325	6	78	Ether / IP / TCP 52.16.218.208:https > 192.168.125.179:61325 PA / Raw
----------------------------------------
304.5450	Eroare: main thread is not in main loop	0.00%
29	192.168.125.179:60254	52.123.134.246:443	6	105	Ether / IP / TCP 192.168.125.179:60254 > 52.123.134.246:https PA / Raw
----------------------------------------
305.8941	Eroare: main thread is not in main loop	0.00%
29	192.168.125.179:61228	52.16.218.208:443	6	298	Ether / IP / TCP 192.168.125.179:61228 > 52.16.218.208:https PA / Raw
----------------------------------------
307.2732	Eroare: main thread is not in main loop	0.00%
29	192.168.125.179:60273	4.208.35.46:443	6	105	Ether / IP / TCP 192.168.125.179:60273 > 4.208.35.46:https PA / Raw
----------------------------------------
310.9023	Eroare: main thread is not in main loop	0.00%
29	192.168.125.179:60773	185.60.218.53:443	6	123	Ether / IP / TCP 192.168.125.179:60773 > 185.60.218.53:https PA / Raw
----------------------------------------
315.7415	Eroare: main thread is not in main loop	0.00%
29	52.109.102.2:443	192.168.125.179:61350	6	98	Ether / IP / TCP 52.109.102.2:https > 192.168.125.179:61350 PA / Raw
----------------------------------------
320.1332	Eroare: main thread is not in main loop	0.00%
29	140.82.112.26:443	192.168.125.179:61372	6	80	Ether / IP / TCP 140.82.112.26:https > 192.168.125.179:61372 PA / Raw
----------------------------------------
321.6006	Eroare: main thread is not in main loop	0.00%
29	192.168.125.179:61334	172.161.47.103:443	6	55	Ether / IP / TCP 192.168.125.179:61334 > 172.161.47.103:https A / Raw
----------------------------------------
325.6835	Eroare: main thread is not in main loop	0.00%
29	52.109.102.2:443	192.168.125.179:61350	6	98	Ether / IP / TCP 52.109.102.2:https > 192.168.125.179:61350 PA / Raw
----------------------------------------
327.1176	Eroare: main thread is not in main loop	0.00%
29	185.60.218.53:443	192.168.125.179:60773	6	242	Ether / IP / TCP 185.60.218.53:https > 192.168.125.179:60773 PA / Raw
----------------------------------------
330.0167	Eroare: main thread is not in main loop	0.00%
29	185.60.218.53:443	192.168.125.179:60773	6	747	Ether / IP / TCP 185.60.218.53:https > 192.168.125.179:60773 PA / Raw
----------------------------------------
331.8608	Eroare: main thread is not in main loop	0.00%
29	192.168.125.179:60374	108.177.96.188:5228	6	55	Ether / IP / TCP 192.168.125.179:60374 > 108.177.96.188:5228 A / Raw
----------------------------------------
335.9097	Eroare: main thread is not in main loop	0.00%
29	192.168.125.179:60773	185.60.218.53:443	6	123	Ether / IP / TCP 192.168.125.179:60773 > 185.60.218.53:https PA / Raw
----------------------------------------
337.3335	Eroare: main thread is not in main loop	0.00%
29	192.168.125.179:64690	192.168.125.213:53	17	92	Ether / IP / UDP / DNS Qry b'mobile.events.data.microsoft.com.'
----------------------------------------
338.5657	Eroare: main thread is not in main loop	0.00%
29	13.89.179.10:443	192.168.125.179:61641	6	157	Ether / IP / TCP 13.89.179.10:https > 192.168.125.179:61641 PA / Raw
----------------------------------------
339.6745	Eroare: main thread is not in main loop	0.00%
29	192.168.125.179:60218	52.123.134.246:443	6	105	Ether / IP / TCP 192.168.125.179:60218 > 52.123.134.246:https PA / Raw
----------------------------------------
344.5347	Eroare: main thread is not in main loop	0.00%
29	192.168.125.179:60254	52.123.134.246:443	6	105	Ether / IP / TCP 192.168.125.179:60254 > 52.123.134.246:https PA / Raw
----------------------------------------
346.0822	Eroare: main thread is not in main loop	0.00%
29	52.109.102.2:443	192.168.125.179:61350	6	98	Ether / IP / TCP 52.109.102.2:https > 192.168.125.179:61350 PA / Raw
----------------------------------------
347.2821	Eroare: main thread is not in main loop	0.00%
29	192.168.125.179:60273	4.208.35.46:443	6	105	Ether / IP / TCP 192.168.125.179:60273 > 4.208.35.46:https PA / Raw
----------------------------------------
348.5470	Eroare: main thread is not in main loop	0.00%
29	192.168.125.179:61325	52.16.218.208:443	6	55	Ether / IP / TCP 192.168.125.179:61325 > 52.16.218.208:https A / Raw
----------------------------------------
351.1627	Eroare: main thread is not in main loop	0.00%
29	20.190.181.5:443	192.168.125.179:61635	6	54	Ether / IP / TCP 20.190.181.5:https > 192.168.125.179:61635 RA
----------------------------------------
353.8996	Eroare: main thread is not in main loop	0.00%
29	192.168.125.179:61228	52.16.218.208:443	6	298	Ether / IP / TCP 192.168.125.179:61228 > 52.16.218.208:https PA / Raw
----------------------------------------
356.2849	Eroare: main thread is not in main loop	0.00%
29	52.109.102.2:443	192.168.125.179:61350	6	98	Ether / IP / TCP 52.109.102.2:https > 192.168.125.179:61350 PA / Raw
----------------------------------------
364.9005	Eroare: main thread is not in main loop	0.00%
29	192.168.125.179:60773	185.60.218.53:443	6	123	Ether / IP / TCP 192.168.125.179:60773 > 185.60.218.53:https PA / Raw
----------------------------------------
366.3181	Eroare: main thread is not in main loop	0.00%
29	52.109.102.2:443	192.168.125.179:61350	6	98	Ether / IP / TCP 52.109.102.2:https > 192.168.125.179:61350 PA / Raw
----------------------------------------
369.8996	Eroare: main thread is not in main loop	0.00%
29	192.168.125.179:61228	52.16.218.208:443	6	297	Ether / IP / TCP 192.168.125.179:61228 > 52.16.218.208:https PA / Raw
----------------------------------------
376.3977	Eroare: main thread is not in main loop	0.00%
29	52.109.102.2:443	192.168.125.179:61350	6	98	Ether / IP / TCP 52.109.102.2:https > 192.168.125.179:61350 PA / Raw
----------------------------------------
379.6787	Eroare: main thread is not in main loop	0.00%
29	192.168.125.179:60218	52.123.134.246:443	6	105	Ether / IP / TCP 192.168.125.179:60218 > 52.123.134.246:https PA / Raw
----------------------------------------
383.5765	Eroare: main thread is not in main loop	0.00%
29	192.168.125.179:61641	13.89.179.10:443	6	55	Ether / IP / TCP 192.168.125.179:61641 > 13.89.179.10:https A / Raw
----------------------------------------
384.7018	Eroare: main thread is not in main loop	0.00%
29	192.168.125.179:60254	52.123.134.246:443	6	54	Ether / IP / TCP 192.168.125.179:60254 > 52.123.134.246:https A
----------------------------------------
385.8966	Eroare: main thread is not in main loop	0.00%
29	192.168.125.179:61228	52.16.218.208:443	6	297	Ether / IP / TCP 192.168.125.179:61228 > 52.16.218.208:https PA / Raw
----------------------------------------
387.2757	Eroare: main thread is not in main loop	0.00%
29	192.168.125.179:60273	4.208.35.46:443	6	105	Ether / IP / TCP 192.168.125.179:60273 > 4.208.35.46:https PA / Raw
----------------------------------------
388.3909	Eroare: main thread is not in main loop	0.00%
29	172.65.225.25:443	192.168.125.179:61643	6	102	Ether / IP / TCP 172.65.225.25:https > 192.168.125.179:61643 PA / Raw
----------------------------------------
389.5127	Eroare: main thread is not in main loop	0.00%
29	104.18.32.47:443	192.168.125.179:61645	6	54	Ether / IP / TCP 104.18.32.47:https > 192.168.125.179:61645 A
----------------------------------------
391.0361	Eroare: main thread is not in main loop	0.00%
29	192.168.125.179:60257	74.248.74.217:443	6	111	Ether / IP / TCP 192.168.125.179:60257 > 74.248.74.217:https PA / Raw
----------------------------------------
393.6871	Eroare: main thread is not in main loop	0.00%
29	192.168.125.179:61325	52.16.218.208:443	6	55	Ether / IP / TCP 192.168.125.179:61325 > 52.16.218.208:https A / Raw
----------------------------------------
395.9185	Eroare: main thread is not in main loop	0.00%
29	104.18.32.47:443	192.168.125.179:61645	6	1354	Ether / IP / TCP 104.18.32.47:https > 192.168.125.179:61645 A / Raw
----------------------------------------
397.0169	Eroare: main thread is not in main loop	0.00%
29	104.18.32.47:443	192.168.125.179:61645	6	130	Ether / IP / TCP 104.18.32.47:https > 192.168.125.179:61645 PA / Raw
----------------------------------------
398.1199	Eroare: main thread is not in main loop	0.00%
29	192.168.125.213:53	192.168.125.179:54334	17	106	Ether / IP / UDP / DNS Ans 104.18.32.47
----------------------------------------
399.4479	Eroare: main thread is not in main loop	0.00%
29	104.18.32.47:443	192.168.125.179:61645	6	130	Ether / IP / TCP 104.18.32.47:https > 192.168.125.179:61645 PA / Raw
----------------------------------------
400.5745	Eroare: main thread is not in main loop	0.00%
29	104.18.32.47:443	192.168.125.179:61645	6	122	Ether / IP / TCP 104.18.32.47:https > 192.168.125.179:61645 PA / Raw
----------------------------------------
401.8994	Eroare: main thread is not in main loop	0.00%
29	192.168.125.179:61228	52.16.218.208:443	6	297	Ether / IP / TCP 192.168.125.179:61228 > 52.16.218.208:https PA / Raw
----------------------------------------
403.0413	Eroare: main thread is not in main loop	0.00%
29	104.18.32.47:443	192.168.125.179:61645	6	122	Ether / IP / TCP 104.18.32.47:https > 192.168.125.179:61645 PA / Raw
----------------------------------------
404.1600	Eroare: main thread is not in main loop	0.00%
29	104.18.32.47:443	192.168.125.179:61645	6	122	Ether / IP / TCP 104.18.32.47:https > 192.168.125.179:61645 PA / Raw
----------------------------------------
405.2495	Eroare: main thread is not in main loop	0.00%
