0.6960	Atac: NORMAL	85.75%
3	192.168.125.179:60773	185.60.218.53:443	6	123	Ether / IP / TCP 192.168.125.179:60773 > 185.60.218.53:https PA / Raw
----------------------------------------
0.8425	Atac: NORMAL	85.75%
4	185.60.218.53:443	192.168.125.179:60773	6	54	Ether / IP / TCP 185.60.218.53:https > 192.168.125.179:60773 A
----------------------------------------
0.9832	Atac: NORMAL	85.75%
5	185.60.218.53:443	192.168.125.179:60773	6	125	Ether / IP / TCP 185.60.218.53:https > 192.168.125.179:60773 PA / Raw
----------------------------------------
3.8498	Atac: NORMAL	85.75%
6	162.247.241.14:443	192.168.125.179:62532	6	54	Ether / IP / TCP 162.247.241.14:https > 192.168.125.179:62532 A
----------------------------------------
4.0061	Atac: NORMAL	85.75%
7	192.168.125.179:62532	162.247.241.14:443	6	54	Ether / IP / TCP 192.168.125.179:62532 > 162.247.241.14:https A
----------------------------------------
6.1923	Atac: NORMAL	85.75%
8	192.168.125.179:63241	51.104.15.253:443	6	55	Ether / IP / TCP 192.168.125.179:63241 > 51.104.15.253:https A / Raw
----------------------------------------
7.8220	Atac: NORMAL	85.75%
9	192.168.125.179:62651	52.123.134.246:443	6	104	Ether / IP / TCP 192.168.125.179:62651 > 52.123.134.246:https PA / Raw
----------------------------------------
8.0343	Atac: NORMAL	85.75%
10	52.123.134.246:443	192.168.125.179:62651	6	93	Ether / IP / TCP 52.123.134.246:https > 192.168.125.179:62651 PA / Raw
----------------------------------------
8.1783	Atac: NORMAL	85.75%
11	192.168.125.179:62651	52.123.134.246:443	6	54	Ether / IP / TCP 192.168.125.179:62651 > 52.123.134.246:https A
----------------------------------------
12.0821	Atac: NORMAL	70.54%
12	192.168.125.179:56179	192.168.125.213:53	17	79	Ether / IP / UDP / DNS Qry b'default.exp-tas.com.'
----------------------------------------
12.2409	Atac: NORMAL	70.54%
13	192.168.125.179:56179	192.168.125.213:53	17	79	Ether / IP / UDP / DNS Qry b'default.exp-tas.com.'
----------------------------------------
12.3862	Atac: NORMAL	70.54%
14	192.168.125.213:53	192.168.125.179:56179	17	161	Ether / IP / UDP / DNS Ans b'deault-exp-tas-com.e-0014.e-msedge.net.'
----------------------------------------
12.5417	Atac: NORMAL	85.75%
15	192.168.125.179:63253	13.107.5.93:443	6	661	Ether / IP / TCP 192.168.125.179:63253 > 13.107.5.93:https PA / Raw
----------------------------------------
12.6844	Atac: NORMAL	85.75%
16	192.168.125.179:63255	13.107.5.93:443	6	66	Ether / IP / TCP 192.168.125.179:63255 > 13.107.5.93:https S
----------------------------------------
12.8113	Atac: NORMAL	85.75%
17	13.107.5.93:443	192.168.125.179:63254	6	66	Ether / IP / TCP 13.107.5.93:https > 192.168.125.179:63254 SA
----------------------------------------
12.9731	Atac: NORMAL	85.75%
18	13.107.5.93:443	192.168.125.179:63255	6	66	Ether / IP / TCP 13.107.5.93:https > 192.168.125.179:63255 SA
----------------------------------------
13.1076	Atac: NORMAL	85.75%
19	13.107.5.93:443	192.168.125.179:63253	6	54	Ether / IP / TCP 13.107.5.93:https > 192.168.125.179:63253 A
----------------------------------------
13.2536	Atac: NORMAL	85.75%
20	13.107.5.93:443	192.168.125.179:63253	6	513	Ether / IP / TCP 13.107.5.93:https > 192.168.125.179:63253 PA / Raw
----------------------------------------
13.4163	Atac: NORMAL	85.75%
21	192.168.125.179:63254	13.107.5.93:443	6	54	Ether / IP / TCP 192.168.125.179:63254 > 13.107.5.93:https A
----------------------------------------
14.0853	Atac: NORMAL	70.54%
22	192.168.125.179:56648	192.168.125.213:53	17	101	Ether / IP / UDP / DNS Qry b'westus-0.in.applicationinsights.azure.com.'
----------------------------------------
14.2575	Atac: NORMAL	70.54%
23	192.168.125.179:56648	192.168.125.213:53	17	101	Ether / IP / UDP / DNS Qry b'westus-0.in.applicationinsights.azure.com.'
----------------------------------------
14.3934	Atac: NORMAL	70.54%
24	192.168.125.213:53	192.168.125.179:56648	17	248	Ether / IP / UDP / DNS Ans b'westus-0.in.ai.monitor.azure.com.'
----------------------------------------
14.5319	Atac: NORMAL	85.75%
25	192.168.125.179:63256	20.189.172.32:443	6	66	Ether / IP / TCP 192.168.125.179:63256 > 20.189.172.32:https S
----------------------------------------
14.7112	Atac: NORMAL	85.75%
26	192.168.125.179:61228	52.16.218.208:443	6	297	Ether / IP / TCP 192.168.125.179:61228 > 52.16.218.208:https PA / Raw
----------------------------------------
14.8625	Atac: NORMAL	85.75%
27	20.189.172.32:443	192.168.125.179:63256	6	153	Ether / IP / TCP 20.189.172.32:https > 192.168.125.179:63256 PA / Raw
----------------------------------------
14.9885	Atac: NORMAL	85.75%
28	192.168.125.179:63256	20.189.172.32:443	6	500	Ether / IP / TCP 192.168.125.179:63256 > 20.189.172.32:https PA / Raw
----------------------------------------
15.1168	Atac: NORMAL	85.75%
29	52.16.218.208:443	192.168.125.179:61228	6	321	Ether / IP / TCP 52.16.218.208:https > 192.168.125.179:61228 PA / Raw
----------------------------------------
15.2682	Atac: NORMAL	85.75%
30	192.168.125.179:61228	52.16.218.208:443	6	54	Ether / IP / TCP 192.168.125.179:61228 > 52.16.218.208:https A
----------------------------------------
15.4312	Atac: NORMAL	85.75%
31	192.168.125.179:63257	13.107.5.93:443	6	66	Ether / IP / TCP 192.168.125.179:63257 > 13.107.5.93:https S
----------------------------------------
15.5585	Atac: NORMAL	85.75%
32	13.107.5.93:443	192.168.125.179:63257	6	66	Ether / IP / TCP 13.107.5.93:https > 192.168.125.179:63257 SA
----------------------------------------
16.2580	Atac: NORMAL	85.75%
33	192.168.125.179:63258	13.107.5.93:443	6	66	Ether / IP / TCP 192.168.125.179:63258 > 13.107.5.93:https S
----------------------------------------
16.4375	Atac: NORMAL	85.75%
34	13.107.5.93:443	192.168.125.179:63258	6	66	Ether / IP / TCP 13.107.5.93:https > 192.168.125.179:63258 SA
----------------------------------------
16.5909	Atac: NORMAL	85.75%
35	192.168.125.179:63258	13.107.5.93:443	6	54	Ether / IP / TCP 192.168.125.179:63258 > 13.107.5.93:https A
----------------------------------------
16.9594	Atac: NORMAL	85.75%
36	192.168.125.179:63255	13.107.5.93:443	6	54	Ether / IP / TCP 192.168.125.179:63255 > 13.107.5.93:https FA
----------------------------------------
17.1112	Atac: NORMAL	85.75%
37	192.168.125.179:63254	13.107.5.93:443	6	54	Ether / IP / TCP 192.168.125.179:63254 > 13.107.5.93:https FA
----------------------------------------
17.2533	Atac: NORMAL	85.75%
38	13.107.5.93:443	192.168.125.179:63254	6	54	Ether / IP / TCP 13.107.5.93:https > 192.168.125.179:63254 A
----------------------------------------
17.3933	Atac: NORMAL	85.75%
39	13.107.5.93:443	192.168.125.179:63254	6	54	Ether / IP / TCP 13.107.5.93:https > 192.168.125.179:63254 FA
----------------------------------------
17.5473	Atac: NORMAL	85.75%
40	13.107.5.93:443	192.168.125.179:63255	6	54	Ether / IP / TCP 13.107.5.93:https > 192.168.125.179:63255 A
----------------------------------------
17.6794	Atac: NORMAL	85.75%
41	13.107.5.93:443	192.168.125.179:63255	6	54	Ether / IP / TCP 13.107.5.93:https > 192.168.125.179:63255 FA
----------------------------------------
18.0654	Atac: NORMAL	85.75%
42	192.168.125.179:63261	20.189.172.32:443	6	66	Ether / IP / TCP 192.168.125.179:63261 > 20.189.172.32:https S
----------------------------------------
18.1995	Atac: NORMAL	85.75%
43	192.168.125.179:63262	20.189.172.32:443	6	66	Ether / IP / TCP 192.168.125.179:63262 > 20.189.172.32:https S
----------------------------------------
18.3836	Atac: NORMAL	85.75%
44	20.189.172.32:443	192.168.125.179:63261	6	66	Ether / IP / TCP 20.189.172.32:https > 192.168.125.179:63261 SA
----------------------------------------
18.5449	Atac: NORMAL	85.75%
45	20.189.172.32:443	192.168.125.179:63262	6	66	Ether / IP / TCP 20.189.172.32:https > 192.168.125.179:63262 SA
----------------------------------------
18.7030	Atac: NORMAL	85.75%
46	192.168.125.179:63261	20.189.172.32:443	6	54	Ether / IP / TCP 192.168.125.179:63261 > 20.189.172.32:https A
----------------------------------------
18.9042	Atac: NORMAL	85.75%
47	20.189.172.32:443	192.168.125.179:63262	6	332	Ether / IP / TCP 20.189.172.32:https > 192.168.125.179:63262 PA / Raw
----------------------------------------
19.0666	Atac: NORMAL	70.54%
48	142.250.184.142:443	192.168.125.179:64422	17	1288	Ether / IP / UDP 142.250.184.142:https > 192.168.125.179:64422 / Raw
----------------------------------------
19.2153	Atac: NORMAL	85.75%
49	20.189.172.32:443	192.168.125.179:63261	6	1354	Ether / IP / TCP 20.189.172.32:https > 192.168.125.179:63261 A / Raw
----------------------------------------
19.3510	Atac: NORMAL	70.54%
50	142.250.184.142:443	192.168.125.179:64422	17	410	Ether / IP / UDP 142.250.184.142:https > 192.168.125.179:64422 / Raw
----------------------------------------
19.4992	Atac: NORMAL	85.75%
51	20.189.172.32:443	192.168.125.179:63261	6	1354	Ether / IP / TCP 20.189.172.32:https > 192.168.125.179:63261 A / Raw
----------------------------------------
19.6446	Atac: NORMAL	70.54%
52	142.250.184.142:443	192.168.125.179:64422	17	1046	Ether / IP / UDP 142.250.184.142:https > 192.168.125.179:64422 / Raw
----------------------------------------
19.7824	Atac: NORMAL	85.75%
53	20.189.172.32:443	192.168.125.179:63261	6	1354	Ether / IP / TCP 20.189.172.32:https > 192.168.125.179:63261 A / Raw
----------------------------------------
20.6328	Atac: NORMAL	85.75%
54	192.168.125.179:63258	13.107.5.93:443	6	54	Ether / IP / TCP 192.168.125.179:63258 > 13.107.5.93:https FA
----------------------------------------
20.7664	Atac: NORMAL	85.75%
55	13.107.5.93:443	192.168.125.179:63258	6	54	Ether / IP / TCP 13.107.5.93:https > 192.168.125.179:63258 A
----------------------------------------
20.9052	Atac: NORMAL	85.75%
56	13.107.5.93:443	192.168.125.179:63258	6	54	Ether / IP / TCP 13.107.5.93:https > 192.168.125.179:63258 FA
----------------------------------------
23.6466	Atac: NORMAL	85.75%
57	192.168.125.179:63251	140.82.112.22:443	6	11754	Ether / IP / TCP 192.168.125.179:63251 > 140.82.112.22:https A / Raw
----------------------------------------
23.7787	Atac: NORMAL	85.75%
58	192.168.125.179:60773	185.60.218.53:443	6	123	Ether / IP / TCP 192.168.125.179:60773 > 185.60.218.53:https PA / Raw
----------------------------------------
23.8984	Atac: NORMAL	85.75%
59	185.60.218.53:443	192.168.125.179:60773	6	54	Ether / IP / TCP 185.60.218.53:https > 192.168.125.179:60773 A
----------------------------------------
24.0338	Atac: NORMAL	85.75%
60	140.82.112.22:443	192.168.125.179:63251	6	54	Ether / IP / TCP 140.82.112.22:https > 192.168.125.179:63251 A
----------------------------------------
24.1709	Atac: NORMAL	85.75%
61	192.168.125.179:60773	185.60.218.53:443	6	54	Ether / IP / TCP 192.168.125.179:60773 > 185.60.218.53:https A
----------------------------------------
24.3192	Atac: NORMAL	85.75%
62	140.82.112.22:443	192.168.125.179:63251	6	54	Ether / IP / TCP 140.82.112.22:https > 192.168.125.179:63251 A
----------------------------------------
24.4568	Atac: NORMAL	85.75%
63	140.82.112.22:443	192.168.125.179:63251	6	54	Ether / IP / TCP 140.82.112.22:https > 192.168.125.179:63251 A
----------------------------------------
24.6009	Atac: NORMAL	85.75%
64	140.82.112.22:443	192.168.125.179:63251	6	54	Ether / IP / TCP 140.82.112.22:https > 192.168.125.179:63251 A
----------------------------------------
24.7343	Atac: NORMAL	85.75%
65	140.82.112.22:443	192.168.125.179:63251	6	54	Ether / IP / TCP 140.82.112.22:https > 192.168.125.179:63251 A
----------------------------------------
24.8592	Atac: NORMAL	85.75%
66	140.82.112.22:443	192.168.125.179:63251	6	54	Ether / IP / TCP 140.82.112.22:https > 192.168.125.179:63251 A
----------------------------------------
25.0069	Atac: NORMAL	85.75%
67	140.82.112.22:443	192.168.125.179:63251	6	102	Ether / IP / TCP 140.82.112.22:https > 192.168.125.179:63251 PA / Raw
----------------------------------------
25.1368	Atac: NORMAL	85.75%
68	140.82.112.22:443	192.168.125.179:63251	6	54	Ether / IP / TCP 140.82.112.22:https > 192.168.125.179:63251 A
----------------------------------------
28.4017	Atac: NORMAL	85.75%
69	192.168.125.179:60374	108.177.96.188:5228	6	55	Ether / IP / TCP 192.168.125.179:60374 > 108.177.96.188:5228 A / Raw
----------------------------------------
28.5361	Atac: NORMAL	85.75%
70	108.177.96.188:5228	192.168.125.179:60374	6	66	Ether / IP / TCP 108.177.96.188:5228 > 192.168.125.179:60374 A
----------------------------------------
30.6999	Atac: NORMAL	85.75%
71	192.168.125.179:61228	52.16.218.208:443	6	297	Ether / IP / TCP 192.168.125.179:61228 > 52.16.218.208:https PA / Raw
----------------------------------------
30.8401	Atac: NORMAL	85.75%
72	192.168.125.179:63066	140.82.113.25:443	6	55	Ether / IP / TCP 192.168.125.179:63066 > 140.82.113.25:https A / Raw
----------------------------------------
30.9781	Atac: NORMAL	85.75%
73	52.16.218.208:443	192.168.125.179:61228	6	319	Ether / IP / TCP 52.16.218.208:https > 192.168.125.179:61228 PA / Raw
----------------------------------------
31.1250	Atac: NORMAL	85.75%
73	192.168.125.179:61228	52.16.218.208:443	6	54	Ether / IP / TCP 192.168.125.179:61228 > 52.16.218.208:https A
----------------------------------------
31.2587	Atac: NORMAL	85.75%
73	140.82.113.25:443	192.168.125.179:63066	6	66	Ether / IP / TCP 140.82.113.25:https > 192.168.125.179:63066 A
----------------------------------------
33.4867	Eroare: main thread is not in main loop	0.00%
73	192.168.125.179:62532	162.247.241.14:443	6	55	Ether / IP / TCP 192.168.125.179:62532 > 162.247.241.14:https A / Raw
----------------------------------------
34.8779	Eroare: main thread is not in main loop	0.00%
73	192.168.125.179:62924	20.189.173.26:443	6	55	Ether / IP / TCP 192.168.125.179:62924 > 20.189.173.26:https A / Raw
----------------------------------------
36.6528	Eroare: main thread is not in main loop	0.00%
73	192.168.125.179:63242	52.123.243.38:443	6	54	Ether / IP / TCP 192.168.125.179:63242 > 52.123.243.38:https FA
----------------------------------------
38.7136	Eroare: main thread is not in main loop	0.00%
73	192.168.125.179:60773	185.60.218.53:443	6	123	Ether / IP / TCP 192.168.125.179:60773 > 185.60.218.53:https PA / Raw
----------------------------------------
39.8576	Eroare: main thread is not in main loop	0.00%
73	192.168.125.179:64212	192.168.125.213:53	17	92	Ether / IP / UDP / DNS Qry b'mobile.events.data.microsoft.com.'
----------------------------------------
40.9953	Eroare: main thread is not in main loop	0.00%
73	46.97.92.74:443	192.168.125.179:63264	6	54	Ether / IP / TCP 46.97.92.74:https > 192.168.125.179:63264 A
----------------------------------------
42.1372	Eroare: main thread is not in main loop	0.00%
73	46.97.92.74:443	192.168.125.179:63264	6	1354	Ether / IP / TCP 46.97.92.74:https > 192.168.125.179:63264 A / Raw
----------------------------------------
43.2638	Eroare: main thread is not in main loop	0.00%
73	46.97.92.74:443	192.168.125.179:63264	6	1354	Ether / IP / TCP 46.97.92.74:https > 192.168.125.179:63264 A / Raw
----------------------------------------
44.3667	Eroare: main thread is not in main loop	0.00%
73	46.97.92.74:443	192.168.125.179:63264	6	1354	Ether / IP / TCP 46.97.92.74:https > 192.168.125.179:63264 PA / Raw
----------------------------------------
45.4909	Eroare: main thread is not in main loop	0.00%
73	46.97.92.74:443	192.168.125.179:63264	6	1354	Ether / IP / TCP 46.97.92.74:https > 192.168.125.179:63264 A / Raw
----------------------------------------
46.7049	Eroare: main thread is not in main loop	0.00%
73	192.168.125.179:61228	52.16.218.208:443	6	297	Ether / IP / TCP 192.168.125.179:61228 > 52.16.218.208:https PA / Raw
----------------------------------------
47.8287	Eroare: main thread is not in main loop	0.00%
73	192.168.125.179:62651	52.123.134.246:443	6	104	Ether / IP / TCP 192.168.125.179:62651 > 52.123.134.246:https PA / Raw
----------------------------------------
48.9526	Eroare: main thread is not in main loop	0.00%
73	46.97.92.74:443	192.168.125.179:63264	6	1354	Ether / IP / TCP 46.97.92.74:https > 192.168.125.179:63264 A / Raw
----------------------------------------
50.0695	Eroare: main thread is not in main loop	0.00%
73	46.97.92.74:443	192.168.125.179:63264	6	1354	Ether / IP / TCP 46.97.92.74:https > 192.168.125.179:63264 PA / Raw
----------------------------------------
51.1866	Eroare: main thread is not in main loop	0.00%
73	46.97.92.74:443	192.168.125.179:63264	6	1354	Ether / IP / TCP 46.97.92.74:https > 192.168.125.179:63264 PA / Raw
----------------------------------------
52.3113	Eroare: main thread is not in main loop	0.00%
73	46.97.92.74:443	192.168.125.179:63264	6	1354	Ether / IP / TCP 46.97.92.74:https > 192.168.125.179:63264 A / Raw
----------------------------------------
53.4157	Eroare: main thread is not in main loop	0.00%
73	46.97.92.74:443	192.168.125.179:63264	6	1354	Ether / IP / TCP 46.97.92.74:https > 192.168.125.179:63264 PA / Raw
----------------------------------------
54.5020	Eroare: main thread is not in main loop	0.00%
73	46.97.92.74:443	192.168.125.179:63264	6	1354	Ether / IP / TCP 46.97.92.74:https > 192.168.125.179:63264 PA / Raw
----------------------------------------
55.6130	Eroare: main thread is not in main loop	0.00%
73	46.97.92.74:443	192.168.125.179:63264	6	1354	Ether / IP / TCP 46.97.92.74:https > 192.168.125.179:63264 PA / Raw
----------------------------------------
56.8884	Eroare: main thread is not in main loop	0.00%
73	46.97.92.74:443	192.168.125.179:63264	6	1354	Ether / IP / TCP 46.97.92.74:https > 192.168.125.179:63264 PA / Raw
----------------------------------------
58.0331	Eroare: main thread is not in main loop	0.00%
73	46.97.92.74:443	192.168.125.179:63264	6	1354	Ether / IP / TCP 46.97.92.74:https > 192.168.125.179:63264 A / Raw
----------------------------------------
59.5045	Eroare: main thread is not in main loop	0.00%
73	192.168.125.179:60273	4.208.35.46:443	6	105	Ether / IP / TCP 192.168.125.179:60273 > 4.208.35.46:https PA / Raw
----------------------------------------
60.6907	Eroare: main thread is not in main loop	0.00%
73	46.97.92.74:443	192.168.125.179:63264	6	1354	Ether / IP / TCP 46.97.92.74:https > 192.168.125.179:63264 PA / Raw
----------------------------------------
61.7869	Eroare: main thread is not in main loop	0.00%
73	46.97.92.74:443	192.168.125.179:63264	6	1354	Ether / IP / TCP 46.97.92.74:https > 192.168.125.179:63264 A / Raw
----------------------------------------
62.8867	Eroare: main thread is not in main loop	0.00%
73	46.97.92.74:443	192.168.125.179:63264	6	1354	Ether / IP / TCP 46.97.92.74:https > 192.168.125.179:63264 PA / Raw
----------------------------------------
63.9579	Eroare: main thread is not in main loop	0.00%
73	46.97.92.74:443	192.168.125.179:63264	6	1354	Ether / IP / TCP 46.97.92.74:https > 192.168.125.179:63264 PA / Raw
----------------------------------------
65.1096	Eroare: main thread is not in main loop	0.00%
73	192.168.125.179:63264	46.97.92.74:443	6	54	Ether / IP / TCP 192.168.125.179:63264 > 46.97.92.74:https A
----------------------------------------
66.4136	Eroare: main thread is not in main loop	0.00%
73	46.97.92.74:443	192.168.125.179:63264	6	1354	Ether / IP / TCP 46.97.92.74:https > 192.168.125.179:63264 PA / Raw
----------------------------------------
67.5170	Eroare: main thread is not in main loop	0.00%
73	46.97.92.74:443	192.168.125.179:63264	6	1354	Ether / IP / TCP 46.97.92.74:https > 192.168.125.179:63264 A / Raw
----------------------------------------
68.8698	Eroare: main thread is not in main loop	0.00%
73	46.97.92.74:443	192.168.125.179:63264	6	1354	Ether / IP / TCP 46.97.92.74:https > 192.168.125.179:63264 A / Raw
----------------------------------------
69.9679	Eroare: main thread is not in main loop	0.00%
73	46.97.92.74:443	192.168.125.179:63264	6	1354	Ether / IP / TCP 46.97.92.74:https > 192.168.125.179:63264 A / Raw
----------------------------------------
71.0340	Eroare: main thread is not in main loop	0.00%
73	46.97.92.74:443	192.168.125.179:63264	6	1354	Ether / IP / TCP 46.97.92.74:https > 192.168.125.179:63264 PA / Raw
----------------------------------------
72.1407	Eroare: main thread is not in main loop	0.00%
73	46.97.92.74:443	192.168.125.179:63264	6	1354	Ether / IP / TCP 46.97.92.74:https > 192.168.125.179:63264 PA / Raw
----------------------------------------
73.2409	Eroare: main thread is not in main loop	0.00%
73	46.97.92.74:443	192.168.125.179:63264	6	1354	Ether / IP / TCP 46.97.92.74:https > 192.168.125.179:63264 PA / Raw
----------------------------------------
74.3295	Eroare: main thread is not in main loop	0.00%
73	46.97.92.74:443	192.168.125.179:63264	6	1354	Ether / IP / TCP 46.97.92.74:https > 192.168.125.179:63264 PA / Raw
----------------------------------------
75.5226	Eroare: main thread is not in main loop	0.00%
73	46.97.92.74:443	192.168.125.179:63264	6	1354	Ether / IP / TCP 46.97.92.74:https > 192.168.125.179:63264 PA / Raw
----------------------------------------
76.6400	Eroare: main thread is not in main loop	0.00%
73	46.97.92.74:443	192.168.125.179:63264	6	1354	Ether / IP / TCP 46.97.92.74:https > 192.168.125.179:63264 PA / Raw
----------------------------------------
77.7565	Eroare: main thread is not in main loop	0.00%
73	192.168.125.179:63264	46.97.92.74:443	6	54	Ether / IP / TCP 192.168.125.179:63264 > 46.97.92.74:https A
----------------------------------------
78.8877	Eroare: main thread is not in main loop	0.00%
73	46.97.92.74:443	192.168.125.179:63264	6	1354	Ether / IP / TCP 46.97.92.74:https > 192.168.125.179:63264 A / Raw
----------------------------------------
80.0063	Eroare: main thread is not in main loop	0.00%
73	46.97.92.74:443	192.168.125.179:63264	6	1354	Ether / IP / TCP 46.97.92.74:https > 192.168.125.179:63264 A / Raw
----------------------------------------
81.1414	Eroare: main thread is not in main loop	0.00%
73	46.97.92.74:443	192.168.125.179:63264	6	1354	Ether / IP / TCP 46.97.92.74:https > 192.168.125.179:63264 PA / Raw
----------------------------------------
82.2309	Eroare: main thread is not in main loop	0.00%
73	46.97.92.74:443	192.168.125.179:63264	6	1354	Ether / IP / TCP 46.97.92.74:https > 192.168.125.179:63264 A / Raw
----------------------------------------
83.3290	Eroare: main thread is not in main loop	0.00%
73	192.168.125.179:64186	192.168.125.213:53	17	92	Ether / IP / UDP / DNS Qry b'mobile.events.data.microsoft.com.'
----------------------------------------
84.5827	Eroare: main thread is not in main loop	0.00%
73	192.168.125.179:63271	13.69.239.77:443	6	66	Ether / IP / TCP 192.168.125.179:63271 > 13.69.239.77:https S
----------------------------------------
85.6867	Eroare: main thread is not in main loop	0.00%
73	46.97.92.74:443	192.168.125.179:63264	6	1354	Ether / IP / TCP 46.97.92.74:https > 192.168.125.179:63264 PA / Raw
----------------------------------------
86.9910	Eroare: main thread is not in main loop	0.00%
73	46.97.92.74:443	192.168.125.179:63264	6	1354	Ether / IP / TCP 46.97.92.74:https > 192.168.125.179:63264 PA / Raw
----------------------------------------
88.2205	Eroare: main thread is not in main loop	0.00%
73	46.97.92.74:443	192.168.125.179:63264	6	1354	Ether / IP / TCP 46.97.92.74:https > 192.168.125.179:63264 A / Raw
----------------------------------------
89.4587	Eroare: main thread is not in main loop	0.00%
73	13.69.239.77:443	192.168.125.179:63271	6	1354	Ether / IP / TCP 13.69.239.77:https > 192.168.125.179:63271 A / Raw
----------------------------------------
90.5627	Eroare: main thread is not in main loop	0.00%
73	185.60.218.53:443	192.168.125.179:60773	6	54	Ether / IP / TCP 185.60.218.53:https > 192.168.125.179:60773 A
----------------------------------------
91.6489	Eroare: main thread is not in main loop	0.00%
73	46.97.92.74:443	192.168.125.179:63264	6	1354	Ether / IP / TCP 46.97.92.74:https > 192.168.125.179:63264 A / Raw
----------------------------------------
92.9278	Eroare: main thread is not in main loop	0.00%
73	46.97.92.74:443	192.168.125.179:63264	6	1354	Ether / IP / TCP 46.97.92.74:https > 192.168.125.179:63264 A / Raw
----------------------------------------
94.0387	Eroare: main thread is not in main loop	0.00%
73	46.97.92.74:443	192.168.125.179:63264	6	1354	Ether / IP / TCP 46.97.92.74:https > 192.168.125.179:63264 PA / Raw
----------------------------------------
95.1487	Eroare: main thread is not in main loop	0.00%
73	46.97.92.74:443	192.168.125.179:63264	6	1354	Ether / IP / TCP 46.97.92.74:https > 192.168.125.179:63264 A / Raw
----------------------------------------
96.4175	Eroare: main thread is not in main loop	0.00%
73	46.97.92.74:443	192.168.125.179:63264	6	1354	Ether / IP / TCP 46.97.92.74:https > 192.168.125.179:63264 PA / Raw
----------------------------------------
97.5539	Eroare: main thread is not in main loop	0.00%
73	46.97.92.74:443	192.168.125.179:63264	6	1354	Ether / IP / TCP 46.97.92.74:https > 192.168.125.179:63264 A / Raw
----------------------------------------
98.6619	Eroare: main thread is not in main loop	0.00%
73	192.168.125.179:63264	46.97.92.74:443	6	54	Ether / IP / TCP 192.168.125.179:63264 > 46.97.92.74:https A
----------------------------------------
99.7488	Eroare: main thread is not in main loop	0.00%
73	46.97.92.74:443	192.168.125.179:63264	6	1354	Ether / IP / TCP 46.97.92.74:https > 192.168.125.179:63264 A / Raw
----------------------------------------
100.8583	Eroare: main thread is not in main loop	0.00%
73	46.97.92.74:443	192.168.125.179:63264	6	1354	Ether / IP / TCP 46.97.92.74:https > 192.168.125.179:63264 A / Raw
----------------------------------------
101.9673	Eroare: main thread is not in main loop	0.00%
73	46.97.92.74:443	192.168.125.179:63264	6	1354	Ether / IP / TCP 46.97.92.74:https > 192.168.125.179:63264 PA / Raw
----------------------------------------
103.0708	Eroare: main thread is not in main loop	0.00%
73	46.97.92.74:443	192.168.125.179:63264	6	1354	Ether / IP / TCP 46.97.92.74:https > 192.168.125.179:63264 PA / Raw
----------------------------------------
104.1953	Eroare: main thread is not in main loop	0.00%
73	46.97.92.74:443	192.168.125.179:63264	6	1354	Ether / IP / TCP 46.97.92.74:https > 192.168.125.179:63264 A / Raw
----------------------------------------
105.3053	Eroare: main thread is not in main loop	0.00%
73	192.168.125.179:60242	52.123.200.36:443	6	54	Ether / IP / TCP 192.168.125.179:60242 > 52.123.200.36:https A
----------------------------------------
106.4313	Eroare: main thread is not in main loop	0.00%
73	46.97.92.74:443	192.168.125.179:63264	6	1354	Ether / IP / TCP 46.97.92.74:https > 192.168.125.179:63264 A / Raw
----------------------------------------
107.5254	Eroare: main thread is not in main loop	0.00%
73	46.97.92.74:443	192.168.125.179:63264	6	1354	Ether / IP / TCP 46.97.92.74:https > 192.168.125.179:63264 A / Raw
----------------------------------------
108.6342	Eroare: main thread is not in main loop	0.00%
73	46.97.92.74:443	192.168.125.179:63264	6	1354	Ether / IP / TCP 46.97.92.74:https > 192.168.125.179:63264 A / Raw
----------------------------------------
109.7439	Eroare: main thread is not in main loop	0.00%
73	192.168.125.179:63264	46.97.92.74:443	6	54	Ether / IP / TCP 192.168.125.179:63264 > 46.97.92.74:https A
----------------------------------------
110.8473	Eroare: main thread is not in main loop	0.00%
73	46.97.92.74:443	192.168.125.179:63264	6	1354	Ether / IP / TCP 46.97.92.74:https > 192.168.125.179:63264 A / Raw
----------------------------------------
111.9591	Eroare: main thread is not in main loop	0.00%
73	46.97.92.74:443	192.168.125.179:63264	6	1354	Ether / IP / TCP 46.97.92.74:https > 192.168.125.179:63264 A / Raw
----------------------------------------
113.0682	Eroare: main thread is not in main loop	0.00%
73	46.97.92.74:443	192.168.125.179:63264	6	1354	Ether / IP / TCP 46.97.92.74:https > 192.168.125.179:63264 PA / Raw
----------------------------------------
114.1561	Eroare: main thread is not in main loop	0.00%
73	46.97.92.74:443	192.168.125.179:63264	6	1354	Ether / IP / TCP 46.97.92.74:https > 192.168.125.179:63264 PA / Raw
----------------------------------------
115.2523	Eroare: main thread is not in main loop	0.00%
73	46.97.92.74:443	192.168.125.179:63264	6	1354	Ether / IP / TCP 46.97.92.74:https > 192.168.125.179:63264 A / Raw
----------------------------------------
116.3296	Eroare: main thread is not in main loop	0.00%
73	46.97.92.74:443	192.168.125.179:63264	6	1354	Ether / IP / TCP 46.97.92.74:https > 192.168.125.179:63264 A / Raw
----------------------------------------
117.4445	Eroare: main thread is not in main loop	0.00%
73	46.97.92.74:443	192.168.125.179:63264	6	1354	Ether / IP / TCP 46.97.92.74:https > 192.168.125.179:63264 PA / Raw
----------------------------------------
118.6310	Eroare: main thread is not in main loop	0.00%
73	46.97.92.74:443	192.168.125.179:63264	6	1354	Ether / IP / TCP 46.97.92.74:https > 192.168.125.179:63264 PA / Raw
----------------------------------------
119.7962	Eroare: main thread is not in main loop	0.00%
73	192.168.125.179:63264	46.97.92.74:443	6	54	Ether / IP / TCP 192.168.125.179:63264 > 46.97.92.74:https A
----------------------------------------
120.8787	Eroare: main thread is not in main loop	0.00%
73	46.97.92.74:443	192.168.125.179:63264	6	1354	Ether / IP / TCP 46.97.92.74:https > 192.168.125.179:63264 A / Raw
----------------------------------------
122.0263	Eroare: main thread is not in main loop	0.00%
73	46.97.92.74:443	192.168.125.179:63264	6	1354	Ether / IP / TCP 46.97.92.74:https > 192.168.125.179:63264 A / Raw
----------------------------------------
123.1276	Eroare: main thread is not in main loop	0.00%
73	46.97.92.74:443	192.168.125.179:63264	6	1354	Ether / IP / TCP 46.97.92.74:https > 192.168.125.179:63264 PA / Raw
----------------------------------------
124.2289	Eroare: main thread is not in main loop	0.00%
73	46.97.92.74:443	192.168.125.179:63264	6	1354	Ether / IP / TCP 46.97.92.74:https > 192.168.125.179:63264 A / Raw
----------------------------------------
125.3736	Eroare: main thread is not in main loop	0.00%
73	46.97.92.74:443	192.168.125.179:63264	6	1354	Ether / IP / TCP 46.97.92.74:https > 192.168.125.179:63264 PA / Raw
----------------------------------------
126.4835	Eroare: main thread is not in main loop	0.00%
73	46.97.92.74:443	192.168.125.179:63264	6	1354	Ether / IP / TCP 46.97.92.74:https > 192.168.125.179:63264 PA / Raw
----------------------------------------
127.5916	Eroare: main thread is not in main loop	0.00%
73	46.97.92.74:443	192.168.125.179:63264	6	1354	Ether / IP / TCP 46.97.92.74:https > 192.168.125.179:63264 A / Raw
----------------------------------------
128.7175	Eroare: main thread is not in main loop	0.00%
73	46.97.92.74:443	192.168.125.179:63264	6	1354	Ether / IP / TCP 46.97.92.74:https > 192.168.125.179:63264 A / Raw
----------------------------------------
129.8273	Eroare: main thread is not in main loop	0.00%
73	46.97.92.74:443	192.168.125.179:63264	6	1354	Ether / IP / TCP 46.97.92.74:https > 192.168.125.179:63264 PA / Raw
----------------------------------------
130.9305	Eroare: main thread is not in main loop	0.00%
73	46.97.92.74:443	192.168.125.179:63264	6	1354	Ether / IP / TCP 46.97.92.74:https > 192.168.125.179:63264 A / Raw
----------------------------------------
132.0545	Eroare: main thread is not in main loop	0.00%
73	46.97.92.74:443	192.168.125.179:63264	6	1354	Ether / IP / TCP 46.97.92.74:https > 192.168.125.179:63264 A / Raw
----------------------------------------
133.1781	Eroare: main thread is not in main loop	0.00%
73	46.97.92.74:443	192.168.125.179:63264	6	1354	Ether / IP / TCP 46.97.92.74:https > 192.168.125.179:63264 A / Raw
----------------------------------------
134.3026	Eroare: main thread is not in main loop	0.00%
73	46.97.92.74:443	192.168.125.179:63264	6	1354	Ether / IP / TCP 46.97.92.74:https > 192.168.125.179:63264 PA / Raw
----------------------------------------
135.4122	Eroare: main thread is not in main loop	0.00%
73	46.97.92.74:443	192.168.125.179:63264	6	1354	Ether / IP / TCP 46.97.92.74:https > 192.168.125.179:63264 A / Raw
----------------------------------------
136.5150	Eroare: main thread is not in main loop	0.00%
73	192.168.125.179:63264	46.97.92.74:443	6	54	Ether / IP / TCP 192.168.125.179:63264 > 46.97.92.74:https A
----------------------------------------
137.6804	Eroare: main thread is not in main loop	0.00%
73	46.97.92.74:443	192.168.125.179:63264	6	1354	Ether / IP / TCP 46.97.92.74:https > 192.168.125.179:63264 PA / Raw
----------------------------------------
138.8159	Eroare: main thread is not in main loop	0.00%
73	46.97.92.74:443	192.168.125.179:63264	6	1354	Ether / IP / TCP 46.97.92.74:https > 192.168.125.179:63264 A / Raw
----------------------------------------
139.9146	Eroare: main thread is not in main loop	0.00%
73	192.168.125.179:63264	46.97.92.74:443	6	54	Ether / IP / TCP 192.168.125.179:63264 > 46.97.92.74:https A
----------------------------------------
140.9895	Eroare: main thread is not in main loop	0.00%
73	46.97.92.74:443	192.168.125.179:63264	6	1354	Ether / IP / TCP 46.97.92.74:https > 192.168.125.179:63264 PA / Raw
----------------------------------------
142.0860	Eroare: main thread is not in main loop	0.00%
73	46.97.92.74:443	192.168.125.179:63264	6	1354	Ether / IP / TCP 46.97.92.74:https > 192.168.125.179:63264 A / Raw
----------------------------------------
143.1888	Eroare: main thread is not in main loop	0.00%
73	46.97.92.74:443	192.168.125.179:63264	6	1354	Ether / IP / TCP 46.97.92.74:https > 192.168.125.179:63264 A / Raw
----------------------------------------
144.3199	Eroare: main thread is not in main loop	0.00%
73	192.168.125.179:58302	192.168.125.213:53	17	113	Ether / IP / UDP / DNS Qry b'621135a1fc5f33807752a82b47602e1d.azr.footprintdns.com.'
----------------------------------------
145.4157	Eroare: main thread is not in main loop	0.00%
73	46.97.92.74:443	192.168.125.179:63264	6	1354	Ether / IP / TCP 46.97.92.74:https > 192.168.125.179:63264 A / Raw
----------------------------------------
146.5256	Eroare: main thread is not in main loop	0.00%
73	192.168.125.179:63264	46.97.92.74:443	6	54	Ether / IP / TCP 192.168.125.179:63264 > 46.97.92.74:https A
----------------------------------------
147.6149	Eroare: main thread is not in main loop	0.00%
73	46.97.92.74:443	192.168.125.179:63264	6	1354	Ether / IP / TCP 46.97.92.74:https > 192.168.125.179:63264 A / Raw
----------------------------------------
148.7874	Eroare: main thread is not in main loop	0.00%
73	192.168.125.179:63290	204.79.197.222:443	6	636	Ether / IP / TCP 192.168.125.179:63290 > 204.79.197.222:https PA / Raw
----------------------------------------
149.8972	Eroare: main thread is not in main loop	0.00%
73	46.97.92.74:443	192.168.125.179:63264	6	1354	Ether / IP / TCP 46.97.92.74:https > 192.168.125.179:63264 PA / Raw
----------------------------------------
150.9934	Eroare: main thread is not in main loop	0.00%
73	46.97.92.74:443	192.168.125.179:63264	6	1354	Ether / IP / TCP 46.97.92.74:https > 192.168.125.179:63264 A / Raw
----------------------------------------
152.0899	Eroare: main thread is not in main loop	0.00%
73	46.97.92.74:443	192.168.125.179:63264	6	1354	Ether / IP / TCP 46.97.92.74:https > 192.168.125.179:63264 A / Raw
----------------------------------------
153.1923	Eroare: main thread is not in main loop	0.00%
73	46.97.92.74:443	192.168.125.179:63264	6	1354	Ether / IP / TCP 46.97.92.74:https > 192.168.125.179:63264 A / Raw
----------------------------------------
154.2954	Eroare: main thread is not in main loop	0.00%
73	46.97.92.74:443	192.168.125.179:63264	6	1354	Ether / IP / TCP 46.97.92.74:https > 192.168.125.179:63264 A / Raw
----------------------------------------
155.3984	Eroare: main thread is not in main loop	0.00%
73	46.97.92.74:443	192.168.125.179:63264	6	1354	Ether / IP / TCP 46.97.92.74:https > 192.168.125.179:63264 PA / Raw
----------------------------------------
156.5225	Eroare: main thread is not in main loop	0.00%
73	46.97.92.74:443	192.168.125.179:63264	6	1354	Ether / IP / TCP 46.97.92.74:https > 192.168.125.179:63264 A / Raw
----------------------------------------
157.6324	Eroare: main thread is not in main loop	0.00%
73	46.97.92.74:443	192.168.125.179:63264	6	1354	Ether / IP / TCP 46.97.92.74:https > 192.168.125.179:63264 PA / Raw
----------------------------------------
158.7494	Eroare: main thread is not in main loop	0.00%
73	46.97.92.74:443	192.168.125.179:63264	6	1354	Ether / IP / TCP 46.97.92.74:https > 192.168.125.179:63264 A / Raw
----------------------------------------
159.9564	Eroare: main thread is not in main loop	0.00%
73	192.168.125.179:56775	192.168.125.213:53	17	87	Ether / IP / UDP / DNS Qry b'roaming.officeapps.live.com.'
----------------------------------------
161.8640	Eroare: main thread is not in main loop	0.00%
73	192.168.125.179:65505	192.168.125.213:53	17	92	Ether / IP / UDP / DNS Qry b'mobile.events.data.microsoft.com.'
----------------------------------------
163.0016	Eroare: main thread is not in main loop	0.00%
73	104.76.220.144:443	192.168.125.179:63298	6	54	Ether / IP / TCP 104.76.220.144:https > 192.168.125.179:63298 A
----------------------------------------
164.1127	Eroare: main thread is not in main loop	0.00%
73	104.76.220.144:443	192.168.125.179:63298	6	1354	Ether / IP / TCP 104.76.220.144:https > 192.168.125.179:63298 A / Raw
----------------------------------------
165.2427	Eroare: main thread is not in main loop	0.00%
73	104.76.220.144:443	192.168.125.179:63298	6	1354	Ether / IP / TCP 104.76.220.144:https > 192.168.125.179:63298 A / Raw
----------------------------------------
166.3664	Eroare: main thread is not in main loop	0.00%
73	104.76.220.144:443	192.168.125.179:63298	6	1354	Ether / IP / TCP 104.76.220.144:https > 192.168.125.179:63298 A / Raw
----------------------------------------
167.4873	Eroare: main thread is not in main loop	0.00%
73	104.76.220.144:443	192.168.125.179:63298	6	1354	Ether / IP / TCP 104.76.220.144:https > 192.168.125.179:63298 A / Raw
----------------------------------------
168.5866	Eroare: main thread is not in main loop	0.00%
73	104.76.220.144:443	192.168.125.179:63298	6	1354	Ether / IP / TCP 104.76.220.144:https > 192.168.125.179:63298 A / Raw
----------------------------------------
169.7043	Eroare: main thread is not in main loop	0.00%
73	192.168.125.179:60773	185.60.218.53:443	6	123	Ether / IP / TCP 192.168.125.179:60773 > 185.60.218.53:https PA / Raw
----------------------------------------
170.7783	Eroare: main thread is not in main loop	0.00%
73	104.76.220.144:443	192.168.125.179:63298	6	1354	Ether / IP / TCP 104.76.220.144:https > 192.168.125.179:63298 A / Raw
----------------------------------------
171.8952	Eroare: main thread is not in main loop	0.00%
73	104.76.220.144:443	192.168.125.179:63298	6	1354	Ether / IP / TCP 104.76.220.144:https > 192.168.125.179:63298 A / Raw
----------------------------------------
172.9985	Eroare: main thread is not in main loop	0.00%
73	23.67.160.244:80	192.168.125.179:63301	6	54	Ether / IP / TCP 23.67.160.244:http > 192.168.125.179:63301 A
----------------------------------------
174.1294	Eroare: main thread is not in main loop	0.00%
73	192.168.125.179:62924	20.189.173.26:443	6	172	Ether / IP / TCP 192.168.125.179:62924 > 20.189.173.26:https PA / Raw
----------------------------------------
176.2866	Eroare: main thread is not in main loop	0.00%
73	192.168.125.179:62924	20.189.173.26:443	6	172	Ether / IP / TCP 192.168.125.179:62924 > 20.189.173.26:https PA / Raw
----------------------------------------
179.0824	Eroare: main thread is not in main loop	0.00%
73	192.168.125.179:60273	4.208.35.46:443	6	105	Ether / IP / TCP 192.168.125.179:60273 > 4.208.35.46:https PA / Raw
----------------------------------------
180.8165	Eroare: main thread is not in main loop	0.00%
73	192.168.125.179:63302	92.122.17.193:443	6	384	Ether / IP / TCP 192.168.125.179:63302 > 92.122.17.193:https PA / Raw
----------------------------------------
182.1285	Eroare: main thread is not in main loop	0.00%
