0.6914	Eroare: Input 0 of layer "functional_1" is incompatible with the layer: expected shape=(None, 42, 1), found shape=(1, 41)	0.00%
0	192.168.180.179:58884	104.18.1.22:443	6	55	Ether / IP / TCP 192.168.180.179:58884 > 104.18.1.22:https A / Raw
----------------------------------------
0.9291	Eroare: Input 0 of layer "functional_1" is incompatible with the layer: expected shape=(None, 42, 1), found shape=(1, 41)	0.00%
1	104.18.1.22:443	192.168.180.179:58884	6	66	Ether / IP / TCP 104.18.1.22:https > 192.168.180.179:58884 A
----------------------------------------
10.3194	Eroare: main thread is not in main loop	0.00%
2	192.168.180.179:58835	140.82.113.26:443	6	55	Ether / IP / TCP 192.168.180.179:58835 > 140.82.113.26:https A / Raw
----------------------------------------
25.2147	Eroare: main thread is not in main loop	0.00%
2	140.82.113.26:443	192.168.180.179:58835	6	79	Ether / IP / TCP 140.82.113.26:https > 192.168.180.179:58835 PA / Raw
----------------------------------------
29.2099	Eroare: main thread is not in main loop	0.00%
2	192.168.180.179:65119	192.168.180.22:53	17	74	Ether / IP / UDP / DNS Qry b'api.github.com.'
----------------------------------------
30.7509	Eroare: main thread is not in main loop	0.00%
2	40.79.167.8:443	192.168.180.179:58828	6	66	Ether / IP / TCP 40.79.167.8:https > 192.168.180.179:58828 A
----------------------------------------
33.3301	Eroare: main thread is not in main loop	0.00%
2	13.107.246.44:443	192.168.180.179:58895	6	93	Ether / IP / TCP 13.107.246.44:https > 192.168.180.179:58895 PA / Raw
----------------------------------------
34.9206	Eroare: main thread is not in main loop	0.00%
2	192.168.180.179:57067	20.199.120.151:443	6	55	Ether / IP / TCP 192.168.180.179:57067 > 20.199.120.151:https A / Raw
----------------------------------------
36.7166	Eroare: main thread is not in main loop	0.00%
2	192.168.180.179:58898	140.82.114.22:443	6	55	Ether / IP / TCP 192.168.180.179:58898 > 140.82.114.22:https A / Raw
----------------------------------------
45.9452	Eroare: main thread is not in main loop	0.00%
2	192.168.180.179:58884	104.18.1.22:443	6	55	Ether / IP / TCP 192.168.180.179:58884 > 104.18.1.22:https A / Raw
----------------------------------------
60.4264	Eroare: main thread is not in main loop	0.00%
2	140.82.121.5:443	192.168.180.179:58902	6	93	Ether / IP / TCP 140.82.121.5:https > 192.168.180.179:58902 PA / Raw
----------------------------------------
64.3436	Eroare: main thread is not in main loop	0.00%
2	40.79.167.8:443	192.168.180.179:58828	6	54	Ether / IP / TCP 40.79.167.8:https > 192.168.180.179:58828 RA
----------------------------------------
66.7727	Eroare: main thread is not in main loop	0.00%
2	140.82.114.22:443	192.168.180.179:58898	6	93	Ether / IP / TCP 140.82.114.22:https > 192.168.180.179:58898 PA / Raw
----------------------------------------
70.4230	Eroare: main thread is not in main loop	0.00%
2	192.168.180.179:58835	140.82.113.26:443	6	55	Ether / IP / TCP 192.168.180.179:58835 > 140.82.113.26:https A / Raw
----------------------------------------
